Comment,Likes,Reply Count
my Doge wallet available on App store for I PHONE   launched Feb 9 2022  wonder what Apple knows    everything Apple touches does turn to gold,1,1
Nope  this is another fiat currency with added value for owners that it cannot be printed out of thin air  Why should I buy it  If Russia or USA or anybody bakes it with Gold or other material  then I might buy some  I agree with you that zelensky could avoid the casualties if he resigned instead of urging everyone to fight for his regime ,1,0
Now should be the best time to buy and hold Bitcoin because it will soon come up to a standard rate which enough profits will be granted ,30,14
I m so happy I just got into bitcoin trading and I made my first profits  I wish i know about bitcoin earlier I would have made a lot of money by now,1,
I think that Binances stance on allowing russians to still use crypto during these terrible times  It s a very sad time but definitely an extremely strong bullish catalyst for crypto ,1,1
This vid doesn t age well lol,1,1
But wait we are at war you know at war the marquet crashes,1,1
Is this dude is owned by Putin ,1,0
My man spit more facts than I ve ever heard in my entire life  Keep it going ,4,2
you a sorry excuse for an asian  telling your sheeps to buy right before the dip ,2,1
fam deleted teh VIDEOS WHAT he deleted the ukraine videos lol,1,1
Feedback appreciated  Wanting more info and insight  WatsApp the numbr above Endeavour to reach out ,1,
Cardano will be the next top crypto in 2028   ,1,0
I really feel sorry for the people that follows you ,1,0
Two days later   we had Bart Simson   and BTC is 39K  not 44 like in video ,2,1
Je respecte le travail que vous mettez dans vos vid os  Je trouve vraiment d concertant que tous les principaux crypto youtubers ne regardent que les vagues pures et ignorent compl tement le r cit plus large de la raison pour laquelle BTC pompe et pourquoi les perspectives d avenir ne sont peut  tre pas aussi optimistes qu il n y para t  Il est un peu irresponsable d ignorer le fait que chaque lancement d ETF jusqu   pr sent a provoqu  un pic majeur du pic de BTC  D j  sur un terrain fragile avec des volumes historiquement bas et des pompes   baleines presque pures  nous avons  vit  de justesse un march  baissier   long terme  C est le pire moment de l histoire pour investir  car beaucoup ne sauvegardent pas leurs actifs cryptographiques  Une plus grande attention devrait  tre accord e au day trading car il est moins affect  par l impr visibilit  du march    J ai gagn  plus de 11 BTC  gr ce au day trading avec Tilo Polter  des id es et des signaux en moins de 2 semaines avec les gens autour de moi ont  t  extr mement r ussi avec les signaux de trading de jour de m  TILO POLTER  C est l un des meilleurs outils pour prot ger votre patrimoine au cas o  il commencerait   d cliner   eI    m  TILOPOLTER  SIGNALS ,94,7
Thank you   for being there when I wanted you to  I was so lost in this new world that I was hassled to start with  You not only guide me along the way but you showed me the proper way  Whatever little I have been able to achieve in life is because of you today  I want to thank you for being there showing me the proper way of doing things  For me  you are the best quide as you truly showed me the way to life  Once again  I would like to tell you a heartfelt thanks for being there   ,1,0
Since the day    stared to work with you  I know I ve changed a lot that really helped me to become a better person inside and out  you re one of the reasons why I m always trying my best  Thank you so much   ,1,0
Since the day    stared to work with you  I know I ve changed a lot that really helped me to become a better person inside and out  you re one of the reasons why I m always trying my best  Thank you so much   ,1,0
Thanks to everyone out there for introducing  this life saviour to us Al can t stop appreciating his thrustworthiness in my life am sure many will have been helped and saved  me and family are grateful to you once again Sir,1,0
I can t stop thinking about the irony and insanity of Elon Musk becoming the richest person in the world why they individual who has spent  20billon,20,27
This why you re  such a pure soul who always lend his hand with money  I wish the world has more people like you without you I wouldn t have setup my business successfully if not for the 4 2BTC I got from you,1,0
This why you re  such a pure soul who always lend his hand with money  I wish the world has more people like you without you I wouldn t have setup my business successfully if not for the 4 2BTC I got from you,1,0
I m honored    to have this team around me in this hard time  thank you always supporting and helping me to get Bitcoin easily   I really appreciate you sir  ,1,0
I m honored    to have this team around me in this hard time  thank you always supporting and helping me to get Bitcoin easily   I really appreciate you sir  ,1,0
Everytime      it s the moment and memories which we lived for  I just got my second 7 2BTC from Mr Joseph       thank you for giving such memories to cherish,1,0
Everytime      it s the moment and memories which we lived for  I just got my second 7 2BTC from Mr Joseph       thank you for giving such memories to cherish,1,0
I really    appreciate your help I got my profit earlier this time around   I receive 7btc in my Coinbase wallet I will never forget your platform sir ,1,0
Down 80k in crypto  Not really seeing how it s so good right now ,1,0
STARTING EARLY IS THR BEST WAY OF GETTING AHEAD TO BUILD WEALTH  AND INVESTING REMAIN A PRIORITY  THE STOCK MARKET HAS PLENTY OF OPPORTUNITY TO EARN A DECENT PAYOUTS  WITH THE RIGHT SKILLS AND A PROPER UNDERSTANDING OF HOW THE MARKET WORKS,35,35
 Successful people don t become that way overnight  What most people see at a glance wealth  a great career  purpose is the result of hard work and hustle over time  I pray that anyone who reads this will be successful in life ,101,93
INVESTING IN CRYPTO NOW SHOULD BE IN EVERY WISE INDIVIDUAL S LIST  IN SOME MONTHS TIME YOU WILL BE ECSTATIC WITH THE DECISION YOU MADE TODAY,10,32
Thank you for the video  the investment part  But your opinion about Ukraine and Russia conflict really is on an un informed base  Ukraine and President Zelensky in particular do not want to join Nato EU by any cost  But we need real guarantees for the security of the country which have been violated back in 2014 by Russia  the country which was one of the security guarantors by Budapest Memorandum on Security Assurances  And there are many other aspects  You have a huge audience and have no right to say suggest spread opinion about so sensitive topic and what Ukrainian should do or should not do  when you did not inform yourself enough ,3,1
stick to crypto  you are biased when it comes to politics ,2,1
So true  Thank you  Its the Way i think   Do due Dilligence   and you will be happy    ,1,0
 Great content always  Thank you for helping all of us stay on top of the market  However from a pay prospective  from what I ve seen  the people who focus more on trading and holding  are usually paid more than the obscure ones  Having applied Ray F Johnson daily insights and Signals I don t even care much about bullish or bearish market anymore as I am comfortably making 11 4 Btc weekly  having invested 2 1 Btc,6,7
GOOD VIDEO  EVERYONE NEEDS MORE THAN THEIR BASIC SALARY TO BE FINANCIALLY SECURED  THE BEST THING TO DO WITH YOUR MONEY IS TO INVEST  MONEY LEFT IN SAVINGS ALWAYS END UP USED WITH NO RETURNS  ,70,86
I have to acknowledge that this is quality content  Getting into the market turned out lucrative for me although I m not doing it alone  I m glad I made that decision because it s been remunerative since I got into it ,10,6
Don t trust any of these fake comments ,1,0
The Ukrainians aren t going to elect anyone  It will be one of Putin s puppets that s why Zelensky won t step down ,2,0
The PM won t back down to join NATO because he is a western puppet  He was put in power for a reason ,1,0
well if we waited for a few days more  consider it as a huge discount ,1,1
I m still amazed that till now people don t know the best time to buy and sell   Well I fulfilled already always seek for guidance and support before proceeding to participate in the Crypto market   The volatility is very high   Good luck  ,24,13
It s really great opportunity to have some one like Mr hanks as a mentor and also a portfolio manager   I feel so help with his kind gesture and services too  ,1,
I think my comment is the only real comment that s not bot,2,0
Love the crypto take   but does Putin really need to  defend  Russia  I think not  He will be out soon by his own people  he is done  He just blocked social media in Russia  that says a lot  Ukraine has a right to remain a sovereign country  Putin has a history of taking smaller regions by force  no wonder Ukraine wants NATO support ,1,0
Bitcoin will fall hard after this war  Soldiers don t want Bitcoin,1,0
Let s not forget that the biggest payouts in the markets don t come from great performances but rather it s great promotions  Stay invested  diversification for streams of incomes is very important ,49,57
Starting early is the best way of getting ahead to build wealth  investing remains a priority  I learnt from my last year s experience  i am able to build a suitable life because I invested early ahead this time ,1,
is a genius  she helped show me how to make sure profit on crypto currency investment,2,0
is a genius  she helped show me how to make sure profit on crypto currency investment,2,0
Because of the economic crisis and the rate of unemployment now is the best time to invest and make money,17,29
she helped me invest my Bitcoin on the right platform so right now I am earning daily from Bitcoin investment  it s really nice to have a means of passive income so I strongly recommend Regina Flores if you want to invest in Bitcoin and make daily sure profits,3,0
she helped me invest my Bitcoin on the right platform so right now I am earning daily from Bitcoin investment  it s really nice to have a means of passive income so I strongly recommend Regina Flores if you want to invest in Bitcoin and make daily sure profits,3,0
A mad man like Putin will continue to push the envelope until he gets what he wants  Like Nevile Chamberlain in Britain  are you advocating giving in to a despot like Hitler by trading nations for peace  You ll never quench his insatiable desire for more ,1,0
Russia s interest in Ukraine is not just about NATO or EU but about resources discovery in Crimea such as oil and gas and a desperate dictator trying to revive the USSR at all costs ,1,1
Your insight and ability to remove emotion from logic   see past what we are spoon fed by media is simply ASTOUNDING ,8,0
Investing with his company platform was a great step for me   I invested  2000 and got  22 000 in a week   i will love to recommend  Raini to y all for his great strategies   ,1,0
New subscriber man  Been a watcher for   two months  Keep going   ,1,1
Talking about stocks  Forex trading  investment is the most profitable venture I ever invested in  I reached my goalof  120k monthly trade earnings  wondering if viewers here are familiar with Lucy s trading platform,3,0
What if the West loses AND bitcoin fails  Honestly  I m a bitcoiner  but EVERYTHING except gold and oil looks pretty bad right meow ,1,2
As of now  March 2022  Switzerland s city of Lugano has also adopted BTC as legal tender  The GOAT of currency is on rise,1,0
When it comes to the world of investing   most people don t know where to start  Fortunately  great investors of the past and present can provide us with guidance  ,6,1
Great advice in buying btc techlead  See those prices diving off a cliff ,1,1
The dollar has been able to be used as a weapon for more than 70 years   The power is decreasing however ,1,1
A lot of people underestimate the the power of investing in the stock market   they just come here watch videos without implementing the knowledge that s been impacted on them  ,12,3
Well I ll say am on this boat right now   but my case is slightly different because I know the power of the stock market but I lost quite alot last year and it was very bad,1,
Fucking Thanks for this sentiment  Zelenski is not so cool,1,1
Looking at the Global markets you can see that we are heading with for a recession as oil prices continue to soar which to me is a good buying opportunity to buy Bitcoin as future hedge  Looking at the price action of bitcoin  its moving in the local horizontal movement levels after rejecting the upper volatility based zone  The peak candlestick is equipped with relatively long upper shadow candle which in the context of the average volatility implies a short term weakness and the selling pressure appear which will see it move to towards the mean which sits at 40k currently  This did not come out as a surprise  because that area was defined as a potential rejection zone as analyzed by  Trader name   His call analysis of the market has been spot on using his automated signals for my entries which has virtually saved my portfolio from cascading liquidations during wild volatility periods of uncertianty  Started with little over 2BTC  so far I ve made over 9 5BTC using his algorithm  If interested then reach out at TeLe G  m  callucas,49,2
think you need to state that this is not a financial advice  fyi,1,1
Thanks for the financial advice  I ll load up on Bitcoin big time ,2,2
I have earned a lot of profit from the crypto investment platform you recommended to us few weeks ago in one of your videos  Thanks much for the recommendation  I have gained a lot from your channel,41,23
Why would I wanna buy bitcoin why would I want to pay 40 something thousand dollars to get  100 000 when I could choose a different asset spend the same Amount of money and get a 10 000   ROI,1,2
crypto is easily trackable  and that is a no no for russian oligarchs  If big business wont adopt crypto  masses wont be doing it either  There might be an influx  but not a widespread use IMO,2,1
Ridiculous conclusions  Stop talking,2,1
WELL SAID TECH LEAD,1,1
best analysis so far  don t stroke your ego though hahahah,1,1
Thank you for saying that about Zelensky   The guy s a joke  Oh and BTW  great post ,1,1
While I hope this doesn t happen of course  any thoughts  techlead on why the US would not ban or significantly over regulate all crypto if it s a way to get around traditional banking and monetary systems  making sanctions less powerful  or even meaningless   Wouldn t they try to hold onto that power by eliminating the non traditional competitors  Not trolling here   truly trying to understand why that s not the obvious big picture move ,3,1
First time here  Most good sense I ve heard for the entire day  I ve subscribed,2,1
Can i invest just 100  into bitcoin now ,1,1
 I m done trading for now  it s become really frustrating  I ve tried several strategies that I ve found online and it just won t work  I m thinking that I really have a problem with being patience and I m afraid it s a conflict of interest when it comes to trading  however  I m open to a new door of much more conservative investment like stocks  bonds  and prolly NFTS too  Any comments advise would be really much appreciated  Thanks ,25,8
 DESPITE THE ECONOMIC CRISIS  THIS IS STILL A GOOD TIME TO INVEST IN BITCOIN AND CRYPTO  ,74,92
Bitcoin is on its way to the moon  it s time we join the Bitcoin community,1,
Life was hard for me until I started trading bitcoin and am now earning  19 435 per week,1,
   Is it true that cryptocurrency investment is really a stopper to poverty  because  I really feel left aside hearing and seeing several testimonies from people on profits with  100 bonus they make on daily bases in cryptocurrency investments  Can someone please recommend a good company and a professional trader that can trade on my behalf and generate profits for me      ,1,0
Thank you for your videos mate  The BTC shows us that when he wakes up he knows how to do it and destroy all the bears   Never go against the trends on cryptos  even less put levers  it is about the immediate sanction as soon as you turn your back  now anyone who has been in the crypto space for the last 6 or more years certainly knows about the cycle structure  every 4 yearsBTC goes through a halving even where the amount of Bitcoin that is mined is cut half  Well  the block reward is cut in half  this cause huge price spikes every 4 yrs because it create a supply and demand crisis that can t be priced in until it s a reality   but all thanks to Charlotte Irene Smith who taught me how to make trade and increased my Crypto from 8 to 21BTC now  No one really knows what is going to happen in the market  and I know you are only saying what you think will happen based on the past  It is yours and my opinion so people should make their own Investment choices based on their own research   ,27,4
Thanks,1,0
Your voice is like angles in this tech war,1,0
Spice   bitcoin     ,2,0
Non of these predictions come to fruition  I ve watched so many over the last year it s become comedy ,1,0
What software do u use to track crypto,1,1
Success is dependent on the actions or steps you take to achieve it  Show me a man who doesn t have an investment  and i will tell you how soon he will go broke  Investment is building a safe heaven for the future  With the right choice of Investment that has at least 1  minimum risk and with an expert guidance  profit and Intrest is 100  guaranteed I pray that anyone who reads this will be successful in life,149,58
 Adas Ohas Great  Personally I love proving people wrong  Honestly investing in forex trading for me has not been impressing  how much do you make of it  if you don t mind me asking ,1,
               ,2,
I g    ,3,
Official Catalina fx,3,
Facebook    ,2,
Catalina vladamir fx,2,
yeah  i have heard of her but I never contacted her ,2,
Her trad ing platform is now recorded the best exchange on stocks Mar ket and account handle ,2,
Her trading platform is now recorded the best exchange on stocks market and account handle ,2,
Any legitimate expert I can trust with guarantee my return of investment ,2,
I Would really love to give this Fo rex trad ing a try but I do not know how to Tra de,1,
I encourage newbies who are interested in Bitcoin investment should place their trade under expert to avoid losses,2,
You re right  So far  investment has been confirmed to be a sure means in gaining financial stability,2,
The best idea about money is  make it  invest most of it returns in nearest future and manage whatever that remains expecting huge ,1,
 Jiwan Will thanks  I m from California  hope she can help too,3,
Just write her up ok,4,
               ,4,
Someone has already dropped her contact up there but you can still write her up on,3,
 NOFIU SEYI Yes of course I also live in alaska  she helped me trade too,2,
She doesn t demand for any service charges  I only sent her a commission of 20  after i have made my profits withdrawal ,4,
 Nancy Dis Honestly for me I started so little with just  4 000 because I was skeptical about investing with her but fortunately now I regretted not starting big ,2,
Do any one knows how much is ok to begin and does she demand for any service charges  I want to give her a trial ,3,
Thank y all for recommendation This is really helpful for my situation right now,2,
 Sagmu Coulibaly yeah for sure  let me give her a trial too,8,
You can tell her that I recommend you,11,
Catalina vladamir fx,3,
Official Catalina fx,1,
Honestly it surprised me hearing people gaining in forex trading  I have lost a lot trying to trade myself ,1,
For me It s four months now I started trading with her and it s been cool and a good experience really ,1,
It s obvious that the importance of a professional mentorship of an expert should be the first step in Trading ,1,
 Charity Silas You are absolutely right  we also have lots of expert  real ones with certificate and firm IDS out there waiting for investors,9,
People are scared of investing because of the high rate of risks in the business  but there are still some good expert with the right strategies to always win too ,11,
Most people don t really invest due to ignorance and discouragement from family or friends without trying to experience it themselves too ,9,
Obviously often times we just look for what to invest in and usually encounter these problem  It s either the money is too huge for what I want to invest or it could require more than expected,3,
Thanks to a friend of mine who recommend me to professional in forex trading  who s helped has make me to earned a lot in the investment ,1,
Tell her that I referred you,2,
              ,2,
You can write her up on    ,3,
can you teach me and what s strategies do you use ,11,
I made 62 800 dollars within 6days of trading with Bitcoin ,9,
 mathew jessy you re right Forex trading is surely a lucrative way to invest whether you want growth  leverage  stable income or something in between ,4,
Profitable Investment one can do convenantly at this moment are,1,
you re right  but any Investment without a proper guidance and experience is suicidal,2,
I urge everyone to start somewhere now no matter how small  this is literally the time for that  forget material things  don t get tempted i became more better the moment i realized this ,3,
Starting early is the best way of getting ahead to build wealth  investing remains a priority  I learnt from my last year s experience  i am able to build a suitable life because I invested early ahead this time ,18,
you really have no idea     stop telling people when to buy    noob    no TA no knowledge what so ever,1,1
What an ignorant position you have on Ukraine  Russia has been encroaching on Ukrainian territory for a decade now  and the instigator is Zelenskyy  Zelenskyy wanted to join NATO so the natural response is to commit war crimes intentionally targeting women and children  You should reevaluate your priorities in life ,1,0
Thank you  I like your content and honest opinions ,5,1
I ve been watching India today for a non mainstream narrative    r ussia is putting out propaganda,1,1
I feel there are more to this market than we know  Ask for a proper guidance before  Nvesting in this pretty much complicated market  I ve made over 38 b tc from an allocation of 15 b tc over the last 8 months using David Wong help  Things might get worse so just make the smarter move,91,6
I would like to know your thoughts about XRP now that swift is breaking down,2,0
Can i be good with an investment of 100    I know it s nothing  but i cant invest too much,1,4
 DBA is true gem   which you don t want to miss at this early stage     ,1,1
Bitcoin is on the rise again and I am new to cryptocurrency and struggling to use these strategies well  Where can I find a legit broker  who will manage my account and also teach me how to trade ,33,12
Hello  I m new to Biticon trade and I ve been makin losses but recently I see a lot of people earning from it  Please can someone tell me what I m doing wrong,59,16
 I will forever be in depted to you    you ve changed my life I ll continue to preach about your name for the world to hear   you ve saved me from a huge financial debt with just little investment  Thanks Mercy Greg ,24,10
You can Reach her on   Te Ie gr am   with the name below Mercy Greg,5,
I M NEW TO BTC AND I VE BEEN MAKING LOSSES TRYING TO MAKE PROFIT MYSELF IN TRADING   I THOUGHT TRADING DEMO ACCOUNT IS JUST LIKE TRADING THE REAL MARKET    CAN ANYONE HELP ME OUT OR AT LEAST ADVISE ME ON WHAT TO DO ,4,4
Great content   What about MetaMotorClub unique collection of 8 888 car themed NFTs  I think it has a lot of potential ,2,1
While you consider bitcoin price  Ukraine s cities are bombarded  civilians   die  You are so heartless    I am Ukrainian and live here  I didn t leave my country  You are trying to get more money on the war where Ukrainians die ,1,2
Do you have  DBA in your bag  bull season is up on us,1,0
 Everybody close to retirement already knows most of these  Real question is where and how to go about these investments factoring the inflation rate  Is there even any other option besides the much talked about crypto   ,245,12
Real estate is the other option  especially with the interest rate hikes that are surely coming ,1,
What about investing in ETF stocks ,1,
  Carmella   Nancy Lynn Lewis  is the name though  she was in the news when she revived Grumac in 2018    You can look her up online to get more info  ,1,
Fish Farming ,1,
  Vargas  Now you have my attention  Who s the knight in shinning armour  The thoughts of retirement alone gives me the chills ,1,
Has got to be foreign exchange    I made my first million through it earlier this year as a newbie after I met a pro in the game    The inflation under Biden can get worse for all I care  I m almost certain of a happy retirement,2,
Keep hodl    Nice video btw keep hodl in radix  they ready to the moon soon,2,8
Hey Tech I m tryna get into Crypto currency more because I ve heard a lot of good things about it and it may impact my future  I m 19 y o and still don t take life seriously   as you can tell by my pfp  but it s time that I put work and effort into my future and I hope this is where it begins ,1,2
 TechLead  not only are you discerning in your tech topics but equally adept in your geopolitical analysis    kudos  and let s pray for peace  ,6,1
lnvesting in crypto now shouId be in every wise individuaIs Iist  in some months time you II be ecstatic with the decision you made today ,18,27
Thanks man  great video  I am eyeing this mercor finance  they are using AI trading  is this good investment  ,2,1
 DBA  a must buy token of 2022  a real UnderValued Gem ,1,1
