Comment,Likes,Reply Count
ETH   DEEP STATE COIN     BUY BITCOIN    ,1,0
so you the Wojak who buys high and sells super low  ahahahaha much love from italy,2,0
You just said on another tube rant that Bitcoin was going to the moon  Now you have a click bait to sell all crypto  you should have stayed in the metaverse with mark ,2,0
titel says sell crypto   in min 1 25 he sells his product to earn with crypto    ,1,0
it means he is unable to read the situation unless is too late  stop watching this bluff,1,0
one day after and bitcoin and eth went 9  up  ,7,1
Investing in bitcoin is the best investment anyone can do this  because it has made a lot of people millionaire  I pray that anyone who reads this will be successful in life,2,1
bs influencers and financially ignorant people ruin crypto,1,0
Could it be that you devolped the million coin and  you feel guilty about some thing  ,1,0
Sell crypto  but buy my course  You are a ludicrous lycaon  As a millionaire ,1,1
lol,1,2
Then LUNA jumped from 70 to 90 since yesterday ,1,0
You say sell  I say buy  sell buy  sell buy  You say down  I say up  down up  down up   lol Hope you return to normal techlead not a crypto mania,2,0
He didn t work for fantom  He made dapps ,1,1
I HAVE INCURRED SO MUCH LOSSES TRADING ON MY OWN   I TRADE WELL ON DEMO BUT I THINK THE REAL MARKET IS MANIPULATED    CAN ANYONE HELP ME OUT OR AT LEAST TELL ME WHAT I M DOING WRONG  ,3,2
Whatever he say  do the reverse ,3,0
1 dat later   Crypto is going to moon   ,2,0
It s a most confusing time in crypto history ,7,2
I ll never sell my crypto    But I do appreciate the advice   I think we can all agree that channels like this put out some seriously amazing and consistent content ,11,2
Then what is the point of investing if you never see a return   You re just giving your money up for other people s profit   I thought the whole idea was to get rich not get poor    ,1,
Buying Cryptocurrency doesn t make you a winner  but the ability to make profit daily out of your capital is what makes you a winner  Stop depending on market price to make profit  choose trading over holding ,83,28
Next video   Why i didn t sell all my crypto even though i said i will,2,0
   ,1,1
But in the end  Bitcoin will stand ,1,1
 This video is brought to you by myself    as a millionaire  ,1,0
True ,1,1
Hello I m new to bitcoin trade and I ve been making huge losses but recently I see a lot of people earning from it  Please can someone tell me what I m doing wrong   ,11,16
I keep hearing about the same guy  are his programs secured ,1,
 Linda Innocent How can someone know a professional account manager that is trust worthy when legit ones are hard to find these days ,1,
All you need now is a professional trader else you will continue making losses,1,
your video 6 days ago was  an urgent message to crypto investors   buy bitcoin     so bitcoin good  crypto bad  get it  confusion infusion   ,1,1
I m a newbie  which coin would people recommend for me pls  ,1,1
This season has been really great  I ve been making massive profits on my crypto investment all thanks to Expert Frederick Joseph,11,20
People will be kicking themselves in few weeks if they miss the opportunity to buy and invest in Crypto as it s retracing    BE WISE,13,12
Please I need someone to help me trade or invest the forex or crypto market because I m tired of trading in losses myself  I ve blown my account twice and it s frustrating   ,71,32
POOR MINDSET IMMEDIATELY SEES A SURPLUS AS AN OPPORTUNITY FOR CONSUMPTION  RICH MINDSET SEEKS TO SPEND THEIR TIME  RESOURCES AND ENERGY ON WORK THAT CONTINUES TO PAY OFF LONG AFTER THE EFFORT HAS BEEN INVESTED   ,1312,109
                     ,1,
The fruitfulness of your trading lies on the account manager or the expert ,1,
This a great video  I learn alot watching your videos and it has been helpful to me  building a steady income is quite difficult for newbies  Thanks to Fiona Cosmann for improving my portfolio   keep up with good videos ,8,9
If we sell crypto  you have to close your channel  do you know something else to do ,1,0
Tech lead is the only person whos able to tell me to buy crypto one day and to sell it the next,49,6
 Michael Coughlin yes  exchanges always make money  regardless if you are buying or selling your cryptos there  ,1,
And there s even in ad in the middle of this video for a crypto platform eventhough the title of the video tells us to sell our crypto  Am I the only one that s confused  ,5,
And shill his own defi crap while telling you to get out of crypto ,13,
TechLead any thoughts on the impact of the new President Biden executive order regarding crypto currency s ,1,1
People suck,1,1
I HAVE INCURRED SO MUCH LOSSES TRADING ON MY OWN    TRADE WELL ON DEMO BUTI THINK THE REAL MARKET IS MANIPULATED    CAN ANYONE HELP ME OUT OR AT LEAST TELL ME WHAT I M DOING WRONG  ,3,3
Hold on mate  I think you got the wrong people to talk to ,1,
ur boy AC exploited many of his projects  eg   EMN Eminence ,1,1
 Traders should avoid attempting to predict trend reversals  or even worse  the moon is ours the price is amazing for every early investors for those who got in for the first time otherwise it s just bouncing back to the normal price for the rest of us which is good  Those who hold the longest will profit the most  I trade and hold profit keep up the great work  And expert Albert Mike has been doing a great job reviewing all chart  trade and techniques on BTC which has enhance the growth of my portfolio to 8BTC lately ,2,4
I have earned a lot of profit from the crypto investment platform you recommended to us few weeks ago in one of your videos  Thanks much for the recommendation  I have gained a lot from your channel,3,21
     INVEST AND MAKE 200  OF YOUR INVESTMENT FOR A WEEK,1,0
     INVEST AND MAKE 200  OF YOUR INVESTMENT FOR A WEEK,1,0
I COUNT MYSELF AS A SUCCESSFUL MINER BECAUSE OF THE AMAZING MINNING STRATEGY  I CONTINUE MAKING HUGE PROFIT  THANK YOU SO MUCH SIR,2,1
I COUNT MYSELF AS A SUCCESSFUL MINER BECAUSE OF THE AMAZING MINNING STRATEGY  I CONTINUE MAKING HUGE PROFIT  THANK YOU SO MUCH SIR,2,0
May God continue to bless your platform fly  since the day 2 5BTC hits my wallet  I don t know how exactly I feel but I know for sure you are the best and real  you re the best one that s hold my heart and will continue to tell people about your wonderful work,3,1
May God continue to bless your platform fly  since the day 2 5BTC hits my wallet  I don t know how exactly I feel but I know for sure you are the best and real  you re the best one that s hold my heart and will continue to tell people about your wonderful work,3,1
When I thought I couldn t go on any longer   you gave me the strength I needed to keep moving forward  Thanks for always being there for me  even when I m not easy to be there  you re an helper and I m so grateful to have someone like you in my life ,5,1
what the f are u talking about,4,
When I thought I couldn t go on any longer   you gave me the strength I needed to keep moving forward  Thanks for always being there for me  even when I m not easy to be there  you re an helper and I m so grateful to have someone like you in my life ,4,0
In just 40 minutes I own  76 000 worth of btc with only  7 000 omg I can t even express my feelings this dude above is more than real,5,1
In just 40 minutes I own  76 000 worth of btc with only  7 000 omg I can t even express my feelings this dude above is more than real,5,0
Never knew I would be who I am today after so much suffering I saw a post about your platform and I took a step to try if it s going to work  you change my life and now  I m so much satisfied with my life now  I just want to share your good work and let the world know how great you re ,7,1
Fake,2,
Never knew I would be who I am today after so much suffering I saw a post about your platform and I took a step to try if it s going to work  you change my life and now  I m so much satisfied with my life now  I just want to share your good work and let the world know how great you re ,7,0
Your   financial help saved me from having take more debt that would have been difficult to be pay  I m indebted to you for your generosity  thanks for all you ve done,8,0
Your   financial help saved me from having take more debt that would have been difficult to be pay  I m indebted to you for your generosity  thanks for all you ve done,8,0
According to me or historical data BTC falls heavily after every halving s year  So this year will be bearish for btc  Next thing is to understand that s crypto market runs by whales  institutions and governments and if btc goes to  100k from around  50k that s will be only 2x but if btc falls to  20k and go to  100k that will be around 5x  So this year will be full of dip so keep usdt in hand to buy in dip  My journey as a trader was not funny at the beginning simply because I was so inexperienced and clueless till I got introduced to a very great trader THE NAME ABOVE  And ever since my journey so far as been the smoothest ,8,0
Opinions like yours are very much appreciated  However  we are in extreme different times with many other keys factors in play that weren t in previous market     They  Now own the market    Yes  read the charts  however  ZOOM OUT and think of the WHY s  regarding the action of the last weeks and going forward  Everything has changed and will change almost in this months ahead  Cannot be ignored if advising  I will say we all should prepare for any scenario as the market has always been volatile  I have played safe by putting my assets into active trades  so I don t feel the price if the declination continues  I have made over 7 5 btc since early November till date from implementing trades with insights and infos from the astra THE NAME ABOVE  I will advise everyone to stick to this method instead of just waiting on a pump ,9,0
Don t buy Million token  Its only worth  1 at most ,1,0
LMAO I love how his last video is to buy crypto and the next video is about selling it hahaha,15,0
Thanks for the great content  If you could please give us an opinion on Quant that would be awesome  ,1,0
NOT selling bro  but good information,1,0
Great video really  Also i agree with your opinion  For the newbie if you are actually trading in the crypto space and you don t have a sound mentor  Then you are certainly going to get liquidated in 90  of your trades   Yeah that s the sad truth  For a start you need a good and experienced hand to guide you  Trust me  trading isn t difficult as we see it  With the right Signals and guide  you can earn hugely monthly ,393,14
 Jared Alex is very legit bro,1,
 Jared make a research bro,1,
I think we have started to shape a W pattern on the weekly timeframe  That would mean that if we will hit the ATH  we will still have space to grow to 100 110k for btc this year,82,4
 Gregory Feigenberg Just check her online  there isn t much i can say here so it doesn t seem as if i am promoting an agenda,1,
 John Wes   Pretty impressive  I have been on the wrong side for far too long and i m willing to make consultations to improve my situation  Can she help me  ,2,
The key difference between the current range and the range we had previously at 46k is we are now seeing significant buying pressure when we visit the lows ,4,
How do 1 control the d33p,1,5
2 flaws in Tech Lead s logic  1 that people will continue to buy an antiquated blockchain like Bitcoin with all of its attendant problems such as slow confirmation times etc  And 2  just because some sensitive developer got his feelings hurt doesn t negate the underlying technology ,4,0
5 days ago  urgent buy bitcoin ,1,1
That s the great thing about bitcoin  There is no person  no committee  no governance body  Just a protocol ,2,0
You sound like a paid asset to deter people away,1,0
thank you for this  much appreciated  Bitcoin ftw    ,2,0
They are quitting because 99  of cryptos are dogshit  Only a handful will survive  XRP is the standard  We have all the banks,1,1
Sell  C mon  I keep allocating usdt to buy and don t worry about it ,1,1
Entitled  Constantly complaining  Non contributors  Lazy  Whiny  Just sounds like every millenial  ever ,1,0
Wasn t the last video about buy crypto now  hahahahaha,1,0
Good job mate lately when asked for predictions about bitcoin and cryptos generally  most experts on youtube and other media  predictions are mostly generic with no specifics on the direction  Everyone seems to be guessing and getting even more confused about the future  The only constant thing I can say for sure is that the traders are actually earning good returns while holders are always concerned about what the future holds for bitcoin or if there is even a future at all  With the insight  skills and experience of a trader like Jason Noah the sky is the limit despite the unstableness of btc  all thanks to Jason Noah who taught me how to make trade and increased my portfolio  from 3 to 17BTC now  No one really knows what is going to happen in the market  and I know people only say what they think will happen based on the past  It is yours and my opinion so people should make their own Investment choices based on their own research Say hello to Jason Noah  for a fix on  eI    m   JASONCOIN01 ,32,3
I like to think of  crypto  as energy  Compute power is energy in general  you use a GPU to process video resources  Internet computer is the scalability and resources of web3 ,1,0
Andre Cronje should migrate to Cardano  we have the best community in the whole crypto space  People supporting each other rather than putting them down ,1,1
Most people don t really understand a thing about cryptocurrency  can anyone please enlightening me and what is all about  ,1,0
Hello what s the best way to get started with trade cos I ve been making my personal research for a while now,2,2
As the economy crisis keep rising  one needs to have different streams of income  a well detailed diversified investment portfolio in the financial markets is needed to survive as well as secure a profitable investment future,3,3
I HAVE INCURRED SO MUCH LOSSES TRADING ON MY OWN   I TRADE WELL ON DEMO BUT I THINK THE REAL MARKET IS MANIPULATED    CAN ANYONE HELP ME OUT OR AT LEAST TELL ME WHAT I M DOING WRONG  ,34,12
Hello I m a newbie in crypto   what s the best way to get started with trade cos I ve been making my personal research for a while now ,3,0
As we are in the month of March and I feel those who would allow the market dynamism to determine when to trade or not are either new in race in general or probably just naive  the sphere have  seen far worse times than this  enlightened traders continue to make good use of the dip and pump even acquiring more equities towards trading sessions  i d say that more emphasis should be put into trading since it is way profitable than holding   Trading went smooth for me as I was able to raise over 9 2 BTC when I started at 1 5 BTC in just a few weeks implementing trades with signals and insights from David Mayor I would advise y all to trade your asset rather than hold for a  future you aren t sure about or hold it and risk losing all     ,5,7
Hello  I m new to Biticon trade and Ive been making huge losses but recently I see a lot of people earning from it  please can someone tell me what l m doing worng ,4,1
JFC a youtuber that understands the value of DeFi and the clear gap between cryptos crypto bros and DeFi lego builders  already subscribed so I can t really say you won one  but been researching crypto for 6 years now and investing for the last 2 and DeFi and never used youtube as info intake  Your videos revolve around other themes so I m glad that when you explored this one you didn t mess it up eheh,1,0
I m new to forex and I find it difficult using these strategies well  Where can I find a legit broker  than will manage my account and also teach me how to trade   ,2,11
That good for them they have made their millions and can just live off the interest or stake rewards    am not quitting though ,1,0
 I m new to cryptocurrency and I don t understand how it really works  can someone guide me on the right approach to invest in and make a good profit from cryptocurrency Investment ,2,1
Yeah  I m burning out on crypto myself  It s too caustic these days ,1,0
I don t have any fantom  just to say  But this morning it is down 24 8  24hr  which doesn t distinguish it from a lot of other tokens  People who get into crypto soon learn not to be quick to pop open the champagne when things are up or run around like their hair s on fire when things are down  There are good tokens that are a lot more down this morning   e g  Magic  which is 36 2   I don t  hold that  either  by the way  tho am watching it  and some good ones that are up  Butterfly  I hold a small bit of this  up 51 8   ImmutableX  don t hold but like  43 3    So it looks rather like business as usual in this volatile world  Speaking of which  I don t know about the other people out there but where are the safe havens for our crypto money to go to at the moment  Most people are going to just keep a bit of money in crypto  maybe a bit in precious metals  maybe a bit in cash in case everything goes down  Governments around the world are teetering on the brink  not even government bonds look reliable  anything could happen  So some might see this and sell their crypto but I think most of us will think  and do what         That said  thanks for the info about Fantom  first I d heard of it  I ve noticed how hot headed crypto people are on e g  the discords  I think a lot of a them are young and or desperate for money and or half mad from playing violent computer games  Can t be fun to be on the wrong side of their tantrums and there s a distinct lack of appreciation for what these dedicated teams of devs  often small and without much funding  are doing to build their crypto projects  They do not owe us a living and we need to appreciate them more and thank our lucky stars when things do go right ,1,0
He made his money and he s found an out  Good for him  Crypto is the future  people are just too short sighted to see it ,8,1
If only people knew about Algorand they just came out with a new upgrade for contract to contract calling  a new  20 million dollar incentive program to figure out EVM compatibility  and State proofs  It s early asf but Algorand has a lot of promise ,2,0
TechLead  Get out of crypto  Also TechLead  Buy my crypto course and make money with crypto ,13,0
The loss of Ethereum s market share is good news for all of us  Gas fees eat up everyone s income and fill the pockets of fat cats   ETH is a parasite that preys upon the entire crypto community  ETH is a project positioned on the market thanks to corruption ,1,0
TechLead  you left Google and they are still around  I am sure it was difficult for them  but they made it ,1,0
Very insightful video  Thank you   ,1,0
i think it must be frustrating  putting so much effort into a project to be legit  and a meme token comes in and on hype and social media alone  blasts up 1000x while your still watching your project barely float ,1,0
LMFAO    His video says  SELL CRYPTO NOW  yet he promotes his cryptocurrency wealth building space DeFi Pro      You can t go anywhere else for the confusing clarity that TechLead offers ,3,0
In just 40 minutes I own  76 000 worth of btc with only  7 000 omg I can t even express my feelings this dude above is more than real,2,0
How do we predict the markets  as a millionaire    ,1,0
In just 40 minutes I own  76 000 worth of btc with only  7 000 omg I can t even express my feelings this dude above is more than real,2,0
Fourth payment confirmation they didn t renage on their words I m happy I didn t get into any trouble dealing with their platform thanks a lot for your help,3,0
Fourth payment confirmation they didn t renage on their words I m happy I didn t get into any trouble dealing with their platform thanks a lot for your help,3,0
May God continue to bless your platform fly  since the day 2 5BTC hits my wallet  I don t know how exactly I feel but I know for sure you are the best and real  you re the best one that s hold my heart and will continue to tell people about your wonderful work,4,0
May God continue to bless your platform fly  since the day 2 5BTC hits my wallet  I don t know how exactly I feel but I know for sure you are the best and real  you re the best one that s hold my heart and will continue to tell people about your wonderful work,5,0
Never knew I would be who I am today after so much suffering I saw a post about your platform and I took a step to try if it s going to work  you change my life and now  I m so much satisfied with my life now  I just want to share your good work and let the world know how great you re ,5,0
Never knew I would be who I am today after so much suffering I saw a post about your platform and I took a step to try if it s going to work  you change my life and now  I m so much satisfied with my life now  I just want to share your good work and let the world know how great you re ,5,0
When I thought I couldn t go on any longer   you gave me the strength I needed to keep moving forward  Thanks for always being there for me  even when I m not easy to be there  you re an helper and I m so grateful to have someone like you in my life ,7,0
When I thought I couldn t go on any longer   you gave me the strength I needed to keep moving forward  Thanks for always being there for me  even when I m not easy to be there  you re an helper and I m so grateful to have someone like you in my life ,8,0
Bitcoin to  11 000,1,1
Your service is highly different and perfect from others  this is the only solution i trust for legit payment  I m a livin proof  ,8,0
Your service is highly different and perfect from others  this is the only solution i trust for legit payment  I m a livin proof  ,21,23
These developers are probably getting forced out as the institutions are coming to take over,1,0
The market is so over saturated right now  I see a bunch of crypto failing within the next quarter or so  It s survival of the fittest right now ,1,0
Dollar cost average   HODL  If a coin goes 40x  take profits  Easy  ,4,2
Real Estate provides cashflow  tax benefits  equity building  competitive risk adjusted returns  and inflation protection on its own  Whether you invest in physical properties or REITs  real estate may help you diversify your portfolio and reduce volatility  Dividends are what got me into investing in REITs  great way to secure the accumulate wealth ,2,
ETHEREUM IS CENTRALISED AND HAS THE IMPLICATION OF J P MORGAN  THAT S WHY METAMASK IS BANNING SOME COUNTRIES FROM USING IT  IT S NOT DECENTRALISED  IT S A BANKER COIN  LOL,1,0
I feel the same way  we build apps for the XRP community and they are just greedy morons that in the end it wasnt worth it for our team aswell ,1,0
Techlead 5 days ago  Buy Bitcoin Now    Teachlead today  Sell Crypto Now  ,9,3
My thought exactly,1,
and now since btc is upto 42k his new vid should be coming anytime now  Buy btc again  lol,2,
You are a brilliant man  Thanks for all of your great content ,1,2
Didn t you say in the last few weeks   Buy Crypto Now        So basically you have no clue what to do at all ,2,0
Thank you for broadcasting the concerns from a dev POV   the domain is still in its embryonic stages but the future is so so bright  ex WEF  ex GS  ex Bridgewater  current stay at home dad investor ,1,2
Just to be clear  Charlie Lee did NOT quit crypto  He sold or donated all his LTC because of a perceived conflict of interest  but he still works full time for the Litecoin Foundation  developing and promoting the project ,1,0
I want to trade my  15 000 worth of Bitcoin on Binance Futures or Exness in order to make 5x profit  Any recommendations ,1,0
I always dig the content  The keyboards are so cool ,3,0
Sounds like the developers need a project management team to block and tackle the negative feedback  One the flip side  maybe don t use testnet for your prod environment,1,0
I will say one thing  he s right in that there are so many projects eating each other s lunch and diluting the returns now  We need a purge and consolidation     But there is 1 project I know of that is in a class of its own and no one is eating their lunch bc no one else has the tech to do it    And that is Quant Network   Their overledger API interoperability solution is one of a kind and patented   Anyone who would want to replicate their API solution would have to find a different way to achieve that than quant  Will take years if not decades  QNT tokenomics are incredible too ,4,0
Andre is a bum  FTM will go on without him,1,0
These high profile dev teams shoold have very polished PR teams ,1,0
Just a few days ago your video was titled something like  urgent buy btc now    now it s  sell now     if you re a crypto investor  stop clicking on these click bait videos  Find some good channels and stick to them  Most of these influencers make their money with views and selling courses  not actively investing,8,1
