Comment,Likes,Reply Count
I met a millionaire once  I worked at a fast food place and he would come in every Wednesday and oder the same meal every time  He dressed in threadbare clothing and that had some holes in them   To look at him you would near think he was rich    Once he told me that he was rich because he did not spend money he didn t have to and adhered to a strict budget  Shortly after that he died and left  25 000 to one of the older ladies in the store whom he enjoyed bantering with when he came in ,2,0
You should play magic the gathering,1,2
I do play that game  love it   MTG Arena is awesome ,1,
Don t worry Bro we are your friend s subscribers,1,0
First of all i wouldn t buy a Lamborghini  better buy the new Toyota Supra or a Dodge Challenger and invest in some nice modifications   ,1,1
 Because she wouldn t listen to me when I tried to talk to her  HahahaHahaha,23,1
We live in a society of equality  Your ex wife can earn her own paycheck  ,3,0
Too bad she turned out to be so financially abusive   Probably amongst other things ,1,0
This video perfectly  illustrates the results of IQ and life priorities mismatch  TechLead  just keep walking ,1,0
If she s earning 500k a year  she has all the right to buy whatever she wants  But she has no right to ask someone else to buy anything,44,7
He cannot afford a housewife  and she refused to be a  houseslave ,5,
If she becomes a good housewife like techlead would want  she does deserve that right  Maybe a Lamborghini  but at least some luxuries ,1,
She expects you to work yourself into an early grave so that she can live a rich lifestyle  The thought that you earned this money to free yourself of a wage slave status does not compute in her brain ,2,0
People who dont make the money  have no idea how hard it is to make it  Spending is the easy part ,2,0
Fully respect your perspective  I think the same way ,2,0
I agree truly successful people don t care about showing off because it s just way too basic of an action,43,0
ONLY   CRYPTO   ,1,0
It s always easy to say  too cheap  when your talking about spending someone else s money    Reminds me of the Margaret Thatcher quote    The problem with socialism is that you eventually run out of other people s money  ,11,0
Financial responsibility is a lot more attractive than a Lambo  imho   as an adult ,2,1
A car is just transportation anyway  vastly overspending on a supercar is pretty pointless unless you re that desperate for attention or you re just so filthy rich that it s not much money for you  When I buy something nice I tend to stop caring about it not long after that  unless it s something like a computer that I use often  and just like a car s purpose is to be safe and efficient at transportation with minimal maintenance problems  a computer is something I ll only buy to be up to speed and reliable so I can efficiently use the net  play games  etc ,1,
The last time I was this early TeachLead was still married   ,4,0
I thought I was doing great by spending only 20  of my monthly income  but after hearing him spend only 2  of the interest of his savings  I feel like I am spending a lot ,1,0
Better drink water or nothing instead of this shitty McDonald s coffee,1,0
Amen  These people thinking they need  1200 shoes is assnine  I once had a guy tell me I looked like a million bucks in a dress that cost  12  It s now about the brand  it is how good you look in the item  How did you marry some brainless woman  You crack me up Techie  Will check out some of your other videos I have missed in the last few weeks ,2,1
my cheap thinks i m a millionaire  as an ex wife ,1,0
Dude you are an inspiration    my family is well off  but we are very humble     to the point people dislike us    who freaking cares    live your best life   and not anyone else s   ,6,0
Do you stream on Twitch when you play games    I would love to see how you play as a millionaire  Also you should give a try to colivings if you wanna meet people with the same life goals values  ,2,0
His realness sprinkled with humor is appreciated ,5,0
I m pretty much the same way   Once I have paid off ALL of my debts  I m going to make sure that I have at least  3M in liquid assets in ten years  then  retire  early  and then just live off the assets without splurging ,1,0
Being cheap is going to a restaurant spending  100 and tipping little to nothing   A wealthy person is a person who believes in Jesus Christ of Nazareth    Keep safe   blessed ,1,0
You still loving you EX Never seen a YT talking so much about a EX,7,3
But isn t this a scarcity mindset  It seems you are pessimistic about your future earning potential  Therefore  you are trying to hold on to gains acquired from past fruitful periods  If you believed the future would carry on the same trajectory as the past  you may have decided to adopt a slightly different strategy from the current one ,7,0
And why did you marry her  She doesn t like match at all   ,1,0
Your ex shamed you into spending more on her  She married you so you could provide  When you didn t fund her she got out because it s easier to enforce alimony than to daily beg for cash  The problem now is you just advertised yourself as a frugal penny pincher  No woman wants to date Ebenezer Scrooge  It s a big turn off  So as a millionaire you now have killed all interest ,2,1
maybe you can just buy woman,1,
Do you know that inflation is not really 2 3  at all  it s more like 15  per year or higher now since COVID  Inflation should be measured by the increase in Fed balance sheet  not the figure they make up  And getting 15 20  annual returns from stock market is not that hard  My rule is that I can spend 10  of the profits I make annually as a multimillionaire  I reinvest the 90   of the retained earnings for long term compounding  It works really well ,1,0
Reality is that your way of thinking allowed you to earn and keep the money  while common person would never be able to keep the money  just look at what happens to all lotto winners  majority of them end up homeless in debt within 5 years when money dries up  To support her dream lifestyle she just doesn t understand it would take 10x more money  I guess she needs a billionaire  not a millionaire ,1,0
You re an INTJ  you re smart enough to know how people are different  maybe to summarize the story you could have said that your ex wife has different values from yours  and talking about how did you make the choice to live together knowing or ignoring these differences could have been more interesting  what is the personality type of your ex wife by the way ,6,0
Millionaire uses Patagonia backpack  not a Tumi  This is practical and respectable ,1,0
At no point should a person buy a Lamborghini  Total waste of funds that could go to much better uses  Just my opinion  Also  I like the way you dress  It suits you  ,1,0
every time I hear someone say    if I had your money     I just know they ll never have any  they re already planning on spending money they don t have LOL,210,3
Yes  when people talking about money  I move them to the folder named  cheap   period,1,
I dont go to Mc Donalds  i make breakfast in 3min  even before i go to my car   So i have more time  but my time is not paid  Tech Lead if you need someone who go to Mc Donald or i can be ur chef  Only 2000e a month ,2,0
If he is staying at hotels that much wouldn t be cheaper to buy a house there  Even if you don t stay there all the time you can rent half of it to someone ,2,3
I agreed  He is literally burning money with hotels  if he invest a house he will get every penny he is spending on it and have a place to live xd,2,
4 12 Killed me  ,2,0
  pls make a youtube video every time your wife doesn t listen to you,2,0
MGTOW   Millionaires Going Their Own Way ,3,0
Even warren buffet lives simple life,1,0
Your wife should be happy that you are not blowing your money and will be able to leave something behind for your child and future grandchildren ,3,0
 Because she wouldn t listen to me when I talk to her ,10,0
This explains why he has and makes money and not her  There is nothing wrong with using money sometimes on expensive things  but you have to think  I totally agree that there is nothing more precious than having a partnership where things are built together  Why does it sometimes seem so hard to find it ,9,4
 Ashhar Kausar Perhaps  and perhaps some men still hope that the woman will stay at home  because without one you will not have the other  But even so  it doesn t make sense  because someone taking care of the house and children while the other works  regardless of gender  is still a partnership  is still a life construct  But even this in the form of a partnership is difficult to find,1,
Much respect for what you re trying to do for your son  Maybe it s better to accept his mother for who she instead of trying to convince her one way or another  Sometimes in life  you have to choose between being right and being happy   I think if either one of you accepts the other it will be much easier to deal with each other and unfortunately  you can only control yourself ,7,0
Congrats on reaching 1 million subscribers ,3,0
Experiences are more important than all things  travel  meet people  discover the world  get good moments  change your vision and enjoy the life  The things can be anchors that force to stay in a place  new responsabilities for worry  I think that you are in the correct     by the way Whats games do you play or enjoy to play ,4,0
Wtf is this stupiest video ever,1,0
Damn ex wife needs a day out with Sean Connery  He ll set her straight,2,0
That is why you are the millionaire and she just can dream about what she would do in your position  keep the good work  your humbleness is truly inspiring,33,1
Actually his ex is the millionaire now and he s the ex millionaire  Tech Lead s a simp who got played  Plain and simple ,2,
People need to understand  if you have to impress someone then that someone doesn t deserve to be impressed  Thus  trying to impress people is literally stupid ,2,0
I get why she stopped listening  Although vitally important to understand  it s super boring to listen to money talk  I am guessing she wants interaction and emotion as a response  You re right though  But do you want to be right or be married ,2,0
Don t worry  be happy  Let money flow  and enjoy life  and be generous  If you live by that  even if you buy 5 Lamborghinis  you should be ok     TechLead  I do like your videos about tech  Hope to see more of those ,1,0
   ,1,0
man don t pay attention to your ex wife at all I was married for ten years and after ten years she went with someone else  she thought it was a better opportunity  so it turned out not so  usually people who lived in total poverty have that sick appetite for  luxury and jewelry expensive cars  these are complexes from early childhood  these people are eager for everything they are always a little not enough no matter how much it is  so do not pay attention to the woman  I have no children whether it is luck or not  I was lucky that I didn t have children with her       so focus on the child  think about him and the ex wife is simply an ex wife that says it all      the problem is that years and years have to pass for you to  mentally reached his birth child as a father  it is a very broad topic      ,2,0
How about the Japanese wife goes to work and buy a lambo herself ,1,0
You inspired me not to marry,2,0
My friends say I m cheap because I don t dine in restaurants and go out with them to expensive bars  But they don t have 4000 GME shares like I do ,4,0
How did you ignore that communist parade of red flags,1,0
You are so funny man    ,2,0
When your wealthy you don t have to prove yourself to anyone ,11,0
Being cheap is how the rich stay rich       ,5,1
The one video I related with your thoughts from India,1,0
I would NEVER buy a Lamborghini  That s a car for posing in  If I had that much money I d use it for something simple and practical  like a quantumly entangled teleportation device    Teleportation   Transportation,2,0
It is her lost Brother  Good decision on the divorce  Cheers ,1,0
Very well explained about being cheap  frugal  as a millionaire to maintain or protect the net wealth and the decades of life into the future ,1,0
You are,1,0
You DO deserve nice things  Idk about her lol,1,1
2 years from now  How I Got My Ex Wife Back  as a millionaire ,2,0
Quite true  my boss expect me to work until 80yo   my gf also hope I can hope until 90yo so they can have money,8,3
Retirement is overrated  It s having money in old age which isn t overrated  Most old people I know would fall over themselves just for a chance to stay busy   If you don t have definitive plans on how to stay busy after retirement then don t retire  If you are a guy and you retire and sit on the couch you will drop dead within a year or two ,1,
How is it cheaper to pay for a hotel then what it would cost to live in a house on from month to month ,2,0
If being frugal is a prerequisite for being comfortable   sign me up  I m actually pretty frugal and some day hope to be just like Tech Lead  as a millionaire ,18,0
His ex wife used him to get a child   A few years later when the child is mobile  she leaves him   I see this all the time ,3,1
Thanks Tech Lead    ,1,0
Imagine you re a hot girl looking for a successful mate  You find this multimillionaire guy living it up traveling  buying the nicest clothes  eating at the nicest restaurants  living in an amazing place  You decide to commit to him and get pregnant  and then immediately he decides that he wants to retire early and only live off of dividends and interest  Now you re stuck with this dude who  due to his fear of losing savings and not having a lot when he s old  provides you the same lifestyle as any other guy making 60k per year  McDonald s  cheap clothes  cheap hotels  risk aversion  and constant rants about how money means nothing because its more important to save it or give to people in need    Bait and switch LMAO,9,0
don t feel bad  Besos  Gates and Elon have all been divorced   thats rarified air,1,1
I actually still have a screenshot of your nyc apartment 5 01 that I took when I first watched your 10 year challenge video quite some time ago  Love the minimalist setup with the mattress on the floor  That video also reminds me of how thoughtful I think it was that you proposed to your ex wife under the northern lights  I m sorry your relationship didn t work,1,0
Is TechLead s ex wife some famous Japanese actress  Who in the world could be so entitled and high maintenance ,1,0
Women always want more  ALWAYS ,2,0
 Some people are so poor that money is all they have   like your ex ,5,0
I love this guy so much     ,1,0
It s never worth to it to buy  At most lease  It s a toy that you will either get tired of  not use as often as you think  increase risk  think if someone else just scratched your car   and you limit yourself to one car versus having many to play with ,1,0
How dare she   She didn t do her research before marrying you so it s her damn fault overall,1,0
How many times do people with a bunch of expensive crap get their items reposed to pay of loans debts e t c or have to sell off luxury items for less than half the buying price as a act of desperation  She acts if there have never been millionaires who have lost all their wealth  Often if people don t have to work for money they don t understand the value of it   the time  effort   sacrifice it takes to make it  Like people who work overtime in crappy jobs just to spend all of their money on multiple holidays a year or for Christmas deciding to live pay check to pay check on purpose   A little restraint goes a long way ,1,0
The sad reality that Tech Lead married a gold digger   Please vet out your potential gf s before taking the plunge ,1,0
Well  like they say  Happy Wife Happy Life          Marriage is overrated  ask Bill Gates  Jeff Bezos  and Elon and all his babies mama s       Don t worry Zuckerberg will be next ,1,0
Wow just see 1mil subs   Graz   And btw one friend of mine help me someday with money  700   to help buy a laptop which helped me to find a job and my family stops beeing so poor as earlier  and Some month after I give all spend money back to my friend     So I undestand what you mean   ,1,0
I like Tesla better    LOL,1,0
Since McDonalds tend to add sugar to every meal   maybe for the sake of your own physical health  avoiding diabetes and some other conditions   you should try eating fruits and veggies for Breakfast and try to prepare your own food   I understand you are thinking on the practicality of buying pre made food but take care of your health as well because if you don t   you are gonna be the only one dealing with health problems in the future  as a Millionaire  ,1,0
Millionaire mindset  I came across your channel by searching fast typing   haha   Congratulations on your financial freedom  you should do a TED Talk  Theres so many  young people that need the mindset that you have  I wish I would have learned about finances when I was younger  Spent way too much time and money trying to impress people   girls  when I was young and single  ,2,0
Tell your ex wife   you re right  why don t you show me how it s done       Everyone always has great advice until it s THEIR time in the rat race  and THEIR money being used up with nothing of permanence to show for it ,95,2
She speaks as if she is ever capable of earning money to buy a Lamborghini  Only people who actually have the money to back up their talk have the right to make bold claims like her  ,7,
exactly what i was think everyone has an opinon on how to spend money but very few know how to make it,13,
Techlead  I agree with most of your spending habits  Living below your means  spending on experiences  looking at the full picture etc  All of that is great but the one thing I disagree with is having breakfast at a fucking McDonald s to save money  If it is once in a while that is fine but your health should be your top priority  Otherwise it would be counterproductive as not spending on your health will cost you a hundred times more in the long run ,1,0
The truth is most likely somewhere in the middle   It s one thing to be frugal but it s another thing to be cheap   You seem to toe the line   Also it s ok to be extremely frugal with the support of your wife   It s another to decide to be cheap af without her input   You really need to be more introspective  as a millionaire  is what I m getting from your videos   You re obviously not over it because you re still bringing up the subject   Sometimes you can t force change on others but you can always improve yourself ,1,1
jobless TechLead  just youtubing  not sustainable long term  you ll turn depressive after 4 yrs  watch out ,1,0
Used Lamborhini from 2013 not cost that much but main problem is with maintanance  oil  parts  insurance you need another 500 000 USD for 10 years of using this car ,1,0
what did you liked about your ex wife ,6,1
I have no friends  as a millionaire and such a nice guy ,2,0
4 16 a rare glimpse of modesty by the  millionaire  TechLead,36,1
He also admitted he can t hold down a job  He s at maximum humility in this video ,11,
Ok so you re more interested in the millionaire label than actually living like a millionaire  That s not going to work for women  If you can t live it up because you are afraid to lose your label you become a shallow poor person ,2,0
And if you live in New York like I do you re looking at close to 58  total taxes        50 Cent  just moved out of NY and down to Houston for those very reasons       as have many others  as I am also considering  ,1,0
  ,2,0
 You have the right to remain silent  anything you say can and will be used in my youtube videos    TechLead talking to his ex,525,4
    ,1,
Like she s going to let that stop her  I look forward to future installments ,8,
5th amendment    ,14,
Buffet  Gates  Besos  Zuckerberg  Musk and Steve Jobs all dress dressed simple ,9,2
I bet shes cheap with her own money  but not yours ,2,0
What if Techlead was really broke and he cant get a really job again  living with his parents because he cant afford a home  wake up people lol,2,1
I have never in my life had any interest in fancy consumer goods of any type ,2,0
Techlead is cheap though  His ex wife is right,5,0
Your ex wife is foolish  if she is extravagant and wasteful  She is no good for you and you deserve a better woman  one without greed  She obviously does not know her maths  if she was expecting you to work for more than 50 years and support her lifestyle ,1,0
If you are a millionaire who spends like a poor man  you are poor in a woman s eyes ,4,0
I would never buy a Lamborghini  People forget  you buy it    then there is upkeep   plus have they ever tried to insure a Lamborghini ,1,0
Smart man,2,0
Go back to making videos about Tech and SWE  Stop airing your dirty laundry online   ,2,0
I feel this so much  It s all about being racional and thinking logically ,8,0
Go go go  Techlead is unstoppable  You are more humourous than a standup comedian,23,1
He came from the stand up scene too  Daily  at 10 00AM ,1,
If you have 40  in cash  your 60  should be 100  in stocks at 8   inflation adjusted ,1,0
I m not sure who thinks it s cheap to live out of hotels  ,4,0
 Posts another video about Ex wife as if she ll see it ,2,0
I love yours perspective and way of thinking  but what I see as an issue is that you see yours way of thinking as  the right one   As you ve said  you have done trips  you ate in expensive restaurants  you bought that expensive clothes  lived in luxurious apartment for years  Enough to get tired of that and move on to more important things   But as I can see your wife isn t and you are being a bit of hypocrite for thinking she has to think as you do now  after all those experiences   I know you want all the best for your family and all and now you are being financially responsible  but I can imagine it is kinda annoying to be with the person which doesn t want to spoil a bit and enjoy in portion of earned money  but it did earlier  and is thinking about everything as a loss of money  Because if you see world that way  everything is in one way or another loss of money and time  and that  at least for me  is not a way to live  Finding true balance is the key and not going in either extreme of the spectrum   And again  you are great guy and I love your view on many things but these were only my two cents ,2,0
it really bothers women how little we need to be happy,39,4
Women think happiness is found in material goods ,1,
Yeah except for needing a women which can get expensive or keeping you busy ,3,
And why do you care  There is a reason to why you are the self made millionaire and she isn t  You are doing what the other smart rich people do  Keep it up    ,2,1
What was she bringing into the table  Was she wealthy  At least you learned the hard lesson that our physiology can blind us sometimes    ,5,1
The use of stock footage is so good in these you can tell that time and care is put into these videos  One of the few channels I actually like to watch and not just listen to,8,0
Your ex wife can buy a Lamborghini if she starts a YouTube channel responding to these videos ,5608,133
the title would be  why i left techlead the millionaire ,1,
Yes ,1,
If she does  techlead will be ruined,1,
I hope this gets pinned ,1,
She Definitely Watches These   Maybe You Gave Her an Idea  ,1,
I would love to listen to what she says,1,
Stonks,1,
I need her to do this   ,2,
Erm  sorry I shouldn t laugh  I knew it has not been easy  I apologize  ,1,
nice comment  You are a very smart dude  She should reply to these videos ,1,
This guy is still owned by his ex wife  LMAO  Poor guy ,1,
I would travel to her and sell her this idea and manage her channel for a percentage,1,
Exactly,1,
Yeah  if she existed  This guy is obviously putting on a persona show with satire  It is  of course  hilarious  but still a fake persona ,1,
You dropped him a family business idea lol,1,
onlyfans,1,
her first video is  I bought a 500k lamborghini,5,
LOL   Checkmate ,1,
I would definitely subscribe if she does ,1,
wait  what  No way  the actual Tay Zonday  ,2,
Imagine Pinky   Brain,1,
You are the tech lead,1,
Ha ha ha    Good one ,1,
HAHHAHHA GOLD,1,
She should  I hate one sided story ,5,
That would take actual work tho,1,
her channel should be  tech lead s ex wife  and the title should be        as a millionaire s ex wife ,4,
Tay my man  CHOCOLATE RAIN ,2,
If she s able to deliver good content constantly and regularly   Which I doubt  because she d be too busy spending it   ,2,
And she could have a Mother s Day sale on how she makes a million dollars a year off of YouTube course,2,
I wonder if she watches his videos,2,
based  Would 100  sub to her,2,
That all makes sense  but what if you are an investment banker who has to wear suits  stay in NYC London working for good money 12 15 hours a day  Don t you need something to make yourself happy because you don t have the freedom  So you buy a nice car a 3 bedroom apartment to please yourself and make all the effort worth it ,1,0
Would you want your child to watch your youtube videos ,1,0
Money ruins people,1,0
U married the wrong person ,2,0
why r u still talking to her ,1,1
updates on his son maybe,1,
I always like your videos  as a millionare ,1,0
Here for the tea      Lol  ,1,0
You re the real deal  ,2,0
