Comment,Likes,Reply Count
It doesnt seem like he understands woman  Im a guy but he doesnt have consideration when it comes to his woman  I know he is all success crazy  but it seems like he changed from who he once was  Thats why she wants to leave because he was a person who lived life and not like now where he is just a depressed millionaire      money isnt everything either  Look at the billionaires recently  People want others who have good experiences and live life so I don t blame her     ,1,0
This dude is a millionaire  I didn t notice,1,0
You are cheap  You maybe wealthy on paper   but your lifestyle is that of someone on social assistance  Sitting in your room stroking your rod and playing video games all day is not a lifestyle anyone should strive for  You mentioned you use to travel   dressed well and you lived a luxurious lifestyle  this is the lifestyle that your wife assumed she was marrying into  instead it sounds like you gave her the bait and switch  Now your wife lives in a home that you pay for and is getting run through by a guy making 30k a year  because her financial needs are being taken care of by you and that just leaves her sexual needs that are being taken care of by someone new  The thing with you young rich guys is that when you get a woman you feel as though you can marry her and park her in the garage like a trophy car  But relationships take maintenance and energy that I don t think you were willing to invest in  I wish I could talk to you directly and school you on some things you ll never find in a text book ,2,0
How did you fall in love with this woman  ,1,0
Great video ,1,1
Mcdonalds is super tasty  And living in a hotel gives you the opportunity to take part in The Continental Breakfest ,1,1
Love this  Respect to you  Your ex wife should ve married some rich Arab   You need a woman with a soul and moral compass to compliment your attained wisdom ,1,0
Well id love to be your imaginary friend that needs tuition for a coding bootcamp   will payback 0  interest  ,2,0
If I made  500k a year from a job  I ll live off  50k and invest the rest in crypto and become a billionaire by 50 ,2,0
Wealth is health most important  ,1,0
I m suspecting the reason you were fired from Google and Facebook is your brutal honesty was just too much for all those safe space millennials to deal with   ,2,1
Dislike from me only because you re more focused on putting millionaire in your title than passing on real useful info to your viewers ,2,0
Thats why she is your ex wife   ,1,0
she s a gold dig  She left for the good reason  as men we don t need a trophy wife like that ,1,0
Eat well   dress well  just administrate your money right  save   invest and you will be okay  when you die you take nothing just memories ,1,0
Bruh  That s where you went wrong   You met her spending money everywhere you went  Then she found out you were a cheap millionaire  She dipped ,2,1
That s why she s an ex wife  All talk and no planning or listening ,1,0
As a millionaire  I m so sorry you re stuck with that parasite ,2,0
You are right bro ,1,0
 well I have no friends  so the situation has never come up     lol  I feel ya man  Can relate to a lot of what you re saying  Just found your videos  great stuff ,45,1
 Sandra bullock  Been in the crypto game myself since 2013   ,1,
my ex wife thinks that I am very dumb and she left me  Not joking seriously as an heart attack  She thinks everybody else is smarter than me and have a better job and living    ,1,0
When have you seen your children last ,1,0
 15 million net worth minimum for the Lambo ,1,0
Mind sharing your monthly spending on things  I live in bay area  rent is hard to cut down ,1,0
You are the R E A L deal   Much respect,1,0
I just wanted to hear about crypto   and now I m 5 videos later stuck in your channel  Great wisdom,29,0
i cannot wait to see your next partner   ,1,0
Your ex wife love those videos  I am sure,1,0
Dam women are something else ,1,0
Your ex wife is just jealous because you found out how to be happy with your own personal growth  rather than your material growth ,9,0
I live in Brazil and eat on Mac is pure luxury for weeknds and spend all month incomes  Its all depends on where you live and the chances you have ,1,0
I see things very similar to you,1,0
lol she damn funny,1,0
I totally agree ,1,0
BOYCOTT ALL CHINESE PRODUCTS UNTIL THEY STOP BANNING BITCOIN IN CHINA  SHARE THIS WITH EVERYONE,1,0
Stay the hell away from Woke   Western Woman       Absolutely never marry them   ,1,0
You re wife is money minded    Exactly like my ex wife ,26,6
 Sundeep Kumar Chill  man  It should have been a meme ,1,
It s very easy to talk about how to spend someone else s money but it s really hard to make your own money  In this day and age saving money is the most important thing to do as an individual  Future seems very skeptical and bleak  Save up ,22,2
The biggest mistake I did I MARRIED ,1,0
 I have no friends  Oh  so that s why he is so relatable,222,6
He and I would be good friends  I pay 1 00 for coffee at McDonald s and buy my clothes and household items at Goodwill ,3,
Smart people tend to not have friends ,5,
 Classical Music Remixes 432hz I m pretty sure he is not  He seems very unlikable  I really believe that he might have Asperger s  Not trolling ,4,
Yea I pretty sure he was being sarcastic ,5,
He actually has alot lol   ,4,
I collect expensive classic cars because they hold their value and can be sold over my purchase price  I can also monetize them by leasing them to movie studios for film shoots  conventions  and other projects  So I would say the  500k Lambo can be bought when you find a way to invest it into a project that pays itself back ,7,0
You are,1,0
Moral of the story  how to get rich   don t have friends,1,0
Thank goodness she s you re ex wife    The maintenance on this life style that she wants is insane,32,3
Yes thank God because now he can be with me,2,
Was she like super hot or something ,1,
dude you are not cheap you are a stingy person,1,0
I love how this video is honest ,11,2
Have other videos you watched lied to you ,1,
Realest ,1,0
McDonald is cheap       Sheesh,1,0
just can t get over it can you,1,0
Lol        A joke of life,1,0
To be completely honest even if I were a billionaire I wouldn t buy a lamborghini id buy a brand new Camry and the rest I would invest somewhere,3,1
You are obsessed with your ex      weak and boring ,2,0
We really need to have the wife s side of the story,5,0
He has the art of making someone sound very nasty without actually saying anything nasty about that person   ,270,5
 Carpe Diem this is a comedy act and the characters are dramatized for laughs just so you know not everything on the internet is real   Play more outside,2,
 Manan Gupta how do you know  Not saying she isn t but why do you say that ,6,
 Carlos If you think about it most people you meet in your life such as family and even friends think like this  I wouldn t say they are nasty but definitely unwise like you said ,15,
Not nasty  simply unwise,17,
At least upgrade yourself from the Happy Meal ,1,0
He s a true inspiration for geeks   ,2,0
Is not Joma your friend ,1,0
Thank you for the video  You reminded me of my late Uncle  He was in Sillicon Valley between 80s and 90s  He used to talk to me share his knowledge and thoughts like what you are doing now  I didnt appreciate him as I was in high school super naive and didnt understand  He died from cancer 1x years ago and only now after start watching your videos reminded me his wisdom and knowledge  Once again thank you for the video  Your videos always inspiring ,12,0
Give this man a hug  As a millionaire ,622,3
Sending hugs  as a millionare ,3,
He really seems to need a hug  Life is not going as expected and that can be hard  family situations can wreck anyone ,7,
Are we allowed  He s a millionaire,20,
Your wife sounds like my ex husbands ,1,0
I am not watch his video night because its too bright,1,0
maybe its hurting her to see that you having so many oppurtinities with your money  but seeing you doing not so much with it  but hey i dont know her,1,0
Ex wife is still stuck in a mindset of wanting to play a status game  by wearing nice clothes and living it up  trying to impress people who don t actually give a sh t or at most feel jealous ,188,7
ppl this with that kinda midset are usually those who can t earn the money themselves  Ppl who are capable of earning that much money would not spend to impress others ,1,
Not an Asian thing  It s quite universal with most western mindset women ,11,
It s an Asian thing  not all of us but many of us have this toxic competitive culture,6,
It s a common thing in new age Asian women,17,
 The truth will set you free  but first it will piss you off ,46,0
I can listen to this guy talk all day you teachlead   why dont you do a podcast  ,5,0
Im starting to think you could really do well as a comedian   ,18,1
You re so subtly hilarious  Very smart   interesting ,5,0
Friendship is overrated  Looking back  mostly they ve been crappy ,1,0
Working for the next 50 years to buy a Lamborghini which depreciates immediately is so not worth it ,1,0
Respect   you sir are a real man  Very inspirational ,1,0
I ve been watching this channel for several months  and I still can t tell if it s a joke or for real ,10,2
 Stronger Than Every Woman On Earth Combined lmao,1,
People are wondering the same about your face ,3,
Maybe not cheap  Stingy  controlling  calculating and exploitative  Comes to mind ,1,0
Lolzzzz    ur not cheap u just intelligent with your money   ,1,0
You re spending your money  wisely   You have a golden heart  Keep that up  Helping others is the best investment  Living simply is heroic  How I wish I we can share more our thoughts and beliefs  God bless you always ,2,1
Wouldn t really say that he has a golden heart,1,
A woman who doesn t listen to your answer explanation  That s hard to believe,10,1
 Ex Google Millionaire TechLead s ex wife thinks he is too cheap     Arguably  the most amazing video description in history ,415,4
TRUE About Most Westernized Feminist influenced Women ,3,
I think this is a beautiful presentation on being rich vs being wealthy ,61,0
FACTS ,1,0
TLDR  Avoid marriage and children ,1,0
techlead is a very humble person  the divorce says a lot about his wife   ,7,1
You are not  don t worry,1,0
What does she bring to the table  NOTHING,1,1
Lol  2 per hour,1,1
Iam not here for the video    just for the comments      as a non millionaire ,1,1
You were giving her  100 000 to play with  that is not cheap  Lol,1,1
Just different expectation in life  Hope u find someone to share the same view as u  But den again  keep so much money for what  Enjoy it   haha,1,0
you are an INTJ  You make your own rules  Stay the course ,1,0
Yes family is very important  ,3,0
The deal yes              ,1,0
Success is not in things  it is in peace of mind ,1,0
I hope your wife is watching this video ,1,1
I love that this is your response,1,0
Because of you I m no longer buying 200 shoes or shopping at the mall,3,0
I don t think buying Lamborghini is good choice instead of this I will spend money on orphans who want study,1,0
hilarious  a million subs watch this including me ,3,0
Wow just wow  ,1,0
For me personally  To justify spending  500k on a vehicle  I d need to have a net worth in the  40  60 million range  I m talking liquid with no debt to my name ,41,12
 Murray Saucedo same  bought my car and everything I own with cash  Being debt free is the best ,2,
 Classical Music Remixes 432hz no offence but that s because many of those people are idiots  A car is hyper depreciable  I agree with Murray that I would only buy a luxury car if my net worth could support it enough that losing thousands of dollars in car value would mean nothing to me ,1,
 Classical Music Remixes 432hz this is why  most people  are poor lol ,3,
 Murray Saucedo so I m guessing that is a 20k car how much do you earn a year ,1,
 Classical Music Remixes 432hz hence why I said for me personally  I don t have that hence why I don t drive a  500k car  I drive a 2015 RAV4 CPO I bought cash again no debt in my purchase,1,
how do you figure that  how about if you just make 1M a year   most people buy 30k cars and make 50k a year  So thats about the same ratio ,4,
His sense of humor is really putting my humidifier through its paces ,23,0
Bill gates new video   I am divorcing my wife  as a billionaire ,1,0
Wisdom achievement unlocked ,1,0
His ex wife is crazy  why would you do this   ,2,0
Great video keep it up  ,1,0
Next time take your dates to Costco for the free samples lunch   It s a tried and true way of weeding out the surface dwellers ,3,0
The secret of your future is hidden in your daily routine  Successful people do daily what the unsuccessful only do occasionally  Successful people don t become that way overnight  What most people see at a glance wealth  a great career  purpose   is the result of hard work and hustle over time  The amount of time you spend believing you can t is more than enough time to learn you can ,8,20
Is this guy an ex millionaire as well ,1,0
You are teaching my life lessons  and helping me with financial information and helping me understand inflation with the market plus managing investments  You are a genius  I can definitely learn a lot from you      ,3,0
 I felt the need to publicly respond to this because she wouldn t listen to me when I tried to talk to her  Lmao this guy actually finds the best excuses to put his 2 cents out in the internet  I love it ,169,3
Actually he just wants to get rid of his 2 cents but he can t coz he doesn t have anyone who would listen to him irl so he just makes a video ,9,
 ,1,
He s smart dude,3,
t h a n k s f o r w a t c h i n g F  o r m o r e g u i d a n c e  1     4      3    1   7     2    2    3    6   0    5      W  h  a  t  s  a  p  p                      On investment DM            ,1,0
Basically marriage brings a philosopher in all asian men    i feel that,446,14
he voted for Biden that s the real reason she left ,1,
 Shadow1986 amen    ,1,
problems brings out the best of humanity man  otherwise we would have never evolved from cave men ,4,
 Shadow1986 i was just thinking about this sentence  but can t remember what it is loll  Thx ,2,
 If you get a good wife  you ll become happy  if you get a bad one  you ll become a philosopher     Socrates,37,
 JML I think he is genuine about his feelings but little emotional and agitated about the unfairness in women dealing with men   but women have complicated system and menstrual problems which drive the hormones crazy  Only woman with menopause can sound reasonable to a man but they can t make babies    that s why men has to be extra tolerant to women to make it work,28,
I am a Asian dude with a wife and 2 kids  living in the Bay Area as well   I have seen plenty of Tech lead type   He is a little off  or is this just an act ,15,
LOL,4,
Next vdeo   I buy ferrari  as a millionaire ,1,0
This man is my hero   Living my dream   RESPECT ,13,0
Bro do your best to take your kid back  or at least get some form of custody  It is quite damaging for a boy to grow up without a father figure in his life  You might not be the perfect father  but you nevertheless are one ,2,1
It seems that your ex wife needs to talk to Kevin Samuels   ,2,0
this guy s humour I just can t,1,1
I think the underlying problem might have been that your wife wasn t feeling successful and since your a millionaire you could have shown her affection by buying her a Porsche for example,1,0
I love his honesty and sarcasm  I had to subscribe ,1,0
Good advice  Now I want McDonald s for breakfast   ,2,1
its incredibly ironic too because she aint buying the lambo with her own money  but is is essentially a beggar to you  hence shes really making the argument that u shouldnt buy the lambo for her lol,1,0
Tech Lead is EPIC  as usual   ,1,0
That is why it is so important to know what you want in a person BEFORE you marry or give them a baby,6,0
I love listening to this ex Google and Facebook employee as a not so broke man,2,0
You are rational  your ex isn t ,1,0
Just meet you dude  I think I will follow you from now on  ,1,0
 I m actually the real deal  hahaha  i love it,28,0
I ve lived at a few income brackets over the years  I think the idea of blowing a heap of money on something like a fancy car is fine  until suddenly you actually have that money to do that  then you find you make different choices  Or  you go on a huge spending spree for a little bit  if I ve been doing it super hard and then get a really good job I find this happens  because there were things I was doing without that genuinely need replacing or updating   but then you ll find yourself naturally evening out  and making choices that ensure a continued flow of that money  I think the car is just dreams  Only people I know to get the fancy cars  was always the upper middle income bracket bogans  The richest people I ve known  just drove a regular Toyota  or if they splashed  it was only like a Renaut  or an Audi  not the super high end   Those were self made people though  maybe it changes with 2nd and 3rd generation rich    Still  I think what she s said is   just the dreams of someone with a lower bank account  They aren t practical  and if it became real  she d likely find herself making similar boring choices as you ,1,0
Your bank account  your choice  I mean it ,1,0
Why the F    would I want to buy a Lamborghini ,1,0
I love your cheapness  I am exactly the same way     this is the true image of success and you need to get that into your head   hahaha  I love that  your wife sounds like insecure about her financial disabilities  people like that love to impress others to hide the fact that they are not financially strong ,5,0
 oh well  as least for me i have no friends   that s a good one,1,0
The most fun part is when he says how much he values friendschips  relations and connections with others when he doesnt even have friends XD,572,24
friends are liabilities not assets ,2,
well     i went through many of this but somehow i can understand     easy to get relationship but hard to get the right   true one,2,
rather no friends  than bad friends  It is not easy to find  good  people who are not superficial  toxic or want to take advantage of you  This is a high quality man and he has high requirements for people in terms of character,15,
The higher you ascend  the more rarified the air  the smaller the crowd   ,21,
You value the things that are scarce ,6,
well that doesn t mean he never had friends  people grow apart all the time  friendship can end because either they had to move out to another country   death  etc  not having friend at that age does not mean its his fault or that his a bad person  it can be from situation out of his control ,53,
      ,1,
ROTFL    OMG    For real  He doesn t ,3,
patrick how do u not understand  your wife thought u were a geek with some money   but then you took money out of the equation  so why would she stay with you  cmon now,1,0
U r the best YouTuber,1,0
If I had millions of dollars  I will still be shopping at Walmart  I will be going to McDonald s and keep a small house and I would still drive my Toyota Camry  You re not alone ,237,15
 Somchai not saying I m wealthy but I also bought my Toyota cash and love it  In fact I like buying everything I own with cash  If I can t then I just don t buy it  Simple,1,
 Bryan Lee I have two Aldi s within 15 mile radius  Love the minimal choice  as weird as that sound ,1,
Got to upgrade to an Avalon  Owned two myself  Rock solid reliability  best bang for the bucks ,2,
 Bryan Lee Yes  I just came home from Aldi a few minutes ago ,1,
 Somchai yes and some of these people financing their Bimmers and Mercs are only a paycheck or two away from not being able to make the payment should they lose their job,2,
Aldi is better value than Walmart for some or most unless U want to get the great value,7,
All my wealthy friends drive Toyota and Honda and paid cash  The poor friends drive BMW and Mercedes and make payments ,19,
 Fan Bu I agree  In fact  these days I actually buy Burger King more than I buy McDonald s  Burger King also got better deals and are less crowded ,7,
Try Burger King  whoppers are consistently better than Big Macs ,18,
you and your ex wife just have different views on money  it s a common divorce issue  that s fine ,3,1
Correction  he and his ex wife have a different view on HIS money lol,1,
I am glad that materialistic wasteful bi    is out of your life  Thank god you can move on now she has no concept of what is takes to make that kind of money  Frugality is a wonderful quality  and she can go home to live with mom  you do not need her anyway ,1,0
I ll be your friend Mr TechLead ,1,0
You are good at optimizing things  but you can t optimize people without their consent  which I don t say you do  but the fact you can t means you have to accept that they must change a lot of things by themselves or actually remain the way they are   They have their own mistakes  and they are free to do or say stupid things  In order to live a good life with others you have to a  get surrounded by people like you or b  Accept their mistakes and adapt to them  The main thing is that they must correspond to your principles  and I don t think your Ex does  She seems to care too much about spending money and not that much about the value of the simple things that people can do  In order to find more people that value little things  you have to do more of those  Because it seems like you only have to offer tons of money and productivity  thus you end up with people chasing your money  As a random nonrelated advice  start doing Muay Thai  It s great for people that care too much about productivity but feel anxious about things like the meaning of life  the blame  responsibility and other stuff ,1,0
TechLead  just date another woman and create a new family  that is what you should do  You value children  and you have strong family values  An unsuccessful relationship is not the end of any relationship that you can have in the future  Find a woman who shares your values  especially related to spending money reasonably  irrespective of how much you have or how much you earn  A woman who simply wants children and who also wants to have a family life as her priority  And who understands that  in life  you have to sacrifice in order to succeed  The Japanese woman you were in a relationship with  your ex wife   it did not work only because she did not have the same values than you have  She was Japanese  yes  and that is part of your roots but a Japanese with bad values is not good as you have experienced  And that is not the end of a relationship with a Japanese or with a woman who has Japanese roots  you could simply try to find both Japanese roots and a woman who shares your values and that will work this second time  Your values are the right ones and they are the ones that will last and that will be beneficial long term as opposed to thinking short term like your ex wife  All the best to you  TechLead  TAKE ACTION ON THIS MATTER  DO NOT WASTE YOUR TIME  AS EVERY YEAR  YOU DO GET ONE YEAR OLDER  ,1,0
SHe didin t want u to share your life  She wanted u to share your wealth  then frustrated wHen she didn t get as much as she think that she desirve   Entitlement is beyond logic that is why man who didn t get spoiled in their life don t understand  Me neither ,2,0
I don t think there s any point where buying a 500k Lamborghini makes sense  Wanting to live lavishly is one thing  but I don t see why the rich have a need to be overcharged so much  Get a Tesla Model S Performance for 1 5th the price and twice the acceleration if you want that experience so much  Eventually  buying the more expensive thing yields diminishing returns  or the expensive thing turns out to be even worse ,1,0
If you don t spend all of your money on them  they are on to someone else   If you spend all of your money on them and have none left  they are on to someone else   Either way  in the end there is only you left ,10,0
This is totally true lol   In the Silicon Valley you see some people wearing very trash clothes chilling in a Palo Alto coffee shop at 11 00 on a Wednesday   Those are the ones who sold their companies for millions billions and don t need to impress anyone   They are the ones who can chill at a coffee shop on a Wednesday because they don t need to work ,505,14
It really depends on lifestyle  I think there is a general culture among tech people to be laid back and care less about appearances or material possessions  However  I have also seen millionaires who do like to enjoy the finer things in life with their money  Especially if a large part of their job requires it or it becomes part of the culture etc  Think hedge fund managers or other millionaires within corporate finance  Or millionaires working on the fashion industry etc  Or just certain millionaires in various industries who enjoy that stuff  How people chose to spend their money I think also comes from some of their value system  It seems the ex wife and him just had a different idea of how they wanted to live their life or spend their money ,2,
The people with champagne tastes aren t usually achievers,1,
Yes but not living in a nice house has no excuses  Why do you work if you can t even afford a freaking decent house    My man s was so afraid of leverage that he ended up spending everything on the divorce instead ,1,
My dumbass clicked 11 00 10x,2,
that thinking ignores the idea that others still achieve some fragments of self esteem from looking well groomed and fashionable and sets the bar for  success  as  busy  divorced millionaire  bad food  bad clothes ,1,
 heymichelley Also true   I like expensive stuff even though I am not rich   It s the appreciation for art and craftsmanship   May be that s why I am not rich   LOL ,12,
