Comment,Likes,Reply Count
 NEW  Join me in DeFi Pro and make passive income with crypto  http   defipro dev ,29,9
Hello  TechLead   Nice hoodie   Could you please share the brand model   Thank you  ,1,
What sapp                More updates on XRP  NFT s  BTC  What sapp              More updates on XRP  NFT s  BTC    ,1,
More like an ex billionaire                                 Lester Crest ,1,2
INVESTING IN CRYPTO NOW IS VERY COOL EXPECIALLY WITH THE CURRENT RISE IN THE MARKET  ACT NOW ,26,98
Great video Scott  The wisest thing that should be on everyone s mind currently should be to invest in different streams of income that doesn t depend on the govt  Especially with the current economic crisis around the world  This is still a good time to invest in BTC and digital currencies  BTC ETH        ,2,1
You made the fact  It doesn t matter  Who  What  Dislike and go on watching what gives you good feelings  Whuuha  speak like a roboter and add commercial content  Brainwash is not a source to upgrade your ego,1,1
Techlead has taught me everything in life   even how to be funny  ,2,1
Gotta make all the freedom haters cry lol    ,1,2
The market is very unstable and you can not tell If it s going bearish or bullish  I advise everyone to forget predictions and start making a good profit now because future valuations are all speculations and guesses  When these reports are bullish take some off to the side lines  when news gets bearish start buying   Keep it simple simple  that bear  correction was the best thing that happened me But all thanks to Mark for his amazing skills for helping me  Trading went smooth for me as I was able to raise over 9 BTC when I started at 2 5 BTC in just 5 weeks of implementing trades with signals and insights from Mark Jean  I would advise you all to trade your asset rather than hold for a future you aren t sure about You can reach Mark on  eI    m Markjean5050,8,6
This is why investing is so crucial  You might not be able to invest as much as 50  but by investing you can be financially free way before your retirement age ,111,6
Bot,1,
 Zahair O Brian  surf the web for her info ,1,
 James comb The market has chopped me so hard  my portfolio is in shambles so i really need some guidance on how to invest better  how can i reach this person ,2,
 Fred Gallag Always backup your trading with a good strategy  else the bear market will hit you so hard  and you might wake up losing your savings ,2,
The long term investors like   Alexis Georgeanna Herman  do not worry about short term performance that s why i follow her trades  which made me get a profit of  17 300 from  2 740  Whilst there will be crashes and opportunities to buy the overall trend is a positive one ,3,
If you have the patience and discipline to buy and hold any asset or stock  you will be rewarded ,4,
I was banned from Twitter over a year ago  My account was always in suspended animation  So now I don t care what they do with it  I ve found more productive ways to waste time  Like here for example ,2,2
DISLIKE,1,2
A great conversation about the whole Musk Twitter thing  https   youtu be y49xMXKN9 4,1,1
Hmm  by no means  it is verified that  it will happen   but from one of the tweets after Elon made the purchase was to Opensource the algorithm  Which I assume  is the algorithm behind how information are circulated for users to manipulate how they perceive their information    Personally  from my point of view  paying 44 Billion to show ads on the platform is fine unless it diverges the whole point of this massive purchase and effects the opinions of the people   If Elon  does what he says  this is gonna be revolutionary  If this isn t done at some point in time  the future is gonna be dark     We are just a part of hivemind created by tech giants   What does this mean  we are being constantly manipulated with the information we perceive on the internet from the corps like GOOGLE  FACEBOOK oops   META  you name it ,2,2
Reacting to Elon purchase of Twitter as an ex Millionaire ex Tech lead ex Husband,1,2
Shouldn t you be in jail ,1,2
Hahahwha,1,2
You crack me up,1,2
Is it too late to get on the Seedify whitelist  I m trying to save over  5k so I can start,2,1
How do I get into these if I m in newyork ,2,1
okay then  I will give her a head start to see what she s capable of making ,3,1
Happy for you,4,1
OMG  ,4,1
Make a note to Sharon on What sapp regarding your interest in investing in crypto currency and Nfts,5,1
yeah she does  she s an exceptional and lucrative broker at same time  I just bought my dream Mercedes from last weeks profit  All thanks to her expertise ,5,0
Techlead we know you just doin this for what moving at the moment to make money of views ,1,1
What sapp 178552173759    More updates on  market  What sapp 17855173759  More updates on XRP  NFT s  BTC ,1,
same  I started with 6k and now 39k   happy I started with Sharon,5,1
Sir your thumbnails are getting better day by day ,1,1
Despite the economic downturn caused by the war here in Ukraine     I m so happy    I have been earning  32 000 returns from my  8 000 investment every 13 days ,6,3
Netflix also suffered because as the world opened people left the media streaming services after lockdown and started going out again  After a couple of years of been stuck in you home watching movies all day it got tiring  after the lockdown Netflix had nothing else to give  Also  a lot of there new movies are so woke that I deleted my account about 2 years ago  ,16,4
Even Anne with an E had a woke streak in it  very annoying ,1,
Developing from the Commons a superbe free speech and open source information platform with training facilities on how to operate gates to free abundantly available naturally sustained energy and information resources would be logical when you look at what Musk has comprehensively been collecting over the years ,2,1
My question to Techlead is what happened to your Million Token  You don t seem to promote it as much anymore ,1,1
Only GOD THE GENERATOR   CREATOR AND DO NOT FORGET THE DESTROYER    WILL CONTROL WHAT WILL HAPPEN IN THE FUTURE THE POLARITY OF GOOD AND EVIL BELONGS TO HIM       ,1,1
so does he talk about DOGE ,1,2
Techlead I found your prediction in CoinRiders  of bitcoin go to 100k in 2022  Is it still relevant ,1,1
It means I can get my account back after being banned for saying let s go Brandon ,4,2
Finally a little common sense on this subject   I am in agreement  lots of possibilities here but people build Musk up to be something he is not  If you re a rational person  there is just no evidence that he has done anything nefarious  In agreement on Netflix as well  But I will add my belief  that the decline in Netflix and the appearant public desire for Musk to buy Twitter are connected  Nobody seems interested in supporting entertainment or professional sports after the woke movement  A take away might be  people don t like being told hiw to act by individuals they put in the position of  celebrity    Either 81 million people are having buyers remorse or that figure was hugely manipulated   ,2,1
 binance lagged right now    btc pair to ethereum almost   x 4    i upIoaded vldeo  ,493,1
elon musk bought twitter to shadowban bill gates,1,1
If I were Elon  I would make twitter more then tweets  He doesn t need to buy FB if he adds features to twitter that make it more like FB or instagram  The network is already there  he just needs to figure out a set of rules for everyone to abide by ,13,2
Love your Channel    Greatings from Norway  ,2,2
Your intro is flawed  You think he s doing it to be the cool kid  Elon is a Patriot  When platform s are restricting free speech that s a major issue  Just because people don t like what Trump has to say  he should be offered the same platforms as his opponents ,1,2
I think Elon wants Twitter to be the centre of the meta verse  also  Will ultimately link in to neuralink as well ,11,3
What s that wallpaper ,1,1
i think its ludicrous that anyone would buy twitter for that much  suddenly lost A LOT of respect for musk  complete waste of money  He could have started his own for 100k us and then just tried to make it popular  what a bizarre thing to do  he should have just given everyone on earth 1000 pound each lol ,1,4
I m always intrigued by these changes of background  I thought the flat in Las Vegas was the deal  now      ,1,2
Please I need someone to help me trade or invest the forex or crypto market because I m tired of trading in losses myself  I ve blown my account twice and it s frustrating ,5,1
Please I need someone to help me trade or invest the forex or crypto market because I m tired of trading in losses myself  I ve blown my account twice and it s frustrating ,5,1
Tesla isn t a car company  They develop self driving cars making it an AI company  The Robot arm of the business will be larger than the cars according to Elon  Tesla ain t BMW ,1,1
Please I need someone to help me trade or invest the forex or crypto market because I m tired of trading in losses myself  I ve blown my account twice and it s frustrating ,6,1
Expect a new name for twitter ,1,1
Crypto currency and NFTS will outsmart the banking system in the nearest future serving as a global fiat  Already making over 85  profit from my current investment ,9,1
You are right but the market is profitable if you are using a really good broker or account manager to help out with trades or provide signals,4,
Title should be I am supposed to buy Facebook as a millionaire while Elon buys Twitter as a billionaire,1,2
Thank you techlead   ,1,1
Great video  techlead  Always enjoy your refreshing perspective on things  ,5,1
Buy Your Hip Waders  the Liberal Tears are going to be deep        ,1,1
What sapp 178552173759    More updates on XRP  NFT s  BTC  What sapp 17855173759  More updates on XRP  NFT s  BTC  ,1,
it s going to be interesting to see if people like Trump are allowed back on Twitter  I am not sure what responsibilities Twitter will have if people start instigating riots through Twitter but will will find out soon  Similarly  you can t yell  fire  in a crowded theater just for fun so the same logic may apply to social media yet difficult to enforce ,1,3
Good content as always,4,2
Does anyone think dogcoin will run up ,1,2
EmoTioNal DamAge,1,2
Interviewer   sir  what do u think about Elon buying Twitter    Techlead   As an ex google  ex facebook tech lead  multimillionaire  sips a cup of coffee     ,89,4
You missed ex husband,2,
Kindly send a direct msg to join our private coaching and membership,2,
What sapp 19195029420  More updates on XRP  NFT s  BTC  What sapp 19195029420  More updates on XRP  NFT s  BTC   ,2,
Please Elon  just delete it ,1,2
so all the money   and he overlooked all the poor people who could use the help  he instead bought twitter ,1,2
Tech lead is a racist  he no doubt hates Indian brown skinned tech CEOs and engineers ,1,2
Did this guy had crypto scandal   Ik I ve seen him somewhere,1,2
Before he bought twitter i didn t even had a twitter account ,2,3
Someone rly needs to do something about these bots ,1,
Active Audience I need traffic on my Channel,1,2
Imagine if he deletes it for the memes,1,1
44 billion  He could have spent the money on a billions better things then Twitter ,2,2
Best news EVER   ,1,2
If he really allows free speech and makes some changes then Twitter could possibly be good  I never liked twitter myself  I m not into having to limit the length of my post,2,2
True  it s pointless ,1,2
This video is brought to you by     MYSELF   ,2,2
Btw i bought the Defi Pro course and give you insights to it on my channel,1,
Alt Title  ELON MUSK BUYS TWITTER  as a billionaire   My views on how your LIFE will change FOREVER   as a millionaire   ,8,3
        ,1,2
I m just enjoying the meltdown these leftist have with Elon Musk owning twitter   ,38,4
TechLead s sense of humor is sexy AF to me  ,1,2
     as a millionaire   You forgot to say it TechLead ,1,1
I hope Twitter becomes Woke Free,2,2
I thought it was a big deal and I got excited for a moment  but then I realized I ve never had a Twitter account ,25,3
Incidents like this are not really about changing our personal lives  It s more about changing the direction of society in general which affects us all on a deep level whether we want it to or not ,1,2
Deactivated my account on twitter after these news  Not that i m a big dude there or anything  But Elon Musks version of free speech is not going to benefit the whole world ,1,2
Yes       ,1,2
Did Elon know anything about Metafora ,1,2
Trump will be able to tweet again ,1,2
Haha     Actually am wearing bonito  it a collection from Dubai,1,
Lol  you crack me up  dude  Love your show  Keep up the awesome content  The money making ones especially ,1,2
I don t care about twitter  as non millionare  ,1,3
Kindly send a direct msg to join our private coaching and membership ,1,
What sapp                More updates on XRP  NFT s  BTC  What sapp              More updates on XRP  NFT s  BTC    ,1,
 ,1,2
The only place where I hear   This video is brought to you by      myself ,2,2
now musk has your email address and your data,1,2
 as a billionaire ,1,2
  I would rather Elon control twitter than a bunch of board directors taking order fm the politicians who spin it to their gains and climate excuses  And btw did you not know that trees is also the causes of Co2 depending of how hot the sun shines on them   everything has a balance in the universe  I wonder what will happens if the oxygen level replaces Co2 formulations  boom  We will all be on fire  ,1,2
Elon has a long plan in place  I think crypto will be a big part of future social media   Maybe even a star kink connection,1,2
ELON MUSK BUYS TWITTER   as a billionaire ,1,1
finally sumthing not related to crypto,1,2
what a boomer take lol  twiter is consuming the youth,2,2
Parag wont get fired  He made it happen ,1,2
Hopefully he stops the massive censorship,1,3
 This video is brought to you by myself  Gets me every time ,127,2
Luv this Dude   Pause   ,1,
If you haven t yet give your life to Jesus Christ   he s alive and he loves you ,1,2
I always wonder how I always end up watching his Tab switching  comment reciting videos  he is phenomenal ,9,2
It remains to be seen ,1,2
 authenticating all humans  that sounds a lot like anonymity  not censorship  will be the first thing to go ,3,3
Yeah  something like my first thought on anonymity  Privacy is as important as free speech  Perhaps Twitter   I mean    Elon    would only verify whether a human executes commands only in order to kill off  automated flash mob   which is highly desirable  PCness and self censorship   oh  same thing haha   is truly deplorable  I find that more offensive than socio political restriction ,3,
I think because he knows AI so well  he probably understands the extent to which social media platforms are manipulated by fake accounts  bots  and algorithmic manipulation ,2,
I hope this guy gets fired right away  savage,1,2
The rational male mentioned you on his last video ,1,2
Puts on FB   ,1,2
I would love to see jacks face ,1,2
someone give Tech Lead an oscar pls      ,2,2
I had the same idea as you    it literally means nothing for normal people ,1,2
Techlead will you ever buy some company    then u can make videos as a billionaire   ,1,3
I don t use twitter  hahaha,1,2
Holy billonaire ,1,2
Hey Techlead  any tips on how I can become a millionaire by creating shitty pro Russian videos on my channel ,1,2
Back in cali   Old setup,1,2
Lol twitter is the only thing i use  I know its hard to grasp for people who don t use it  Try and join community that you believe in  you twitter experience will never be the same ,1,3
Maybe Elon will hire you and you could be an x Twitter tech lead lol,1,2
Good for him buying twitter but I don t think society is going to improve because he owns it   Not because of him but because people are selfish and lack direction   They love to go on twitter to get distracted because its more painful to look at their own lives ,1,2
The masses will follow and invest  If twitter improves my dating life  I will bow to the king ,1,2
I d like to see you on twitter more TL,1,2
0 00 when you drank so much coffee  v,2,3
His move to purchase Twitter maybe one of the factors that might save America  To it her has been a left wing mouthpiece for a couple of years now and opening it up to you points that opposed the left is one of the greatest benefits to mankind  Twitter has influenced the last election heavily  Because it is unbalanced and favors leftist opinions ,1,2
If I dated I guarantee she d leave  we d be seated at a nice restaurant  after I spent the first 1 hour talking about Elon  she d check out after I started going over the Boring Company details  Sucks for her  this is real life ,7,2
I had to click     ,1,3
I skipped a few times just in the first minute then had to quit the video altogether  Did I miss anything ,1,2
4Chan shares plummeting right now,2,2
hey  been watching your videos for years  I m the son of middle eastern immigrants who I ve recently made very proud of me  I managed to get a good tech job that pays six figures  start a nice family  and bought a house  I just want to say thank you for inspiring me before I go to Ukraine and fight Putin s goons  My wife will miss me and the kids will too  but I know I m doing the right thing  So  again  thank you for all your help  Hopefully I ll be back to be able to watch more of your videos later  Until then  SLAVA UKRAINI ,12,2
Excellent acting skills ,1,2
Elon should put you on the board of directors ,1,2
Musk bought Twitter  as a billionaire  ,1,2
Awesome video   I do make over ten thousand dollars weekly with Max s assis tance  ,2,1
My years of trying to earn  profits out there has not been good to me until I knew Mr Max Davies  I make over 30 thousand dollars weekly  ,2,1
Tesla I would say is totally an ecosystem  Tesla car  charged via their solar panels  or charged on their network  or charged by the powerwall  Then the batteries being used for storage for renewable technologies  Then you talk about the smaller companies which granted arent much but the whole robot thing they got going  neuralink  SpaceX  and Boring company pretty ecosystem oriented,2,5
What does it mean  Does it even mean anything    ,1,2
You forget to add as millionaire,1,2
he gonna be able to form public opinion on any subject  also if he make twitter open source  it does not mean what he gonna be using same version of twitter in his servers  maybe hes short of ideas  will make it open source and then gonna take best parts of its forks,1,2
Thank you for the post  beloved TechLead   I need to buy that coffee mug ,1,1
Means Freedom of Speach is Coming Back Bud,1,2
hey fraudster,1,2
reddit CEO says the internet is hard   I dont think hes ever met Elon Musk   Elon looks at hard and makes it effortless ,61,4
That s your opinion lol  ,1,
If you hard  you hard,1,
Nothing good is easy ,3,
lmao all the desperate females commenting here thinking they have a chance  2 years ago  never saw a single female comment,2,1
Well     how about if Trump comes back  That will certainly change some people s lives ,3,3
My theory he let s Trump back on Trump praises Tesla and Elon stroking his ego  Then just shits on ford and GM ,2,2
Oh yeah lets keep free speech going but is he hes helping Nazis in Ukraine   is the propaganda going to be better,1,2
Elon Musk is the real life Bruce Wayne,5,2
What sapp 15097410204    More updates on XRP  NFT s  BTC  What sapp 15097410204  More updates on XRP  NFT s  BTC ,1,2
I swear TechLead could be a stand up comedian,157,3
But instead he is a sitting comedian  ,21,
Elon musk buy twitter   as a billionaire ,1,2
Most emotion I ve ever seen from Techlead,50,1
   I m new to crypto and I find it difficult using these strategies well  Where can I find a legit broker  that will manage my account and also teach me how to trade   ,1,0
ecosystem  did you mean Metaverse  xD,1,2
Not that expensive  imagine if Elon Musk bought Meta ,11,5
Metafora,1,
Do you think Elon can buy a trillion dollar company like Facebook    ,2,
Would be awesome  Although I doubt zucky would ever let it go  I wouldn t ,3,
Has anyone here been able to talk to him  because he already put several watts and it s never his  now another  I m Brazilian  but that doesn t matter  so I think if the youtubers  role is to help  then why hide  Looks like they just want subscribers  cruel world ,1,3
Can you do a video on Andrew Yang s presidential campaign since Elon is a big Yang supporter   What you agree with  what you disagree with  what he could have done better  and your thoughts on Asian representation in American politics ,1,1
That dude let his emotion get in the way of investment    overpaid massively   I m here for the sarcasms ,6,3
 sheldoncooper0  big league,1,
It s probably the best deal in the history of trade deals  like ever  Bigly ,1,
This matters a lot to me  For all I know  Elon Musk is just a bunch of pixels  Maybe you are only pixels  Are either of you real  Only on screen  Do you impact my life  Both of you do  You have made me think  You have given good advice  You have also made me think twice  You have positively impacted my life whether a real person or not  Elon Musk is important because I want the future to still have options when my daughter is an adult  I actually invision in my mind a frightening  inevitable tech revolution of society  But  I would rather it be one with options and choice whether virtual and secluded or not  That s my two cents  I don t necessarily care about him on a personal level  Though  the idea of him as a motivated  successful  routine  logical  non emotional man is extremely attractive  He does like creating babies a bit too much  and that is not attractive  So  he is not real but an idea   No one is real unless I see them in person  Isn t that just a fact  Life is only created in reality by what our mind can render in front of us  Mythic Mode raiding was only real for those who could participate  Otherwise  it was not reality to those players  That never rendered in their MMORPG world   I m getting off track  I m slightly frustrated atm  I had to wake myself up from a pretty much a comatose state and it feels very  very not good  I had to get to a concert for my daughter for school  Now I m  awake    It s not always this bad  I m commenting as if I m talking to someone  Lol  Dear Diary  blah blah blah  I would go back and erase stuff  Brain on standby ,5,10
 Kevin N lmao what did you take ma am  I m ready for a trip to VALHALLA,2,
I had a friend who commented on random posts on Facebook EXACTLY like this chick on youtube   turns out it was a psychotic break     Hope you get the help you need  lady ,1,
The hope of freedom of speech has resurged your being  Listen to your gut  repair yourself mentally and emotionally  and hang on for the ride this year  It s been a doozy for the world ,1,
i remember when i did acid the first time,1,
Wtf,4,
I appreciate what you ve done just a random thought come to my mind that I have to thank you for being so kind for the  40 500  I want to thank you for making my life better there s no man like you  I m so grateful thanks  ,1,0
Thanks for the continued great videos  I would say more emphasis should be put on trading as it is much more profitable than holding  Trading was smooth for me as I was able to go up more than 6 2BTC when I started with 1 5BTC in just 5 weeks implementing trading signals,2,1
I m just 40 minutes I own  76 000 worth of Btc with just  9 900 omg I can t even express my feelings this dude above is more than real,1,0
I m just 40 minutes I own  76 000 worth of Btc with just  9 900 omg I can t even express my feelings this dude above is more than real,2,0
Mm I don t know what does  freedom speech  means to him    If means people like Trump walking around vomiting inconsistencies  as already happens but with impunity  I fear that I m out,1,3
There are people spitting nonsense everyday and everywhere  it doesn t mean they should be silenced   certainly doesn t mean you re not allowed to leave a social media,1,
I m in the TechLead ecosystem  as a thousandaire ,58,2
As a consumer  I avoid  ecosystem  type products services  It eventually becomes a trap that is overpriced and hard to leave ,1,4
 Fred Jung Android allows other app stores besides the official one  Apple does not  so they monopolized that aspect  Not to mention that all the Apple cloud stuff doesnt work on non Apple devices whereas all the Google services cloud work on any type of device ,1,
 Fred Jung I m talking about the ones that trap you  like Apple s iOS  Which is why I use Android OS  much more open ,1,
May God continue to bless your platform  since the day 1 8 BTC hits my wallet  I don t know how exactly I feel but I know for sure your the best and real  you re the best one that hold my heart and will continue to tell people about your wonderful work,1,0
May God continue to bless your platform  since the day 1 8 BTC hits my wallet  I don t know how exactly I feel but I know for sure your the best and real  you re the best one that hold my heart and will continue to tell people about your wonderful work,1,1
Fake,1,
Never knew I would be who I am today after so much suffering I saw a post about your platform and I took a step to try if it s going to work  you change my life and now  I m so much satisfied with my life now  I just want to share your good work and let the world know how great you re,4,2
Your   financial help saved me from having take more debt that would have been difficult to be pay  I m indebted to you for your generosity  thanks for all you ve done,1,0
please start working there,1,2
     INVEST AND MAKE 200  OF YOUR INVESTMENTS FOR A WEEK,1,0
     INVEST AND MAKE 200  OF YOUR INVESTMENTS FOR A WEEK,1,0
The sarcastic reaction demonstrated how absolutely no one reacted to the news ,4,2
