Comment,Likes,Reply Count
u will delete this once u see the elon mads,1,
Every little bit of freedom helps ,1,1
As a billionaire,1,1
Next  run for presidency,1,1
It means that freedom of speech is restored on the largest online discussion platform in the world ,1,2
 Rott Hound 2 under one comment  One word   Dedication,2,
first thing  fire the board ,1,1
Not gonna change my dating life   I m married and still dating my husband     But   Elon buying Twitt is awesome   I hope he sticks with his free speech convictions and all the liberals completely lose their minds   ,11,2
Twitter is information warfare the pentagon now has control of Facebook and twitter,2,2
Ur  So  Jelly   ,1,2
Between me and Elon  we re worth about  200 Billion,1,2
This move by Elon has changed my dating life forever  ,23,5
I am guessing he might change the name to Twisla ,1,2
No offense but i think as an ex google  ex facebook drone  you are completely missing the point here  I guarantee Elon does not see this as a marketing tool or a place to push his agenda  That s how Google and Facebook think  That s not how Musk thinks  My Money is on him buying twitter to connect it with starlink and establish a global freespeech platform that brings humanity together and ultimately solves the specter of war  One can only really justify war against people that one doesn t know  If everybody has friends in every country  no more war  And since each of Elons companies tackle one existential threat to humanity  i think this makes sense  Might also at some point be used as a direct democracy platform ,1,2
I mean  Elon Musk is single  I m single    Elon has Twitter  I have Twitter  Sooo        the possibilities are endless  Great video lol ,4,2
thx for the chuckle,1,
You know I was thinking yesterday and had a chat with a friend exactly about the things you said in your video bro and by the way I love your videos  also stole a lot of  hidden  tips and url links from your them to improve my skills so thank you for being here for us every time sharing your honest opinions especially when you do it with style   About Elon Musk  I just hope he live enough to  change the world  like he claims because so far he had amazing results but knowing the sick world we live into where interest it s above anything  he might sit on the wrong tale by revolutionising things and humanity would suffer a very big loss if something would ever happen to him  Just my opinion ,2,0
The most expensive troll move ever  Lol,13,1
it means were gonna have lightning fast free speech on twitter from now on  ,32,4
Hopefully unbanned Twitter in my country    ,2,
 We gotta call the police  tell my Mom  ,2,2
I m astonished  a sensible analysis of a complicated issue ,65,8
 Sarbjot Singh You are wrong  Elon can easily use Twitter to market products from his other businesses  without scaring off other viechle companies   In fact  if a brand as prominent as Tesla starts using twitter as a primary promotional outlet  more similar companies will be attracted to Twitter because of the increase of potential customers   Elon can do mostly what he wants with Tesla to promote their products because he is by far the driving force of the organisation  and its most valuable asset   Twitter is struggling to make enough money considering their widespread brand recognition   Elon will be given free rein to generate more money for Twitter  no one else in the world has proven anywhere near to Elon in being a wealth generator based on personality  and business outlook   Twitter at present is stagnant  and without inspiration   Elon will change this  enabling it to satisfy ordinary users  whilst becoming attractive to businesses ,2,
 Sarbjot Singh I did not hear TL say Twitter will exclusively advertise for Tesla ,1,
 Twitter is not living up to its potential as a platform for  FreeSpeech   I m cautiously optimistic that Elon will make Twitter better than it has been for years       Democracy is Not possible without  FreeSpeech aka  Truthful  Journalism      CENSORSHIP is the Tool used when the LIE loses its power      Control the narrative  control the world      The greatest weapon is not a gun  nor is it nuclear    it s information control     Corporate owned MSM will Rot your zucking brain        People tend to overestimate the power of the US war machine  and underestimate the power of its propaganda machine     Social Media like Twitter   Facebook are the modern  Public Square    CENSORSHIP violates the Constitution s 1st Amendment on  FreeSpeech  These treasonous  Anti Democratic acts against  WeThePeople Must NOT be tolerated      The power of lies propaganda must never be underestimated      First  they took the journalists      we don t know what happened after that     Those who can make you believe absurdities  can make you commit atrocities   Voltaire     Propaganda is much less effective    when you Know it s propaganda,2,1
I think he bought himself a great deal of headache hehehe  ,4,1
Title of the video should have been  Elon Musk buys Twitter  as a Billionaire  ,589,18
Genius comment  ,1,
He missed the opportunity  ,3,
Billionaire would still be underrated    As a 0 1 trillionaire  ,1,
My reaction to Elon Musk buying Twitter  as a billionaire  as a millionaire,15,
While Techlead can t,1,
Lmaoo,2,
Dude           ,4,
Hahaha,4,
Thanks   Much appreciated  What sapp 17325357448  More updates on SHIBA XRP  NFT s BTC        What sapp 17325357448 More updates on ADA  ETH  DOGECOIN ,5,
Twitter is a joke  Elon got scammed  So what if he wants to control social media  Social media only works if one participates in it  Elon needs to buy CYN ,1,3
You are a RIOT       So funny TY,1,1
Who knows    Hehehe  ,1,1
ELON MUSK is a ex million  ,1,1
elon used tsla shares as collateral to get the loan  thats not so great for the shareholders  twitter will have to generate a lot of revenue to justify the evaluation elon gave it,4,0
He s owned it for not even one day lmao,1,
If he partners with Charles hoskinson on cardano yes it will benefit me greatly,1,2
Elon should start a  As a Billionaire  Youtube channel ,39,4
as a trillionare,1,
TechLead is easily worth a few billion   He just needs to update his video titles to reflect  as a billionaire  ,2,
TechLead your input is appreciated   ,2,1
Hello   I don t think anyone cares  Do you   Good luck ,2,1
It s over valued for what it is and what it will end up as ,11,1
Great opening almost worthy of a millionair,9,1
Twitters going to beat facebook now ,4,1
God bless Twitter  He should buy CNN too,1,2
It s a social experiment  A flex  in the biggest way  And personally I agree with the privatisation of everything that involves what drives the world  what connects people as a whole and matters towards the future of humanity  So  as much as I think social media is detrimental to interpersonal communication  I still think Tesla owning Twitter should be an indicator to the future of finance  and the world  generally  as we know if ,8,1
  I HAVE ATTRACTED SO MUCH LOSSES TRADING ON MY OWN   I TRADE WELL ON DEMO BUT I THINK THE REAL MARKET IS MANIPULATED    CAN ANYONE HELP ME OUT OR AT LEAST TELL ME WHAT I M DOING WRONG  ,58,52
 ,1,1
I m curious to see what Twitter becomes in the future,1,2
Hi Patrick  I want to move back to my parents but they are refusing  I even showed them your videos to show how I can thrive like you while living with them  Still they were not convinced  What should I do ,1,7
Did you start your conversation with  as millionaire   Ithink thats why,1,
buy the house and rent it out to them,3,
That s a lot of emotion to show for an ex Google employee ,315,10
 As a millionaire     very amusing      ,1,
Correct your self as a millionaire ,4,
For real this guy is biased hahaha,3,
this is his biggest cope video,5,
You forgot ex Facebook employee ,8,
As a millionare ,9,
 as a millionaire ,17,
What sapp                More updates on XRP  NFT s  BTC  What sapp              More updates on XRP  NFT s  BTC    ,2,
 Investing in crypto currency now should be in every wise individuals list  in 2 to 3months time  you will be estactic with the decision you made today  ,14,16
 ,1,1
You can authenticate humans by using The iPhone facial ID to open your account like Twitter      Would be best course of action,4,2
You ll need to learn to be responsible for your own views and jokes  It will increase resilience to mob bullying ,1,1
Twitter will sore to the MOON  ,1,
I was just waiting for this video before forming my own opinion HAHAHA,16,1
        FIRST        ,1,1
I totally agree with what you are saying     The fact is  BTC is the future of crypto and the questions traders ask themselves now if this is right time to invest  before jumping into conclusion i think you should take a look at things first  for the past few days the price of BTC has been fluctuating which means the market is currently unstable and you cant tell if it is going bearish or bullish  while others still continue to trade without the fear of making lose  others are being patient  it all depends on the pattern with which you trade and also the source of your signals  i would say trading has been going smoothly for me  i started with 2 5 BTC and i have accumulated over 12 6 BTC in just few months with the trading strategy given to me by expert trader Josh Jhang  ,5,4
shill ,2,1
What sapp                More updates on XRP  NFT s  BTC  What sapp              More updates on XRP  NFT s  BTC    ,1,
Notigang  ,1,1
Hi Patrick      Go Musk       Been a fan of Musk since 2006   3,11,2
 thatshilarious,1,2
Kindly send a direct msg to join our private coaching and membership,1,
What sapp 19195029420  More updates on XRP  NFT s  BTC  What sapp 19195029420  More updates on XRP  NFT s  BTC  ,1,
King Elon,5,1
