Comment,Likes,Reply Count
Ready to work  Starting salary  250k  Join ex Google ex Facebook engineers for my coding interview training  https   techinterviewpro com ,49,26
I like your sense of humour  ,2,
Will the economy crash in these next 2 years ,1,
 Michael Adkins There will be far worse evidence to go with that too    Think Epstein Pedophiles   Human Trafficking and worse ,1,
 This is my own conspiracy theory that I came up with on the fly  but those ransomware attacks could be staged by the government so that they can have an excuse to go after Bitcoin     Cryptocurrency is a threat to Modern Monetary Theory  If people see rampant       then they re going to turn to digital   ,5,
Idk if I can trust your course if you buy at the height and sell at the bottom    ,2,
The worlds needs a tech lead  millionaire  video rap mix  Compiling techlead voice clips of thoughts on mil lee on air lol so awesome  That would be dope and satisfying  Techlead is my spirit animal lol ,1,
 A healthy human being does two things well  works  and loves    Mum,1,
Certain pll had harder jobs than you like plumbing  construction  lumber  sanitation etc   Some of these  kids  got jerked from the government with no union  healthcare costs  low wage jobs  student debt etc   There are so many issues and son of these  kids  we should be happy for them ,2,
Work smarter  not harder   Scrooge McDuck ,1,
jealousy among millionaires is not cool   don t stress    a fool and their money are soon parted      Making money is somewhat easier nowadays  BUT  saving it and properly reinvesting it   AH HAA    let us see,2,
Imagine the cryptofam commenters if you had an ex bitcoin engineer to add to your group   ,3,
oh  boooo hooooooo ,1,1
AMC diamond hand  Keep working software bum,1,1
Don t support crypto   Support Bitcoin because it s the right thing to do   There aren t many kid crypto millionaires   All these problems stem from central banking   Bitcoin actually fixes this ,1,1
Bitcoin is banned in India,1,1
I love this guy  He has good jokes ,1,1
every other crypto youtuber   i am not a financial advisor techlead   as a professional psychiatrist,1,1
If only you could have included the suicidal tendencies of these lazy people who dont want to work,1,1
A lifetime of hard work vs a single right decision  Damn,1,1
   I admire the efforts u put in your videos mate  digital currencies continues to reshape the world globally  its hard for for anyone going against them these days  though from a trader s perspective i feel we really need more experts in the field updating newbies   lnvesttors on how the community works  crypto currencies are gradually moving towards something big and the price surge over the past few months is just the beginning of greater things to come  lots of persons are skeptical on when to buy in the market and whether it isn t too late to buy an asset  when you re hodling it could be but when trading its never too late to buy  a trader with the right strategy and indicators earns big regardless of market price  bulls or bears   I trade using signals from trade expert Mrs  Susan Bossmann with her guide and signal service i  ve made over 27B TC worth of crypto assets over some months  only for crypto inclined issues    connect her on               Susanbossmann ,213,1
This dude s comedy is focking hilarious   ,1,1
Salty much  Even if bitcoin goes down another 50  I m still a bitcoin multimillionaire  And no  that didn t happen overnight  4 years of blood  sweat and tears  Anyway  enjoy your salt ,1,2
INVESTING MAKE UP THE TOP NOTCH HEMISPHERE OF WEALTH  THAT IS MORE REASON ONE SHOULD SAVE AND INVEST TO SECURE MORE PROFIT AND ENSURE SUCCESS        ,12,23
Bro  you just want to buy the bottom    No hate here  Your vids are great ,1,2
Great NEWS     Can I get a job offer in the US please   Also  less workforce  I can finally get mt pay to go higher since lately the excuse to pat less is that they have people willing to work for peanuts ,1,1
 Money is not a tool   says the millionaire lmfao ,1,2
Investing in Bitcoin right now is the only wise thing to do as the market is much favourable to invest in right now,12,25
Also not fair that kids suffer and die  while you sit there drinking redbull and eating pizza while earning your million  Whats your point ,1,2
Lol  you made your money the old fashioned way through years of hard work  How old are you  35 ,1,2
Glad I m not the only one who loves watching meme stocks and cryptos crash ,1,0
My friend s friend made a lot of money when the first bitcoin spike happened  He bought a tesla and couldn t even drive them cus he was 15 at the time  He now has 3 and he just hangs out at nyc,2,0
Crypto currency is the future  investing in it will be the wisest thing to do especially with the current drop but It s strange how people talk about all the profits  they ve been making through trading of bitcoin  while am here not making any profit at all  Please can Someone put me through on the right path or at least tell me what I m doing wrong ,109,33
  allows you to do things you don t want to do ,1,1
Let me introduce you to new strategies,1,
Didn t you retire and stop working ,1,2
As Jack Sparrow once said   There is no fair or unfair  there is only what a man can and what a man can t do ,1,1
 1200 gains on trolling,1,2
Complains about problematic millionaires when he is a problematic millionaire himself  Ahh the shamelessness ,1,1
The best decision I ever made in my life was Investing in financial market  Trust me guys  it pays alot  And I have come to realize that trading bitcion is more profitable than holding it and waiting for it to skyrocket  ,58,33
The level of self awareness  introspection  and dry humor from TechLead is amazing to watch,1,0
03 22   gosh   ,1,1
I want this man to know we appreciate his dilligent research and dry humour  ,2,1
Awesome and very insightful updates Well i will also say this here    Even as the world still experience slow recovery in terms of economic meltdown due to the recent Covid 19 outbreak  it is best advised to find another alternative to make good income ,195,66
this is humorous,2,1
Will the economy crash this year ,1,1
My favourite a  hole is back with another classic video   ,2,1
money is not the solution so smoke some weed and be happy haha,1,1
Look working hard is something I have done all my life and ai am not find a way to earn a second income   I would give all my extra time to get just 5 min with you to at least point me in the right direction ,1,1
Erm  Mr  Tech Lead   you misread your ransomware graph   Millions  not Billions ,1,1
This guy is hilarious,1,1
admission of being a hater kek,1,1
When you say you are a millionaire it all depends on location in Silicon Valley almost everyone in IT is a millionaire you are below average net worth for that region  Where as in mid west being a millionaire means you are 1  ,1,1
Sorry dude  but I want the easy money ofc  wtf is wrong with you,1,1
Someone is salty AFFFFF,1,1
Tech Lead why are you not looking up to blockchain projects Is a lot of interesting stuff,1,1
So you re a hater  I should ve known   But  alas its useless  you re hate only makes us stronger   as a millionaire ,1,1
Success is dependent on the action or steps you take to achieve it  Show me a man who doesnt have an investment and I will tell you how soon he ll go broke Investment is building a safe haven for the future  with the right choice of investment that has at least 1  minimum risk and with an Expert guidance  profit and interest should be guaranteed ,8,8
Great thoughts    thx   Always good thought    Ride the chair     I really appreciate your insight    brilliant   My old age wisdom agrees with most all your thought   Please touch on political thought   Much respect  ,1,1
TechLead    I am old and with your thought    but not long ago we said that about your work   Many lay asphalt  farm  build  and do not sit in a climate controlled room in a soft chair   Just saying    Life is not fair and       I really like your thoughts    thank YOU    Respect the TechLead     Very smart and unhumble     haha,1,0
Next video  How I become a millionaire with Bitcoin  as a millionaire ,1,1
 RICH PEOPLE PLAYS THE MONEY GAME TO WIN  POOR PEOPLE PLAYS THE MONEY GAME NOT TO LOSE  THE GOAL OF THE TRULY RICH PEOPLE IS TO HAVE MASSIVE WEALTH AND THE POOR SEES A SURPLUS AS AN OPPORTUNITY FOR CONSUMPTION INSTEAD OF INVESTING IT  CHANGE YOUR MINDSET AND DO WHAT THE RICH DOES  WHICH IS INVESTING  INVESTING AND INVESTING   ,31,97
Hey tech lead  How to start our own software company Please answer my question Asking for 2 years,1,1
Hey tech lead  How to start our own software company Please answer my question Asking for 2 years,1,0
Hey tech lead  How to start our own software company Please answer my question Asking for 2 years,1,0
Hey tech lead  How to start our own software company Please answer my question Asking for 2 years,1,1
You sound resentful but you shouldn t be  Even crypto trading is hard work  You need to spend countless hours researching all the coins  studying the markets for good entry and exit points  and keep up with a market that never sleeps and is going on 24x7  On top of that  you also have to endure extreme volatility and see your holdings drop by up to 70  even at times  and mustering up the strength to keep holding through such depressing lows where it feels like you ve lost all your money  losing your hair due to the extreme stress  and your claim about crypto traders being able to sleep is far from accurate  Don t assume things about others that you have no idea about  And even after going through all that pain  most crypto traders actually end up losing money  Think carefully about what I m saying here  Crypto traders have earned their money too ,1,1
By that logic  you only worked for few years and became millionaire  but most people work their whole life to become a millionaire  That s not fair  ,1,1
I want to have MILLIONAIRES PROBLEM    WHEN  GME gamestop moon i think i can experience the millionaire problem,1,1
Hello   But didn t most all Bitcoin millionaires buy there coin with money there parents gave them while living at home with there parents     Good luck ,1,1
next video  my problem of making a decision and then regretting it in every single video after that ,1,1
The cryptocurrency analyses is on the back foot ahead of a long weekend in a raft of countries  including the UK and the US  and with volatility levels still high  whippy price action over the coming days cannot be discounted  Technically Bitcoin have been seeing signs of rejection  Trading around  36 000  For the past 2 days    putting the market at a Range  with highs and lows  personally this past few days has been most prof table for me while others are hold ng with loses  Check my YT discussion you might  you can get to hear about my Tut0r   lyraholtdean  T   g   ,190,5
Coin Bureau,1,1
I have been searching for a good broker to trade with  Please sir how can I find one  ,6,2
 When you have a hammer  everything looks like a nail to you   This is truly inspiring ,4,1
Hedge funds and Wall street are allowed to become billionaire doing what we do by trying to invest ,1,1
 Play the long game   This ,1,1
Only fools and horses work ,1,1
Can you do a review of the tv show  billions  as a millionaire  Like hoe realistic is it  ,1,1
i gave you a like because of your sense of humor,1,1
Cheers see you on the next one ,1,0
This is all factual truth facts that are linked to displayed and research and analysed  When fake media specifies alleged 7 1933 British pennies where made its not a fact truth  The truth is hard work like research and analysing and displaying the thrust of impact knowledge like this YouTube video explaining,1,0
Nice video   Very engaging from beginning to end  Nevertheless  businesses and investment are the easiest way to make money irrespective of which party makes it to the oval office ,5,38
Unsubbed  Tired of your rants ,1,0
you all should watch Naval as well,1,1
 Buy high  sell low    as a millionaire ,2,0
I quit my job to watch techlead fulltime  as a peasant ,4,3
Bitcoin is the feature investing in it now is the wesest thing to do now especially the current rise,22,25
Ein wirklich weiser Mann  Vielen Dank ,1,1
Yep  All those twitch thots with DogeCoin  Why would I wanna buy higher than them so they can sell at a higher price  No way man,1,2
Funny or not  I can feel his jealousy through the screen  Lol,18,1
Hey TechLead  work smarter not harder buddy  There are many paths to financial independence  Don t be bitter  Be thankful you are in a great position ,1,1
I became a millionaire by having a regular high paying job  saving  value investing  you should invest in gold miners  coal and oil   gas right now  for a pure inflation play  and having fun along the way ,6,3
btw  Techlead  i wanted to migrate to the US to fill one of those vacancies as a tradesman  engineering   but i am dismayed not by lack of desire to work  but the threat of forceful vaccination ,1,1
I work 20years  in IT  started my journey with IT 36 years ago as a kid coding on 8bit computer in 80s  Lately I got bored with this  Unfortunately I m from 2nd world country when we earn 1 3 of US wages  but everything costs more then in US  much more   I still  have to  work 22 more years to get to retirement  I would be walking corpse when I get there  so I m searching ways to stop this madness  I can live for less then 500  when I pay off the mortgage  I fully understand people who does not want to work 9 5 jobs  9 5 is slavery     ,1,0
 Putting On Diamond Gloves   as a non millionaire ,2,1
Great video  but Selling your coins won t be appropriate at the moment  I d rather buy more with this chance as it s plummeting and with the current  market trends    investing now in Bitcoin will be the wisest choice you d ever make   People will be kicking themselves in regrets in few weeks if they miss the opportunity to buy and invest in crypto,22,35
 Brenda Myers Yes of course  Expert CHRIS ROGERS has an intellectual strategy that cut down losses  I got the best investing help with the aid of Chris  He s friendly and easy to get along with in terms of signals and investing tips ,1,
No doubt  Chris Rogers is the most trusted to Start an investment with ,3,
I met Mr Chris Rogers last year for the first time at a conference in Manchester  I invested  25 000 and traded in one month making close to  143 670,2,
 Mason Schr der  Wow   I m amazed you mentioned Chris Rogers trading services   I actually thought I was the only beneficiary of his trading Expertise   He s my portfolio Manager too,1,
He s an Expert in trading and mining cryptos and I trade with his intelligent strategies,1,
Crypto is the future   My advice to anyone right now is to secure a good investment in digital assets like cryptocurrencies,2,
I invested in both stocks and crypto but my crypto Investment is more profitable,1,
That s correct  Investing in Crypto now is very wise especially with the current DIP in the market now  I bought the dip  ,6,
The crypto boom is pretty much over though right   I mean it seems like a trend that breaks out every 3 or 4 years   I doubt we will see any huge jumps again any time soon  overnight millionaire levels at least  lol ,1,1
So basically you re butthurt that earlier investors that made millions made it easier than you  Lmao  Side note  Those people actually didn t buy and hold and become millionaires overnight  They had to wait and deal with violent price volatility for months years    Get out of your feelings  College grad with a full time and part time job who is also pursing their masters degree talking here   oh and I m also in crypto    lol ,1,2
I came to the comments to see exactly how many people agreed with my opinion on this video of his  It is very selfish and scuzzy of him ,1,
Next  How my ex wife became a millionaire investing on crypto,109,4
 as a millionaire ,1,
How to live a good life without hardwork  Becoming a cat ,8,4
And you get to bite the hand that feeds you,1,
Yo Dude I don t want to Work for Minimum Wage either  What s the Answer ,1,1
They didn t Make it yet  Hello IRS calling ,1,1
Comedy gold,1,0
lol same  Fundamentally I sold doge at  03     but because fundamentals don t matter  it pumped anyway  Really don t like the crypto market much anymore  seeing shitcoin after shitcoin pump for no good reason  Watching dumb friends buy the top and lose all their money ,1,0
I also secretly hopes it goes down as well  ,4,1
  Play the Long Game    crypto is the long game son ,8,1
Nope  Crytpo is a false dream,1,
I wish I knew when he s being serious and when he s joking   ,5,1
It s better to take everything he said with a pinch of salt lol,1,
The amount of stress trader s go through is nothing compared to a coder  I can confirm it as a C   developer ,1,0
take it easy  dont be envious of gamblers  they took risk and got lucky  it could go either way  working hard and being smart will eventually reward you in the long run,2,0
thank you  you are so wise master ,1,0
Work smarter not harder,1,1
Man  you are so funny  love you humor,1,1
Oh look who s already milking early in the morning again,1,1
When Techlead sells  time to buy,5,1
I think you ve mastered the art of sarcasm,18,1
I appreciate the honesty  as a millionaire ,1,1
I agre with you as an upcoming millionaire     Your decisions are right       ,2,1
I enjoy TechLead  because it s entertaining to listen mostly but there s also good life lesson you can learn from him time to time ,11,2
 When you have a hammer    ,2,1
I work 40  hours then use my paycheck to invest and double it  ,4,2
As a broke dad i support your efforts   ,2,2
 Enough about me    this is about you    and your problems      ,2,1
I dont know if your serious or not,1,1
Can someone explain why Crypto fanboys expect crypto to replace fiat currency when all they do with it is speculate on the  asset  and value it against fiat currency  How can you expect this to replace the dollar if you value it against the dollar and are so quick to cash out back into USD when it starts to fall  People treat Crypto like digital gold  not an actual currency ,4,2
That s because all they know is bitcoin  a d Bitcoin s pricing system works just like gold  Not all cryptos exist only for speculation  Ethereum let s banks trade nearly 4x as fast,1,
hey man work smarter not harder  its good if someone becomes a millionare overnight because they did the work and chose the right investment  even if they were just gambling they did the work to be at the right place at the right time though if they keep gambling theyll probably get blown to bits eventually   investing is definetely risky  its like gambling except you must improve your chances of success to far above 50   hopefully  by researching and preparing for the worst etc  if you work hard at anything for a long time its likely to improve your chances of success  its like there is a trade off between doing a little work and having higher risk vs  doing alot of work and having lower risk   its possible bitcoin may be heading up soon  if you draw trendlines you can get a downward wedge with the recent movements which often leads to an upside breakout  its already broken out depending how its drawn  its possible that it is a flatbottomed triangle too though which often leads to a selloff so i would definitely be careful and form your own opinions about it ,1,0
hahahaha this guy wouldnt know a hard days work if it hit him in the face  did he just say he lives at home with his parents lmao if you just have cash and no hard assets like a home I don t think you re doing that well bud,1,1
TechLead is very smart  but I also feel like he s trolling us too ,2,0
I m a bitcoin holder  but in no way em I relying on my bitcoin to survive  I worked since I was 16  and I feel that it doesn t hurt to invest in something that is a great idea  but just don t invest more than you can afford to lose ,1,1
speaking of going to the moon  how about them ufo reports ,3,1
F      ck  he is so funny  I laugh myself to tears     ,1,0
Wow      now I get it  Techlead is a player hater  Don t be a cry baby    money don t mean nothing without the people you love    you need to go apologize to your X wife and son    and quit sponging of your parents    also go get you some good therapy with your millions ,1,0
could you give me some of the paper that doesn t solve your problem ,1,0
When he mentions wife I laugh,1,0
 The juice isn t worth the squeeze   The best way to describe modern society ,147,4
 GG WP lol  when your a kid your told  the world is your oyster     if you want to succeed you have to work hard    if you want to be successful just go to college    All blue pilled none sense  Hard work doesn t matter  it s the perceived value a person contributes to society that matters  A coal miner could just be as hard working as a doctor  but we don t value ones hard work  as the coal miner could be easily be replaced  Your salary doesn t reflect how good of a worker you are  your salary represents how hard it is to replace you   And it s clear society doesn t value hard working  honest men or what I would consider the  average man   If an 18 year old girl can make 1 million dollars in the space of six hours on only fans  I have every right to sit at home on my butt  throw money at shitcoins in the hope one day I become millionaire because in 2021  nothing it s out of the realm of possibility in this dystopia ,1,
Society is the illusion that everyone somehow has a role to play in it  It is true  but WHAT ROLE are we talking about for the average man     That explains most of the current lethargy ,5,
Do you actually have any idea how hilarious you are    You are a perfect Jerk  and I love the Hell outta you   I thank you for these uploads                   ,1,0
I really enjoy your humour  ,2,0
Stfu  no wonder why you re alone,1,0
Man I love his contents   he really speaks facts,1,1
I love the way he says  bitcoins ,3,1
Oh  smashing the problem feels so good   The hammer is absolutely the optimal tool ,1,0
Job vacancies are due to Bidens unemployment boost extension not cryotos ,1,0
 Because you guys don t wanna work  you just wanna sit around at home watching your crypto YouTube videos  I can t stop laughing ,408,10
    like this one    ,1,
I love watching this because your videos are entertaining   You re life is sad,3,
 like this one    D,5,
 TrashWhale   Why you laughing  It s true ,1,
1 35,3,
As a business owner Millenial Gen Xer I ve gotta disagree The boomers printed the money not these young people  I see the environment these Millenials Gen Z kids are in and it is by no means easy  no one wants to be lazy  there s always a reason someone sits on the couch all day Not gonna get into it in a comments section  there s just so many reasons Just to mention one  they didn t even have a chance at a normal relationship  when I was younger dating was semi normal  now it s a circus I ve got a soft spot for this younger generation  I ve met some hard working kids and they make NOTHING for their hard working  2 3 4 job  efforts So I hate to say it but this video shows how out of touch  as a millionaire  this guy really is ,18,4
 Robin Miller you ve hit a nail on dating  And marriages that end in 80  divorce rate where as a man government will  legally  confiscate your property  Why even bother to jump into the rat race  If you ask me  bitcoin is a safer gamble than slaving away all your life in some cubicle only to see it all evaporate in a day ,1,
One more thing  they ll work 2 3 jobs and still not have the money to settle down and build roots  have children  they can t afford kids  2 3 jobs just to keep themselves affloat  it s ridiculous ,1,
You just learned a life lesson    Being a tool is not as rewarding as being free  Even if there is no money in it   ,1,0
Oh please thererare  people in the crypto space that have put in the work and it tooked years for them to become a millionare ,1,1
Lying flat is a good lifestyle for young men especially today I think,31,1
I love this content  I am working but I also have full respect who does not want to work  Everyone makes their own decision on their life and they don t have to live the same standard lifestyle  I respect the yonger generation s thoughts on this,17,2
I noticed he s no longer a multi millionaire  The ex wife must have taken half ,4,1
Some people will think that programmers are undeserving of their fortunes too,1,0
As a millionaire I do feel guilty at how easy I did it  Asian millionaires generally have to work hard for years ,18,4
 joe smith I bought three condos in Hawaii from  11  14 and boom  From 2018 I ve been a millionaire  Now invest for fun as a professional accredited investor in real estate  I hold 0 1  of my NW in crypto lol,2,
Change the title to  Bitter divorcee cry s about people escaping their set in stone financial level without slaving away for another man ,1,1
Bitcoin 1 Million  ,1,0
You sound bitter  cry more,1,1
Video summary  Narcissistic Boomer   wants you to trade 80 hours a week for 50 years of your finite time for fiat that they can and have been diluting continuously since the 70s so that you become a millionaire in your 60s  which by the time you are 60 will be equavilent to 100k  because this is the right and honest way to make money ,1,2
I d rather steal what I need and ask for forgiveness later ,2,
Don t play the long game  YouTube and Twitter has made it easy to become a millionaire ,2,0
 Coming from an overnight millionaire  I m telling you to play the long game     How could anyone fire this guy ,258,7
 City in the sky Yeah  makes it a lot easier for them to know who they need to sack real quick ,1,
He said money won t solve problems but every problem needs money    ,2,
