Comment,Likes,Reply Count
In the workplace  it is best to communicate in a direct and straight forward manner  Any other form of communication can be problematic ,2,
How can anyone judge this guy if you are not a millionaire with more than a million sub ,5,
how can anyone employ this guy    ,12,
Nice videos anyway  ,1,0
 As a professional psychiatrist ,312,12
  Dorothy Akpon Ebiyomare Yes because without discipline you will lose that money  Better to have a little money at the beginning than a lot since it can overwhelm you   Ecclesiastes 5 10   He who loves money will not be satisfied with money  nor he who loves wealth with his income  this also is vanity ,1,
 Kindergram he s joking ,7,
 ihavetubes the Bible has the best financial advice   ,3,
This is new,1,
Wait a sec  So he is a professional psychiatrist  techlead and millionaire  but living with his parents  Also he was at Google Microsoft and Facebook  but never stayed  Makes him look more like a con Artist  despite the fact that he is right about Cryptos and Tesla ,5,
Luck may gain wealth but intelligence will keep it ,9,
Proverbs 13 11  Wealth gained hastily will dwindle  but whoever gathers little by little will increase it ,17,
It s true that people wanna become millionaires over night just by holding crypto  and not working anymore lol  ,2,1
Employee and masters  lazy dreamers  have different mentality  yet both needing each other for growth  ,1,0
 As a professionnal psychiatrist  i ll stop talking about me because we re here for your problem  hahahahaha,94,0
My dream was to grow potatoes on one of Mr Gates potato farms  Thankfully he saw the potential in me and today lets me grow potatoes on his beautiful land  I worked real hard at Farmer School and got all As  I think that payed off big time  because Mr Gates saw my potential  So I just want to thank Mr Gates and say we have a bright future together  A team  You and me  Mr Gates  I love him  He watches over me  Thank you  Enjoy your potatoes Mr Gates  Just one thing maybe you could give me just one more measly potato everyday for dinner  I feel a little light headed working in the hot fields all day  Just an idea  No  I m not complaining  I m just get a little hungry at times  No  it s no big deal  You re right  you already pay me adequately  Two potatoes a day is more than enough to live on  What was I thinking  one more potato is too much  Yes  I can work harder for you  Sure  you want more potatoes  How much  double  Okay  no problem  I can do that  What  You don t believe me  Oh  you decided you would try a new farmer from India to replace me  He works for just one potato a day  Oh  okay     I can drop a few pounds  no problem  I ll work for one potato I guess    Oh  that s not enough    You want to do what to my wife   Oh  I ll have to ask her    Oh  you already asked for me  Oh  she said yes     Hmmm    Well  guess I ll go back to growing potatoes for you Mr Gates  What s that over there     Is that a whip  Hmmm what s that for  Oh  a new motivational tool  Interesting  Very interesting  How does it work     Oh    ow  ah   ouch    Hey stop that Mr Gates    I don t like that    What  You want to work for half a potato a day    Ahhh okay that seems fair no problem,1,0
great video amigo ,1,0
Is techlead a millionaire ,1,1
lol  lol love this dude,1,1
More like TechWEED amaright ,2,0
I smoke weed and don t do 9 5    I m an artist so I can smoke and paint while emailing clients in my PJs  Never got into crypto but hearing your point of view is fascinating  Looking forward to your next video ,1,1
I don t have a dream job  I don t dream of labor   ,36,2
Your salty Because you can t trade  You buy high and sell low  If you actually knew the value of it  you would be buying for 6 thousand ,1,0
Wait until he hears about Dogecoin millionaires  ,95,2
    ,3,
Annnnny day now   ,3,
haha haha funny money go brrr,1,0
The kids are NOT to blame here  you should look to the US government and the FED for that,4,0
You were right on the dot  Most girls in my generation age is between 20 and 29 can t be trusted  why would I want to spend 60 hour weeks working and providing for them when I know eventually I ll be cheated on  Asked to do with all the bullshit social media  which is created chick girlfriends that can t be trusted LOL,1,0
I don t think most Crypto speculators are sleeping all that well   Crypto trades 24 hours a day which means your  investments  can go down in price at any time  At least stock investors have a period when the market is closed ,2,2
I Love the TechLead   ,1,1
Well done  Kind of like what I do   That s why I like you   marketing your own product in such funny way  Keep doing ,10,1
How do you find time do videos  you with working so hard  Ah  living at home  it s your Mom helping you picking up your room  making up your bed and doing your laundry ,5,1
guy who quit work to make youtube videos complains about how other people don t want to work     and actually  bitcoin is another thing that solves this  people would be much more willing to work if they thought knew that the money they made could actually help get them somewhere in life  which bitcoin does because it preserves it s spending power over the long term  whereas cash does not because it loses 10   of it s spending power for important things like housing every year ,1,1
love the channel,2,1
Lying flat   FIRE in some sense   ,2,0
Central banks transferred wealth to the upper class through their policies and now we reap the consequences  Don t hate on the hodlers who are the ones applying the pressure that just might peacefully change the system ,5,1
Working from home makes productive people more productive  everyone else is stuck because they can t just walk into the productive person s office and leach their productivity any more ,1,0
Dream job at facebook or google sounds like a nightmare,4,2
 Levy Roth you have no idea how right you are buddy   ,1,
These coins better go to the moon QUICK ,1,1
Money is not gonna solve my problem  Tell that to my landlord ,4,0
Bro     ,1,0
Work smarter not harder,1,0
I understand why he s salty though,15,4
As a MILLIONAIRE  WHAT S nexts    Gets an IQ tests and updates status to GIFTED MILLIONAIRE ,1,0
 Drinking redbull  eating pizza ,4,0
actually Bitcoin  and other crypto  incentives me to work for more of them  You ll sometimes win and sometimes lose on speculation  you need constant income  Other thing that they may be just unregistered freelancers  who just earn crypto for actual unregistered work ,1,1
Gosh  I love this dude       as a millionaire ,1,1
Regardless of whether you agree with his sentiment or not  studies show that people who have no purpose or direction fall into depression  It happens often with folks who reach retirement  I can understand not wanting to be part of the rat race but if they don t substitute the rat race for some other meaningful purpose that gives their life direction and goals of some sort  they will likely not be able to sustain their happiness even if they become a crypto millionaire ,19,2
U could say whatever u want   but as of right now   money is solving   All   my problems ,7,1
LOL  these kids got to sleep that night  you crack me up  Keep up the great videos ,16,2
Some of the hardest working people I know smoke weed   hard work     setting concrete forms I m the elements  Or sitting at a desk in a climate controlled building   ,2,2
 asdrubale bisanzio are you sure about that   I d like to see people with those same opinions go up a ladder with a bundle of shingles vs a job that money and  education got them  Soo it s not really fair to compare the 2  and really Like really say what actual hard work is  but I know all smart people will say how easy something is    obviously someone in a wheelchair is not going up a ladder   ,1,
 asdrubale bisanzio lmao    there are only two kinds of jobs in this world  participation and creative jobs  All participation jobs where the physical presence of a human is required will be replaced by software or robots  All creative jobs will be safe for humans until true AI emerges  Mental labour is a participation job ,1,
world is not just    you should know it in this age ,1,0
Robert Kyiosaki telling everyone to get out of the rat race  Everyone has to work ,3,2
 Levy Roth Elon Musk works  Jeff Bezos Work  and Mark Zuckerberg works ,1,
Rich people don t work ,1,
 ,1,0
What do you think about chi network,1,1
I m buying that too as soon as I can ,1,
I think his brain has gone soft  he says any bullshit which comes to his mind ,2,0
I want to wake one morning and find out that my portfolio is  300 000  I know it s possible ,68,22
wow im not suprised you  mentioned this name David Harrison   he s really awesome  two years ago i  n my husband got into a fight bcoz he misused our kids trust funds investing in the wrong hands  i was introduced to him although was scared but gave a try,1,
While you ate pizza and watched Netflix ,3,
Mr David Harrison continues to be an inspiration to all new bees and those who have been fortunate to have made use of his signals,1,
The market has changed trend with almost a 50  dip recently and making new entries or looking at the charts can be dangerous to one s mental health especially for newbies  and this is a clear indication of why we as experienced Cryptocurrency traders and analysts have always advised from the start to always apply proper risk management and use stop losses in all trades  depending on your sentiment  ,2,
i invested in dogecoin in 2013  I m in my 20 s and now I don t have to work  On paper I m poor  but I have a lot of crypto  I took the ez way out   young,3,2
Troll so hard your wife takes the kids and leaves you,8,1
BAN marijuana   what are you living in the 1950 s  get real buddy   ,5,0
The way this guy is churning videos one after the other with low hanging fruit probably shows that his parents decided that it was better for him to pay rent  as a pretend millionaire  ,5,1
Where I live  EU   Hungary  half of the people get 500    700        per month at an avarage job  like a cashier in a shop for example  Guess whodafakk wants to work bro   ,6,2
I would say one of the best videos  but you did throw in the ignorant half truth on some types of cannabis    kind of wrong in full  but meh   good video man   The end though  was the greatest point I have seen in a while ,2,0
Never going back when I can control my own Time   More than 1M ,9,0
So you sold off     bet lololol,1,0
 You can solve problems with money but it is not the right tool   How does this add up ,3,1
 TechLead So all in all you are jealous because they were smarter than you investing in something with high risk   By the way  Other people work really hard and will never be a millionair  So they think the same about you  Not everyone can have a job like you have had  Because if they had  then noone would produce your cheap displays and other stuff ,3,0
don t get me wrong  I think inflation is going to take off  But the CPI print of 5  is on a YEAR OVER YEAR basis  April and May of LAST YEAR were extremely low  so the spike in April and May of this year only makes sense and was expected  Don t spread inaccurate information without context ,1,1
You hate people who born with wealth  It s called LIFE  stop hating and move on   Find new girl who can share your happiness with instead of hating on particular crowds  ,1,1
What a weird video   I can t tell if he is serious or kidding or somewhere in between   Kids these days  huh   Fine with me if they are not working  more opportunities for the rest that do   I think there is a huge difference in terms of being able to entertain oneself at home compared when I was that age   I mean  there was only so much you could do on a commadore vs today s instant streaming  cool video games  crypto gambling n stuff or some junx,1,0
2 56 techlead has been checking out Porsche Taycan    as an millinare,1,1
People increasingly giving up because of inceldom among men  No point in working when you know it is over for you  There s an unprecedented rate of sexlessness among men  yet women are sleeping around with Chad on a daily basis  Ted Kazynscki was right  there needs to be a ban on social media or else humanity will perish  We need to go back to traditional families ,5,2
Nothing wrong with that  Not everyone needs to be a macho porn star IRL ,1,
 As a theraphist  the problem is you  ,22,3
 Crazydog 330 google is doing a really crappy job blocking these comment bots  Even though they are starting to seriously devalue the comment section of Youtube ,1,
 Pi   d  by   MM rypt  lol this bot  how are you Singh Phi ,1,
Saw clips from the Miami Conference these guys are out of their minds,1,0
bitcoin is going to atleast 15 million dollar  mmcryoto  Exaaaaaaacty as predicted,1,0
THE ONE MORE EPIC DUMP TO 28K IN PLAY TO FLUSH OUT ALL THE BULLS THIS WEEKEND,1,1
Is that why you sold all youre TSLA too because you don t like seeing  people buying teslas with their TSLA stock when you had to learn to code to get yours  I think you re just in a very unhappy place right now   maybe your wife was onto something about her calling you  cheap  when potentially what you just lost on panic selling your BTC you could have used to make your then wife not think of you as such ,1,0
It s more about work life balance and finding FIRE   Freedom  independence  retire  early   It s not everyone s dream to work 40 60hour work weeks   Not sure why that s so hard for tech lead to understand   Working smarter doesn t mean you re lazy   it just means you re smarter ,4,1
Love how often your posting Content my dude  Thanks for the insights n sharing  ,1,1
The thing is techlead could become a millionaire by working hard bc he probably he has high IQ and is very smart but if you arent way above average intelligence you got no chance in our hyper competitive world  there are more and more people and especially high paying jobs are really rare and as a normal person it is nearly impossible to get a job at a firm like facebook  So you are forced to work your hole life in some shitty minimum wage job  just to not become homeless ,5,1
Very good philosophy from Tech Lead,1,2
Life ain t fair    Get yo sorrry as up and get money    No one cares about you whereabouts    Nothing is fair,1,1
The problem is the manipulation  The manipulators wanted a quick double and accidentally took the market down to far  I don t think they realized the damage they would do by being extra greedy and dumping too much  They took it down a bit to far and that spooked out the market   They were expecting the normal V shape recovery but you can only do so much of that before it spooks off buyers ,2,0
Techlead     The other Asian Tim Pool  bringing you the trends ,2,1
Nailed the issue on the head   after getting a taste of not having to work people don t want to go back to work  then decide to gamble in hopes it will work out ,6,1
I don t want to land a job at Facebook or google  they are two companies that need to go,3,0
I agree investing is not a job  I just aim to double some of my money at least through crypto  But man  most people expect x100 ,3,1
Haha  You re so funny ,23,1
Great video on FB succumbing to Apple ,1,1
What do you thoughts about El Savador becoming the first country to adopt bitcoin as legal tender   Will it result hyperinflation in US economy as foreign nation start dumping USD in favor of cryptocurrency ,1,0
I listen to techlead more than the opinions of my friends  just saying   ,10,1
I don t blame people For not wanting to work Their lives away ,10,2
They didn t want to hire women  like me  long long ago before coding was a degree   So   are they going to pay to train us  Probably not  Are they going to pay for the interview expense  Probably not  As a genXr   I understand and appreciate the value of those who can click into a millionaire life ,1,0
Millionaires are not fair,1,1
 Deadnsyd bruh,1,
You got the whole crypto cult pressed,2,2
Oh man  can t get over the fact that he s ranting and simultaneously plugging in the sponsors of his show in between his rant  Genius ,2,1
my problem with millionaires who talk about bitcoin millionaires  as a peasant ,26,2
THe higher inflation the more btc price will rise actually ,1,1
There is a good chance that a bitcoin millionaire may have a spending problem  see lotto winners  and in 5 10 years will be broke and have no skills  If you have not been working for 15 20 years you can not say you are  tired  of the rat race ,3,1
I ve been working for 15 years  I m 35 and don t plan to work for long anymore  I ll focus only on covering mortgage and utilities  My wife will cover the costs of food and other expanses  The pandemic turned me into a minimalist and legit I don t want to buy stuff I don t need anymore  All my extra income gets invested or saved  Work is for poor people nowadays ,1,
I mean they re no different from wall st in terms of produced value,32,2
Wall st guys have to dress up and get to the office,2,
Bro money helps a lot    as a high 6 figure 20yr old that made it from crypto ,18,1
Life is not fair  get used to it    Bill Gates      ,15,14
Ha ,1,
 an nimo an nimo So Jeffery Epstein was not trafficking in underage girls ,4,
 an nimo an nimo If I got any of the facts wrong please let me know which I got wrong ,3,
 Kirk Johnson that s bullshit,1,
 Kirk Johnson exactly life is not fair  he can get away with it and we can t lol,1,
 an nimo an nimo Bill Gates has been strongly linked in recent times to Jeffery Epstein who trafficked in under age girls to a clientelle of billionaires  Lots of pictures of him with Gates and Gates recorded on the flight manifests of his plane  even after Epstein was busted by the law for this very thing  Gates wife has spoken publicly about being unhappy with Bill s relationship with Epstein and it was a factor in their recent divorce proceedings ,2,
Jeff  are you sure she s not 18 yet   Bill Gates,5,
Life s not fair  If this is why you don t support crypto  you re bitter  I m happy for anyone who was able to achieve success when they risked their income in a speculative asset  Now that there is clearly adoption from institutions  retail and now El Salvador kicking off with using it as a legal tender   you d be wise to let go of your bitterness and diversify your portfolio into btc  eth and some other Projects that you find interesting ,1,0
3 15 No sarcasm  You are smart to cut your costs that way ,7,1
Lay flat     we are minimalists,1,0
He really needs some serious therapy   As a millionaire of course ,21,2
He IS a therapist  This is not about him  it s about you ,7,
well said at the end  our generation just wants an easy way out  no ones has the patience to work for success anymore  everyone wants instant gratification   why do pick and roll and run few extra steps to score 2 points  when you can just try to shoot a 3 ,4,3
You should go for middle management you d do good there  A hard working pleb to discipline the lazy plebs  lol,1,
The boomers created a greedy and sick and uncertain world where it is impossible to hope to build anything for the long term  the blame lies at their feet,9,
Fast and easy  You re kidding me right  4 11 years is fast  Putting all your money in crypto for a long time and dollar cost averaging when majority of mankind did not believe in it is easy  Didn t seem easy for you  Some get lucky  but that doesn t apply for the majority ,4,2
Hate the game not the players  Life is not fair  I could complain that I m a  Type 1 Diabetic Have graves disease Had lung and heart surgery in 2019 And other things  But I don t care  or compare myself to others  You deal with the hand given to you and deal with it the best you can  Stop B thing ,2,1
So let s go back to the rat race and be poor forever  Great ,3,1
 I actually had to work all night coding drinking Redbull  eating pizza in front of a monitor  These kids got to sleep that night     God  these feels  I m still in the  sleepless coding nights  phase waiting for my millionaire moment ,38,5
 V t zslav Ackermann Ferko so you r gonna be 1 20 of a millionaire after doing all that   Damm life s hard ,1,
Working two dev jobs at this moment to myself become a millionaire and I am actually becoming one at the end of this year  Luckily my currency is 1 20 of USD  so it s easier   ,3,
Skills are the only thing is value  Keep working hard,4,
I would have worked hard to land a job in Facebook or Google but as a white male i have 0 chance of getting hired in today s political climate   ,1,0
This guy is so hard to get a read on  his humour is so dry hahaha,2,1
soon     Why I m jealous of bitcoin millionaires  as an ex millionaire ,100,4
He s now just a weirdo with money   We got cash now and he mad,1,
He will regret selling does Bitcoins  he can make more money with Bitcoin than he will ever do with his businesses and all the time he has worked ,1,
 asdrubale bisanzio i mean who isn t,2,
You do realize you can both work hard for money and invest it wisely at the same time ,71,3
 Ivan Fuentes Work hard and invest in crypto and you ll only have to wait 10 ,1,
Totally  Be shrewd like an economist   sharp like an accountant ,1,
And wait 30 years  Why not chill now  not have kids  and die at 50 with a satisfying life ,13,
 If you re angry now lol    you ll be really p ssed   in about 10 years   ,11,0
video summary  a millionaire hating on other millionaires,134,29
 Degenerate Mii If they censored Alex Jones then that means its only going to draw more attention to him  Make people think what he spews is the  truth  when its drivel mixed with occasional glimpses of insight  Same situation with Joe Rogan,1,
I like you and even I have invested quite a bit into crypto  I m still not going to deny that Bitcoin was so obviously and blatantly created by the CIA  Learn what controlled opposition is  People like Alex Jones  Joe Rogan  etc ,1,
 Degenerate Mii Cryptocurrencies will give governments more control ,1,
 WayShiny 1 dude you have so much to learn that sharing can not teach only life experience will suffice   ,3,
When everyone is a millionaire what s the worth of ur money   crypto huge psyops plays right into human greed ,6,
Hater who talk talk talk   If he wasn t  millionaire   I rather be broke than be a small mind person like him with money  ,3,
Right   ,2,
I m a millionaire  but not through crypto   However  with that said I m still HODL ing my BTC  ETH  and DOGE  ,8,2
You hold and I ll buy more  we both win ,2,
You forgot   As a millionaire  lol,3,
El Salvador is going to start standing in line at the grocery store waiting for their 6th confirmation on bitcoin to pay for groceries ,59,27
 Crazy prayingmantis I planned on shorting it at 64 000 but missed my chance because it went straight down  Hopefully  I get another  I doubt it  That was the all time high ,1,
We still have the problem of when bitcoin goes to zero Salvadorians will have no money  But the IMF will help out I am sure ,1,
 aries prince They will have the option to use government wallet  or their own  It will be their choice and its a step in the right direction ,1,
Strike solves this  There are videos already on YouTube of Salvadorans paying groceries at supermarkets with Bitcoin  Instant transactions  The lightning network works ,3,
They started using btc last year in a small village using lightning network  fast transactions,1,
I m hearing news that the transactions would be happening on the lightning network    will make btc payment processing faster   but it s going to be through a government custodial wallet issued  by the state  which leads back to a centralization situation since the users wont have access to the wallet Adress  keys as  it technically belongs to the government  that s not freedom imo    that s deception in plain sight  ,3,
This is where litecoin is superior  because its bitcoin but faster for smaller purchases that don t require Fort Knox security and time to secure as a payment    litecoin is invented and MIT licenses for these reasons   lawl at you  for being behind the train and bashing on bitcoin ,1,
 Mike p it doesnt work,2,
They re using the lightning network  Are you ok ,12,
Yeah  life is not fair boomer,1,1
I believe in you Sir  ,2,1
 this is not fair    this is a regressive argument   life isn t fair,22,2
Well delivered techlead  As amusing as ever  Top channel ,54,2
I am never going back,1,
lol You are part of the dropout bud    also weed doesnt make all people lazy   ,2,2
 Levy Roth Has me bouncing off the walls   ,1,
He s never heard of sativa apparently     ,2,
What do people even do if they re not working   I m bored out of my mind on weekends,2,2
watching Tech Lead YouTube videos is a full time job ,204,5
 Junkyard Willie yeah but I wouldn t blame that on bitcoin  rather the dollar is the reason no one wants to work  it s not worth anything,3,
I think you guys are missing the point  The issue is that people just want easy money now  simple simple,3,
 Cerius Tech Lead is more volatile than Bitcoin,15,
Yeah  following his mental gymnastics  is truly a full time job  I need to get a rehab to recover from his hypocrisy      ,4,
This guy is always wrong and have worst timing  He know he we don t care  I like his frankness of being stupid        ,4,0
When people sead you will get ripped off from Bitcoin they laughed now they always remember the guy,1,0
You re sort of salty but funny  ,4,0
So you got a problem with cryptocurrency cuz kids can easily get get rich cuz of it while you suffered sweats and tears    That aint a reason    ,6,0
Techlead why do you hate on btc  This in actuality is a billionaire toy  There are only a few kids that made millions  most lost their shirts in this game ,1,2
I agree with you  as a GTA Online milionaire ,456,14
