Comment,Likes,Reply Count
 Just Chill That depends how u measure work  I m pretty sure the amount of time energy a donkey puts in its work in a day is much more than a human  just like the amount of time energy people like Techlead puts in is more when compared to a Bitcoin millionaire    If one wish to argue that people like Techlead are smarter luckier than donkeys   can get more better results then it can also be argued that Bitcoin millionaires are smarter than people like Techlead   got more better results than him   Looks like money is still very very important compare to hammers  unless it s one of a kind like Mjolnir   Better to get keep more money than hammers ,2,
Statement 1  Most Bitcoin millionaires got rich without working as hard as people like Techlead thus it s  good fair  if they lose money or go poor bankrupt   Statement 2  Money  like hammers   doesn t solve all of life s problem thus it s better to not get a lot of money   Counter 1  Most people like Techlead got rich without working as hard as animals like donkeys thus it s  good fair  if they lose money or go poor bankrupt   Counter 2  If so why don t all rich people just give throw all their money away ,2,
Same here as a Stardew Valley millionaire ,2,
this angry  get off my yard  dude    is too funny,1,
myself as well   as a real life   streets of Los Angeles GTA millionaire      ,5,
Are we gonna ignore the fact that you will buy higher and pump my bags ,2,0
Just buy some  little bit every week  you ll thank me in 5 years  When its all that really matters ,11,16
 Ryan Brubacher you dont need to  understand  BTC  whatever that means  since it s always used as shifting goal post  to understand that govt controls the exchanges  Without a reliable way to exchange your BTC for anything tangible  you know how much it s worth  Take a guess   yea  thats   nothing ,1,
 Ryan Brubacher In the current volatile market a lot of country s and corps are dabbling in it  potential for easy money  The infrastructure of it will never be a global accepted replacement unless Gov t can track all aspects  which they control every businesses payroll taxes  network lines etc   If that becomes the new norm  The Gov t will know everything you ve ever bought or spent currency on       which would be significantly more taxes for you  which is why Gov ts are working towards that   There is no avoiding it ,1,
 Ryan Brubacher Majority want control and protection from government  People get rich in crypto from the next guy buying it higher than you pay for ,4,
 Calvin Something yes the kid who thinks blockchain is going to change anything    May change method  but will not change outcome ,1,
 Ryan Brubacher you re blind bias is just foolish    clearly you fell for all of the hype,1,
 Ryan Brubacher two things in life that are guaranteed  death and taxes  Nothing is going to avoid either  Nothing,2,
 Raybrig2k4 you don t understand BTC if you think the government can Control it ,1,
will end up gov t controlled    just a short term win  will never be long term,2,
This guy is so cocky and I love it,14,0
My problem with bitcoin millionaire as a millionaire is millionaires,145,11
 Ryan Alex That s a poor example  Welfare is there to support the poor so they don t starve and not to make them rich  If it made people rich  everybody would drop their 3 min wage job and get rich so they could live by investing money into bubbles ,2,
 Ryan Alex My grandpa has already done that before internet existed  He works very very hard but never feels he is rich enough to retire  He had a very hard tough life as a farmer so he hopes his future generations can work wiser smarter  makes more money  or find get a Cash cow   have more time for health family   or gets better results returns ,1,
 Ryan Alex Absolutely  But forcing making people to decide between Starvation or Exploitation  aka Slavery  isn t a great solution either ,5,
Statement 1  Most Bitcoin millionaires got rich without working as hard as people like Techlead thus it s  good fair  if they lose money or go poor bankrupt   Counter 1  Most people like Techlead got rich without working as hard as animals like donkeys thus it s  good fair  if they lose money or go poor bankrupt   Statement 2  Money  like hammers   doesn t solve all of life s problem thus it s better to not get a lot of money   Counter 2  If so why don t all the  rich  people just give throw most of their money away ,4,
I m here for the TechLead comedy  ,5,
yeah  as an unemployed bum I am also upset how working people don t appreciate me lying in my bed half day and watching tv for the rest of the day ,3,
so early  feels like im watching it live  o,10,1
This is guy is very annoying  Seriously ,4,1
    ,3,1
Paperhand lead,1,0
  How much I need to invest in crypto to have a million in a year     2 millions will be enough  I am sure,71,5
MOST BITCOIN MILLIONAIRES are FAKES   LYING  gurus  trying to build YouTube channels   The real Bitcoin millionaires more to Puerto Rico to avoid taxes ,1,0
