Comment,Likes,Reply Count
 robert anderson  Don t let him discourage you  don t give up  Trading takes years to master  even the pros learn everday  Never the less  if you lose money no matter which side you take  maybe you need to look at how you are managing active trades rather than how you are entering them  moving stops to BE may help  My advice  find a mentor   And also  try incorporating the use of oscillators or rsi into your strategy to make your entries better and prevent overtrading  And most importantly move to higher TFs 4h or 1D preferably   you ll thank me later   ,1,
Stock is the oldest online market we have done in the past years  we employed it because of the highest quality services it renders and how successful it is  today we now say cryptocurrency too  I m just saying that people should develop the habit of investing  it s really helpful in life ,8,16
 Watched so many videos yet I am confused until I saw excellent remarks about  say to the world that s is the best he got me btc perfectly without any issues  ,1,1
I AND MY   ENTIRE FAMILY   LIVING A PERFECT AND COMFORTABLE LIFE S EVER SINCE WE MET  MORE KUDOS TO YOU SIR,1,0
Your support        and your encouragement has always been the driving factors in my life thank you sir     ,1,1
Their act kindness       and service show how big of a heart for other thank for the successful transactions,1,1
Thank you so       much for the  7 000 you keep sending to my wallet in every 3hours l really appreciated all your effort,1,0
I M HUMBLE         AND APPRECIATE  ALL YOU VE DONE FOR MY SCHOOL  BILLS  THE FLIP REALLY  GOES A LONG YOU RE THE BEST       ,1,1
I really appreciate   your help  sir l got my profit return of 10btc in my bitcoin wallet just now  ,1,1
I Was so    excited when l received my bitcoin from  the real source thank you   may god continue blessed your work sir  ,1,1
Excellent information        a very complete work  without  a doubt and your    information as being useful to me from  1000  20 000 thank you  so  much,1,1
Honestly I can t imagine   why anyone would dislike this is very clear and very helpful  kudos to  you just got a new investor and recommendation  from me    so much sir ,1,1
Everything       comes back to position since I meet him my life now perfect     ,2,1
As I embark on my crypto journey  I thank you for bringing light into my path  Thank you again for another great video ,1,0
I HAVE INCURRED SO MUCH LOSSES TRADING ON MY Own   I TRADE WELL ON DEMO BUT I THINK THE REAL MARKET IS MANIPULATED   CAN ANYONE HELP ME OUT OR AT LEAST TELL ME WHAT I M DOING WRONG  ,9,2
Glad I got into the crypto market when I did because it s been a turning point for me financially  Been my best decision so far ,71,12
Greetings ma am  a newbie here  Care to share you winning methods  I ll like to be profitable ,1,
Hello I m new to bitcoin trade and i have been making huge loses  but recently i see a lot of people earning from it   can someone please give me a new strategy or at least tell me what I m doing wrong ,40,13
Can you make a video on DAOs for 2022  I have my own thoughts on it but it would be great to get your take on it  Also  thanks for producing fun content ,1,1
7 17 Solana is EVM compatible now with Neon EVM,1,0
Crypto millionaires are flocking to Puerto Rico   TechLead    ,1,0
Thanks to  Robert Gabriel crypto  on telegram for helping me regain my Bitcoin back,1,0
Thanks to  Robert Gabriel crypto  on telegram for helping me regain my Bitcoin back,1,1
Thanks to  Robert Gabriel crypto  on telegram for helping me regain my Bitcoin back,1,0
      I m speechless  all I just know is that they are good in cash flipping,1,0
      I feel safe dealing with him  he s so reliable to work with,1,0
      You always give me tangible reason to continue dealing with you    You re nothing but a hero,1,0
      I feel safe dealing with him  he s so reliable to work with,1,0
      To everyone who recommended you  I really appreciate  If not for ya ll recommendation I wouldn t have gotten money that I ve made,1,0
   I don t usually do recommendation stuff but dealing with him had put me in a great mood  ,1,0
      I m so lucky to have someone like you around me  you re a life changer,1,0
  Absolutely  no one does account recovery better than him  he s a legend,1,0
      I feel safe dealing with him  he s so reliable to work with,1,0
   He s the best hacker when it comes to hacking,1,0
False  Cardano does support EVM  see Milkomeda ,1,1
Great my comment didn t get auto deleted finally  Somehow all the spam bots below made it through however ,1,
  Since the day I started working with you  I know I ve changed a lot  Your strategies and technique has really assisted me to become a better person inside and outside   you re one of the reason why always trying my best    you have influenced my life in such a positive way and also change my view of investing Thank you very much sir ,162,1
 With bitcoin investment  I make over 6000usd weekly with Max s assi stance ,2,1
I PRAY THAT ANYONE WHO READS THIS WILL BE SUCCESSFUL IN LIFE   SUCCESSFUL PEOPLE DON T BECOME THAT WAY OVERNIGHT  WHAT MOST PEOPLE SEE AT A GLANCE WEALTH  A GREAT CAREER  PURPOSE IS THE RESULT OF HARD WORK AND HUSTLE OVERTIME,6,0
I PRAY THAT ANYONE WHO READS THIS WILL BE SUCCESSFUL IN LIFE   SUCCESSFUL PEOPLE DON T BECOME THAT WAY OVERNIGHT  WHAT MOST PEOPLE SEE AT A GLANCE WEALTH  A GREAT CAREER  PURPOSE IS THE RESULT OF HARD WORK AND HUSTLE OVERTIME,5,0
I PRAY THAT ANYONE WHO READS THIS WILL BE SUCCESSFUL IN LIFE   SUCCESSFUL PEOPLE DON T BECOME THAT WAY OVERNIGHT  WHAT MOST PEOPLE SEE AT A GLANCE WEALTH  A GREAT CAREER  PURPOSE IS THE RESULT OF HARD WORK AND HUSTLE OVERTIME,5,0
   As in advisor  investor and partner  I m impressed by the thoroughness and professionalisms exhibited by all the principals  in particular  their depth of knowledge in diverse disciplines as construction  operations and assets management is highly advantageous  their focus  integrity and attention to details make comfortable doing business with,5,0
   As in advisor  investor and partner  I m impressed by the thoroughness and professionalisms exhibited by all the principals  in particular  their depth of knowledge in diverse disciplines as construction  operations and assets management is highly advantageous  their focus  integrity and attention to details make comfortable doing business with,5,0
Your team are such a light thank you for brightening my view when all I could see was darkness  you are such a special person  and I am so incredibly lucky to call you my saviour  thanks for the profit earned,5,0
Your team are such a light thank you for brightening my view when all I could see was darkness  you are such a special person  and I am so incredibly lucky to call you my saviour  thanks for the profit earned,5,0
Your team are such a light thank you for brightening my view when all I could see was darkness  you are such a special person  and I am so incredibly lucky to call you my saviour  thanks for the profit earned,5,0
Since the day I started flipping with you    I know I ve changed a lot that really helped me to become a better person inside and out You re one of those reasons why I m always trying my best Thanks you so much you know I appreciate in so many ways,5,0
Since the day I started flipping with you    I know I ve changed a lot that really helped me to become a better person inside and out You re one of those reasons why I m always trying my best Thanks you so much you know I appreciate in so many ways,5,0
Incredible tutorial  it s ideal because it works when you finish doing all the steps  you do not have to wait that long  it s easy to do,7,0
Incredible tutorial  it s ideal because it works when you finish doing all the steps  you do not have to wait that long  it s easy to do,5,0
 This can be done in many ways  As we know teachers are generally helpful  considerate encouraging and forthcoming towards their students  that s how has been so helpful and amazing ,5,0
 This can be done in many ways  As we know teachers are generally helpful  considerate encouraging and forthcoming towards their students  that s how has been so helpful and amazing ,7,0
If you don t find a means of multiplying money  you will just wake up one day to realize that the money you thought you had has finished  investments is the key  ask how you can start investing today  I pray that whoever reads this will succeed in life  zero risk ,5,0
If you don t find a means of multiplying money  you will just wake up one day to realize that the money you thought you had has finished  investments is the key  ask how you can start investing today  I pray that whoever reads this will succeed in life  zero risk ,7,1
If you don t find a means of multiplying money  you will just wake up one day to realize that the money you thought you had has finished  investments is the key  ask how you can start investing today  I pray that whoever reads this will succeed in life  zero risk ,7,0
   i will be forever grateful for the help the name above provide to me helping me recover my account i thought i will never get it back when i could not get help from the customer services but he was able to help me recover my account  thank you,1,0
   i will be forever grateful for the help the name above provide to me helping me recover my account i thought i will never get it back when i could not get help from the customer services but he was able to help me recover my account  thank you,1,0
Thank you for sharing these tips  Passive income was a dream for our parents  and it s cool to see it s something we can achieve today   Hit 130k today pioneered by Expert Bernice  ,1,0
2022 should be more Volatile  Stocks should be up and down  I think Crypto Alt Projects will provide good opportunities  I ll be in both and potentially get a rental property towards the end of the year ,6,3
I m not surprised because I ve made over 180k  following her advice and guidance,1,
I got her recommendations on CNBC news last month,1,
With the current crypto market situation you can make an average of 10 15  daily for your return    ,2,3
Thanks so much madam your a pro I m interested in making profits,2,
I feel those who would allow the market dynamism to determine when to trade or not are either new in space in general or probably just na ve  the sphere have seen far worse times than this  enlightened traders continue to make good use of the dip and pump even acquiring more equities towards trading sessions  I d say that more emphasis should be put into trading since it is way profitable than hodling  Tradlng went smooth for me as I was able to raise over 12 5 BTC when I started at 3 4 BTC  in few weeks implementing trades with signals and insights from Thomas Chaung   You can reach Thomas on  eI    m thomaschaung,96,9
No one  NO ONE  can argue  thomas chaung at least currently  the best out there  even when Bitcoin is looking bearish with the market sentiment swinging low  But they kept us grounded with their real analysis  just the facts in the charts ,1,
Orr What sapp 15036733935 ,2,
You can reach him by searching  thomas chaung crypto  on the internet ,2,
not following this guy s advice will make you money in crypto  He sold his BTC at 26K,1,0
Having an investment is more than keeping a job your right ,1,0
I suggest you update yourself on Cardano  A lot of misinformation ,1,2
Show us your crypto portfolio ,1,2
Great video   I really do have a quick question  For someone with less than  10 000 to invest  How would you recommend we enter the market  I am looking study some traders and copy their strategy rather than investing myself and losing money emotionally  Whats your take on this approach ,63,11
Invest in knowledge lol,1,
 McArthur are you a bot,4,
I would buy some Million token at these prices,1,
I tried copy trading  just when I started investing last Christmas  Had a poor experience  the guy I copied made many small trades  slowly loosing money  What good came out of it was that it gave me an insight into how the market really works  Make sure you do your homework ,1,
In my opinion ADA and Solana will continue growing up  Cardano is working with governments and there are projects coming up that will make it grow  Solana in 2022 will grow as will be released on july a game made with unreal engine 5 and the developers and designers are world know as they come from big movies as star wars  Maybe on the future Solana will down but not in 2022  Anyway  nice video and hope you continue doing videos like that  Thanks ,23,2
Do you watch South Park  b c this guy is an AD,1,1
His kindness shows it to everyone the king of heart  feelings   passion he have for another man s fortune thanks for the 3BTC you re so amazing sir ,1,0
His kindness shows it to everyone the king of heart  feelings   passion he have for another man s fortune thanks for the 3BTC you re so amazing sir ,1,0
 Don t fight the trend  is an old saying  and there are other variants of the phrase like  never catch a falling knife   The bottom line is that traders should not try to anticipate trend reversals  or even worse  try to improve their average while losing  It really doesn t matter whether one is trading soy futures  silver  stocks or cryptocurrencies  Markets generally move in cycles  which can last from a few days to a couple of years  In B  TC s case  it s hard for anyone to justify a bullish case by looking at the chart  It is much more complicated than some would have you believe but from Eddy James approach  bear market aren t worth losing from if you use the ongoing new bie investor programs  A portfolio I got into the strategy with 1 3B TC was quickly increased to 6 6B tc ,54,7
This is so amazing to have such earning platform with no stress  Now I can relly on my money to work for me from home I don t have to work hard just to receive a token at the month end  nothing is as awesome has living a luxury life without any bill to worry about   thanks for creating such an amazing platform at this critical situation of the world,1,0
This is so amazing to have such earning platform with no stress  Now I can relly on my money to work for me from home I don t have to work hard just to receive a token at the month end  nothing is as awesome has living a luxury life without any bill to worry about   thanks for creating such an amazing platform at this critical situation of the world,2,0
I thought their legitimacy is only known to few people unknowing it world wide  It would have been a grate loss if I haven t been part of their investors  they have the best trading signal with good rating in crypto world  the world is at peace to those who investors with their platform,1,0
I thought their legitimacy is only known to few people unknowing it world wide  It would have been a grate loss if I haven t been part of their investors  they have the best trading signal with good rating in crypto world  the world is at peace to those who investors with their platform,1,0
2 53 Our prediction is Cardano  3 end of year 2022  ,1,0
Why would you share your predictions if they re correct ,1,0
Nice video and great work I m new to cryptocurrency and I don t understand how it really works  Can someone guide me on the right approach to investing and making good profit from cryptocurrency investment ,10,9
Get an expert trader who will trade for you while you receive the profit  that s the best way to make good profit from cryptocurrency investment,1,
Ada is built to be compatible with eth in the future  As in eth built on eth can and will be transferred to ada if the project choices too  Definitely do more research   ,2,0
What Is Salvation   Everyone experiences pain in their lifetime  No one asks to be hurt  Yet pain is commonplace in our lives  Our pain is the direct result of sin in the world  It is because of that sin that we experience pain and are separated from God  However  there is still hope for us and that hope is through Jesus Christ  God came down from heaven as the man Jesus  lived a perfect life  and then died an innocent death on the cross so that we could live a free and unencumbered life with Him ,1,0
Good,1,0
Venturing into the trading world without the help of a professional trader and expecting profits is like turning water into wine  you would need a miracle  that s why i trade with hilder Ferguson  her skills set is exceptional ,39,10
Check out an easy way to cash out crypto https   youtu be kcXv923sQeI,2,1
Super guide on how to make money with crypto ,3,0
Unintended consequence  rogue Nation states fund their nuclear weapons programs through crypto             ,1,0
 it will be obvious in hindsight     That s some great wisdom there      rollseyes     Anyway  love your videos    Been watching since you were picking on peoples coding   Keep up the good work ,6,1
Trading crypto has become a lucrative way of making money and i m grateful to my account manager Melinda Dixon,15,7
Hello   from Germany         ,2,0
Good vid but disagree with your assessment of Cardano   Cardano is literally on the cusp of releasing its first main Dapps   The snowball is just about to be pushed down the mountain as there are hundreds of dapps being built on it right now   more than most of the blockchains you mentioned,12,0
Like your vids and tech approach  however I feel that there is a lot of hidden product placement here ,3,0
I like Tech Lead  His Knowledge about this market is very accurate  ,1,1
I agree about ADA  I gave up on them at the coinbase launch ,3,1
 If it s not obvious now  it ll be obvious in hindsight     The Techlead  2022,85,4
To be fair  it s always obvious in hind sight so that s not really prophetic or anything ,1,
I think this is irresponsible  You should always mention crypto and block chain is speculative in nature and high risk  Maybe some value can be added but ultimately it is not producing anything  It is a store of value  Guys don t take financial advise anywhere on YouTube  specially if the channel is often sponsored by crypto brokers  Always do multiple source research and cross check everything ,2,2
Yeah how s your million token doing mate ,4,2
well well   ,1,
87 83  down in the last 6 months   ,1,
About to Explode AmpleSwap Token,1,2
straight to the point    thank you,1,2
You are nohing,1,2
super Analysis,1,2
developers,1,2
  Crypto YouTubers need to stop looking for reasons that the market is struggling solely on what is happening in the Crypto market   The World financial system is on the edge People are nervous not just about the Crypto market   but all markets  If it goes off the edge Crypto will take a massive dive just like all other markets   Suppress the market for the real money to come in  ergo the lengthening of the cycle    I wish I had bought more   I am in profit for now but I am planning on using my experience to do exactly what you have said in this post   Micheal Richard has been doing a great job reviewing all chart   trade and techniques on BTC which has enhance the growth of my port folio to 11btc lately  I would wait and see how the market react to first interest increase to understand batter which direction would put BTC      ,49,4
I really feel left aside hearing and seeing several testimonies from people on profits they make from crypto Forex investments  Can someone please recommend a good expert that can trade on my behalf and generate profits for me   ,19,2
Yeah,1,3
Thanks for being a part of a supportive community  Helpline   ,1,
Signal received to buy Cardano  ADA  ,2,2
why don t you buy a 49  ultrawide already ,1,2
Damn good content ,1,2
He killed all projects and shilled his biggest bags  The way he spells   th rom  makes me ghrrrr,1,2
you will be rich if you inverse him,1,2
Great analysis and philosophy channel,1,2
CORRECTION  Solana has an EVM bridge to Ethereum via Neon Labs mainnet going live in a few weeks ,1,2
clicked it just to hear his intro    ,1,2
ADA is wil be bigger this year it s already up in 2021 with only the staking function and 2022 wil much bigger with the release of all the dapps and the ERC 20 converter   But i do believe the wil be a new top 10 crypto list regarding to market cab,2,1
yeah sadly OP seems a bit misinformed about ADA  Was pretty disappointed with the misinformation this video provided ,1,
First of all  you remind me a bit of Neo  So that s dope  How do you feel about Solana and AMP more specifically ,1,1
cardano has the erc 20 converter coming and milkomeda to deploy solidity code on ada without the gas fees  you are willingly ignoring those facts,14,2
yeah I was super disappointed by his opinion on this although he has other good takes ,2,
No one can be compared to     I KEEP SEEING LOT OF COMPLIMENT ABOUT HIM ON EVERY PAGE AM REALLY LUCKY TO GIVE IT A TRIAL IT WAS ALL SUCCESSFUL WITH EASE   ,1,0
No one can be compared to     I KEEP SEEING LOT OF COMPLIMENT ABOUT HIM ON EVERY PAGE AM REALLY LUCKY TO GIVE IT A TRIAL IT WAS ALL SUCCESSFUL WITH EASE   ,1,0
I enjoyed how you talked and how fluent your mind was  I appreciate the knowledge  I thought Cardano would be a hit  now questioning it  may sell it ,1,3
Thanks for being a part of a supportive community  Helpline  ,1,
Do you really need a college degree to be a web or app developer and to get a job   ,2,2
KDA   Will be the next AVAX,1,2
Nothing is more easy and sweet than earning from home  I ve been earning of this platform but I keep ignoring the information not until my cousin showed me his wallet balance all from his investment with this platform which gave me the full commencement with them  ,1,0
Nothing is more easy and sweet than earning from home  I ve been earning of this platform but I keep ignoring the information not until my cousin showed me his wallet balance all from his investment with this platform which gave me the full commencement with them  ,1,0
Hi TeadLead  what is your thoughts on Chromia chr ,1,2
cardano will be huge   ,1,3
Thanks for being a part of a supportive community  Helpline  ,1,
Hii,1,
They ve been the talk of the town all over here in Pakistan   but it s so surprising I saw many people praising their platform in other countries   This must be a blessing to everyone to have such earning platform over the world,1,1
They ve been the talk of the town all over here in Pakistan   but it s so surprising I saw many people praising their platform in other countries   This must be a blessing to everyone to have such earning platform over the world,1,0
Thanks for continuous great videos  The fact is  NFTs  BTC is the future of crypto and the question most traders ask themselves is   if this is right time to invest  I feel those who would allow the market dynamism to determine when to trade or not are either new in this space in general or probably just na ve  the sphere have seen far worse times than this  enlightened traders continue to make good use of the dip and pump even acquiring more equities towards trading sessions  I d say that more emphasis should be put into tradng  since it is way profitable than hodling  Trading went smooth for me as I was able to raise over 9 BTC when I started at 1 5 BTC in just 5 weeks of implementing trades with signals and insights from Russell Owen   I would advise you all to trade your asset rather than hodl for a future you aren t sure about  Say hello to Russell for a fix ,50,5
yes I bought Pfizer stocks and I m already 20  profits,1,0
love the way you tell it like it is about cardano ,1,1
Xrp  ,1,1
This guy likes to talk a lot huh ,1,0
SAITO is going to explode this year  Its a Layer one blockchain built on Polkadot ecosystem  SAITO will provide the infrastructure for Web 3 0  Great project with a great team  Small cap gem with at least 100x potential ,1,0
Hey Papa TechLead   Would you mind linking these articles that you read for us in the description going forward  I know we could just Google them ourselves  but it d be a real service for us all  Hope you don t mind this request ,1,0
Best insights on infrastructure issues to avoid in crypto investments  Thanks ,1,0
Whats your take on KDA  Kadena  bro  Please do a video on it ,1,0
I think Bitcoin will tend toward the yellow part of the rainbow chart   stock to flow model  with fewer of the insane pumps and crashes we ve seen until now  It will still be a good investment but it will lose volatility  There will be countless Dogecoin copycats which will all fail in the long run  but they will make a few bucks for their creators  Dogecoin itself will stabilize around  0 20 and turn back into a reliable stable coin  My gamer coin in Enjin  and my web 3 coin is ETH  although there s a strong case to be made for an alternative to ETH   But don t count out Fluffy coin  and of course  MM,2,0
Bottom signal for Cardano  Everyone is trash talking it,1,1
can someone write 7 predictions by text ,1,1
Your my Idol,2,1
Remember this is the guy who sold Tesla less than a year ago ,1,1
polker  to the moon guys,1,1
I m gonna have to hold my stance on ADA  so many signs lead me to believe they are an ultimate sleeper play  ,9,1
 The general market for some days has been going up and down and even the crypto market is not left out  but the good thing is that every market gives us a certain leverage to benefits from  For me  i m taking full advantage to continue  bitcoin day trading so as to grow a very strong portfolio ahead of the major bull market after this short correction  Greg Kaplan deserves all praises from me due to his unfailing efforts  signals and guidance towards his traders  I v gained 9 3btc trading with his signals and services With Greg kaplan help I no longer have to worry about the rise and dip of Bitcoin  He can easily be reached  on  T E L EG R A M    kaplansignals  His SUPERB    ,28,0
Your wife is a silly woman,1,2
Cosmos  Bets investment 2022,1,2
 Farmville  Farmville for blockchains   I m dead ,1,1
    326 per day,29,1
