Comment,Likes,Reply Count
   NEW  Join me in DeFi Pro and make passive income with crypto  http   defipro dev  Get  25 FREE crypto https   crypto com app y7cw5y7xvd Get up to  250 of FREE crypto https   blockfi com techlead Web 3 Social Network https   metafora app  Join the Discord  http   app milliontoken org discord,16,16
 TechLead   My brother you are s little strange  qwerky  left field  out there but just found your channel but I like you so have subscribed because despite all your  traits  whether good or bad  no doubt you provid some interesting and good information ,1,
thanks Techlead,1,
Fix your microphone,4,
 NICE VIDEO       I HAVE BEEN TRADING FOR MONTHS NOW  I KEEP MAKING MORE LOSS TRADE WRONG COINS PLEASE I NEED SOME KIND OF ASSIST OR ADVICE ON WHAT TO DO ,4,3
As you can see we are already in April and I feel those who would allow the market dynamism to determine when to trade or not are either new in space in general or probably just na ve  the sphere have seen far worse times than this  enlightened traders continue to make good use of the dip and pump even acquiring more equities towards trading sessions  I d say that more emphasis should be put into trading since it is way profitable than holding  Trading went smooth for me as I was able to raise over 9 2 BTC when I started at 3 5 BTC  in just few weeks implementing trades with signals and insights from Ryan Donald s would advise y all to trade your asset rather than hold for a future you aren t sure about ,201,16
Glad to know many already benefited from him not just me and my friends  he has really made a good name for himself  apart from his amazing profits  honesty is the key as i m approching my 5th trd  trading without fear is very important   ,1,
I was big on gold and silver but a few months ago I discovered Bitcoin and Ethereum    Listening to lots of stuff from Ryan Donald has been really helpful in my journey ,1,
 Williams Johnson No one  NO ONE  can argue Ryan Donald at least currently  the best out there  even when Bitcoin is looking bearish with the market sentiment swinging low  But they kept us grounded with their real analysis  just the facts in the charts,1,
 Leesa Halik Building a good investment portfolio is more complex so I would recommend you seek Ryan Donald support  This way you can get strategies designed to address your unique long short term goals and financial dreams ,1,
First understanding the financial market and how it works then you need to know how to study the market charts  That s all you stand to get when you start trading with Ryan Donald  he s highly recommendable  And his signals works,1,
 Robert N Burch thanks   for the opportunity and recommendation,1,
 Leesa Halik   Orr tele   gram   ryan trading,1,
 Leesa Halik   Orr What sapp 14382661548      ,1,
 Paul C  Montero PLs  HOW do i KNow Ryan Donald Strategy ,1,
 Agrad vel Anthony I will recommend Ryan Donald trading services for you their strategies is working for me at the moment and making good profit from bitcoin trading,1,
 Leesa Halik How can someone know a professional trader that is trustworthy when legit ones are hard to find this days ,1,
Get an expert trader who will trade for you while you receive the profit  that s the best way to make good profit from Bitcoin trade ,1,
Bitcoin is bringing a different revolution in the world   of economy  people are so optimistic investors earns consistently    other will just sit and watch,1,
That is true you need an expert trader to make good profit from Bitcoin trade for you ,1,
All you need as a beginner to make good profit from Bitcoin is a professional trader who will trade on your behalf else you may make losses,1,
Most coins are going to 10x this Year  The recent bitcoin correction down from its alltime high has had themarket in a panic in the past week However noteveryone has seenit as a bad omen The digital asset s price had gone down below  50 000 causing investors to believe the bear market ,78,11
NOBODY BECOMES MILLIONAIRE OR A BILLIONAIRE S BY WORKING FOR OTHERS AND DEPENDING ON THEM  GOOD INVESTMENT BRING MILLIONS OF DOLLARS  AND CONSISTENCY BRING BILLIONS  THE MARKET IS ALL ABOUT CRYPTOCURRENCY AT THE MOMENT NOW  ,67,117
Investing in crypto now should be in every wise individuals list  In some months time you ll be ecstatic with the decision you made today   ,45,14
The future is bright ,1,2
I promise to keep talking about your good job that you keep doing for me and my family you really amazed me when I recieve the payment of 7btc I was like is this huge amount of money for me wow I can t thank you enough sir and you will never lack for the rest of your life thank you so much,1,0
I promise to keep talking about your good job that you keep doing for me and my family you really amazed me when I recieve the payment of 7btc I was like is this huge amount of money for me wow I can t thank you enough sir and you will never lack for the rest of your life thank you so much,1,0
STARTING EARLY IS THE BEST WAY OF GETTING AHEAD TO BUILD WEALTH  AND INVESTING REMAIN A PRIORITY  THE STOCK MARKET HAS PLENTY OF OPPORTUNITY TO EARN A DECENT PAYOUTS  WITH THE RIGHT SKILLS AND A PROPER UNDERSTANDING OF HOW THE MARKET WORKS ,40,40
Investing in bitcoin is the best investment anyone can do this  because it has made a lot of people millionaire  I pray that anyone who reads this will be successful in life,1,1
I realized that the secret to making a million is making better investment   I always tell myself you don t need that new Car or that vacation just yet and that mindset helps me make more money invest   ng   For example last year I invested 70k in blue chip stocks and crypt0 s   with the help of my advisor of course   and made about 380k   but guess what   I put it back and traded with her again and now I m rounding up close to a million   Delayed gratification always pays off,60,19
At this point  we should all take advantage of the dip  The fact is  NFTs   BTC is the future of crypto and the question most traders ask themselves is   if this is right time to invest  I feel those who would allow the market dynamism to determine when to trade or not are either new in this space in general or probably just na ve  the sphere have seen far worse times than this  enlightened traders continue to make good use of the dip and pump even acquiring more equities towards trading sessions  I d say that more emphasis should be put into tradng  since it is way profitable than hodling  Trading went smooth for me as I was able to raise over 19 BTC when I started at 2 BTC in just 5 weeks of implementing trades with signals and insights from Gerald Werlau  I would advise you all to trade your asset rather than hodl for a future you aren t sure about  You can reach Gerald on  eI    m Geraldwerlau  ,1,1
I stumbled across your video and instantly knew this was made for me  goodvibesI m going through the same thing with my business but just knowing that I m not the only one who s experienced this just pushes me to go harder  Continue to put out informational content and sharing your story  THAT is what separates you from the rest  Much gratitude Marvin and EXTREMETOPPERS com was so helpful during the process of boosting my credit,210,0
Can t praise you enough for all you did MONEYHAVENINVESTMENT ORG all that was about your your site is really true have got the payment successfully also which I m proud of my helper thanks for rendering the best service to me when others fails I just appreciate you for the good work  what you do will forever be remembered,1,0
Can t praise you enough for all you did MONEYHAVENINVESTMENT ORG all that was about your your site is really true have got the payment successfully also which I m proud of my helper thanks for rendering the best service to me when others fails I just appreciate you for the good work  what you do will forever be remembered,1,0
Can t praise you enough for all you did MONEYHAVENINVESTMENT ORG all that was about your your site is really true have got the payment successfully also which I m proud of my helper thanks for rendering the best service to me when others fails I just appreciate you for the good work  what you do will forever be remembered,1,0
Can t praise you enough for all you did MONEYHAVENINVESTMENT ORG all that was about your your site is really true have got the payment successfully also which I m proud of my helper thanks for rendering the best service to me when others fails I just appreciate you for the good work  what you do will forever be remembered,1,0
INVESTING IN CRYPTO NOW IS VERY COOL EXPECIALLY WITH THE CURRENT RISE IN THE MARKET  ACT NOW ,72,83
 I will forever be in depted to you    you ve changed my life I ll continue to preach about your name for the world to hear    you ve saved me from a huge financial debt with just little investment  Thanks Mercy Greg,41,7
You can Reach her on   Te Ie gr am   with the name below   Mercy Greg,4,
Every investor around the world wants to invest in U S  markets because they re regulated and they re licensed  They re trustworthy  they have confidence  If you take that away  the global economy will take a hit like nothing else  We want to create that for Bitcoin ,188,4
Every investor around the world wants to invest in U S  markets because they re regulated and they re licensed  They re trustworthy  they have confidence  If you take that away  the global economy will take a hit like nothing else  We want to create that for Bitcoin ,195,4
Our mission is to accelerate the development of a better financial system  it s not just development of a better Bitcoin financial system  and so we want to back the best teams  who have the biggest ideas  unique solutions to big problems ,199,4
Our mission is to accelerate the development of a better financial system  it s not just development of a better Bitcoin financial system  and so we want to back the best teams  who have the biggest ideas  unique solutions to big problems ,191,4
I view Bitcoin as the more democratic version of money and value transfer because no one controls it    I expect the Internet to be around longer than any nation state  so a nation state backed currency is actually less safe than an Internet currency in my mind ,189,4
I view Bitcoin as the more democratic version of money and value transfer because no one controls it    I expect the Internet to be around longer than any nation state  so a nation state backed currency is actually less safe than an Internet currency in my mind ,194,4
Well  bitcoin is a currency  Bitcoin has no underlying rate of return  You know  bonds have an interest coupon  Stocks have earnings and dividends  Gold has nothing  and bitcoin has nothing  There is nothing to support the bitcoin except the hope that you will sell it to somebody for more than you paid for it ,194,4
Well  bitcoin is a currency  Bitcoin has no underlying rate of return  You know  bonds have an interest coupon  Stocks have earnings and dividends  Gold has nothing  and bitcoin has nothing  There is nothing to support the bitcoin except the hope that you will sell it to somebody for more than you paid for it ,195,4
Bitcoin woke us all up to a new way to pay  and culturally  I think a much larger percentage of us have become accustomed to the idea that money no longer comes with the friction it once had ,198,4
Bitcoin woke us all up to a new way to pay  and culturally  I think a much larger percentage of us have become accustomed to the idea that money no longer comes with the friction it once had ,192,4
As a newbie about to invest  you must have these three things in mind 1  Have a long term mindset    2  Be willing to take risk  3  Be careful on money usage  if you re not spending to earn back  then stop spending  4  Never claim to know   Ask questions and it s best you work with a financial advisor   I made it as a newbie by working with Alex Valentino and today I can show alot of my achievements ,197,13
When you stop learning  you get left behind  Never stop educating yourself,70,26
Thanks for introducing me to  Moneyhaveninvestment ORG   investing  Having applied the concepts I learned from you I am happy to report that my portfolio is starting to grow  I especially liked your patience and simple step by step approach in explaining to me the investing strategy  Also your guidelines for maintaining a portfolio are simple and easy to implement,331,0
Thanks for introducing me to  Moneyhaveninvestment ORG   investing  Having applied the concepts I learned from you I am happy to report that my portfolio is starting to grow  I especially liked your patience and simple step by step approach in explaining to me the investing strategy  Also your guidelines for maintaining a portfolio are simple and easy to implement,2,0
I love this video because he gives real strategies for growth of your holdings during unstable market times or even downward market periods   However his explanation for why crypto is staked is let s say imperfect   Staking is a replacement and upgrade to traditional mining and less energy intensive   It returns value similar to mining   Without having a server GPU farm   Proof of stake is the next generation of coin creation and value creation  Bur before then  I ve been trading with  Moneyhaveninvestment ORG  and it s very profitable,245,0
I love this video because he gives real strategies for growth of your holdings during unstable market times or even downward market periods   However his explanation for why crypto is staked is let s say imperfect   Staking is a replacement and upgrade to traditional mining and less energy intensive   It returns value similar to mining   Without having a server GPU farm   Proof of stake is the next generation of coin creation and value creation  Bur before then  I ve been trading with  Moneyhaveninvestment ORG  and it s very profitable,313,0
Interesting consideration  have to consider digital land probably won t function like physical land obviously  but I see application  The issue right now is no one can foresee where this space is heading  Metaverse is an obvious choice in purchasing land as it s backed by FB but when I bought my VR headset a lot of people didn t want to have any association with FB like having to create an account to access their VR profile  I think if fears of future pandemics persist people will be more willing to stay home and interact on VR for shopping and social events  not to mention viewing events in other countries without the costs of flying  etc  There s a lot of potential and opportunity to integrate with cryptocurrency when you deal with the right source like  Moneyhaveninvestment ORG  but there s probably a long way until a platform exists for it ,1,0
Interesting consideration  have to consider digital land probably won t function like physical land obviously  but I see application  The issue right now is no one can foresee where this space is heading  Metaverse is an obvious choice in purchasing land as it s backed by FB but when I bought my VR headset a lot of people didn t want to have any association with FB like having to create an account to access their VR profile  I think if fears of future pandemics persist people will be more willing to stay home and interact on VR for shopping and social events  not to mention viewing events in other countries without the costs of flying  etc  There s a lot of potential and opportunity to integrate with cryptocurrency when you deal with the right source like  Moneyhaveninvestment ORG  but there s probably a long way until a platform exists for it ,309,0
When it comes to the world of investing   most people don t know where to start  Fortunately  great investors of the past and present can provide us with guidance  ,1,0
As you can see we are in the month of February and I feel  those who would allow the market dynamism to determine when to trade or not are either new in space in general or probably just na ve  the sphere have seen far worse times than this   enlightened traders continue to make good use of the dip and pump even acquiring more equities towards trading sessions  l d say that more emphasis should be put into trading since it is way profitable than holding  Trading went smooth for me as I was able to raise over 9 2 BTC when I started at 1 5 BTC in just a few weeks implementing trades with signals and insights from Alex Valentino   I would advise y all to trade your asset rather than hold for a future you aren t sure about or hold it and risk losing all   ,82,9
Hello  I m new to forex and bitcoin ethereum shiba trade and I have been making huge losses but I recently see a lot of people earning from it  Can someone please tell me what i m doing wrong,73,17
Never knew cryptocurrencys could be so challenging  Kept running back to these YouTube videos to learn more about this your video is indeed helpful,6,4
Investing in bitcoin is the best investment anyone can do this  because it has made a lot of people millionaire  I pray that anyone who reads this will be successful in life,2,1
Let it go  Drop it  Forget about it because that money is gone  As of this moment you have learned your lesson  Never trust anyone when it comes to crypto  Work some more and make up for that lost money  and if you want  re invest back into the crypto market  Don t go looking for someone thinking they might be able to help  more than likely they re just going to bait you again and take some more of your money  Just be careful  It s you against the world ,1,
buy ethergem is the best project with its own chain and has a very low capital,1,0
Hello  I m new to Biticon trade and Ive been making huge losses but recently I see a lot of people earning from it  please can someone tell me what l m doing worng ,4,1
https   youtu be ai7f4CwB0N8,1,1
Never let today  ruin   your tomorrow when there is life hope is   certain    I give thanks to that legend man   for rescue my life from poverty he promise to generate my wallet with 5btc wish I was thinking many peoples say that to me but he make it real to my wallet   joy all over my face thanks  alot sir,1,0
Never let today  ruin   your tomorrow when there is life hope is   certain    I give thanks to that legend man   for rescue my life from poverty he promise to generate my wallet with 5btc wish I was thinking many peoples say that to me but he make it real to my wallet   joy all over my face thanks  alot sir,1,0
INVESTING IN CRYPTO NOW IS VERY COOL EXPECIALLY WITH THE CURRENT RISE IN THE MARKET  ACT NOW ,50,80
Nice video   Very engaging from the beginning to the END   I m new to Crypto trade and I have been making huge losses but recently see a lot of people earning from it  Can someone please tell me what I m doing wrong ,14,24
If you don t find a way of multiplying your  money  you will wake up one day to realise that the money you thought you had  has finished  Investment is key ,10,20
When it comes to the world of investing   most people don t know where to start  Fortunately  great investors of the past and present can provide us with guidance  ,2,0
Investing in today is priceless because tomorrow isn t promised  trading bitcoin  gold  silver or any other crypto secure a better tomorrow ,49,17
 When it comes to the world of investing most people don t know where to start  Fortunately  great investors of the past and present can provide us with guidance ,128,51
Most people venture into crypto to be a millionaire  meanwhile  I just want to be debt free,2,
How to wish I knew about crypto trading earlier  I invested in stock but it seems crypto is more profitable  I will try with her,2,
 Amir Alkasim my earnings range from 2 8btc to 3btc depending on the volatility of the market ,2,
 Deborah Feldman oh Gosh  sir that s quite a good capital  please what are your returns  ,2,
 Deborah Feldman This is helpful for my situation   thanks  Guys I will try her but Do you know how much is ok for a start let me know if I can do this,3,
Happy I got this info I will give her a try to see what she s capable of making for me ,1,
 Ran Benjamin Thanks for the opportunity  I look forward to hearing from her services soon,4,
 davis miller  tell her I referred you to her,1,
I m new here how to wish I knew about crypto trading earlier  I invested in stock but crypto is better ,1,
 davis miller  seeking for her info  you can reach her via chat,3,
I m new to trading  I love profit earning in bitcoin  and would like to reach out to  Mrs Kathy   How and where can I do dis ,7,
 Ran Benjamin Yes I am one her clients ,3,
 Bianca Correia oh you also know  Mrs Kathy L Watley  I did Invest with her and I made huge profits over 11btc and still counting ,3,
The quickest way to make your first million is to invest directly with an expert who has a good broker  someone trustworthy  and has made name many individual billionaires,5,
 Qwin Savage Yes  It s a stepping stone to success  and it s the wisest thing to do especially with the current inflation in the market,2,
The highest paying job or investment with the lowest barriers of entry is trading forex  crypto If you know how to trade  you can make a ton of money no matter where you find yourself ,4,
Doctors  Lawyers    Upper management in the US and Europe earn on average ver 150 000 dollars per year  If you re good at what you do and hyper specialized you can double or even triple that amount ,7,
Making 1 million dollars sounds like a lot of money if you ve never earned high figures before  It might seem like an obsolete objective  but the truth is new millionaires are created each day ,1,
When I asked my followers from different platforms what are they immediate financial goal  most of them said that they want to make their first million  So that s what we re doing today ,3,
Rushing into forex crypto trading without adequate orientation or trade with a professional with a good broker for accurate signals  you might lose all your hard earned money ,1,
Successful trading require discipline  patience  adaptability  mental toughness  independence  and forward thinking ,3,
After watching several YouTube tutorial videos about trading I am still making losses,3,
XRP,1,0
Thank you  great video ,1,1
After listening to your other videos about Cardano I didn t think you really understood the platform  However after listening to your reasoning on this video it seems that their development language could be the weak point or their Achilles  heel   While Haskell was supposed to have advantages  its known to be more challenging  ,1,0
 Every crypto investor right now is just smiling at the price of bitcoin as it held strong and indeed valuable enough to generate good ROI  more persons are gonna become millionaires and we have crypto to thanks for that  ,55,26
comments are sus af,1,1
Polkadot   Kusama  the elephant s  in the room ,1,1
Hello  I actually looking for a good trader in cryptocurrency that can help me make good profit  I m looking for recommendations and I saw Expert Doris  Who trade cryptocurrency Expert doris help me out and I made better profit,6,10
I really enjoy her trading,2,
Thank you for the recommendation,3,
Tell her that I referred you,4,
wow   please can she still help me I m a beginner and I want to invest with her,4,
Hello  how much does she make for you in every trade,5,
I m from Germany I used to take loan from bank for surviver but after trading for real expert Doris  She changed my financial status for real,5,
I have been trading with about 4 traders in the past but non of them is good as Expert Doris  she  helped me to recover all my money that I have lost from other traders  thank you so much God will be with you,5,
I stumbled across your video and instantly knew this was made for me  goodvibesI m going through the same thing with my business but just knowing that I m not the only one who s experienced this just pushes me to go harder  Continue to put out informational content and sharing your story  THAT is what separates you from the rest  Much gratitude Marvin and EagleSpy Net was so helpful during the process of boosting my credit,22,0
I stumbled across your video and instantly knew this was made for me  goodvibesI m going through the same thing with my business but just knowing that I m not the only one who s experienced this just pushes me to go harder  Continue to put out informational content and sharing your story  THAT is what separates you from the rest  Much gratitude Marvin and EagleSpy Net was so helpful during the process of boosting my credit,16,0
I stumbled across your video and instantly knew this was made for me  goodvibesI m going through the same thing with my business but just knowing that I m not the only one who s experienced this just pushes me to go harder  Continue to put out informational content and sharing your story  THAT is what separates you from the rest  Much gratitude Marvin and EagleSpy Net was so helpful during the process of boosting my credit,1,0
The regular lending rates on FTX are quite good compared to most banks  but they fluctuate by the hour  and also intra hour  but you re generally not paid for that   Meanwhile staking is a set yearly amount that seldom changes  but then you have to find a good entry and bare the risk that entails  On the other hand  I consider the opportunity cost of not owning crypto these days to be much of a much higher risk  That is to say  I think  not  owning crypto is far more risky than owning it  due to various things not limited to stupid fiscal policies and Fed money printing  So the best is owing it  trading and investing with it  I learned that from a crypto expert from TheSpaceHackers Com I ve made tons of profits btw ,20,1
