Comment,Likes,Reply Count
The regular lending rates on FTX are quite good compared to most banks  but they fluctuate by the hour  and also intra hour  but you re generally not paid for that   Meanwhile staking is a set yearly amount that seldom changes  but then you have to find a good entry and bare the risk that entails  On the other hand  I consider the opportunity cost of not owning crypto these days to be much of a much higher risk  That is to say  I think  not  owning crypto is far more risky than owning it  due to various things not limited to stupid fiscal policies and Fed money printing  So the best is owing it  trading and investing with it  I learned that from a crypto expert from TheSpaceHackers Com I ve made tons of profits btw ,16,0
Thank you for being there THESPACEHACKERS Com when I wanted you ton      I was lost in this new world that I was hassled to start with     you not only guided me along the way but you also showed me the proper way    whatever little I have been able to achieve in life is because of you today       I want to thank you for being there and showing me the proper way of doing thing for me you are my best guide as you truly showed me the way to life    once again   I would like to tell you a heartfelt thanks for being there ,17,1
Thank you for being there THESPACEHACKERS Com when I wanted you ton      I was lost in this new world that I was hassled to start with     you not only guided me along the way but you also showed me the proper way    whatever little I have been able to achieve in life is because of you today       I want to thank you for being there and showing me the proper way of doing thing for me you are my best guide as you truly showed me the way to life    once again   I would like to tell you a heartfelt thanks for being there ,20,0
Wow this is really on time THANK YOU FOR BEING YOU AND YOUR KNOWLEDGE    your videos are perfect for motivation and ideas and we enjoy and learn so much from them Thank you for your information and being open THESPACEHACKERS COM,20,0
Wow this is really on time THANK YOU FOR BEING YOU AND YOUR KNOWLEDGE    your videos are perfect for motivation and ideas and we enjoy and learn so much from them Thank you for your information and being open THESPACEHACKERS COM,10,0
I think you literally just saved my life   I ve been struggling to find a way out  I m currently an N A waiting to get certified because of covid and stuff but I support myself and my grandma  I don t have anyone to turn to for help  I ve been trying to save but I can t because of bills and renting my apartment and everything  But this  literally helped me look to a brighter future  My grandma is crippled so she cannot do work or anything  Most people have parents to turn to but I don t talk to my mom or dad  This literally helped me so much because since i met EagleSpy Net the real issue i have about debt was solve in some weeks am sure before Feb of my birthday i will be home owner ,18,0
 would not have been able to achieve this if it wasnt for them   I have huge respect and love for them   everyone needs to use this   ,19,0
 would not have been able to achieve this if it wasnt for them   I have huge respect and love for them   everyone needs to use this   ,17,0
I started what a few months ago   and I already understand how everything works   not hyping myself but some people really just stay home doing nothing   get into cryptocurrncy and let them work for you,24,4
I started what a few months ago   and I already understand how everything works   not hyping myself but some people really just stay home doing nothing   get into cryptocurrncy and let them work for you,18,3
I also started a couple of months ago and it s been going perfectly well for me   im just glad I started with the right group,22,3
I also started a couple of months ago and it s been going perfectly well for me   im just glad I started with the right group,19,2
Its never too late to start somewhere guys   anywhere no matter how little   it s all about making moves because believe me the future is not going to wait around for any of us,27,3
Its never too late to start somewhere guys   anywhere no matter how little   it s all about making moves because believe me the future is not going to wait around for any of us,14,2
When you invest  you re buying a day that you don t have to work      I pray everyone reading this becomes successful ,21,2
When you invest  you re buying a day that you don t have to work      I pray everyone reading this becomes successful ,20,3
When you invest  you re buying a day that you don t have to work      I pray everyone reading this becomes successful ,28,2
                                      10 BTC                     ,1,0
The quality of this video deserves 10 Million subscriber and 25million views   Such an amazing and talented young men with so much talent on explaining as smart as possible how to actually earn money from crypto and not having to rich much money   Thanks dude for this video keep it up and a shout out to TheSpaceHackers Com for being real with their investment plans,19,0
The quality of this video deserves 10 Million subscriber and 25million views   Such an amazing and talented young men with so much talent on explaining as smart as possible how to actually earn money from crypto and not having to rich much money   Thanks dude for this video keep it up and a shout out to TheSpaceHackers Com for being real with their investment plans,12,0
The quality of this video deserves 10 Million subscriber and 25million views   Such an amazing and talented young men with so much talent on explaining as smart as possible how to actually earn money from crypto and not having to rich much money   Thanks dude for this video keep it up and a shout out to TheSpaceHackers Com for being real with their investment plans,23,0
Life is so precious  when you know you own a property or an investment to always keep you go  I have no regrets starting my journey in crypto  It s been nothing but perfect ,48,18
I just saw this video today Jan 25  should have sold my sol  I lost half of it  ,1,0
  You really did what you promised     You re best In Bitcoin investment sir I make my first invest and earned alot of income thanks so much for your efforts and support      ,1,0
Super,1,1
I can guarantee everyone that you re legit     this profile above generated huge profit into my wallet without any complaint or errors,1,0
Investing in Bitcoin is the best investment anyone can do this  because it has made a lot of people millionaire  I pray that anyone who reads this will be successful in life,2,0
Investing in cryptocurrency is the best way of getting ahead to build wealth  investing remains a priority  The Cryptocurrency market has plenty of opportunities to earn a decent payouts  with the right skills and proper understanding of how the market works  I pray that anyone who reads this will be successful in life  ,25,38
People will be kicking themselves in few weeks If they miss the opportunity to buy and invest in crypto as it s retracting     BE WISH,27,14
Investing in crypto now is very cool especially with the current rise in the market now,3,2
Despite the economic crisis and the coin dip this is still a good time to invest in bitcoin trade ,51,24
No doubt alot of opportunities will present it self this year as the markets have been searching for liquidity for the past 69days  As you can see from the charts   In case you wondered  we are looking at a 5 fold range bound fractal  This must be the rangiest range I ve seen in years for Bitcoin  The vast majority of discretionary traders tend to become more and more hopeless as the range box develops  It s a patience test failed by many  This is a pivotal moment and that s why the majority will regret  If it goes down  people say  why haven t I sold If it goes u  people say  why haven t I bought   In September 2021 bulls trapped the bears  check the lower wick on 21th of September and now a buy signal has been given which strongly indicates a final bottoming process is locked  One of the scenario s from career trader Callum Lucas is that bulls will use the same trick  as his automated sig    nals based on unique combinations of trend  momentum and volume scanners supports this thesis  So far I ve accumulated over 8BTC trading with it  If interested then reach out through Te  E G  m  callumlucas,135,3
Successful people don t become that way overnight  what most people see at a glance wealth  a great career  purpose is the result of hard work and hustle over time  I pray that anyone who reads this will be successful in life ,2,1
I m new to cryptocurrency and I find it difficult using these strategies well  Where can I find a legit broker  that will manage my account and also teach me how to trade,39,11
I lost everything once  due to leverage  Now I started again  Doing fine  2022 my year ,2,1
Thanks so much  for watching You can join our VIP offer,1,
Very good video  I was wondering what s your opinion on Link  it seems very good and can be use with a lot of blockchains  You think it will go up like cro  ftm  atom would ,1,1
One could argue that choice of preferred programming language could change over time   however that does not guarantee that Haskell would be the preferred programming language in the long run  We ll have to wait and see once hydra deploys  for now we could only speculate ,1,0
Man all we all need is a good knowledge of tech analysis in perspective of crypto in a whole     I ve just started learning from a 15year old kid who has been in the crypto world since 12    Sounds crazy and unbelievable but man I m getting changes I m my portfolio even though it s not big figures yet but it keeps on yielding increase and interest     I also play call of duty with kid most time so it s fun learning and having fun at the same time     I know with time I ll be able to make those big figyres     All these videos posted on here are just to get views and talks about what you already know or can easily know    They won t give you what you really need,1,0
If only you know what the future says  you ll know that indeed crypto currency is the future  investing into it now will be the wisest thing to do  Hold    And you ll thanks yourself,10,3
Money is an issue that everyone has for a better and luxurious life  life was hard for me until I started Bitcoin and I m now earning  9 500 per week ,4,0
MM token ,1,1
lmao  2022 is the year of VR ,1,1
Im there with you that we likely have more bullish action for crypto and stocks in 2022  Dems are gonna want to keep rates low so that people think favorably of them in the mid term elections  Could see Fed rate hikes after that  Bullish on DeFi  Gaming  NFTs  and AI for this year  Excited for StandardDAO release in late Q1 where they are taking the Olympus model but making a more sustainable evolution of it with real world and digital assets in the treasury ,1,1
You said 1 year ago that crypto will crash   and now your saying to invest in it      This is exactly a example of someone who has not got a clue about what is happening  You just want the views,1,1
I got the best script from hackerkong on telegram the script generate 7btc into my wallet without no problem    ,1,0
Why is this guy still on youtube      He s a joke,1,0
Venturing into the trading world without the help of a professional trader and expecting profits is like turning water into wine  you would need a Miracle  that s why i trade with Erna solberg  her skills set is exceptional ,3,2
Wasn t this dude like shitting on crypto just the other day ,1,1
You are clueless      ,1,1
Thanks for sharing this  Very helpful  Still struggling as my losses are bigger than my wins  I am still hanging in there and learn from you guys as much I can to turn it around  Thanks to you  Andrew and all the Bull traders team ,128,9
 YINGLI XIE I hope she replies public mails  I just looked her up with her full name and left her one on her webpage  kudos on your portfolio ,3,
 Dustin Nguyen This is where technical analysis comes into play  very important   I seeked the guidance of  Jennifer Bright Emfield  who has made me understand that strategy is everything  her strategy has brought 5x returns so far this year  I copy her trades in real time which i can confidently say i am impressed ,2,
 YINGLI XIE  I started trading around august  been slowly going up  This choppy market chopped me real good  Now I m back to where I first started ,3,
 Dustin Nguyen  Could you share more information  Bad risk management I believe ,1,
The market killed me today  Sigh  My account is back to 0 ,3,
Set a risk and stick to your plan  cut losses quickly  do not hold and hope  have a reward to risk ratio greater or equal to 2 1  hope this helps ,2,
When it comes to bitcoin                                                                                                                                                                                                                                                                                                                                                                               IMMEDIATELYHACKER TECH is the best no doubt I try them and I never regret dealing with them I m here to say thank you for the  60 000 credit into my wallet ,1,0
U forgot to add  as millionaire   after title of the video  ,1,0
it s the start of a new year and the non   investing public should really pay attention to the markets cause there s no better time to invest than this period  I m speaking from experience  I just dropped some cash in crypto too,199,8
Thanks so much I was able to find her page and I already leave her a message ,1,
t s coming back up 20zz    history  but comparing Btc to 2013  2017 it s like comparing the 1800 s to 2000 s  It kinda sounds good but it s apple s to orange s  I have been holding since 2018 and I am hoping just like everyone else that it will assess before 2022  but some believe while others don t  Too many instuititations waiting for new budget allocations  Suppress the market for the real money to come in  ergo the lengthening of the cycle    I wish I had bought more  I am in profit for now but I am planning on using my experience to do exactly what you have said in this post  I have learned from you and other s especially From David Mayor  who taught me how to make trade and increase my crypto from 6 to 15btc that no one really knows what is going to happen and I know you are only saying what you think will happen based on the past  It is yours and my opinion so people should make their own investment choices based on their own research,9,15
Are you the bruce lee from movie once upon a time ,1,0
    he helped recover hacked account  he s fast and reliable,1,0
Oh we have another cardano hater,1,1
Damn Techlead your comment section is full of bots conversing with bots about financial scams ,1,0
Talk about gilgamesh crypto ok,1,0
I will forever appreciate this channel  you ve helped my family alot  your videos  advice  lessons and funny words are inspirational and helpful to us  My husband and I have been able to be minimal  conscious in spending  saving and investing wisely  I now earn every week  You re such a blessing to this generation  we all love you   ,62,25
 Arjun Isaac I agree but finding a professional for guidance ain t as easy as it sounds  cause I ve been searching for one ,1,
 Joana Beatriz I can share some tips  that helped me   1  Plan towards it 2  Be minimal on spending 3  Save money wisely towards retirement 4  Save to invest  it s a proven way to get richer ,1,
weren t you so bearish on btc a while back  gtfo ,1,0
Investing in crypto now is very cool especially with the current rise in the market now,3,1
You shall never enjoy a dollar of my money you took  You will spend it on sickness on every single day in 2022,1,0
Very informative video  Well the Crypto market has waken up in a bullish pattern and a better season to go into trading with a working strategy and signals backed with the help of a pro which turns out to be so accurate and profitable Mr Pier has been a real mentor so far  I have been able to grow my portfolio from 1 1btc to a total of 4 8btc through day trading in 2 weeks   with the help of Mr Pier you can contact him on   Te l e g r a m  piermario101 ,19,4
  Hackerkong on telegram just use a little payment to generate 4btc successfully into my wallet without no issue ,1,0
GOOD VIDEO  EVERYONE NEEDS MORE THAN THEIR BASIC SALARY TO BE FINANCIALLY SECURED  THE BEST THING TO DO WITH YOUR MONEY IS TO INVEST  MONEY LEFT IN SAVINGS ALWAYS END UP USED WITH NO RETURNS  ,2,1
CHEER UP LOL,1,1
It s coming back up 2022   history    but comparing Btc to 2013  2017 it s like comparing the 1800 s to 2000 s  It kinda sounds good but it s apple s to orange s  I have been holding since 2018 and I am hoping just like everyone else that it will assess before 2022  but some believe while others don t  Too many instuititations waiting for new budget allocations  Suppress the market for the real money to come in  ergo the lengthening of the cycle    I wish I had bought more   I am in profit for now but I am planning on using my experience to do exactly what you have said in this post   I have learned from you and other  especially From Aaron Addison   who taught me how to make trade and increase my crypto from 6 to 15btc that no one really knows what is going to happen and I know you are only saying what you think will happen based on the past   It is yours and my opinion so people should make their own investment choices based on their own research ,242,9
 Someone is going to build Farmville  Saying this as the game Sunflower Farmers has grown exponentially and literally DDoSed the Polygon chain  until it got rekt haha  ,1,1
defi and web 3 will be 2022 year  and not to forget cloud base blockchain  storage  ,1,1
Investing in bitcoin is the best investment anyone can do this  because it has made a lot of people millionaire  I pray that anyone who reads this will be successful in life,4,2
I have been trading on my own but my  lost is too much for me  but I need a good expert trade we can help me out,1,
Your facts are incorrect mate ,1,1
You re a STUD  Love your videos ,1,1
You flop around like a pancake,1,1
You should interview Richard Heart  A new crypto he s designing already has 1 billion dollars sacrificed for freedom of movement and assembly  2022 is gonna be insane ,1,1
Despite your   own work pressure   still look out for time to help me out his so genius and I totally appreciate it,1,0
Despite your   own work pressure   still look out for time to help me out his so genius and I totally appreciate it,2,0
Despite your   own work pressure   still look out for time to help me out his so genius and I totally appreciate it,2,0
I never knew     has the best info and item to solve an issues immediately I got introduced to him luckily for me he did well than my expectations     Kudos to    he never disappoint,4,0
I never knew     has the best info and item to solve an issues immediately I got introduced to him luckily for me he did well than my expectations     Kudos to    he never disappoint,4,0
I never knew     has the best info and item to solve an issues immediately I got introduced to him luckily for me he did well than my expectations     Kudos to    he never disappoint,4,0
I never knew     has the best info and item to solve an issues immediately I got introduced to him luckily for me he did well than my expectations     Kudos to    he never disappoint,4,0
   got a great review everywhere his truly the best as they said  I received a legit alert and my fund was confirmed,5,0
   got a great review everywhere his truly the best as they said  I received a legit alert and my fund was confirmed,5,0
   got a great review everywhere his truly the best as they said  I received a legit alert and my fund was confirmed,5,0
   got a great review everywhere his truly the best as they said  I received a legit alert and my fund was confirmed,5,0
I just withdraw my profit last two days before now  am glad I did invest with them still reinvested and the trade is ongoing,10,3
The only source to make money this season is by contacting the above name,2,0
I just confirm     the 8k on my cashapp without error,2,0
It always work like a charm dealing with the above name             you own all my respect,2,0
A successful    transactions is done   by the best crew for the job I made 6k on mine too,2,0
   You are the reason why I smile always   I really appreciate the effort you render,3,0
Jet aren t fast    enough with the way their investment scheme work I got 5btc investing too,3,0
I bless the day I meet this source    ,3,0
Contact the above name I got the help through them,4,0
    thanks for the help sir I got the 5btc in my wallet now   the above name as been my source of income,5,0
I got help dealing with    you are the best in the world,5,0
You    have influence   my life in such a positive way word can ever Express I got the 3btc in my wallet without stress th,6,0
I bless the day I meet this source    ,7,0
Everything work as plan dealing with the above name the are the best crew I ever meet,8,0
Contact the above name I got the help through them,9,0
You    have influence   my life in such a positive way word can ever Express I got the help without stress th,10,0
   It is a complete transactions working with this great crew,10,0
I personally advice you all to start dealing and investing with this  pro     ,10,0
I personally advice you all to start dealing and investing with this  pro     ,10,0
I do like your videos  thanks from Brazil,1,1
Battery Metals  Supply chain shortage  Graphite  Nickel  Lithium etc  The  other  mining   ,1,1
BNB   EGLD INJECTIVE PROTOCOL   solana  saito  Velas   gala  Enjin   sand  Ares protocol  harvest finance  will be massive in 2022,1,1
Hello guys I have been watching some video and I was thinking about investing in bitcoin forex but still don t know where to start from ,3,1
    There is always a saying that no Billionaire made it through Salary that why i have make the grate move to focus on investing  Am so grateful to God i meet the right investor and trade manager at the right time,6,0
    There is always a saying that no Billionaire made it through Salary that why i have make the grate move to focus on investing  Am so grateful to God i meet the right investor and trade manager at the right time,6,0
    There is always a saying that no Billionaire made it through Salary that why i have make the grate move to focus on investing  Am so grateful to God i meet the right investor and trade manager at the right time,7,0
Their    plateform is really amazing   It is completely secure and easy to acess   Thinking to invest more in future   ,8,0
Their    plateform is really amazing   It is completely secure and easy to acess   Thinking to invest more in future   ,7,0
Their    plateform is really amazing   It is completely secure and easy to acess   Thinking to invest more in future   ,8,0
wow this year is going to be a grate and awesome year for me just make a withdrawal of  80 000 investing the broker name above this comment ,9,0
wow this year is going to be a grate and awesome year for me just make a withdrawal of  80 000 investing the broker name above this comment ,9,0
wow this year is going to be a grate and awesome year for me just make a withdrawal of  80 000 investing the broker name above this comment ,9,0
Talking about stocks  Forex and cryptocurrency trading is the most profitable venture I ever invested in  I reached my goal of  120k monthly trade earnings  Wondering if viewers here are familiar with Rosemary trading strategy   ,114,44
3 48 adaik Cardano supports EVM on cardano testnet at least  Afaik Cardano supports multiple different smart contract layers at the same time  In theory   Soon   Just my layman understanding,1,1
EVM compatibility is overrated ,1,1
I m new to cryptocurrency and I don t understand how it really works  Can someone guide me on the right approach to investing and making good profit from cryptocurrency investment  ,8,6
Origin Trail will change crypto forever,1,1
Great video  but how we make money again ,1,2
I really appreciate using  is services,1,0
Where is your Drink ,1,1
 I pray to meet you in my next world   you re such amazing,11,0
You re  such a talented person thank you for getting my life back I wish you all the best,11,0
MAY GOD CONTINUE TO BLESS YOU FOR THE 20k YOU GENERATE INTO MY ACCOUNT   ,13,0
All the praise goes to you for being my live back up when I taught everything is gone,13,0
                    wonderful job from him  He made it possible for me    Am recommending him to you all,11,0
Never doubt the technique use by  investing directly with them,11,0
                                                                                  you are the  only best source I ever meet,11,0
             you way are the best sources and strategie to make huge funds                                                You are the best in the world     ,11,0
Always deal     with the right source,11,0
I m so gratefull that I came accross your channel sir  There are some smart folks covering the crypto space on YT but no one explains their insights into the fundementals like you do  Thank you for taking the time to share your knowledge ,22,1
The best decision I ever made in my life was Investing in financial market trust me guys it pays alot and I have come to realize that trading bitcoin is more profitable than holding it and waiting for it to skyrocket,5,2
   HELLO  I WANT TO TRADE AND INVEST CRYPTO PLEASE WHICH EXPERT DO YOU RECOMMEND    ,5,1
