Comment,Likes,Reply Count
 I admire the efforts you put in your videos mate  Digital currencies continues to reshape the world globally  it s hard for anyone going against them these days  Though from a trader s perspective i feel we really need more experts in the field updating newbies on how the community works  Crypto currencies are gradually moving towards something big and the price dip over the past few days is just the beginning of greater things to come ironical though  lots of persons are skeptical on when to buy in the market and whether it isn t too late to buy an asset  when you re holding it could be but when trading its never too late to buy  a trader with the right strategy and indicators earns big regardless of market price  bulls or bears   I trade using signals from trade expert Richard Grey Trading Signals  with his guide and signal service i ve made over 6BTC worth of crypto assets over some months with an estimate of 1 5BTC as a start  You can easily get to him on               RG trade    cheers,26,5
 but your not here for the desks are you  Or are you      ,30,1
3 ads so well hidden,1,1
How do you use the elegant keyboard with your cabbage hands ,4,1
Isn t this the guy that blew all his money day trading stocks   Why would I ever take advice from you ,1,1
meme coin  you just make a meme out of it and it got banned,2,1
The USA dollar is backed by nothing  There is no gold they the NWO 10 stupid families stole it all  ElSalvador will be a success  It already is  Don t be brainwashed the USA is fiinished ,1,1
Lmfao trying to ruin crypto fans lives on a daily  I love it  ,3,2
 funds are safu    Bizonacci s meme was prophetic,21,1
this guy is a kid nothing more,2,1
We will consider your words when you show us your short position    as a millionaire   ,1,1
 El Salvador could collapse   lol it s been collapsed  Adopting Bitcoin is their hail mary ,38,1
which might cause an even greater collapse  According to his recent series of videos  BTC  might head towards another crash due to heavy manipulation  If it does  then they re in deeper trouble ,1,
you must be new to crypto lol  Have fun staying poor  as a millionaire ,1,1
Put money where your mouth is and short bitcoin ,1,1
Investing in bitcoin is the best investment anyone can do this year 2021 Because bitcoin investment has made a lot of people millionaires,5,4
Savage,1,1
Great video and analysis There s nothing new with the bitcoin price manipulation    dumping and liquidating millions of dollars in the process  If you want to be safe just trade and don t hold  The bottom line in bitcoin has always been volatility  bitcoin investors should be aware of Anthony s strategy  his strategy work s and it s good  with Anthony Graham the rich are getting richer with his trade  i think the pandemic has taught people the importance of multiple stream income unfortunately having a job doesn t mean security   if you want to be successful in bitcoin trad have the mindset of the rich  spend less and invest more in bitcoin  Don t give up your dreams  don t be in a haste to invest  know what and who you are investing to and be sure that the person will deliver before investing  learn and get the knowledge first before investing  Mr Anthony Graham methods are legit his methods works like magic  I was convinced to say his an expert  i keep on earning and learning every single week with his strategy  Mr Anthony Graham impact on my trading activities won t make me choose another expert or account manager  Anthony is the only one i know best  i manage my bitcoin with with him  my first experience with Mr Anthony Graham gave me a profit over  60 000 in just one month of trading ever since then i keep on reinvesting with him  I m not here to convince anyone but to share my experience and testimony  you can get to Anthony via Tele gram    expertanthonygraham50   i know you will be glad ,33,8
Bitcoin will be 100K within a year    Selling is dumb ,2,1
Grab some random chart and compare it to Bitcoin  Great job tech lead ,2,1
 Fashion conscious mechanical keyboard          ,40,1
     love this one  Too funny ,1,1
We should all just do the opposite of what he does   ,1,1
Nice video    But  People will be kicking themselves in few weeks if they miss the opportunity to buy and invest in bitcoin,56,42
Lmfao  ,2,
Wow every post here is made by same guy w different names  Hmmmm,1,
This guy is crazy  stop listening to him  He is the worst person you can ever listen to when it comes to trading and cryptocurrencies ,1,1
4 00 a tweet by Elon Musk lol,1,2
Booze  Drugs and Hookers those are the Best Investments,1,0
Diamond hands       Flaky paper hands       Rotten cabbage hands,1,0
This is starting to become one of my favorite all time channels  Good laughs  good info  real talk  Keep it up ,25,1
Nation states are what is looking bearish not crypto currencies which are here to stay ,1,1
Bitcoin is over  56 000 and counting investing in it now is a very lucrative way of making profits  sleep on it  don t just buy and hold bitcoin  Trade it,1,1
We are here for the desk     ,1,1
unbelievable,1,1
I revamp furniture  so yeah I m here for the desk ,1,1
Pound the table with your diamond hands     as your crypto crashes      ,39,0
I love your sense of humor ,1,1
Don t give up  Think in turn of technology and the future ,3,1
He just wants crypto to fall so he can buy all of the precious DOGECOIN     ,18,2
Despite the economic crisis  this is still a good time to invest in Gold and crypto,69,47
Lmao these ad spam bots are getting smarter,1,
The rich spend less and invest more,3,
To the core of the earth baby ,1,1
I m a fashion statement right here  the luxurious keyboard  the mouse that looks like a container of high end hand cream  This guy gets it   ,45,1
Cabbage hands    ,1,1
how much of this argument relies on you using your imagination    or how things  seem  to be   lulz,1,1
I start with  4 200 at the ending of May and I m almost at  33 000 now  all thanks to expert Sharon,3,4
 BLACK SWAN   Crash    ,1,1
Governments  banks etc  Are just trying to scare the market and drop the prices so they can buy in for lower prices  They missed the boat and are trying to bring it back  Everyone in crypto should strive to be a while coiner  Hodl at least one Bitcoin ,1,1
I m all in physical silver   gold ,1,3
 dansynth yeah in my cats litter box,1,
I like to watch Techlead when I m sitting on my squatty potty,29,0
Psa  if you find yourself getting offended attacked emotional at this video  you should think twice about whether youre qualified to invest in crypto ,2,1
Maybe he is  right I m 45  Down ,2,0
I broke so many tables with my diamond hands  I need that desk now ,34,1
I broke zero tables    cabbage hands       ,2,
The fact that China banned bitcoin payments should make you a firm believer in bitcoin,6,3
enemies of doge have declared themselves,2,0
Only youtuber who s ads I don t skip past,1,0
Gold is over valued,1,0
Nice video and thanks for also recommending your trader Ma Sandra Wilson  her services are exceptional and I ve been earning greatly from investing with her,61,28
Your Cabbage hands are healthy ,1,0
Boomer,1,0
If crypto crashes    I ll buy even more    keep the eyes on the ball ,36,7
 Henry Didelot because these guys have no idea what trading and investing is  They have not studied 1 day in their lifes and think these crypto are really viable currencies for the future  They are pretty dumb,3,
It s because he is confident it will recover like it always has  only ones scared are new to crypto  4 yrs or less,5,
The copium is strong in this one   ,2,
This has to be the most stupid investment strategy ever,7,
Pass the dip please    ,1,
That s really bad investing strategy  You wouldn t buy more shares of Blockbuster while it s on its way down to zero ,12,
Then venn diagram for people who invest in soy beans and those who invest in crypto overlaps very little indeed ,1,0
Is cumrocket a meme coin ,1,0
Because everyone knows about the famous integrity of Thailand s SEC     rolls eyes     OK boomer ,1,0
Keep announcing the crash every week  one week you re bound to be right,8,2
Nice Facebook mug  as an ex facebook techlead ,1,1
TrollLead at it again,1,0
Hi  I d like to listen how your portfolio looks like with context of your financial plan and where you re gonna invest for hedging inflation  Thanks  I like your videos  I always learn something new ,1,1
LOL imagine if El Salv gets rugged by Tether LOL,3,1
Techlead lives with his parents because he s a stealth millionaire ,3,1
This is the most bullish thing Ive seen in a while ,1,1
I m here for the desk and those keyboards  Plus the sarcasm  Love your straight faced humor ,2,0
As a Techlead funny how you didn t invest in tech  s p  but in commodities lol,1,0
STFU and talk about things you know,1,0
  deep into the red into the core of the earth,2,0
This is a nice video     So inspiring but do anyone knows about expert Mr George Gilbeth  Mr George Gilbeth is legit and his method works like magic I keep on earning every single week with him new strategy,7,38
   ,2,0
TechLead   We are going deep in the red   Me   Oh no  anyways ,70,4
 eckosama i mean his course for landing an interview there can still work since he DID land a job there  Just don t land a You re Fired like him ,4,
its weird  he didnt make money day trading  swing  or trading crypto  He also got fired from facebook and is now selling a course about landing an interview there  He is making money from not making money and talking about it  Strange method,3,
 Jojo Joe  Yup  I agree  It s gunna be boring for a long while ,2,
yeah highly doubt it won t bother  you unless youve sold and made profit already and holding out for the drop  it ll be a while  months before it picks up to the highs again ,1,
 Very cool keyboard indeed       ,2,1
I agree with TechLead  there will be a correction for bitcoin and altcoins  And then a massive super economic cycle where bitcoin will go 250k  ,2,1
Do you still hold your dogecoins ,1,0
Who cares ,1,0
just remember guys  this guy got out of his marriage scot free    some of you might not fully appreciate the awesomeness of this feat  trust me its not easy  try it on your own peril,16,0
Crypto is dying  repost this to make it die faster and get finally the GPU,1,0
I cannot compete with your fashion sense bro  But I enjoy the content  thanks   ,4,0
I don t really think he s actually EX facebook  senior engineer holding that facebook  cup      just advertising them lol,1,0
Damn    My diamond hands just crack by you    Selling my crypto currency asap the price level out ,6,1
Rip haha,1,
Buy and hold does not work  OK  I am going to buy and hold anyway  ALSO  can you explain how a Country can ban a Crypto and enforce it ,1,2
 Verum Serum It s all a whatever sandwich to me    The Fed is going to need a basket of currencies to back their new Fedcoin so it s just easier to use Bitcoin over ban  which you can t do  In fact  trying to ban Bitcoin only makes it worth more ,1,
TechLead is a financial alchemist  Just showing him to a diamond will produce a cabbage ,1,0
Techlead   The market can stay insolvent  longer than you can stay solvent   Bruv it s  The market can stay irrational longer than you can stay solvent   As a millionaire ,2,0
It s actually  the market can remain irrational longer than you can stay solvent ,136,6
 Pinned by TechLead Of course Keynes went bust   twice   thinking he knew better than the markets ,1,
the market will stay solvent longer than you will stay rational ,2,
 Pinned by TechLead ohh fake channel,4,
 Pinned by TechLead what s this number you sent me too,2,
Well said,2,
What do you think about gold mining stocks  ,2,0
Bitcoin is going sideways  let s be honest  I understand  as a millionaire  you need your click bait,3,0
Investing in Crypto is a lucrative and a big chance to make money online nowadays  ,21,22
How do I get her to help me please,2,
 Paris Herms Try Amanda Hernandez her strategies are really great ,1,
How does this whole Crypto thing work  I m interested in it and I m willing and ready to invest heavily in it but I m gonna need an assistant from any trusted and productive professional,1,
Best comment from my friend was  I don t need BITCOIN  I have a good job   ,1,
1 video    1 life lesson ,1,0
Cabbage hands  XDDDD,1,0
Cardano will push through and stand strong,5,1
ADA all the way,1,
He s so funny,1,0
Brah  Cracking up  Pounding the desk with your diamond hands as your crypto crashes    ,5,0
You keep doing crypto videos  do you have so many views in this topic compared to another one ,1,0
 keyboard,1,0
He has a different keyboard for each video lol,1,2
News is transitory  inflation isn t   In 6 months time  people will be selling their granny and taking out a 2nd mortgage to buy bitcoin ,1,0
El Salvador s official currency is the USD  let that sink in ,73,8
Exactly why they switched to BTC  They had 0 control over money printer,8,
mind s blown,1,
 DeFi Damian I never knew this  I thought they had their own currency  Good info   rep for OG Jin Bling,6,
That isn t new,3,
  that sink in,3,
We re taking crypto deep to the core of the earth lol,6,1
The Netherlands is bs is just one opinion of a person who s misted out on buying btc on 20k  Whatever I think you are really negative and your saying all negatief news whatever we will see      ,1,0
 El Salvatore ,22,2
El Salvatoar,1,
El salvatorrrrr,3,
As much as i enjoy these videos from Techlead  the whole point of Bitcoin is that  because of how it is programmed  one day  there will be no more than 21 millions BTC in circulation  When this happens  the price can only go up  even if the adoption rate is slowed down significantly  I am a stock investor and don t hold any coins  but i am bullish on BTC alone  I do own some shares from Coinbase though  We ll see what happens ,1,0
Although I don t share the same conclusions  I love this sense of humour a thumb up from me ,68,6
 Alberto Foti yuck   Your saying a dollar is legitimate Your just regurgitating whatever indoctrination they did in college  No need to show off debt and gibberish  From what I ve learned there are three requirements  we differ bc your biased as most colleges teach Keynesian BS and not free market stuff   medium of exchange  unit of account  and store of value  Thank you Interest rates and central banks are fundamentally corrupt bro  Check out economics explained video on a world without debt  they explain things pretty well   Also I d appreciate if you explain in layman s terms  as I don t speak the woke unfortunately  Finite currency is great bc it causes deflation and common ppl savings go up in value and ppl live frugally and don t buy the fcking Gucci unless they want it really bad  What happened in 1929 was due to mismanagement from financial institutions by using financial instruments like derivatives ,2,
 Y gen it is actually the opposite  Money needs to be adundant and not scarse at all  If you have limited currency you end up in cyclical crisis like with the gold standard  And these crisis result in millions and millions of unemployed   2008 crisis on the other hand was handled better because a large amount of money was injected in the system by central banks  Without central banks the modern developed world could not be possible  With bitcoin or other cryptos  this 2020 pandemic would have resulted in massive destruction and unemployment  because you can t mine bitcoin instantly in the blockchain circuit of bitcoin  and besides that  it is limited to some millions of unit  And here I am just touching the surface  we didn t even talked about tax collection  economic health analysis of the country  and a lot of other issues in a closed  decentralized method of transactions  You can have a hardware wallet with millions of dollars and you cannot be taxed  You can have millions of dollars in a wallet that gets stolen and you would have no way to retrieve all your life s savings  Cryptos are a religion  but the economists know that the direction is centralized CBDCs  digital currencies  in transparent blockchains  Decentralized pseudo anonymous blockchaines are not viable  let alone a limited currency like bitcoin,4,
 Imran A no they are not currencies  You should study Currency Theory before talking about things you don t know  A currency neeeds to have second moment variance  pretty low  needs a central bank to inject liquidity and control interest rates on this liquidity injection  and needs to be adundant  Bitcoin is not abundant  it is actually finite like gold  And with gold it went really bad  go study the gold standard crisis like 1929  I suggest Monetary History of United States to clear your doubts  because you don t know what you are talking about,1,
Good ,1,0
I broke my my old decrepit desk with my cabbage hands while my cryptos are crashing  I need to buy your desk now ,21,0
  And I thought I was going to be totally rich  until I wasn t  ,309,5
But then I remembered I was an ex Google multi millionaire so I was already rich  The end ,3,
as a multimillionaire,1,
But then I was,2,
 as a millionaire ,3,
Lots say btc will make it to 120k this Christmas  ,1,2
Tech lead  I sold mine and I m the smartest man alive so you should sell yours and be at a loss like I am,62,9
 eckosama It s just strange how he said he sold everything and wants to now buy back in a few days later after the prices goes up ,1,
 badjazy no he is selling his course here  Its just part of how he makes money  He loses alot everytime he enters a new market  I think  because he keeps overthinking everything and then trying to justify his reasoning after selling off ,3,
 BTC Berg I didn t even finish reading his comment lol  It gives me tumors ,2,
 Opressa Era this guy knows nothing and im pretty sure he lives at home with his parents and just shills crap as a   millionaire   if you take this guy serious I feel for you ,1,
 badjazy  Seriously  his last few videos have been bizarre  like  he s making noob mistakes  It s weird ,9,
you can hold and double your loss of course,6,
His advice is terrible  I almost think he is just trolling ,21,
South Korea will not ban crypto,1,0
SHIBA Army worldwide buy and hold for a long term    ,3,2
Make sure you keep those fingers crossed for the next 50 years,4,
You are one smart cookie boy  Tech      keep them coming  bro ,2,1
If Elton John was a keyboard  ,5,0
I just posted a video similar to this earlier today  The only difference between us is that I don t think governments are ready to replace the current cryptos with their own digital currency for a while ,1,1
 So the population of these diamondhanders are thinning out   LMAO  ,64,4
That was my favorite line  These crypto kids aren t going to even notice if they catch the coof  unlike grandma ,3,
If you have been watching his channel  whatever he does  do the opposite,6,1
Thank you for your help in increasing the supply of GPUs in the market  Millions of gamers pray for crypto crash ,3,0
50  of alt coins are scams ,2,1
100   every single one ,1,
Countries will have no choice but to eventually accept crypto  Might take  5  10  15  20 years  but some sort of decentralized non governmental currency will be accepted ,1,2
Dude  after all these Crypto Youtubers who get dumber by the day and deeper into their stupid narrow minded  the elites  narratives  it s good to see  that there are normal people here  too  And thanks for pointing out that you feared inflation back then  This  inflation  scare is ridiculous  As if the people at the Fed have no idea of any of this but every Youtuber knows exactly how economics work  Keep it up man  And maybe just maybe I ll see you in a hostel somewhere  for a beer ,2,0
TechLead lost some weight,1,0
Crypto predictions are the lowest form of youtube content ,1,0
I would love to see how I became broke as a Millionaire,1,0
Such a beautiful keyboard  it has golden teeth    I mean key caps ,9,1
Thank you for your honesty         Just  wish you  be   Happy   and     STAY  Happy  ,2,1
It s half comedy show  Love it,1,1
I m more curious about the new keyboard and mouse  They re slickkkkkkkk ,6,1
Thank you   for being the only guy on YouTube willing to tell the truth about the current crypto market  The climate simply is not the same as it was from one or two years ago but too many people are behaving like buy and hold is still an effective plan to make money in it  So many of these people are just gonna sit there and watch all their gains go right down the toilet ,5,3
I just put money in crypto I believe in like ADA  VET  XRP some which have logical applications  And a few more but I do dolar cost average I put a few hundreds every week or month and I don t really look at the charts all day  It s more like I rather gamble a little with projects I trully believe in than let my money sleep in a bank   ,2,0
In other news  almost ALL banks are gearing up to offer crypto to their clients directly from their bank accounts LMAO  Tech lead  investing is obviously not your thing bro  You just got shook out of all your positions while the institutions are buying hand over fist to offer their clients crypto ,2,0
Thank you for sharing this information with us,5,1
Lol kpop bts will blast btc  They wanna change it to BTS instead of BTC ,1,1
The coin bureau   ,7,0
CFO probably just left because they didn t raise his salary   ,1,1
Loved your plug at 8 51,3,0
first of all commodities and crypto is different  Wtf you just started crypto this year and acting like you in it for years lmao,1,0
Stop making clickbate crypto videos   It s clear you are just here for the add revenue,1,1
This channel is transforming from a tech comedy to a finance comedy channel  But jokes apart I enjoy the way how Techlead presents knowledge with dry humor and sarcasm ,511,18
Same ,1,
Yeah it took me a couple of videos to  get  his humour and appreciate his dry take on things  but I m on board now ,4,
Yeah  I agree  He provides good content with a touch of dry humor  There s a good balance  ,2,
It s not knowledge  just comedy and current news,2,
He s not really presenting knowledge   More like his opinion ,5,
He just mad cause he lost loss of money from it ,9,
I just joined this following  so I only know this as a finance comedy channel  It excels in both categories ,9,
I m scared,1,0
need a guidance on what to buy and when,43,3
This guy can sell anything anyone ,183,8
 Arthur Vasquez  This May Have All HAPPENED Before in History  Research   Tulip Mania ,1,
no he can t,2,
He only sells at the bottom   ,1,
Only if there s someone to buy it  ,3,
Literally he would be a good Ponzi scheme ring leader,9,
 pinnedby Gregory Mannarino Are people still falling for this  ,9,
Cabbage hands  ,1,1
i miss your normal ctuff,4,0
Buy high sell low,4,0
I sold my car to buy crypto to buy that desk because BTC is the future ,4,1
So funny  Yes everything could go haywire but imagine if the oposite happens and lots of countries adopt it  Laws change all the time ,11,3
not gonna happen  there is a possibility of crypto currency for every country though ,1,
Love that xD sold on dip buy on top     3,6,1
At least he sold the top  I trash this dude at times but he is making sense  Hodl is bullshit  95  of btc is owned by 2  of wallets  If you cant figure that out then you are destined to suffer ,2,1
 Crypto    crash    black swan     My man s just juicing that algo now ,24,2
i love your uploads ,5,1
Dude this one has too many advertisements  I will buy the table  the keyboard  sign up with ting mobile  and the high quality fashion statement items living with my parents as a millionaire   ,11,2
I would call riots super spreader events too but hey  depending on who you are talking too it is or it isnt     ,11,1
No it s  CRYPTO NEXT BIG MOVE    THIS IS BAD   BLACK SWAN  CRASH THIS WEEK     AS A MILLIONAIRE ,1,0
Buy high sell low,2,1
All these crypto gurus lol,1,1
finally some truth    tired of these bull tubers always trying to prop up the price cause they re down 50   ,32,8
some truth  he s a fool,1,
 Michel Bruns  possibly buy more  lol   Keep hodling my dear  You ll lose it all ,1,
Either way it s all people drawing triangles on graphs trying to pretend they can predict the future ,2,
Oh I know    they say buy the dip and it tanks day after day   hahahahha   all of em are frauds,1,
It s funny how people insist they ll be flying to the moon after it has already happened  What do you think BTC at 67 000 USD was    Anyone buying at that level was like someone buying GME at   420 per share  Your moon ride already happened  now the prices are going to revert to the mean  which is much closer to zero  for BTC  ,3,
COLOSSAL DUMP TO 17K IMMINNET  AS THE PI CYCLE TOP CONFIRMS BITCOIN TOPPED OUT  SORRY GUYS HER READY,1,1
btc vs invesco ,1,1
As a millionaire  and ex Google ex facebook tech lead  what do you think about Internet Computer ,3,0
Just took this guys financial advice   I lost my wife   dog   cat   gerbils following this guy   ,6,1
Tech lead tryn soooo hard to drop the price of BTC so he can get in on the cheap and make up the losses when he panic sold xD,68,13
 Gianni H Mostly jokes  but he did sell ,1,
Hope so  I d love to buy some BTC under 29 000   ,2,
 Gianni H Not entirely  There are subtle truths ,1,
Damn the number of people in crypto that don t understand market cap is astounding  Reading comments like this make me ultra bearish ,2,
One YouTube channel will never make a dent in a 600 Billion dollar market cap  If BTC goes up or down  it will not be because of this video channel ,10,
 Gianni H dude   are you saying he is joking about the content of his message  Delivering his message in a sarcastical manner  and funny apparently to some  doesn t mean he isn t serious about his message  Don t insult others if you don t get it yourself,16,
