Comment,Likes,Reply Count
If you don t get that these videos are mostly jokes  you don t have the intelligence to be touching anything finance related lol  He s a great troll,13,
He bought on top guys  don t listen to This dude s investment advice   He is for coding ,9,2
 Joe Mama If you think he is trolling then you are a baby ,1,
Pound the desk with your diamond hands as your crypto is crashing LOL,345,12
you mean  rotting cabbages ,2,
This aged well ,1,
Hilarious  ,1,
TechLead 2021   Buy high  sell low ,65,1
Good short,1,
You re just mad you didn t buy into crypto sooner,1,0
Ok boomer,1,0
I just sold my whole crypto portfolio to buy that desk,212,9
I sold my desk and went all in on crypto   ,3,
I only managed to buy the cup only ,1,
 BrodyLuv2 e Toro  Robinhood  Binance US  Uphold  Kraken and so on if you want to Trade in US,1,
 WayShiny 1  There is no  legitimate exchange company s      that is the problem ,4,
I bought a lamp ,4,
Ha  you re lucky you got the desk   The problem is not only the volatility of the coins  but the fact that exchanging it to some other currency is going thru dodgy  unregulated  banks  that more than likely are walking away with your coins  Some people were trying to get out for weeks before getting an email that said  Sorry  sucker  ,5,
My next comment will be at  250 K   Don t delete my comment ,3,3
 farmerfox99 Hope doesn t have much chance but Logic Does ,1,
This is the goofiest technical analysis I have ever seen ,130,15
 Egg I would argue that it s more like a foreign currency than not a currency  at all  It is generally accepted and in use for the exchange of goods and service  Just not by all businesses  and it is not recognized as official within any geographical borders    So it s kind of like owning a bunch of euros  but Europe is in a different dimension that you can t travel to  but that s okay because some businesses still accept it where you are    The core quality of currency is that people can agree on the value and it is commonly exchanged in commerce  I disagree that it s not a currency because you have to exchange it to extract value  1  because of what i just explained  It is generally accepted as a form of payment  and also 2  Tell me how much a Euro is worth  You ll need to express the value with something    like dollars ,2,
I WILL buy Cute Blonde girl with beautiful Body when I get rich with Bitcoin ,2,
YES Just HODL  NON Bitcoin holders  and their families will become our Slaves while we become rich  They will Work to Death  HODL  Bitcoin is Our Religion ,3,
Unless a major establishment accepts crypto freely back and forth as a fungible medium it won t reach it s goal of being a currency   Everyone constantly relays the value back to USD  undermining its ability to be a currency  if you have to exchange for another currency to extract value  you don t have a currency  you have a technology and an outdated one at that   The point being  yes you will likely make money on bitcoin over the short term  but only because of market forces which could disappear at any moment  after all we shouldn t be relying on Keynesian economic theory for something you d supposedly bury in the ground and forget about for 10years ,1,
 hashem chehouri What is the most influential financial development you talking about  Cant be crypto  right  Since its here since 12 years and I still cant do anything with it  Except of hodling and hoping to dump on some new comers ,1,
 Emanuel Schuchart there is a big difference between most commodities and BTC  BTC supply is fixed and most commodity suppliers increase production when things start to get bearish to keep there profits up or the same quarter over quarter  bottom line is this guy doesn t want to see you make money on bitcoin he even said so a few videos ago calling crypto investors lazy  but isn t he the one that still lives at home with his mom and dad lol,2,
Bro he tried selling us the desk  his course  and the keyboard and then shat on the some most influential financial developments that have ever happened  So yes  VERY goofy  ,3,
im here for a desk i can pound with diamonds,2,
 farmerfox99 Bitcoin mining is an insignificant fraction of gold mining s energy usage and an even more insignificant fraction of qlobal banking energy usage ,8,
This is not technical analysis by any definition  its sarcastic fundamental analysis,22,
Someone needs to do a video of a dirty coal plant making power for BC then scale how many are needed to keep it  alive  the visual will show how BC wrecking the planet,2,
 12gaugeAngel did you not listen   He bought commodities because he was scared of inflation after massive money printing  Same simplistic narrative as now ,14,
The rest was goofy  too  Stay in your sarcastically elitist lane ,9,
When he says considerable the way he expresses himself priceless  ,28,0
I think most people are shorting the market currently so a crash will make it rain     lol,1,0
really looking forward to shitcoin going to zero   These fuckers are going to have to get real jobs and contribute to society ,2,1
Cabbage hands ready  ,9,1
Cabbage hands present ,3,0
 Never put all your eggs into one basket     Lebron James,1,1
PONZI Scheme,5,0
