Comment,Likes,Reply Count
   Going to the Moon  Check out MILLION Token  https   milliontoken org ,71,35
BTC just rose above 40K  Nice video btw NOT,1,
i m so addicted to this guy ,1,
 Cryptocurrencies are transparent in their mechanism but private in their use  whereas central bank currencies are opaque in their mechanism and public in their use  ,1,
 Bing Si   do you watch the news   World governments are cracking down on Bitcoin and all other cryptocurrencies because it s a threat to the government s hegemony on currency ,1,
 Really  your best bet hedge against inflation is going to be yourself    That s why I invested in your course ,3,
 New world ODOR Weird economic force em yes he know exactly what to do for YouTube channel income   I do not believe he hates crypto   I guarantee you he is one of the Whale who has massive amount of Bitcoin   ,1,
 i like nice he isn t trying to confuse us  He is trying to appeal with his sarcastic humor to people who apparently find it funny such as yourself and that is working  His message is still the message he wants to convey regardless of the way he is delivering that message ,3,
 New world ODOR Weird economic force em  He knows what he is doing  He IS confusing you   So   yea   mission accomplished   Oh yea   cracking  on folks   too,1,
 Joakim Fridlund        what is crypto          ,1,
I think that crypto is fairly risky   I honestly think that it s going to    but I would say invest with caution ,2,
 smart1 confusion is a sellable commodity too   it seems   did you notice this beautiful beveled desk   that you can pound with your   hands,7,
Best placement for a crypto related ad ever,21,
 Haydenkaur TLGM       I respect your work mate because you are pointing people in the right direction  this is the FOMO August for the incoming dip in September  It is manipulated but that can be a good thing if you understand it  We should all know that when these reports are bullish take some off to the side lines  when news gets bearish start buying   Keep it simple simple  that bear  correction was the best thing that happened me  but all thanks to Hayden Kaur Cobb trade for his amazing skills for help me to earn 7 1 BTC through trading,57,13
I am also growing with Hayden s daily signals    it s a good thing other people are doing same,1,
I ve heard a lot about his trading system in other crypto boards  I can t wait to get my paycheck this week so I can join ,1,
Money is an issue that everyone has for a better and luxurious life  life was hard for me until I started trading bitcoin and am now earning  20 000 per week ,3,0
You re the only one commenting on the bad things happening in crypto ,1,2
Shut it yer too bloody negative   You really need a hooker teach you how to take a compliment    ,1,1
   I admire the efforts u put in your videos mate  digital currencies continues to reshape the world globally  its hard for for anyone going against them these days  though from a trader s perspective i feel we really need more experts in the field updating newbies   lnvesttors on how the community works  crypto currencies are gradually moving towards something big and the price surge over the past few months is just the beginning of greater things to come  lots of persons are skeptical on when to buy in the market and whether it isn t too late to buy an asset  when you re hodling it could be but when trading its never too late to buy  a trader with the right strategy and indicators earns big regardless of market price  bulls or bears   I trade using signals from trade expert Mrs  Susan Bossmann with her guide and signal service i  ve made over 27B TC worth of crypto assets over some months  only for crypto inclined issues    connect her on               Susanbossmann ,210,0
He s hilarious  ,1,1
Well  you called it  ,1,2
Cabbage hands  Lol ,1,2
Oh gosh you were right,2,1
3 years and u cry lol,1,1
Kekw,1,1
greetings from Saigon,1,1
Netherlands wont ban crypto  If you do some research you ll realize its just one guy yelling about it,1,1
another payment of 2btc confirmed just now via the help of bithacoin mining platform they have really been so helpful to me and legit,1,1
When looking at previous reoccurring history of bitcoin  all conditions for the bulls to take full charge has been met but for the lowest band of the bollinger band which is yet to constrict the entire band to signal a sharp upward swing  Indications also show that this is about to happen so  bit will definitely keep rising so its right time to get all in but smartly of course  Its either you are great at it and if not  there are quite a lot of services offering signals  the best to my knowledge being that of Justin Wouter s  a well seasoned trader who has proved his worth  at least to me as i made over 7 btc is a few weeks starting trading his signals with just 2  Justin   Telrgram   wjustin   is very adept in TA and FA as well as analyzing the markets in such a manner that other top traders should emulate,124,7
The restrictions on  US Persons entities  are due to FATCA ,1,1
i just got 0 5btc added to my wallet just now via btc mining done by bithacoin mining platform honestly it is really a satisfying and a profitable platform i am so happy i got to find out about them,1,1
Great context  Everyone needs more than there salary to be financially stable  The best thing to do with your money is to invest it rightly  because money left for saving always end up used with no returns  I started investing in bitcoin mid November 2020 with the help of a well known  professional Mr Brook Fred and the profit entirely funded my recent duplex ,9,8
You failed to mention the CoinGeek  Zurich BSV meeting  ,1,1
This channel gives you crappy analysis  Lol,2,1
He s a fashion statement now    ,1,1
2 38 LOOOOOOOOOL,2,1
hahahahahah diamond hand lol,1,1
Lmao great prediction  Sounds like Somebody is mad they sold their bitcoin,2,1
Lol  excellent  Thanks  ,1,0
why is watching your videos so addictive,1,0
Lol Techlead thanks for another good buying opportunity  Stick to coding  you have 0 understanding of trading ,3,0
 TechLead When did this become a crypto analysis channel  Were your normal videos losing viewers and crypto is topical  To everyone else watching  beware of overly bearish analysis and overly bullish analysis from any YouTube speculator  Its probably unlikely that Bitcoin is going to die now  but remember this is all a game of probability as  no one  knows whats going to happen  My BTC analysis for what its worth  not a lot but I called the 60k top   buy an amount of BTC that you can afford to lose at  11500  Yes it can get that low again  but it will likely fill the gap between 50   54k first  I ve been in this space since 2013 with all the crazy price action that has happened during all the subsequent years ,1,1
This has aged well lol,1,1
TechLead is a pretty reliable counter signal  Next time he buys into BTC  I will be selling ,1,1
Watching TechLead s vids is always a seamless experience ,1,1
This guy wants BTC to get down to 10K so he can invest 50  of his wealth into it  Pure class ,1,1
BTC above 40k today  Guess you are wrong  ,2,1
Hmmm not liking this new crypto bashing attitude from TL ,1,1
This didn t age well lol,2,2
do exactly opposite of what this guy says,1,2
This dude is a marketing genius ,1,2
This guy wishing crypto to crash every week     What s wrong with him    ,1,0
Why did title change change from weekend to week   ,1,0
and then Elon lol,3,1
Just buy bitcoin  HODL   forget about it  If u wanna become a millionaire by 2030  Think ,1,1
Coffee Beans and Rice dont underpin your mortgage or provide you with the internet of the future though  Sadly    Id love an internet made of carbs ,1,1
TechLead tells you what you need to hear instead of what you want to hear  Contrary to popular belief  Patrick has not stopped being a nice guy  He s still helping people by giving advice to those who have lowered their egos enough to listen ,2,2
Holy cow  broke a million subs  That s crazy ,3,1
He might be inspired by Elon Musk    Lol,1,1
I miss the  oh hey I didn t see you there  intro  ,2,1
You forgot  as a millionaire  in your title,3,1
The only BLACK swan   is the AMC short squeeze event   apestogetherstrong,2,1
i love your marketing skill xD,1,1
So from what I gather  its bitcoin to the moon  ,4,1
Bitcoin is not going anywhere next 5 years     but in the long term it s a definite buy,1,1
         ,1,1
Thanks  Just sold my crypto,1,1
Because of the economic crisis and the rate of unemployment now is the best time to invest and make money  ,1,43
Trading on your own is very risky I ve lost Alot trading for myself,1,
 Ana wilson  Thanks for info  i will get to him right away,1,
How do i contact Mr Alexander sean ,1,
Trading crypto with Expert Alexander sean  has been a game changer for me,1,
His success story are everywhere  ,1,
he s obviously the best i invested 2000USD with him and in 9 days I made profit 9101USD,1,
he has really made a good name for himself,1,
 Lasbury donald Yeah s it,1,
 Donald albert I heard his trading strategies are really good,1,
I wanted to trade crypto but got confused by the fluctuations in price,1,
Buy gold and crypto,1,
Crypto is the future  ,1,
 Ace lawson This could be the wisest word I ve heard you got my points  ,1,
 Ace lawson Accurately spoken  ,1,
Cryptocurrency investment is here to stay if you can t see that at this point  it s time you learn more about it,1,
Investing in crypto currency is one of the best chance of making money  ,1,
Exactly    nice words,1,
Damn dude your a hater     someone butt hurt   Lol,1,1
This video didnt age well,1,1
HELL YEAH WERE GOING TO THE MOOONNNNN         ,4,1
Unofficial crypto bear king of YT         You should have a debate with George from CryptosRUS  You each sometimes use the same articles as your evidence in vids but have completely OPPOSITE perspectives ,1,1
So should we buy Bitcoin now because it is going up ,1,1
People will be kicking themselves in few weeks if they miss the opportunity to buy and invest in Crypto as it s retracing    BE WISE,19,6
check this out    BITCOIN ETHEREUM CARDANO DOGE AGIX     YouTube,1,1
Thumb nail really got me  Couldn t deny not to click  Really serious face of TechLead ,1,1
Bitcoin is over  56 000 and counting investing in it now is a very lucrative way of making profits  sleep on it  don t just buy and hold bitcoin  Trade it,25,23
As far as I m concerned your opinions on crypto should be disregarded  You ve already admitted that you want to see crypto fail  Your analysis is therefore extremely biased and none of your opinions should be seen as objective ,1,1
Keyboard is dope  mouse is cringe,1,0
Oof,1,1
That seamless transition to techinterviewpro though,2,1
This channel should be renamed to PaperHands,2,1
Both Tesla and Microsystems invested  1 5B ea    what strike point ,1,1
Tesla is only up because of its crypto Holdings specifically BTC,1,1
Watching this on 2x speed   ,1,1
garbage video,1,1
is that true  Im honestly not surprised,1,
Yea  listen to a guy who  buys high sells low   His  TA  should be precised ,2,1
Could Be History Repeating Itself  Research   Tulip Mania ,5,1
Research WHAT Happened with   Tulip  Mania    Tulips were once worth FAR More Than Gold   UNTIL They Weren t ,1,1
  And I thought I was going to be totally rich  until I wasn t  ,4,0
I have  been thinking if I could start up and Investment on crypto now that the market is so low  But what I m scared of is if the market will still automatically crash more   ,2,22
 I m a fashion statement  right here  XD,1,1
I was crying with laughter     this guy is better than Benny Hill  Borat  and Monty Python  Classic comedy ,2,1
 Rotting Cabbage hands  LMFAO     Love your content ,6,1
The fed was able to juke the public and pretend we had sound currency after 2008  It depends how much longer the fed can fool people with be new currency units printed ,1,1
Yep  We are in for a long bear market   definitely a few months at a minimum  They rigged the market and took all the gains ,1,1
El salvador not El salvater,1,1
The rich see s economy crisis as a garage sale  that s why investing right now will be the best decision,3,17
 I was making more than the President   hahahaha epic  ,15,1
TechLead  as someone who works in finance  I have to say you might actually be the worst investor I have ever seen,22,10
you never met my sister,1,
 eckosama He s reading the news and noticing trends and patterns  Pay attention  because if Tether is a ponzi being used to buy up bitcoin  what do you think is gonna happen when they decide to dump  On top of the banning you re seeing signs of a collapse  Legacy Finance is laughing at this while ppl are saying  nah it ll be fine  ,2,
I think he keeps reading news and not about how markets work,5,
 I must say  Bitcoin s price action has been fluctuated throughout the past few days and weeks  with bulls and bears both reaching a clear impasse  the aggregated cryptocurrency market has been following in Bitcoin s lead and is struggling to garner any decisive momentum  One analyst is now noting that BTC has been holding above a key macro level throughout the past few months  He believes that the recent consolidation above this level bodes well for its near term outlook and could indicate that significantly further upside is imminent in the weeks and months ahead  Tips like this are why it s advisable for investors and newbies to trade with the help of pro traders like Rick Richard  He is always one step ahead of other traders  he fully monitored all my trades to avoid me making mistakes and losing my money  My earnings have increased drastically from 1 01 BTC to 6 700 BTC in just 4 weeks using his strategy  You can easily get hold of him for a profitable system on TE LE GRAM   rickrichardcrypto    ,1,4
 They re very sturdy so you can pound them with your diamond hands as your cryptos are crashing    10 10 sale pitch,5,1
Look at these 440 crypto bag holders LOL,1,1
compares Bitcoin bottom to a Gold peak lol what a joke channel,1,1
Great video  I m just subscribed   A super smart tech lead who has a genuine  honest and quite funny videos is RARE   I ve been in software for years most developers are  monotone  talks overly technical   introvert and either arrogant or super humble  The leads are bit more social  Thanks hehe nice promo for that funny keyboard  ,1,1
YOU HAVE A GUY POSING AS YOU GIVING OUT A NUMBER   Thumbs this up so he sees this please  Thanks  All caps  he ll see it   ,1,1
With the current  market trends  investing now will be the wisest choice you d ever make as it will skyrocket soon after the plummeting  People will be kicking themselves in regrets in few weeks if they miss the opportunity to buy and invest in crypto,24,35
 Brenda Myers Yes of course  Expert CHRIS ROGERS has an intellectual strategy that cut down losses  I got the best investing help with the aid of Chris  He s friendly and easy to get along with in terms of signals and investing tips ,1,
No doubt  Chris Rogers is the most trusted to Start an investment with ,3,
I met Mr Chris Rogers last year for the first time at a conference in Manchester  I invested  25 000 and traded in one month making close to  143 670,2,
 Nate Gudjohnsen  Wow   I m amazed you mentioned Chris Rogers trading services   I actually thought I was the only beneficiary of his trading Expertise   He s my portfolio Manager too,1,
Crypto is the future   My advice to anyone right now is to secure a good investment in digital assets like cryptocurrencies,1,
That s correct  Investing in Crypto now is very wise especially with the current DIP in the market now  I bought the dip  ,6,
 But you re not here for the desk  Are you  Or are you    ,2,1
You have the best sense of humor of any YouTuber out there  You crack me up  ,8,1
I d love to see Andrei Jikh do a reaction to this ,1,1
  I was making more than the president    Humble TechLead,8,3
Even with 10  to the  big man  ,2,
   ,1,
 super spreader event      get real man  stop watching the mainstream media  it s making your brain into mush ,1,1
Countries are banning crypto because of the upcoming high inflation that they made by printing money  They are afraid of people abandoning their currencies and triggering hyperinflation ,1,2
the big difference with BTC and other commodities is as commodities like copper and iron go down in value miners produce more to off set the falling prices  yet  bitcoin production is fixed  again this guy is a tool and doesn t want to see you make money he even said so a few videos ago  on top of that I think he lives at home with his parents lmao,1,1
Summer is here again with the restriction of movement and recess to be enjoyed by most workers  It s an opportunity to utilize and redirect this funds into life changing investments as to secure financial sustainability  ,38,33
That keyboard makes me nauseous,1,1
Btc is here to stay guys,1,1
Anyone agrees that this channel has now become Crypto Tech Lead  Smash    ,1,1
I almost forgot about the core of the Earth  Thanks for reminding me ,4,2
Hodl and get Seek Hash miner and you will thank yourself,61,1
Investing in crypto is a more lucrative way of making money,12,17
Lol bots   ,1,
Absolutely right   I got 70  of my total portfolio in crypto and I have been making good profits,1,
I like how TechLead uses different keyboard for each videos    ,1,1
Tech lead  coffee taste much better with milk I promise  ,1,1
Having starting up to trades binary options hasn t been easy but though it s ended up been successful for me cause I meet the right account manager mr mattieu Gregory I have gotten hugely Earns in 12 hours of explicit trades,30,17
Crypto is haram  so basically don t invest ,1,2
Man your are so cool    that s mean cryptocurrency aren t coming back   ,1,1
 sigh   Headline   Dutch official calls for a complete ban on Bitcoin     one Dutch official argued  one   ONE Techlead interpretation   Netherlands calling for a complete ban on Crypto ,8,14
  Richard Bloemenkamp   There is a limitation to cryptocurrency for international transactions  Cryptocurrency is inherently slow due to the nature of blockchain   A person might have a hard time understanding this if that he she never took an intro to computer science or data structures course in university  but blockchain is essentially a linked list    In computer science  we say that linked lists take O n  time  Technically  blockchains are slower than linked lists because of the hash function used for each node in the blockchain  but we do not typically count that  So  as far as a computer scientist is concerned  a blockchain is  as  slow as a linked list  but actually  it is a little bit slower  but we are not counting constant time    One can contrast this with fiat currency  which we say takes O 1   which is constant time which means that it is instantaneous    O 1  is no time  as far as a human being is concerned     Many people cite how slow wire transactions take  but that is due to human interaction in the process   Another example is credit or debit card transactions  where it takes few seconds for card transactions to clear  but that is due to network bandwidth   However  blockchain transactions would require the few seconds of network communication  plus the time to traverse the blockchain and calculate two harsh functions per block in the chain   A few seconds is much faster than 30 minutes to an hour   Nevertheless  the beauty part of cryptocurrency is the democratization of money   Bitcoin and most other cryptocurrencies provide a monetary system that is entirely transparent to the world while maintaining high degrees of anonymity for its participants   The inner workings of traditional money systems  on the other hand  are kept secret from the public  but their banks and governments track participants  transactions in these monetary systems     The inherent slowness in cryptocurrency is exactly why transactions within these digital monetary systems are trusted   Central Bank Digital Currencies are not cryptocurrencies but are fiat currency but entirely in digital form   So  that way  central banks and national governments no longer have to bother with printing physical money   This isn t a situation that the normal person wants  but  unfortunately  governments around the world are working to shutdown Bitcoin and other cryptocurrencies and replace it with their own digital currencies ,1,
 UC2Q aFMZVzyoc cNLLlAJEw I m not very knowledgable on the subject  but anybody who is afraid of of the money press can buy stocks  real estate  commodities  gold and other metals at any moment  I don t see why you would need crypto currencies for that  World depth is indeed held for a large part in dollars and the US can theoretically  and backup with military if needed  print dollars to reduce depth  But those are existing depths  part of the past  If oil is becoming less important and Asian economies are strengthening further  there will come a point where foreign countries will no longer accept dollars for their work and goods and especially no long term loans in dollars unless there are good conditions  e g  high interest  guaranteed military protection  other    I do see the value of crypto currency for international transactions and trade ,1,
 Liars Paradox I think quite a few people agree that the banking sector and its ties with the governments are a problem and that the salaries they give themselves are totally undeserved and require and intervention  As such an independent parallel distributed financial system might a good thing  However this new crypto system appears to have some issues too  On one side I m not interested that the government bails out risk taking banks with tax money or by printing money  on the other hand I m also not interested in large hordes of people going bankrupt because they gambled that crypto would go up in value  In the latter case  in the end  that will require government intervention as well  which will again be paid with tax money or the money printer  BTW I have no idea what this has to do with Marxism or monetary theory ,1,
 ALL  governments are turning on cryptocurrency because crypto is a threat to  Marxist   Modern Monetary Theory  where it states that governments can        because the people don t get a choice     Richard Bloemenkamp   Satoshi Nakamoto created Bitcoin in response to Modern Monetary Theory  MMT    MMT has been around since Richard Nixon took the US dollar off the gold standard  Since then  all currencies are backed by the US dollar  backed by faith in the US government    This phenomenon then gave birth to Modern Monetary Theory presented by left wing economists in the US as a solution for funding government projects   MMT states that a country cannot default on debt denominated in its own currency  Therefore  that budget deficit is irrelevant because sovereign currency issuing governments can always print more money       Modern Monetary Theory describes the system that most countries live under and have lived under since 1971   Governments have been steadily growing debt to GDP  and that ceiling has been guarded poorly by fiscal conservatives  In America  however  the primary camps of Republicans and Democrats are united in determination to spend trillions more than revenue takes in  Thereby taking MMT to unprecedented new extremes      The widening gap of wealth that you have seen recently is due to Modern Monetary Theory   Bitcoin was created in response to this   Bitcoin is the antitheses to MMT s thesis   Cryptocurrency provides an alternative to fiat currency      The governments of developed countries have not addressed the public s concern of rising levels of total and government debt  prolonged fiscal deficits  ultra loose monetary policies  skepticism about politicians  and other relevant decision makers  abilities and intentions  and economic growth  Moreover  since the 2008 financial crisis  the fragility and instability of the developed nations  economic systems have increased since then        Consequently  market participants will seek to preserve their wealth by avoiding domestic monetary instruments and foreign currencies and  instead  seeking shelter in cryptocurrency    As more and more people drop paper currency  a deadly inflation spiral will continue   Further cryptocurrency investment will further fuel inflation and continue a negative feedback loop that makes the problem increasingly unmanageable ,3,
TechLead is the bomb   He covers the most salient topics for techies and 2 sigma types ,2,2
If miami crypto conference superspreader event kills whales then their accounts will become inactive,1,1
Banning crypto makes it more of a commodity  same as drug wars drive prices up,1,1
Crypto on sale  ,1,1
I love watching these bearish videos still holding though  If it goes to zero  I didnt lose  I gained a lot of knowledge  Wont hurt me just my feelings lol ,16,0
Ada going to  30,2,1
Techlead using Yahoo Finance like a pro  meanwhile I had forgotten that Yahoo even existed ,24,0
Totally Classic   I nearly broke my stearing wheel  but my desk survived cause it s a 2 inch solid slab of wood ,2,0
Predicting future  as a milionare,1,1
You could pound the desk with diamond hands while crypto is crashing      ,1,1
 This desk is so sturdy that you can pump them with your diamond hands as your cryptos are crushing     awesome line tho,30,1
I ve always wanted a mouse that looks like a container of luxurious hand cream,9,1
I can see it and I love it  If you look at the weekly money flow indicator   it s really showing that the bear market is coming,1,2
 pound it with your diamond hands as your cryptos are crashing ,3,1
I always appreciate both sides of an argument ,5,1
I am from Thailand   I think our SEC has just became a meme ,1,1
