Comment,Likes,Reply Count
The purpose of this assignment is to practice OOP with Decisions  Loops  Arrays and ArrayList    Input Output Files  and Constructing Objects and Classes  Create a NetBeans project named   HW2 YourId  Develop classes for the required solutions    Important  Apply good programming practices      Provide API documentation comments for your class s   class constructor s  and method s    using the Java standard form for documentation comments discussed in this course      Use meaningful variable and constant names      Show your name  university id and section number as a comment at the start of each class     Submit to Moodle the compressed file of your project with name  HW2 yourID  along with   a PDF file that contains all your code      Problem    Bugs are simple creatures that only know how to walk towards other bugs  Bugs maintain   information about their  x  y  position  by which it can tell if they are standing next to other bugs   Watch the following video  bug movement   Create a java project that simulate bugs movement  You need to write a class  Bug  that models a   bug moving along a straight line and it can turn to change its direction counterclockwise  i e  90   degree to the left  north   west   south   east   north   In each move  its position changes by   one unit in the current direction  Details of the  Bug  class is described below   Your simulator should read information of an unknown number of  Bug  objects from an input   file called  Bugs txt   Each line represents a bug and the initial position and facing direction of this  particular bug  Keeping the first bug position as a reference the simulator should move the second   bug next to the first bug forming a cluster and its final position and direction should be stored into   a list  The simulator should then read the third bug and moves it towards either the first or the   second bug  then add its information to the list  The consequent bugs should move next to any bug   in the list  i e  randomly selected   as soon as it join the cluster its information should be stored in   the list  This process should continue until no bugs remain  Notice that at the end each bug has its   unique position  i e  no two bugs can stand at exactly the same  x  y  position  When a bug starts   moving  the simulator should randomly select its path vertically or horizontally towards the cluster    This results different possible bug cluster shapes each time you run the simulator  See the figure 1   below as an example of bug movement simulator resulting a cluster   Original positions Possible Cluster sample 1 Possible Cluster sample 22  Figure 1 Example of bug movement simulator forming a cluster  As soon as the final cluster is formed  your program should display the details of the bug available in   the simulator in an output file  BugsSimulator txt   Figure 2 and 3 shows a sample input file and the   corresponding possible output files forming different clusters      Bug Class  a bug has a code  original location at a point with integer coordinates  faces north  east    south  or west and keeps a record of all its current movement position  The class generate a unique   code for each new  bug  object created starting with value  b 100   It also includes the following   methods     A default constructor that initializes bug s code to  b xxx   where  xxx  is the next code   sequence number in the class  positions to  0 0   and direction to WEST     A constructor that is given bug s information  starting location  facing direction and generates  bug code similarly to the default constructor     Accessor methods to access all the instance variables and the simulated movements of the   bug     Mutator methods that change the instance variables to given values and they make the change   for only suitable values     turn method that changes the direction of the bug counterclockwise     move method that moves the bug by one unit in the direction it is facing,1,1
just goes to show you money is the root of all evil    a true successful man is one that has a successful family  ,1,0
Plot twist   He is still married and living with his wife  this is an experiment ,35,3
 asdrubale bisanziohe worked for google you can see his certificate on LinkedIn too,1,
Letting other hikers past when you re slow is just common sense brah,20,2
It s a courtesy that is good for both parties  You get to move at your own pace ,5,
She never loved you she loved what you provided she saw a sucker and you proved her wrong haha,3,1
 You may not be jealous of Bill Gates  Steve Jobs  or myself     Such humbleness and narcissism in the same moment ,1163,45
 Opal Tometi BLM CEO you re a guy  i thought you were a girl lol,1,
 D Ttradude you are showing your age   He is not just a coder   He is a FAANG tech lead at two companies   The million YT subs are a RESULT of his success   No graphics  pranks  celebs gossip  money give aways  politics  etc  and a million subs    And he has LOYAL SUBS   The  thing speaks for itself   Dude get out of your feelings and understand how metrics work    Certain people don t have to look for jobs or send out resumes    This man is one of them ,2,
 D Ttra  you confused bro  The world has changed p  and fast   He got HIRED at FB and GOOG  and was a lead at that   I don t think you can comprehend how many WELL PAID people around the world would kill to have that on their resume  Again  that is SUPERIOR to having a Harvard STANFORD or MIT degree TODAY    If you are not in the tech fields  you would never understand   This man is asked to interview  he could consult anywhere    Any start up would kill to put him and his credentials on their website  He could teach at 90  of US colleges just with those credentials   He has been where people are paying  60 000 a year for a 4 her college degree dream of going    He then built a 1 million sub yt following with his wit   It is what it is  It s all about FAANG dude ,2,
 D Ttra  actually  Techlead is the stuff    In 2021  being a former software tech lead at Google and Facebook  is  bIGGER than a Harvard and MIT college degree   Now he has used his dry sense of humor to have 1 million yt followers   Techlead is that rare    The WORLD wants to be In Silicon VAlley   He is obviously not Gates or Jobs  but he is not coloring his hair and doing pranks for 1 million followers   Dude is beyond rare ,1,
especially when just 2  minute ago  1 57 he spends a whole 2 minute describing how he is the  final boss  that everybody is just so fixated on defeating because he is young and successful  he considers himself successful because he s a millionaire I don t know how trillionaires are gonna have to consider themselves as LOL    Has it ever occurred to him that the reason why everybody is supposedly  fixated  on destroying him is just because he is just not pleasant to be with   And in reality  he needs to get his head out of the cloud to realize that  just like he doesn t give a s    about others  nobody gives a s    about him   Nobody really wants to spend the time and energy to want to  destroy  him   People just don t care about him and that of course leaves him actually incredibly lonely so he actually wants to provoke others like what he does in majority of his videos  LOL  He s the one who wants to compete with others and defeat others otherwise his life is boring and no fun   Of course he doesn t realize that   Oh well at least he s entertaining   LOL,1,
I liked how he slipped the comparison in ,1,
 Opal Tometi BLM CEO yes he s not up there  he is way beyond them,2,
 Opal Tometi BLM CEO he knows exactly where he is  He s just joking about things  to make it more light ,2,
  SuperAvocado 2,1,
 redsox fan With you on trump  However  tech progress that Jobs brought was coming regardless  the difference was that had it been led by engineers  it would have elevated users  An example I also like to use against minimalism is music production software  People tend to reach for the easiest tools when doing things but geniuses tend to reach beyond their first instinct of what s easy  and so the more minimalist the software  the more everybody s music starts to sound the same  To elevate people  there s no way around making them constantly learn new vocabulary and guiding them to reach further  This is important human potential even for grandma s phone that she just uses to check email and doesn t care about the  extras  like where files are stored  I use vocabulary here metaphorically  because if we applied the same example to language and gave you 5 letters instead of 26  your limited words will mean everybody speaks the same  we re seeing it by the way with censorship and enforced corporate speak    My rant doesn t mean that software or hardware should be messy  What people should focus on as opposed to minimalism is space  The more space you have to fill in ideas  like the tracks or midi areas of music software   the higher you ll reach to fill it ,1,
 JFrame you present the cons  yet skip the pros   Windows transformed business   People who had no idea how to work with computers were not totally functional    And  Apple  it s impact on society  it s ease of use  is one of the reasons it is the de facto standards of musicians and artists   To allow  On computer persons to work without knowing anything re computers were huge transitions   Yes  I despise alleles vertical integration model and know Jobs took credit for EVERYTHING   BUT  LIKE trump   I know a bad comparison   he got the job done   Trump had America talking about issues NO PRIOR PRESIDENT DARED DISCUSS  even with his massive flaws and corruption   Jobs PRODUCED  It s just that simple ,2,
 JFrame And how many people you think Gates and Jobs helped ,1,
 JFrame yah and he s not even close to being as rich as them   lol,1,
  redsox fan In Gates  case  stepping over people and elite favor trades  I understand why that built his empire  In Jobs  case  ruining all of technology with a cancerous business model that holds back progress  and that others end up copying  leaving us with no user centric devices and a crippling over simplification of vocabulary in how people communicate with technology  that is far too many eggs  It s devolution of humanity ,2,
 Johnny Nolen btw what illogical thinking was going on in your brain when you labeled me a cry baby   what makes you think im not a millionare   let me tell you   my life is way better then his life    and i know how to attract women to fall in love with ME    not use me for my money  ,2,
 Opal Tometi BLM CEO you shouldn t have internet access or follow tech lead  Crybabies aren t welcome,10,
he s comparing himself with bill gates and steve jobs  WOW    he s think s he s up there     which is why he s NOT up there   ,5,
This is pushing to the level of poetry ,9,
Tech lead really is quite funny you got to catch his stuff   ,13,
 JFrame got to break some eggs to make omelletes ,11,
Considering how many lives gates and jobs ruined  it is pretty humble to put himself on that boat ,16,
He must have studied the humblest person pewds  Maybe ,5,
Those guys were just simple coders never a Techlead ,85,
 Hell is you seeing who you could have become  wow great quote  TL getting raw in this one,2,0
1  Stop worrying about that woman  You can find another her    She can t find another you  Bet   2  If you re around people who are intimidated by your success  It s time for YOU to take accountability and find a circle of wealthier people  That will eliminate that altogether ,1,0
The irony is that people focus on money and never makes them happy  This guy is a perfect example,16,9
 Luminous Mind Games techlead channel is about whatever techlead feels like talking about  because techlead is more important than whatever may be happening elsewhere ,2,
 fuhk  and yet you would say I came to his page  TechLead  to learn about something he wasn t teaching  tech    That is asinine  This is a circular debate  You re in your feelings like this guy which explains why you re here and I no longer am   I ll give you the last word ma am ,1,
 fuhk  So you re telling me none of his videos are about tech  You sure that s argument you want to go with ,1,
 fuhk  I came to the  TechLead  to learn about tech  Clearly that s asking too much lol You girls enjoy the drama and relationship talk  I m good,1,
 Luminous Mind Games Less and less about tech  You realize he got so much notoriety due to his relationship  not tech  If anything  his channel is about relationships and he also speaks about tech ,1,
 Tucker Stewart  Definitely over my head but since you re super smart  maybe you could clarify for us all what his channel  TechLead  is about  Technology  money  or his crumbling family life playing out in ever increasing videos that have less and less to do with tech   Please speak in simple terms as I am not as smart as you,4,
Thats kinda the whole point of his channel  Whoosh ,1,
  It s probably not worth your time and effort to compete with people in your local vicinity  because they re probably losers anyway  and if anything  you should compete with me  in which case you probably already lost      The TechLead,581,22
 Amy Horton Feminist Blogger this Karen seems to be throwing a tantrum and losing her faecal matter       ,1,
 MansionCapital by the amount of sponsors he puts in his videos  I seriously doubt he is a millionaire tho     a  thousandier   maybe   ,1,
 Ria Zam you have a victim mindset and that s why you will always fail  Wishing on others downfall is a poor people sport ,1,
Game recognises game  This man is the most humble savage I ve ever come across ,2,
The TechChad,1,
This is the best part of the video ,2,
If I could somehow come up with this quote I will definitely become a millionaire,3,
so you have chosen death   ,1,
i really want to see his divorce trial  him explaining this  all vid  to a judge      and finally meeting his demise     as a millionaire    not cuz he is not right but cuz the way he puts it   ,2,
This quote is golden ,39,
This guy cracks me up  Love it   Compete against me  in which case you already lost  lol,55,0
The best thing you can do for everyone involved  ex wife  kids      after your divorce  is to take care of your own happiness ,10,1
I love having to distinguish his bits of wisdom from sarcasm,113,0
People often failed when they couldn t be able to overcome a worst state of their own emotion       if you can control your feeling and drive into the right way   you ll be easily able to control your life     ,2,0
Next video title   What air I breathe  as a millionaire ,1,0
In one word  envy  This disease is at epidemic levels in this world where people with no talent believe they should be on top and possess all the power in a relationship ,21,1
Yes  people    Aka   women  90  of the time,3,
Why can t people just love everyone  Simple  I m still in my early 20s but something I have realized is that people are generally selfish and want to get something from their association with you  Your parents are truly the only people that will ever love you for who you are  if you happen to be lucky enough to have a stable and positive family life  ,9,3
As a mom of a person of your age  this is unfortunately true  If your family members truly love you  hang on to that,1,
Sometimes even they love you as far their agenda is concerned,1,
Pretty much,1,
Haha    you DIDN T ruin her life  Everybody is responsible for their own happiness  It s just a convenient way to make someone else responsible for her own shortcomings ,1,0
I totally get it except for the ex wife part  Once a woman has children with a man and she s no longer with him  her life is ruined  no other man will ever want to be with her again ,31,11
 Amy Horton Feminist Blogger Aren t you all supposed to be independent  why do you need this man s money   Seems like independent is like a magic spells to get what you want for you women  You scream independent when it suits  and you need help when it suits  you have no standards ,2,
 Profitglutton Men s sperm does not have the same genetic viability it does in your 20 s than it does when you re 60   Chances of genetic defects go up with men too  it s just much later in life ,2,
 61raindrops what is the end of a man s fertility  Is there proof of this so called end ,1,
Agree  I ve seen hundreds of men posting YouTube video like  stay away from single mothers   There s a reason why  smart middle class  wait til their peak of earning power to get married  and wait til the end of their fertility to have kids ,14,
You underestimate the thirst of simps,26,
you mean his life is ruined,4,
I like your confidence  Keep it up    We live only once ,1,0
Monetizing your wife s public shaming like a true millionaire,200,5
Chad move,2,
millionaire moves only   ,3,
She probably receive alimony  from him  She should be of any use ,4,
A good way to make money    I approve    ,7,
Lol,8,
I m a 26 y o watching this to get some tips about life   and how I should be treating my future husband       ,29,15
 Ray yep   At least tried   I was given no say so ,1,
 CalicoCooperFan It would have been nice if she said she wasn t happy and needed to work things out first ,1,
Kevin Samuels is who you should be watching,1,
 CalicoCooperFan Well  that s life  Some people are damn lucky and some are so so  But I don t wanna be negative about things  I should give it a try at least    Worst case scenario  I ll be a single again  or maybe I ll get married again  One thing is for sure  I won t stuck myself with someone who just let the marriage broken    Btw  thanks for wishing me luck   ,2,
 Jody Atienza It takes two people to get get married   It only takes one person to end a marriage ,5,
 Jody Atienza Everybody enters marriage with the best intentions  My ex and I were married for 14 years and together for 17   2 young kids   She had an affair and divorced me   I never saw it coming   We weren t arguing   There was no abuse or substance abuse   Our combined incomes were around  225k and I received another promotion just before the divorce   I couldn t get her to go to therapy   I wish you the best of luck ,9,
watch Kevin Samuels Youtube videos,3,
 caminante That s the thing  there s another 50   ,1,
 caminante When couples have  200k  annual income that number drops to 20   You can fall in love with a rich man as easily as one can fall in love with a poor man  may as well fall for someone with money  That s what my grandma says anyways ,4,
 Jody Atienza 50  of marriages end in divorced so most likely ,9,
Future ex husband   ,18,
Bezos need to learn from Techlead   Virgin Bezos v s Chad TECHLEAD,2,0
never clicked on a video so fast     love the title ,4,0
Maybe we all need to listen to others  find out what their interests are  show some interests in their interests and not try to one up others or always dominate conversations ,1,0
WOW  Thank you for describing how other people have been treating me  I may not be the final boss  but I m definitely someone to hate   apparently     sigh   My therapists says my actions and presence creates a  power dynamic  because I m so awesome  lol ,1,1
you know it is serious when the quick pause is actually quick ,2,0
he reached a new low,1,0
Techlead is visiting Japan to see his son  and he happened to meet his ex wife too and she told him  you ruined my life  ,7,1
Alternative 1  This guy is the final boss  SuperNarcissist Alternative 2  This channel is the biggest troll channel on Youtube ,3,0
 I m an easy person to hate   Hahaha   I can relate  ,110,0
4 11 Why would wife or girlfriend or sibling treat stranger better than family  if they treat stranger nice  they may have something to gain  If they treat the family nice  they have nothing extra to gain    it is the same  money will be wired into my account   Pity  the world might be according to benefits or loss by some people  Some people are like that  some people are not  but the people who are not  are sometimes viewed as  idiots  by the pragmatic people ,2,0
when u successful they tell u to be  humble  around them  its because you take their prestige and they get intimidated by that  if they were in ur shoes they would ve done the same thing as u  that s why they let u feel bad about urself for being successful its because it hurts their ego,23,0
Just never get married  I m exhausted just hearing about it ,426,33
 Vaquera Soto never lived with the in laws that s insane  Two relationships is expected to collide in the same household  Me I would do anything to find our own place no matter what ,3,
 Vaquera Soto Actually i do know how she behaved  He said so in this video  She never treated his parents kindly even though they were good with her   If you actually saw the video you claim to see you would ve known  Also  it s funny how women call men  mammas boy  yet expect their own sons  assuming they become a mother  to behave in the same way   Also what has you being hispanic got to do with anything  The dude is American  You can be from the streets of nigeria for all i care ,2,
 Riyansh Biswas you don t know how she behaved  Yeah  I m blaming him because he stated that in his video  I m going to go with what I ve heard from him and not assume anything else like you are doing  Go watch that video  My word  I m Hispanic  So stop assuming ,6,
 teaCupkk have you heard his video where he talks about how his mother who they lived with came against his wife all the time and he did nothing about it but tell her to do as his mother says  There s more to this story ,7,
nah  i dont buy    you gotta pick the right person    prob is most pple pretend and then it falls apart,2,
 Vaquera Soto lol  Mommy will love you unconditionally and there is only one  farming tools will always be there ,3,
Marriage is the best thing that ever happened,2,
 Riyansh Biswas Between blaming him for everything and  kidnapping their child  I think it s safe to say wifey was rotten to the core  Sure  we only get to hear his side of the story  but knowing women today  it sounds quite plausible ,5,
 Vaquera Soto Maybe instead of blaming the dude  you could ve said it was the responsibility of the wife to make things work  Not everyone like the American lifestyle where everyone lives separately  Maybe some people like a joint family  But not  the wife just left instead of putting in the effort to make the marriage work  If she will just be with him if all things are fine and rosy  then she s the problem  not him ,8,
Do not marry someone like him who moved his wife and child into his parents house when the mother in law doesn t like his wife  Common sense such a move will affect your marriage  He s a momma s boy ,10,
 Mumin Marriage and a partner are two wholly different things  Conflating the two is often painful and expensive these days ,4,
for sure u wud have to sacrifice adjustments on a lot of things    but i guess for some    its really worth it  without a partner wudnt old age be very lonely  ,2,
 Kristian Schmidt Underrated comment ,1,
As a woman  I concur ,5,
Just never get married  as a millionaire   I m exhausted just hearing about it ,4,
I m married and I have a great life  In fact if it wasnt for her  I probably wouldnt be as successful and I m now  srs ,18,
We can marry  but it s potentially very expensive  It may require doing tit for tat and be willing to burn down the house  because that is what it takes to make some women sane  that you mirror their insanity ,7,
With the right person it s a good idea  with the wrong person it s a bad idea,18,
Get married to a Millionaire,5,
Yep  Even friendships are problematic these days ,19,
as soon as I began think about this  marriage  thing a couple of years ago  I never heard once a positive thing about it  friends and strangers alike  it sincerely became a phobia for me,37,
 Mohamed Abdalnaem watch how you get divorced lol,13,
 Ralph B i feel sorry for laughing hard at your misery,17,
Yep ruined my life as well  as a non millionair ,70,
I agree mate,22,
Techlead   Dog  as a millionaire ,1,0
so you re saying your wife was like a dog,1,0
 I am their hell  hahahhahaha I will use that line ,13,0
Maybe I should stay single ,2,0
Making even more money after ruining my wife s life  as a millionaire  by talking about it ,12,0
I think marriage is about finding a good match  I don t believe there s value in struggling in a relationship  I believe there is value in finding a good match where people get each other and things just flow smoothly  I think we should struggle on more important things  like improving the world  Spending a lifetime arguing with someone as if somehow we re  growing  in some profound sense doesn t sound appealing to me at all  When I argue I don t find I learn much  When I spend hours and hours reflecting on my behavior  I don t find that either  I only find that I m evolving when I m actually grabbing books and acquiring knowledge  or improving on skills  like social skills  art skills  engineering  and so on  But marrying someone who just doesn t fit with me seems like a major waste of time and energy  Life can be wonderful if we avoid the dumb pitfalls ,1,1
1  Is it necessary to put as a  millionaire everywhere   Also he feels promoting is more important  And this is what is called business,1,0
That divorce was the best thing that ever happened to you,768,26
 CodeThatTalks you re only hearing the story from this guy and he s a weirdo u actually believe him  I support his wife she s doing a great job,1,
 Nik s One Life Did you see an update   He got reunited with his son after 8 months   Hopefully those 8 months made him think a bit and effect some positive changes in his life and make him a better person  somebody who is beyond a coding machine ,4,
