Comment,Likes,Reply Count
Join ex Google ex Facebook engineers for my coding interview training  http   techinterviewpro com ,128,40
You need to beg ur wife back   Women are the glue that holds a man together brother  ,1,
 James Bell  Exactly    dry humor     why do all these people insist on putting him down as if he were being serious       Curmudgeon maybe  ,2,
 Opal Tometi BLM CEO oh yeah true true   ,1,
 James Bell whatever floats his boat    btw steve jobs and elon musk doesn t penny pinch    they spend like no tomorrow   ,2,
 Opal Tometi BLM CEO I get his sense of humour  He is quite dry and witty  He is not actually comparing himself it s called dry humour I think,2,
 James Bell if your not a multimillionaire like tech lead then your a nobody     he s comparing himself to bill gates and steve jobs    can you do that ,3,
 andythom  If he were a woman you d be defending her    a true white knight ,1,
 MANxVSxMACHINE I watched his other video  He didn t want to spend money on buying a house for himself and his wife and decided to live with his parents  That financial decision cost him his marriage and relationship with his child  So  when I see him making videos about financial management and investing I cringe as his frugal decision making cost him more than any stock market crash could  He was so stingy with his money he could not see his ex wife did not get along with his parents  he has saving few dollars and this in turn caused his wife to leave with his kid  He makes Warren Buffet look like an amateur ,3,
Maybe your sibling asked you to make way for other hikers because he she wanted to protect you  Over protection  Your wife sounds nuts  But you ve got a kid  So you know she ain t nuts  you re both bitter  But get over it and at least you ll be a peaceful place for your kid to come visit  Bitterness is overcome at different rates  I like this video  Just my two cents worth  I m probably wrong  ,1,
 Opal Tometi BLM CEO well if we think about it society ruined that as she would never had been in the position if american dating norms were pushed first instead of marriage as they seemed to not grow apart but never be properly together to begin with,1,
you did ruin her life    she could still be on the market making money from customers    now shes stuck with your baby making no money   and begging you to give her some money so she can afford to raise your kid    lol,1,
 andythom The person that thinks they are the smartest person in the room  is typically not   Techlead is one of the finest edutainers and what you are seeing is a persona   He knows that relationships are not one sided ,2,
Hmmm   I don t see you as a villain   I find you entertaining and educational    Some insight on combat training from a veteran  disabled veteran  that is a huge supporter and subscriber of yours   Combat training isn t meant to create a sunk cost fallacy where soldiers are ready to enter combat   From experience  there is some truth that through instructional design you develop habit to shoot at a pop up target  that makes it much easier to pull the trigger  accurately  at a person and not think too hard that you are pulling the trigger at a person   That may have come out wrong and I don t think anyone should think lightly when pulling a trigger whether they are at the range or in combat  but sunk cost fallacy should be applied to economics and not combat training for novice soldiers ,1,
TechLead  have you  as an ex Google ex Facebook multimillionaire  considered including your siblings or parents in a video ,2,
I love the intro   if your life is messed up  it s your fault   Listen people  Extreme responsibility is what will take you out of the gutter ,9,
 Everyday Person Watch his previous videos  he has very clearly spelled out his mistakes   taken accountability  Documenting this experience provides a valuable lesson in how to avoid failing a relationship  It also highlights the problems we face in western society such as    entitlement ,8,
She left  It s not your fault man  You re allowed to voice your feelings  Don t let her hurt you ,5,
Hmmm  so by you treating your ex wife so well by you and your family providing her with all the material resources and emotional support she decided to leave with your child for an uncertain future  Well  makes perfect sense to me  By treating her well  is it the same as you are treating her now  By tarnishing her reputation by making these assertions and delivering your monologue on this platform when she does not a right of reply  Again  I have not completed a computer science degree so I might be daft to the situation  but I have not heard one negative word from you describing your actions that may have contributed to the dissolvement of your marriage  Maybe you are like the rest of the divorcees who seem to never be in the wrong  Rich  educated  experienced and worldly but ex wife left with his child to another continent  hmmmm  yep  never wrong ,6,
It s not your  millions  that make you toxic   it s your mindset and attitude towards others   Do you know what Barrier To Entry is   I ll wait ,3,
Is competitive programming imp for faang,2,
I disagree  a single person can ruin someone s life  and if u dont believe me  well let s give some examples  John Lennon an obsessed  fan    Successful men where their ex wife take their money through the court system  just a few and there are alot more of 1 person ruining lives  Becareful who blet in ur circle ,1,2
Feedback appreciated   Wanting more info and insight   WatsApp the numbr above  Endeavor to reach out       ,1,
your brutal honesty is dangerous but it is badly needed in the world today    so thank you for sharing your wisdom with us mere mediocre humans,1,0
Of all the money you make and the knowledge you think you know and you think you are successful   Think again ,1,0
A bit of humility might be beneficial in your future relationships,2,1
Did you say your were a prick or something  Maybe your wife couldn t take it   But I like you anyway  But rich people are not going to stand before the Lord very well ,1,0
I like this guy   is so honest but lack basic emphaty  you just need to have other arrogant friends dude I can be one lol   or maybe you can try to master yet another skill   how your brain function about feelings and emotion by learning yet another programing skill   neuro linguist programing  NLP  which in fact is not a computer programming but brain programing with words   they will teach you how brain uses mate programming but not being specific but generalist    just take a mentor like Richard bandler,1,1
Helpline    QUESTION CAN COME IN   ,1,
Keep making clip like this for your son  When he grows up  he can learn your great strategy how to live a simple life happily  While waiting until he grows up  you already  inspire lots of people around the world  Happy for you     ,1,0
techlead   you cant blame anyone of ruining your life   also techlead   my wife ruined my marriage   i feel like these are the closure videos almost directed to her,16,1
I m surprised that you  TechLead  as a millionaire  have so little control over your emotions  SAD ,1,1
I hope he finds a new love,1,0
 i m a very easy person to hate   ,1,0
I totally agree with you that we can t victimise ourselves  Every relationship has something to teach us for our growth  Yet I think here we can use empathy to approach the issue  A divorced woman with a child has a significantly lower market value indeed  while a rich old man  not you  can still feel confident to meet more people  Your ex probably needs some courage to face the reality that she s divorced and has to be independent to face the future that she fears about  Her accusation to you shows that she is a weak person lacking confidence and strength to move on fully  So Empathy is better than logic ,10,0
My ex wife cheated on me got pregnant from another guy during my marriage  I divorced her and  have become a multimillionaire since  I can tell you this is the ultimate revenge method that burns her everyday on earth  Until she burns in hell of course ,1,1
I ll tell you why your wife was treating strangers better than you your family  Because she knows you well enough that she can be her true self  while she has to keep up the  nice  image when dealing with strangers   ,4,0
Hmmm the way this video starts off  if this is how you talked to her then I can see why she thinks that   lol,2,0
lol talk about petty  maybe your wife left cause she got sick of talking to a robot  maybe she made a human error that Techleads couldn t forgive but she probably found someone else that has a heart ,15,0
This is way too much BS for my recommendations  Such a waste  Unsubbing right now ,7,0
Some of these videos take strange turns ,2,0
Being humble is not his strong suite  or  he is trying to stir up controversy  which is most likely ,2,0
Your Ego is swelling past Jupiter      I am a good person to the best of my ability   I am NOT influenced my money at all  ,3,0
Oh Boy Did you see movie Parasite  if so watch Parasite ending explained,1,0
I don t think it s smart to always be at higher level than other people  There is smartness in going down sometimes  It expands the vision of reality  If you go traveling and limit your budget to  say  200 per day  you may have a very exciting time  but it will be different from you normal Hawaii trip,1,0
This guy is HILARIOUS lol   You know  it s lonely at the top  And this is truly a personal problem  Because of this  I m so lonely   Classic ,3,0
This guy needs a therapist    Like urgently,1,0
Deluded  Entitled Princess  Ignoramous Feminist  Hiding in Comments  Section ,1,0
He needs to get over his wife,1,0
I think that it is important to know the heart of your now ex wife   You seem to be good at using your brain and are apparently monetarily successful   Marriage is more about knowing how to be there for your spouse on all levels especially emotionally   It isn t just about the money ,1,0
Final boss syndrome         As a millionaire,1,0
I am not sure if this guy is trolling or serious  If he is serious  it looks ridiculous ,1,0
As a trillionaire     I m super impressed that you are a millionaire   I own a trillion shina coins   It actually wasn t that difficult ,1,0
me me me me me     me too ,1,0
Lmao   final boss    epic ,1,0
1 30 You re lying  Elon s birthday is on june 28th,1,0
Well said  ,1,0
Self inflicted is my mantra,1,1
Hey  is this guy a millionaire ,1,0
I think people forgot that this video was published on April 1st ,2,1
Ur wife is lucky,1,2
In my opinion  People tend to  hate  each other because they only see superficial things and don t bother understanding what lies underneath   Edit  Or  in your case  what it cost to get where you are ,1,1
You re just too logical and practical for most modern people  Don t take it too personal  Most people today are pretty much emotional overgrown babies  it s all about feelings and image  People don t really appreciate quality and wisdom  The people that are  cool  are the ones that are flashy  loud  rude  obnoxious  Being aware of truth is a lonely road ,3,1
I feel like your ex wife just got too comfortable around you,1,1
I would love to have a one to one conversation with this man,3,0
     and probably the reality is you re incredibly self entitled and think the world owes you things for you having done nothing to deserve it       SHOTS FIRED   ,2,1
 Hell is seeing who you could be  I nearly die laughing ,1,1
Lesson learned  never married a person with different value  You guys are both right by yourself  but wrong to each other ,4,1
I want to troll the way this guy does  total boss level  ,2,0
You re overanalyzing ,3,0
In fact u r just like what u were criticizing the others by ,1,0
I am starting to understand your wife ,3,0
I love this vid,1,0
 Hey  I m a millionaire  I ve got money  Well that s pretty good  maybe we can all celebrate that    LOL,10,0
Lmao that transition to the ad,1,0
You are a really smart man  Why did you get married in the first place  Did you have a prenup  Anyway I learned a lot from stories like yours  stay strong  Mr  Tech Lead ,2,0
you re soo my type  please ruin my life too ,2,1
Man  this is so true in my life right now  going through a divorce and my  still current  wife saying I ruined her life  all this and that  when I was just trying to live my life and she s the one that would actively seek out to destroy it   I read that if people get offended or threaten by a simple statement it s their own insecurities coming out  and I have seen jealousy in that form  where you share your success and someone instead of being happy  they get jealous  instead of celebrating or being happy  or even better  asking for advice  That s what I would do  if I meet someone more successful  I would try to learn as much from them as possible  rather than hate on them  that really doesn t help anyone at all ,22,1
 TechLead  WELCOME BACK     ,1,0
When the value of a human is measured by his money we failed as a society,1,0
I m dying laughing the man is too honest ,2,1
Hey  ex wife  we invite you to reply to this video    ,1,0
Just reacting to the thumbnail     not watching the video     YAWN     aight  I m out ,1,0
Why do you care so much Tech lead  Quit complaining you have millions in the bank I would be jumping up for joy if I had that ,1,0
I m terrified of having your life ,1,0
  ,1,0
Stop overthinking and visit a stripper club as millionaire ,1,0
Tech Lead should create a crypto coin  Like so he can see this ,1,0
A Woman can ruin your life    if you let her  That s by letting her do everything she wants ,1,0
Wow I like the final boss syndrome example so true about women who chase a stud,1,0
Love this guy so on point my boy is getting red pulled,3,0
Posted on April Fools Day  You define your own success ,1,0
Kitesurfing lessons replaces misery with stoke ,1,0
I was just watching this video  and I liked your channel so I subscribed  Then I refreshed and you hit one mil  Nice job ,1,0
      ,1,0
 Ex Google TechLead ruins his ex wife s life ,1,0
Ex google  ex Facebook  ex wife  ex yotuber and then ex billionaire ,1,0
was your wife stunning ,1,0
Unless you re being totally sarcastic and don t really mean to say what you re saying  I can t agree with anything I heard here  Of course  a person can ruin the life of their spouse because marriage means the two become one  Which means there is dependence on each other  and of course control over each other s life  future  all sort of decisions like where to live  how much to spend  how many kids to have  how to raise them etc and much more  And wiring money to your spouse and making it seem like you re doing her or him a favor is not the way to be the good spouse  And it does not mean that you care about her   This is just one small part of it  Being a good spouse is loving them  caring for them  providing for them  sharing everything material and non material with them  spending quality time with them  doing things they love  showing them honesty  transparency in everything  loyalty  respect  forgiveness  showing how much you re grateful to have them  showing them they re your number 1 priority in life  always showing them nothing else matters as much as they are  staying with them through thick and thin  being nice and kind to their friends and relatives  supporting your spouse in every way  not only financially but also emotionally  morally  spiritually  and practically  helping them not only financially but by sharing all household duties  child care duties  cooking  cleaning  mowing the lawn etc     If you can not do this PLEASE DON T GET MARRIED  GET ONLY A FRIEND WITH BENEFITS  Don t ruin someone s life    ,1,0
I do agree  You are easy to hate,2,0
You are a smart guy making stupid videos  Respect your story  respect your kids  your family  your choices  your past ,1,0
 I m an easy person to hate    The most likeable dude on planet Earth ,128,4
Plot twist  Cadam was the one being sarcastic ,4,
 Cadam2019 I don t recommend you to watch this channel if you don t understand sarcasm little boy ,6,
he s entertaining  far from most likable dude on planet earth   you need to meet more people ,19,
what   i think u misspelled punchable,21,
Example of a massive character development   XD,1,0
Well this video was pointless,2,0
Ex Google  Ex Facebook  Ex husband TechLead here ,1,0
This lad has no time or intention for the extravagance of empathy ,1,0
FBS   Final Boss Syndrom   Lmao,1,0
I dont think you re very successful lol I feel bad for you  money is overrated ,1,0
Has your wife ever gotten diagnosed with any disorders  Maybe she is borderline personality or bipolar disorder ,1,0
is this guy halucinating  so narcistic   ,1,0
Remember everyone  you could spend your life becoming a successful millionaire like Patrick  having never developed a single social skill  or you could be happy ,5,0
Sell the dog  sell the wife,1,0
as a future millionaire  future million subscribers  I agree with TechLead,1,0
I am jealous of you as a hundredaire   3 I am hundred bdt now  p,1,0
Have you considered stand up  Think Andy Kaufman ,1,0
 Hear me story tell every miniscule detail of my life  as a millionaire  ,3,0
I hope it just trolling   Otherwise ur just delusional    Lol,2,0
The way he talks is like about the fox  who could not get the grapes from the tree after multiple tries  so it walked away by saying that the GRAPES ARE SOUR  I think the main problem is his bad personality for getting divorced And he is just not ready to admit tge fact,22,2
You can smell the sarcasm  Every quality about himself that he said was probably what his wife accused him of being ,2,
do you really think its his real personality ,2,
I think you hate your self and you project that to others I don t think that everyone hate you ,3,0
The ad transistion was seem less,1,0
Money alone doesn t make you successful   you assume money can one up everything but success is a combination of factors  one of them is a family which you clearly didn t succeed  You are not a  final boss   just a lonely man venting  And i can see why people would think you are arrogant   you seem to not be able to hold a convo without involving money ,1,0
     you know what the real problem is     most people only think they are successful until they finally meet me   ,28,0
Appreciate the honesty   arrogance   however I believe it would be very interesting and same time very annoying to hang around with you ,1,0
This guy is on the way to having a million sub being sarcastic  ,1,0
I like a lot of your points  maybe you re speaking hypothetically  but you seem as fixated on yourself as other people who are fixated on you  in fact  your perception of yourself as a  final boss  or someone else s  hell  is only true in your own conception of what a final boss or someone else s hell is  it s sorta off putting how much thought you re putting one upping people in conversations  etc   a constant  nagging  and uncontrollable internal desire to one up people is my version of hell   I just think you need to let it flow  get out of your own head  and maybe go to Jamaica  smoke a blunt or two  find yourself a new lady  and chill at a beach bar with some locals  I like your videos a lot  but this one turned me off my guy   ,1,1
TL has lost it   He s created this imaginary world where he s the hero and everyone wants to be him or take him down   What a joke   No one cares except the incels who cheer him on ,4,0
For anybody reading this  Know the meaning of what success is like to you  Success is different for everyone   I ve seen families that only had enough for their necessities  but are the happiest people and you can feel the families closeness  I ve seen rich families  but their kids are all messed up  I m sure the best are probably rich  close and loving family  The last example is probably I m gonna be jealous of lmao,5,0
This video alone shows clearly why you may have been in the wrong in your marriage  People influence other people  Your way of thinking is faulty and very narrow minded  You need to take a close look at yourself,5,0
Techlead is independently successful and satisfied with his life so he is happy for other people s success and literally does not understand jealousy  envy  resentment  Sadly I ve found these negative emotions drive a huge amount of people s day to day interactions thoughts and feelings  it s really sad ,25,3
I believe you and I are the same with him because otherwise people don t even believe that a human could  not  understand envy  I don t even feel like he s using sarcasm  Why do you envy instead of being happy for them  Well  I guess it s about being satisfied with your life ,1,
I learned a new term today   Final Boss Syndrome  Lmaooooo,104,0
Love it  So funny  She must be outraged  ,4,1
TechLead is incomprehensibly intelligent and financially successful  but his general disposition is very off putting  Maybe he has a great mind   like Bill Gates  Steve Jobs  Jeff Bezos  Elon Musk  but the arrogance and narcissism are too much for many people to digest  In other words  people don t just marry for money  Money is not an ingredient for genuine friendship and long lasting love ,3,0
We are like his therapist  so this mess his ex wife left can be sorted out  as a millionaire  ,2,0
People could ruin your life let s stop,1,0
its been like a year this dude still not over her,1,0
 and if anything  you should compete with   me   clicked like on this ahahaha ,2,0
      ,1,0
Sorry to hear you choosed the wrong person  Even millionaires make mistakes ,1,0
I just love this guy   even if he s being serious  Coz let s face it  he s right ,1,0
Trash lead here,1,0
As always  great sound bites  name dropping  etc  Keep making this entertaining content    ,1,0
 If Elon Musk doesn t invite you to his birthday party at his mansion where there s sushi and wine    like he invited me last weekend  IM ROLLING LMAO,388,7
 Nicholas Weng  If Elon Musk doesn t invite you to his birthday party at his mansion where there s sushi and wine    like he INVITED me last weekend ,1,
 Nicholas Weng Fancy birthday parties with sushi and wine are planned months in advance  You would have to be a millionaire to know this ,3,
 Nicholas Weng He was just kidding  if you haven t noticed that yet about his videos ,15,
LMFAO     Brilliant    ,5,
This video got me to subscribe     Your ex wife was jealous of your family  and perhaps of your upbringing  and felt she was entitled to it  When it wasnt given freely   she attacks ,1,0
you understand   he ruined it  as a millionaire of course ,1,0
this guy is on another level  as a millionaire,1,0
Betray is the reason of hate,2,0
Who got custody of the kids  TechLead,2,0
Hey I am a little confused    Is this guy a millionaire ,2,0
 Like he invited me last weekend  lmao,14,0
Hm marrying a woman then failing her and letting her alone to grow a child  single mother with min8mal chances to rebuild a family or a life  True millionaire you are right ,2,1
maybe people are really mad about him as if he s so selfish or whatever  but this genius hypes me asf for my life for being a succesfull person  thanks man ,1,0
He s secretly hoping his wife gets back  He s low key begging her to come back ,21,4
Then  he is using the wrong approach  which will render her even more resentful ,2,
I don t think you would publicly criticize your wife  air your dirty laundry  and complain about your marriage if he wanted her back lol  I think he fairly effectively shreds her character and it s hard to think someone like the TL  at least from what I can gather from watching his videos  would respect his wife enough to want to be in a relationship with her again ,1,
 elenabob I have actually said this to someone when I was in victim mentality mode  I did really believe that person actually ruined my life then  They took away many formative years from me and I had to deal with the repercussions growing up  To be specific so people don t think I just threw that phrase around  this person molested me since I was 5 years old  I had to realize the hard way that no one can really ruin your life if you don t let them  Yes bad things can happen and people can do terrible things but we have to move on and try not to be a victim  It s easier said than done however ,1,
Nah  he s just venting and I can see how one could be hurt by such a remark when it comes from someone close to you  In my case  my bigger sister really know his to push my buttons ,7,
Went from tech lead to divorce lead ,2,0
SHE WANTS MORE MONEY  Simple ,2,0
LMFAO,1,0
it is lonely at the top  but that s why I ve come here,11,0
Correct me if I m wrong but your entire message in every video is pretty much  dont mind everything else and focus on yourself ,1,0
Dude   You re twisting the situation around to place the blame on someone else   A spouse can destroy someone s life   If u don t know that  ur blind   People like u are oblivious to how much harm you can cause   If it makes u feel better believing what u say  ur a fool,6,1
Don t diss farmers man,1,0
Hahaha i luv the arrogance  I wonder how he come up with these,1,0
Her ex wife is just like a kid that used to take candies from other kids and that other kid finally stood up  ,2,0
Never mess with the Techlead  ,1,0
Rationalising failed transaction normal people call  a relationship   The good thing about the fact that you have a YouTube channel is that any future potential mate could reference this before making the mistake of becoming enmeshed with a person displaying NPD traits ,1,0
