Comment,Likes,Reply Count
It s hard to figure out how serious this is  but anyhow I think a big reason they hate you is that you are no longer a Facebook or Google tech lead and now just live in your parents  basement yet still constantly brag about your achievements  There are tons of millionaires out there these days and most of them are way more successful in life than you are  no offense  They also are generally nicer people ,1,0
Hmmm  this video was published on April 1   ,1,0
This would fit well with some rap beats ,1,0
Soo poor all you have is money,1,0
This guy is hilarious,1,0
You just described the condition of race relations in the United States ,2,0
Is this guy losing subscribers  Or so people just watch to feel better about themselves ,1,0
Your comedy and humor is underrated    videos are hilarious,1,0
You just inspired me to become a super villain,5,0
This is a therapy session lol,1,0
disgusting,1,0
 You can just love me for my money    I can t even tell if that was serious  ,48,0
You should do a video about how humble you are ,10,0
typical daughter in law man    her in laws are actually  out  laws by definition,3,0
How could she just take your son like that   Sue her for kidnapping,1,0
I bake cinnamon rolls  as a millionaire ,1,0
How do you define woman   Self entitlement,1,0
Finally  his shirt fits him well ,6,0
Want to say with so many words on how good your advice is on your divorce  but will just complete this passage with a thank you  ,1,0
This is an obvious shitpost but a good one ,1,0
TechLead isn t a bad person  he s just very focused on his feelings and his life views he disregards other people s perspectives     It s not a terrible thing to be selfish  He s really good at protecting himself    He doesn t think about  why his wife may feel certain emotions  nor does he consider what other people may be going through  he doesn t even understand why he should be considerate and let other people cross on hikes  5 30   he just seems very self centered    But congrats  you re a millionaire    I think TechLead serves as a great reminder that we should not push ourselves to the extremities of any place  although money is great  it s not worth it if you don t have people to share it with ,10,0
Hahaha  I really like you dude  your arrogance as well  Reminds me of myself  I am the one you were always afraid to meet though    Not gonna say more cause I don t want your world to come tumbling down    P Keep up the good work ,1,0
Oh   god      ,1,0
Haven t watched this man child for a while   I see he s still wallowing in the passive aggressive narcissism that I remembered   Nice to see some old traditions still endure  anyway     ,5,1
call him what you will he s probably a lot smarter than you  and that  s kind of the point of his channel how to use your brain to get ahead  If you re not into that there s other channels out there for  you   Let me guess you re gona respond with I just watch to hate right   Just goes to show how much smarter I am than you  as I should be being that I m a millionaire ,1,
Sooooo Poetic    ,1,0
Its funny how confused these comments seem    People just really dont understand how success happens or how really smart people think ,1,0
Should have seen this when i was a kid  I was too good at sports  had good skin and nice hair  but bad at socializing  After a while most of my classmates hated me  I realized i was a final boss and i didnt really want to change it  I wanted my classmates to grow up to me but they failed and i failed as well  My failure was not knowing enough  their failure was not being able to grow ,2,0
perhaps your sibling was being courteous to oncoming traffic and you re a slow hiker  lmao,2,0
People decide that their lives have been ruined way too easily  Didn t get into company school whatever they wanted  Life ruined  Failed relationship  Life ruined  Et cetera ,9,1
Failed marriage is definitely a life ruined  Because you get married expecting to be together forever  My best friend almost died after her husband dumped her for no fault of hers    She was weighing only 48 kilos at one point  not eating  not sleeping  not wanting to live  Broken heart is just as hurtful as physical pain trust me   And when it s caused by someone you thought was literally another half of your body and soul  that s a trillion times more painful ,2,
TechLead is a flawless clean white gem,1,0
lmao i love how he can easily switch between his techinterviewpro and his rant about his ex wife  That s millionaire mindset right there ,2,0
I always thought the final boss would be you know a good programmer ,1,0
 Hell is when you see who you could have become  so when people come face to face with me  I m their hell    Tech Lead,71,0
You re over thinking this Techlead  Newsflash  persons of average iq habitually lie and gaslight knowingly in order to turn your own logic against you ,1,0
The best thing about working at night or early morning  Is that you don t get jealous  because you won t see people xD ,2,0
Bro   I ll grant U this    the combination of ur satire  sarcasm    humor  are unique,1,0
 Even though the farmer has more criminal acts than me    ,11,0
I think people hate each other because people are inherently selfish   want to do what s best for themselves first  Sometimes this will get in the way of someone else s goal to do what s best for them   will think of that other person as an obstacle to overcome ,1,0
The alpha chad of nerds,2,0
I really needed TechLead today    he is hysterical  xo,3,0
I love your videos  they  make me so happy ,1,0
Dude  your pride is consuming you and you re hurt inside   ,9,0
Have you tried therapy  I feel like narcissistic personality disorder might be a thing you should mention to your therapist ,1,0
damn u needed to vent didnt you,2,0
 They think they are smart until they meet me  Techlead,2,0
In all seriousness  is TechLead on the spectrum  Like  I can t imagine being married to a less empathetic human being  I get it that he thinks he and his family paid for everything  but what about spending time and interacting with loved ones  I feel like under the surface he s really insecure  still   Edit  I ask if he s on the spectrum because that would clarify some of his mannerisms  explanations  and behavior  Being on the spectrum isn t a bad thing  it just explains things ,3,2
I experienced the same thing you had with your brother  but with an adult   ,1,0
I just listened to this guy praise himself whilst putting his ex wife  along with everyone else lol  down    I don t know how I feel about this ,1,0
A lot of commenters here seemed to miss that this was posted on April Fool s Day ,5,0
always interesting to listen to you,1,0
I ve seen this video twice  It s well worth a second watch  Golden,3,0
Woa  must be why my sister treated me so badly  I was recovering from cancer treatment in Mexico and my sister cleaned out my home stealing everything that wasn t nailed down  Then left  It s worth it to have her gone though ,1,1
Get a Life    ,2,0
Can we get a video on how to drink coffee  as a millionaire   ,10,0
Great video  Sibling just trying to be polite ,1,0
You and your wife need to go to a marital psychologue,1,0
Don t worry bro  come to play League of Legends     You are never lonely there ,1,0
You are inspiring ,1,0
How to brag i am a millionaire  as a millionaire  ,1,1
Dislikes are from current Google current Facebook engineers  non millionaires ,1,1
I can t decide is this guy just straight up honest or a full of himself arrogant   ,1,1
I love this kind of humor,3,0
You should change the channel from  Tech Lead  to  Emotional Lead  as a millionaire of course ,3,0
Patrick at his best ,2,0
There are total 46 8  million millionaires    ,1,0
Nah dude  Elon Musk totally ruined my life by not inviting me to his mansion for sushi and wine   ,1,0
I hope your kid is doing well  ,1,0
My take away from this  techlead thinks he s a dog ,2,0
This man got  10 in charisma  10 intelligence  0 narcissism,70,2
and all as millionaire,12,
Actually negative narcissism,8,
TECHLEAD  I SERIOUSLY  LOVE YOUR VIDEOS   this one yes  just cause you re host  but literally 98 6  of all  YOU BRING ME UP TO SPEED     THANK YOU      I just used to be a  Corporate Victim   what I call it   BUT HEY  I M 29 5 YEARS OLD  GOT TIME AHEAD OF ME         ,3,0
This man is too logical for love ,198,3
He is too logical to hate  ,17,
He should have married another engineer  His wife sounds like she wanted a poet,28,
Vegeta  what does the Scouter say about his Ego level  ,2,0
dude  get some therapy  you think about your ex too much,4,0
this video has co parent drama vibes and i love it,13,0
is this a joke ,1,0
You are just like me  as a millionaire though ,1,0
Yes  but     ELON MUSK RUINED MY LIFE        ,3,0
you can EAT the dog,1,0
I wonder what you son will feel like when he grows up and watch all those videos that you publicly criticize his own mom    We never know her side of the story ,75,14
 Carpe Diem how is it falsely  Because he said so ,3,
 Z NIGHTMARE lol  idk  who cares ,1,
 Jovial what s the name of her youtube channel,1,
 Jovial fair point  Especially after I just watched his recent video on how his wife tried to have him falsely accused for domestic violence  Still feel sorry for his son who did not ask to be born into this but has  People need to be more wise about who they have children with  both men and women ,2,
Yes I agree  if they had no children I think it would feel more fair game  I wonder if she ever thinks of suing him for public defamation or something ,3,
Agree  If this guy loves his son as much as he claims he shouldn t try to insinuate to the son through these videos that his own mother  kidnapped  him ,11,
you can know her side of the story by watching her youtube video s  And for the son s feelings  its upto the son  You dont becomes a millionaire  by making every single person feel good  LOL,10,
 Love me for my money    True to life there ,11,0
I honestly on God believe that this man is a Comedian       I love it       ,29,1
Your wife ruined her own life  Being single mom limit s her option s with quality men  6 figure men don t want to marry divorced single mum s  She didn t see it but your a quality man even though your a bit geeky ,1,0
The Techlead  but not the Familylead ,1,0
He s the boss ,1,0
I think you are depressed  You should get help  as a millionaire ,1,0
All Men out there don t you ever forget  It s all your fault  ,1,0
Obviously you are right techlead  as you re a millionaire   and you re making good points  but making a video that s essentially about how you re right and your wife is wrong is not going to make YOU a better person  On the contrary  trying to prove to your followers you have a moral highground goes to show that you re not the right person to give moral advice  You re merely reinforcing and digging in to your own story  Growing up emotionally is hard  especially for programmers like ourselves  haha   But role models like you have an obligation to grow up faster and inspire others  Love ya ,1,0
You re hilarious   this put me in a really good mood,1,1
the  as a millionaire   part of the title gets me all the time ,22,0
The only reason your ex say you  ruined  her life  is because she fantasize that she could have spent that time with someone who would give her even more money ,7,0
Because you are a SIMP  Don t do this mistake ever again  Jesus  lift some weights too and be more manly ,1,0
how did you end up talking about this    ,1,0
I can t tell if this is sarcasm or not but in this case that it s not  I ll say this      Your behaviour  telling all and then some about what happened or didn t happen between you and your wife to your large fanbase  just goes to show that she is better off without you   She can t defend herself so we are left to listen to your side of the story  the least you can do is to stop using her as content and actually create something original   This tactic is getting old and your audience will catch on soon  so you should start creating useful content instead of using your wife Google Facebook to make sub par videos   PS  When you re in a committed relationship with another person and compromise on your personal needs for an extended period of time only to realize it was all for nothing  you can end up affecting each other negatively ie  ruin each other s lives ,1,0
 The dog s just been existing  It doesn t even pay attention to you  It s just living out its own life   You know  I THINK I ve worked out what you did wrong     Don t know if you are attempting to fix that lack of attention somehow by making multiple videos about your ex wife     But  given you have a child together  complaining about her publicly on the internet MIGHT not be conducive to the happiest home environment for your son  Whether it s right or wrong  making your ex wife even angrier at you  will not make things easier when it comes to custody  visitation and generally being included in key family moments  A funny ish  video that gets thousands of views and makes you a little money can t possibly be worth the negative fallout  ,2,0
what I love about your videos is that not only are you educated  you are also wise  Making you a rare title that you exe wife will hate  She hates to have to admit that you are smart  She can t out smart you ,1,0
 People think they are smart untill they meet me  That s me as well,26,2
    and then they think they re brilliant ,1,
It s probably not  But if it makes you feel special go for it ,6,
I worked alongside nerds in IT   Believe me majority of male IT nerds are not nice human beings at all   And once they start to make some money their hidden personality traits start to emerge   They have this anger and tendency to go on some sort of trips of revenge and punishment of whole world for tine little things that would not bother most of us   Totally insecure  constantly competing on every trivia things demanding to be agreed with   not flexible at all  you submit or war   nothing in between  Have a huge ago   prone to have uncontrollable power trips with those that ate somewhat dependant on them but can never stand up for themselves verbally   mentally or physically outside of their comfort bubble  Just listening to this guy ranting   On and one and one rehashing same thing over and over   probably having a great kick and patting himself on the back for his  smart    waffle   If you are rich   get a lawyer and deal with your wife    She is out of his control and he is throwing hissy fit every month for last year or so ,1,0
In a psych class I once asked why we were spending so much time on peoples weaknesses rather than showcasing strengths  It was not a popular point  Glad to see others have thought this way ,43,6
Wouldn t that be the same as going into a med school class and asking  why are we spending so much time focusing on unhealthy people  ,2,
If you took a psych class and this guy isn t one huge red flag then you didn t learn anything,2,
Psychology is becoming more political  And the political makes people miserable ,1,
 K3th  B W That s not good for business  Same reason why medicine that cures instead of treating symptoms is more expensive to produce in the long term  You can t rationally invest in that  It s seriously difficult to survive as someone who fixes other people s problems  permanently  I m not trying to being ironic or cute about this  Market pressures alone are enough to select for professionals that engage band aid solutions over those who prefer to fix problems for good  I m not suggesting of course this an ideal mode of existence to aim for  But it s worth noting that this was the inevitable conclusion to never ending increased market pressure on psychiatric facilities to make quotas  Where ever it is in the world where the self induced victim status fails  it isn t in the therapists  offices   So they train their patients to think that way  then send them out in the world to find out the flaw in that attitude  anywhere else but where they learned it  And they keep coming back for more lessons in their safe space  until they can t afford to anymore  That s the real lesson     I tried what my therapists told me for decades  and now my life sucks     Yes  Glad to have been of educational merit to you  You re very welcome  Please come back anytime for more     ,5,
Your supposed to promote victimhood mentality ,4,
 It s lonely being at the top  Techlead 2021 I could be making money printing his quotes on t shirts but I m too busy being broke ,1,1
Divorce and loneliness is difficult Guys  you can see how poor he is  I wish you rapid recovery  ,1,0
 self invest fallacy ,1,0
hilarious title ,1,0
Great words ,1,0
Don t you want somebody to fight  you need to find somebody to fight ,1,0
Welcome to the red pill  ,1,0
It s just my opinion and I might be very wrong  First  his ex was a very attractive  graceful and elegant woman who had many  many suitors   She fell in love with him during her best years  He did mention that she d bought him gifts  cooked meals  using shopping coupons to keep within their budget  So she must have deeply and truly loved him in the early years   When my husband and I were separated  we later reconciled   I said to him  you ruined my life   Because I truly love him and it s too painful to let go  We just had our first baby so I was furious and fearful at the thought of raising my baby alone    I hope all works out harmoniously for him and his ex wife,3,0
True bro  you are such a genius,2,0
Cope ,1,0
there there,1,0
Hey Tech Lead  is your wife weaponizing custody of the kid against you  I heard Japanese women in a divorce often do this to an even more insane degree than other places  Like they even brazenly break disobey custody rulings and flee the country   and don t even have any means of supporting the kid   even not wanting the money from the ex husband  Like the whole point is to inflict pain on the husband and use the kid as a pawn weapon  You experiencing this  There s support groups  It happens to Japanese men in Japan too  but it s more effective when it s an international marriage   as Japan s government is reluctant  negligent  even  to get involved recognize any foreign custody ruling   Take care ,1,0
TechLead soon to be called PhilosophicLead,1,0
You seriously look like the level BOSS who has lure or dalsim s extending arms  But for me  you are honest smart and have best hair ,1,1
 In which case you ve probably already lost     ,1,0
I want to see you meet a new millionaire girlfriend   ,1,0
His wife watching       ,1,1
Boils up from the bowels  Cabbage and ham does that to me,1,0
The king of the slick brag  ,1,0
next video   as a millionaire  as a millionaire ,1,0
FDR  Facebook Divorce Rule,1,0
I found these videos from the chair review video lol   now I am hooked ,1,0
This dude lol  ,1,0
She s a psycho,1,0
 TechLead   When I see you  I saw what I could ve become but am relieved and glad that I didn t   So no  I am not jealous of you and honestly nobody is   And one last thing  you are lonely not because you are at the top   You are lonely because you  think  you are at the top when you are not and you make yourself out to be because you are not able to appreciate things that are different from you   You dismiss things that you can t do or fail as inferior or frivolous and you automatically elevate what you do well as the epitome of godliness to give yourself this illusion that you are  at the top and therefore lonely    You are lonely because nobody  wants  to be with you not because nobody   can  be with you   The moment you can realize the difference  the moment your life will be better and be truly more successful   You are not successful right now btw as much as you think you are ,1,0
Your sibling wanted you to get out of the way of people who were walking faster than you guys  It was just consideration ,3,0
Completely agree  now I just need to be rich ,1,0
TechLead should have interrupted his ex wife s pity party and explained the child she produced is what ruined her life and she can only blame her own stupid biological urges and lack of critical thinking skills for her ruined life   I think I recall she is Japanese and if so  point out her duty to eliminate herself so that her ruined life doesn t affect others  Otherwise   I do like how TechLead obliquely compared his wife to a dog in the first minute  then a short ad   At 1 35 he happens to name drop just a little bit followed by several minutes of suggestions  that we should envy and hate him   it is too funny ,1,0
Love the videos,1,0
Did u just compared yourself to a dog  But whatever you are saying in the whole video makes sense,1,0
Next time I m going to make my haircut the same as you ,1,0
i feel he needs a beer and a hug i can see the good in him   this guy is a narc  lacks emotional intelligence and doesnt understand women  he sees himself as a god yet he s not even a billionaire  yet he s able to bleed like the rest of us  he has no army  no airforce  no navy at his command like putin or xi jinping yet he somehow sees himself at the top   he admits he spoiled her and then left her spoiled  he then gave a logical explanation even though women s behaviors arent based off logic but predictable emotion female psychology   i agree he ruined her life  i wouldnt want a guy like him to get a daughter of mine  he gave her so much because he doesnt understand LESS is MORE with WOMEN  he himself sees himself as a bad person  he sees success as having more money than OTHERS and not setting a goal and finishing it to the end    i was waiting to the end of the video to see how he concludes things and he did  he said why cant people s downsides be accepted so we can love each other  my answer to that is that humans arent perfect beings we cant expect things to be perfect  throughout history there has always been war  its what makes us human but this guy is more of a computer  id still buy him a beer and hang out with  after a beer things are more out in the open and clear  id teach him how to understand women if a terminator can learn to love maybe this computer can too and maybe he d teach me some computer skills  i see the good in him he just needs to let go of his pride so he can learn to be more emotionally intelligent ,1,0
People hate each other because we are subconsciously jealous to the other one that has a better grass,1,0
There is a reason why someone becomes an  X  and you must remember  YOU  can never ever  never ever  never ever go back it will never work out  PERIOD  ,1,0
basically you r calling your ex wife a dog   I was expecting you call her a cat ,1,0
She ruined your sons life by leaving without any regard that he needs a dad to grow up properly ,1,0
I regret commenting  but get over it man  ,1,1
Thanks for existing and putting these videos out there   ,1,0
Tech lead is the real life Seto Kaiba,1,0
Sheldon Cooper was based on him,1,0
The Final Boss Syndrome  That s badass dude     ,17,0
I would secretly be delighted if my ex told me I ruined his life ,5,1
Never underestimate the power of someone else s jealousy ,132,3
 H  C Exactly Jealousy is like a vacuum  Hop out of it immediately and save yourself from being drained into it  Stay positive and focus on where the path should be and that is where you should be heading ,5,
You don t wanna be in the vacuum  Hop aside as fast as you can bid farewell ,1,
I hope you re okay mate  What you re saying does makes sense ,1,0
great performance art  maybe this should be shown in school instead of Shakespeare,1,0
Being an INTJ  I can relate to him ,41,2
Million dollar where,2,
I think you meant  Being an INTJ and millionare      ,5,
Enjoy Man   You are perfect   ,1,0
After Covid you should do stand up comedy  as a milionaire  you re hilarious ,6,0
This is quite hurting  I think it is a big step for you to forget about those dark past and hurting words   Otherwise it would keep reducing  your energy  You deserve happiness  Life is long  sometimes we got bad times  but good times come too  Keep faith  ,15,1
     quick pause     ,1,0
That s what happens when you marry a waitress,2,0
Human are very complicated  How you response to those sea of humanity is what matter most in the eyes of God  You made a lot of good points and appreciate your straightforwardness ,1,0
TechLead President 2024  2028 ,1,0
you are amazingly inteligent,1,0
My friend is a marine and he mentioned he wanted to kill people because he doesn t want to not use what he learned  Funny you said that because I always chuckled thinking he was a dumbass but it s good to know it s a bigger phenomena,1,0
The final boss of the next Dark Souls game  Techlead  the Millionaire,2,0
You re a master of sharing your thoughts   scary to think how potent you ll be when you learn to share your feelings ,1,0
Do you love your ex wife ,1,0
Even if you did ruin your ex wife s life  that s probably the best  Red Pill  thing that could have happened     Go Red Pill brotha  cause that blue pill will cause you some major pain  FOR LIFE     ,1,0
maybe he is joking on April fool s day,1,0
grrrrrrr your  little  life story  You successfully triggered something in me  my ego  Which tells me something about myself I didn t come here to learn  Kudos ,3,0
Why would you post your argument with your ex wife on youtube for the public to see  This is inconsiderate  no wander why she left you    you speak with such arrogance but   you ruined your own life  is your own personal philosophy  not a scientific one  If everyone has the free will to be responsible for their lives  then what about environment and genes ,1,0
The best part is that what he s saying is really true   i dunno but i find it funny  and wise and the same time  haha and i really enjoy it,1,0
high dopamine state   ,1,0
   It s lonely at the top     Cheers  ,1,0
