Comment,Likes,Reply Count
You re such a light  Thanks to this team for brightening my views when all I could see was darkness  you re such a special person and I m so incredibly lucky to call you my friend  thanks for the 2btc,2,0
Great video  Really learned a lot  You were very clear in explanations ,3,0
I AND MY ENTIRE FAMILY LIVING A PERFECT AND COMFORTABLE LIVES EVER SINCE WE MET THE MINING PLATFORM  MORE KUDOS TO YOU SIR,3,0
I can t imagine my life without this platform above I got 2BTC from them all the way from United state       thank you so much may God continue to bless the platform,3,0
1  Fantom  FTM  2  Glimmer  GLMR  3  Near protocol  NEAR  4  Osmosis  OSMO  5  Cardano  ADA ,420,18
I have a much better list with some that can easily 10x  1  Aleph Zero  AZERO  2  Hathor 3  Cherry Network 4  Ioten 5  KDA 6  FLUX,1,
ATOM,1,
Cardano is the best,2,
Idk about Cardano doing a 10x but that would be amazing lol,4,
 FTM FTW  if you know what i mean   ,1,
I trust to products from South Korea like Samsung and now Fantom,1,
Thanks  but it is too late already  ,2,
Just take my like,4,
Thanks fam,2,
Thanks man ,2,
I think he was recommending Cosmos  ATOM   not Osmosis  OSMO ,27,
  You ve been a great addition to the team   Best regards I m excited to work with someone with your experience  Having you on the team makes a huge difference  You always find a way to get it done   and well done,5,0
EVERY TIME IT S THE MOMENT AND MEMORIES WHICH WE LIVED FOR  I JUST GOT MY SECOND TRANSACTION FROM THE PLATFORM I INVEST WITH  THANK YOU FOR GIVING SUCH A MEMORIES TO CHERISH,10,1
Don t contact  only scamers here,1,
This why you re such a pure soul who always lend his hand with money  I wish the world has more people like you without you  Miner  I wouldn t have setup my business successfully,7,0
 When I taught I couldn t go on any longer  the Miner gave me the strength I needed to keep moving forward  Thank you for always being there for me  even when I m not easy to be there for  You re an helper and I m so grateful to have someone like you in my life  ,11,0
I look forward to a future video titled  How I sold out to crypto  as a tech lead  ,1,0
TO BE HONEST I DON T KNOW HOW YOU MANAGE TO DO SUCH A GOOD JOB EVERY SINGLE TIME  WELL DONE SIR,10,1
What s your take on xrp and hbar   I m own both,2,0
This is my first time watching one of your videos  And I immediately subscribed within the first 10 seconds because of your attitude   We need to start making some money around here     And as I watched  lucky me that I already own all except one of those coins  Time for some pumparoni with those coins ,1,0
This why you re such a pure soul who always lend his hand with money  I wish the world has more people like you without you I wouldn t have setup my business successfully if not for the 5 4BTC I got from you ,11,0
HONESTLY I CAN T IMAGINE WHY ANYONE WOULD DISLIKE THIS  THIS VERY CLEAR AND VERY HELPFUL  KUDOS TO     YOU GOT A NEW CLIENT AND RECOMMENDED FROM ME    SO MUCH SIR,15,0
Cheems inu                  ,1,0
As in advisor investor and partner  I m impressed by the thoroughness and professionalism exhibited by all of the principals  In particular  their depth of knowledge in diverse disciplines as construction  operations and asset management is highly advantageous  Their focus integrity and attention to details make comfortable doing business with the  Miner  name above ,13,0
 Thanks to everyone out there for introducing the miner to me you re such a life saver to us I can t stop appreciating his trustworthy in my life am sure many will have been helped and saved  Me and family are grateful to you once again Sir  ,13,0
This can be done in many ways  As we know teachers are generally helpful  considerate encouraging and forthcoming towards their students  that s how the  Miner  has been so helpful any amazing,13,1
We  follow the fact  correct once it happens we all can see  The problem is we can t predict anything form chart  So far no tools are working  Only trend is your best friend  When it s more than 50  down just buy and wait till it goes up  I learned a lot about buying when there is fear in the market  I use to get shaken out and panic sell but now I buy more when I see the low prices  I started making gains from trading with help of Ray F Johnson   guidance and signals  No chart is needed  All waste of time,5,6
Pulsechain and PulseX   ,1,0
Good picks  I miss AVAX and CRO and maybe some other  For degen TOMB is missing  great opportunity still ,1,0
I m bullish about Saitama ,1,0
Cardano shows potential but I don t get the confusing lingo such as liquidity and scalability   Cashflow and measurability ,1,0
Great informations here   Thanks for sharing,1,0
If only you know what the future says  you ll know that indeed cryptocurrency is the future  investing in it now will be the wisest thing to do  Hold    And you  ll thank yourself,27,34
I remember back in 2016 when I started my journey in crypto  I was warned but today that has been my best decision ever  Pamela Morgan has made a good name for herself  by always ensuring her clients satisfaction is her foremost priority,1,
I met Pamela Morgan last year for the first time at a conference in BELGIUMI  linvested  30 000 and traded in one month  making close to  200 000 ,1,
Many of us don t know where to invest our money so we invest it in wrong places and to the wrong people,1,
Crypto trading is very profitable when you trade well ,2,
Exactly  at the moment bitcoin is the best and profitable coin to buy and invest in ,2,
Investing in cryptocurrency is the best way of getting ahead to build wealth  investing remains a priority  The stock market has plenty of opportunities to earn a decent Payouts  with the rights skills and proper understanding of how the market works  i pray that anyone who reads this become successful in life ,2,
You are right  to be a successful person in life requires him or her of hard work and time,3,
 ETNA and DEVO  ,1,0
Thanks  Love your videos,1,1
most of my coin investments are long term   but if i had to pick one i hold to 10x i would go with jacy its already had impressive gains on the last couple runs     i like your outlook on phantom  also another coin i am planning on getting into with other phantom followed coins    thank you for the awsome video      ,1,0
Trying to make sense of cryptocurrencies can be a bit overwhelming for investors   It s a nascent but promising asset class built on technology that has the potential to disrupt a wide range of industries  For investors  what s probably most attractive is the possibility of life changing returns  Don t worry  you re not late to the crypto party  We re likely still in the very early innings  leaving you with lots of time to put money to work and learn about this burgeoning market  If you re new to crypto then my advise is that you trade with the guidance of an expert  I have learned from alot of Youtubrs  especially my mentor Marisa Nguyen  who taught me how to make trade and increase my portfolio to 17 btc lately ,2,8
Cryptocurrency is now on the rise I m new to Crypto trading and I find it difficult using these strategies well  Where can I find a legit broker  than will manage my account and also teach me how to trade ,17,10
10X  How anout 100X   Jacy will grow like Saitama but actually deliver  Consider this your final notice ,1,1
I think Jacy Token will surprise everyone as a huge gainer in 2022  10x 100x 1000x  Think early days of Saitama early days of Shib,1,1
I thought you were a bitcoiner not a shitcoiner   ,1,1
All for it  TechLead   thank you for sharing your knowledge with us  Can t wait to work remote ,7,1
Nice i hold atom   near  good to hear it Will 10x this year  ,2,1
  ,1,1
Shorting anything that u recomend is the best way to profit,1,0
Good Video  I m kinda motivated by it  but I feel you should make more video pertains how to make wealth,2,0
FTM  DOT and MATIC are the only coins I would spend my USDT in Q1,1,0
SAITO will 100x this year    small cap gem built on DOT ecosystem  SAITO is building Web 3 0 and is the only blockchain that solves the infura monopoly problem  Buying SAITO now is like buying Sol or Matic at under 10cents ,1,0
Hey what do you think of play to earn  Sandbox potential ,1,1
I love your videos   thank you  ,1,0
Self recommended to be the content of your next video,1,1
 Alex Becker              Fake man ,1,
Hello  I m new to Bitcoin  Ethereum and Shiba Inu trade and I ve been making losses but recently I see a lot of people earning from it  Please can someone tell me what I m doing wrong  ,4,1
To expensive most are free where I learn,2,0
Thanks for DeFi secrets  interesting content,1,0
Thumbs up for Kobes Hoodie                     ,1,0
Stop it  the L1 narrative is gonna shift to crypto gaming  Why don t u cover that,1,0
you don t have a video on golang     pls make one,2,0
Please who can recommend me to a professional trader  ,14,19
Nice Content You have here on this Channel  I ve been following your videos  but I still don t have a knowledge on how to trade on Cryptocurrency  what s the best way to get started with trade cos I ve been making my personal research for a while now ,30,12
BTC under 30k by March,1,0
dogelon mars y all  DONT FORGET ABOUT IT   ,1,2
I love your personality TechLead  We have a problem today  Money  We need to start to make some money   goalz ,1,0
Let s get that        ,1,1
Hope doge is on this list    i expect a 20x,1,1
10x  That s it ,1,0
You are one of best,1,0
I m new to cryptocurrency and I don t understand how it really works  Can someone guide me on the right approach to investing and making good profit from cryptocurrency investment ,5,8
Video ends at 7 44,1,0
Pulsechain will 100x or 1000x  A 10x for PLS would be a massive failure,1,0
TechLead was shilling on Cardano 2 Videos ago now he s hyping it up lol,1,0
Thank you so much for making these videos and providing this incredible knowledge  Im  completely new to crypto but im ready to learn and work hard to change my life for the better  Im so done with working for an hourly payed wage  This DIFI concept sounds amazing so thanks again for bringing it to my attention  I appreciate you and I m definitely going to answer the opportunity    ,19,1
  TECH LEAD get outta here man,7,
1  Fantom 2  Glimmers 3  Near protocol  near network 4  Osmosis 5  Cardano,54,5
Thanks  ,2,
Thousands of people have been saved by this platform  I just found out they are worldly known for their trading service  I m glad am also one of those happy investors   ,1,1
Thousands of people have been saved by this platform  I just found out they are worldly known for their trading service  I m glad am also one of those happy investors   ,1,0
This is the most useful video you ve done  Good to see you ve returned to practical tips,1,0
Unfortunately this is not  as a millionaire   ,1,0
 there is a bug on binance with exchange rate    auto exchnage to x10 price on btc eth pair    i posted a video  ,261,0
Thank you   for the fantastic job you have been doing for my family lately  Your hard work and dedication has really helped us out during a difficult time in our home  We just wanted to make sure you know  how much you are valued and appreciated,3,1
Thank you   for the fantastic job you have been doing for my family lately  Your hard work and dedication has really helped us out during a difficult time in our home  We just wanted to make sure you know  how much you are valued and appreciated,3,0
You ve been so helpful    Is there anything I can do  to let the world know how trustworthy you are this has been a challenge for me and my family since we got the 10BTC we love your service    ,4,0
You ve been so helpful    Is there anything I can do  to let the world know how trustworthy you are this has been a challenge for me and my family since we got the 10BTC we love your service    ,4,0
You ve been so helpful    Is there anything I can do  to let the world know how trustworthy you are this has been a challenge for me and my family since we got the 10BTC we love your service    ,4,0
    This team are such a light  Thank you for brightening my views when all I could see was darkness  you re such a special Angeles sent to me and I m so incredibly lucky to call you my friends  thanks for the 3BTC ,6,0
    This team are such a light  Thank you for brightening my views when all I could see was darkness  you re such a special Angeles sent to me and I m so incredibly lucky to call you my friends  thanks for the 3BTC ,6,0
    This team are such a light  Thank you for brightening my views when all I could see was darkness  you re such a special Angeles sent to me and I m so incredibly lucky to call you my friends  thanks for the 3BTC ,6,0
With the unexpected    expenses that came up recently I didn t know what I was going to do  You re financial help saved me from having to take on more Debt that would have been difficult to repay  I am indebted to you for your generosity,9,0
With the unexpected    expenses that came up recently I didn t know what I was going to do  You re financial help saved me from having to take on more Debt that would have been difficult to repay  I am indebted to you for your generosity,9,0
With the unexpected    expenses that came up recently I didn t know what I was going to do  You re financial help saved me from having to take on more Debt that would have been difficult to repay  I am indebted to you for your generosity,10,0
This why you re    such a pure soul who always lend his hand with money  I wish the world   has more people like you without you I wouldn t have setup my business successfully if not for the 4 2btc I got from you  ,11,0
This why you re    such a pure soul who always lend his hand with money  I wish the world   has more people like you without you I wouldn t have setup my business successfully if not for the 4 2btc I got from you  ,10,0
Since the day I started      flipping with you  I know I ve changed a lot that really helped me to become a better person inside and out  you re one of those reasons why I m always trying my best  thank you so much you know I really appreciate in so many ways ,13,0
Since the day I started      flipping with you  I know I ve changed a lot that really helped me to become a better person inside and out  you re one of those reasons why I m always trying my best  thank you so much you know I really appreciate in so many ways ,11,0
Since the day I started      flipping with you  I know I ve changed a lot that really helped me to become a better person inside and out  you re one of those reasons why I m always trying my best  thank you so much you know I really appreciate in so many ways ,11,0
Honestly   I can t imagine why anyone would dislike this dude  this is very clear and very helpful  kudos man  on the name above  you got a new shout out and recommended from me  thank you very much    ,23,2
Honestly   I can t imagine why anyone would dislike this dude  this is very clear and very helpful  kudos man  on the name above  you got a new shout out and recommended from me  thank you very much    ,18,1
My life has been        of so much value to me since I met Mr Michael  he gave me hope with his words and then gave me results  I never believed it s possible to have withdrawals after being scammed several times  but he helped me get withdrawal without asking me for any extra fee at all  thanks you so much sir for making me and my family smile again ,14,0
My life has been        of so much value to me since I met Mr Michael  he gave me hope with his words and then gave me results  I never believed it s possible to have withdrawals after being scammed several times  but he helped me get withdrawal without asking me for any extra fee at all  thanks you so much sir for making me and my family smile again ,16,0
My life has been        of so much value to me since I met Mr Michael  he gave me hope with his words and then gave me results  I never believed it s possible to have withdrawals after being scammed several times  but he helped me get withdrawal without asking me for any extra fee at all  thanks you so much sir for making me and my family smile again ,14,0
When life hits you    hard go harder your success is not based on a man decision it s based on your actions and those actions got consequences it s either good or bad so it s up to you thank god I make the right I doubted you at first ,16,0
When life hits you    hard go harder your success is not based on a man decision it s based on your actions and those actions got consequences it s either good or bad so it s up to you thank god I make the right I doubted you at first ,16,0
I m so excited    for recommending this great team  no one really does it better than this team  kudos to your work keep it moving  you re real and trustworthy you re the savior ,18,0
I m so excited    for recommending this great team  no one really does it better than this team  kudos to your work keep it moving  you re real and trustworthy you re the savior ,18,0
ADA will most likely take off on the second half of the year when all the scaling solutions go live  I m def holding a nice ADA bag and staking it to sell potentially next year ,10,1
This website above     more respect to you platform they re accurate and legitimate is   they lived up to my expectations and fulfill their tasks  I m grateful to him ,19,0
This website above     more respect to you platform they re accurate and legitimate is   they lived up to my expectations and fulfill their tasks  I m grateful to him ,19,0
This     can be done   in many ways  as we know teachers are generally helpful  considerate  encouraging and forthcoming towards their students  that s how he has been so helpful and amazing   god bless you so much    ,22,0
This     can be done   in many ways  as we know teachers are generally helpful  considerate  encouraging and forthcoming towards their students  that s how he has been so helpful and amazing   god bless you so much    ,22,0
This     can be done   in many ways  as we know teachers are generally helpful  considerate  encouraging and forthcoming towards their students  that s how he has been so helpful and amazing   god bless you so much    ,20,0
I m honored to have    this team around me in this hard time  thank you always supporting and helping me to get Bitcoin easily  I really appreciate,21,0
I only      wanted to give it a try but surprised me beyond my expectations  Thank you sir   I received the coin as promised  ,22,0
I only      wanted to give it a try but surprised me beyond my expectations  Thank you sir   I received the coin as promised  ,18,0
Jacy would be my pick for 10x and beyond  The new dev s took it over and it has migrated to V2  it is definitely worth looking into ,28,5
Yooo  I just invested  I m super excited and believe it s going to take off  The community is the best I ve been in too ,1,
Best team and community out there What the Devs say that do love JACY,4,
1000  nice to see other Jacy holders here,6,
Agreed 100   Jacy       ,8,
I second that  Never been more bullish I a token than Jacy  highly recommend looking into it  ,8,
At this point  we should all take advantage of the dip  The fact is  NFTs   BTC is the future of crypto and the question most traders ask themselves is   if this is right time to invest  I feel those who would allow the market dynamism to determine when to trade or not are either new in this space in general or probably just na ve  the sphere have seen far worse times than this  enlightened traders continue to make good use of the dip and pump even acquiring more equities towards trading sessions  I d say that more emphasis should be put into tradng  since it is way profitable than hodling  Trading went smooth for me as I was able to raise over 19 BTC when I started at 2 BTC in just 5 weeks of implementing trades with signals and insights from Astra    I would advise you all to trade your asset rather than hodl for a future you aren t sure about  Say hello to Astra for a fix  You can reach Astra on  eI    m Astracryptotal,54,0
Happy new year   thanks for watching  Don t forget to hit the subscribe button WhatsApp              ,1,
I make huge profits on my investment since I started  trading with stellakatrina  her trading strategies are top notch,1,0
I feel there are more to this market than we know  Ask for a proper guidance before investing in this pretty much complicated market  I ve made over 38 b tc from an allocation of  5 b tc over the last 8 months using Kevin Cischke s help  Things might get worse so just make the smarter move ,105,8
I am a bit of skeptic  but know a lot of aspects about BTC  So  let s make few things straight   BTC is an investment asset   like gold  it s scarce  but it s easier to acquire it and big players like pay pal and grayscale are holding it  same with a lot of banking institutions  hedge funds and masses of people ytSelf host wallet btc owner whales have a hard time selling it without doing KYC and in some cases  this can wreck them financially  People lose access to their btc wallets which makes that btc frozen for all time  The Hype and FOMO is on the rise and most people only buy and hold with btc  I mean you have to understand that normal stock market fundamentals don t apply here  It s not a 2017   2018 scenario  The regulation added to BTC can actually even make it more desirable although have a minus   Basically  anything that could stop the mooning of btc imo would be extreme regulation restrictions and also better investment opportunities discovered by btc owners  However   it s is best advice you find a working strategy daily signals that works well in other to accumulate and grow a very strong portfolio ahead  I have been trading with Rawlings Smith daily signals and strategy  him guidance makes trading less stressful and more profit despite the recent fluctuations  I was able to easily increase my portfolio in just 4weeks of trading with Rawlings Smith daily signals growing 1 5 BTC to 6 7 BTC  His daily signals are very accurate and yields a great positive return on investment and is available to give assistance to anyone who love crypto trading You can reach Rawlings on           Rawlingsmith   OrR What      447868765279,1,0
do you now Raccoon      RAC,1,0
 and if they don t  they re going to print more tethers to assure that  lol,1,0
You forgot YesOrNo  YON    big project and big team  Decentralized bets,2,0
Your need to do your research on Oasis Network  Rose,1,3
99  of the people who made it in crypto  rose from the ashes of a 3 year bear market  real traders pray for real bear market because it is called shopping time ,4,5
A real bear market is exactly what I m hoping for by having the opportunity to buy the real dips on good project  I am looking at investing in something solid for long term  have about  35k sitting in my saving  what do you think i should be buying ,1,
will always be grateful to Marion clark I was only a newbie trader when I met him last year October  Now I m more informed and experienced in the trading aspect of bitcoin  earning more than 1 9 btc every 2 weeks    ,62,8
can you please help me with Morion Clark info ,1,
Love these videos ,2,0
I wish you will cover Shiba Inu,1,0
Cryptocurrency is now on the rise  I m new to forex and i find it difficult using these strategies well  Where can I find a legit broker  Than will manage my account and also teach me how to trade ,4,1
Yieldly is the best Defi ,1,0
Great unbiased info  Thanks bud ,3,0
VET  HBAR  QNT  XRP  EWT,1,1
Im bullish on CRO ecosystem,1,0
Wanna buy my tulips   ,1,0
Really enjoy your videos  Thank you,1,0
Hi  Thanks for the video  Can t agree more on your choices especially with the cardano  Cardano will be like the iPhone in the phone industry  Quality  However few days ago you mentioned that cardano won t make it this year and now you changed your view on that  I also wonder if you know the real reason why sundaeswap announced there will be delays with transactions  Or could you make more research on that as well  There is a really good reason to launch the Dex slowly  Security is the first one ,1,1
If only you know what the future says  you ll know that indeed cryptocurrency is the future  investing in it now will be the wisest thing to do  Hold    And you  ll thank yourself,1,1
Dude you are great,1,0
I like your videos  They are easy for me  a beginner  to understand    teach mee    ,1,0
REEF Finance will save your portfolio and make millionaires in the bull recovery ,1,0
Hey nice mug but  you should get yourself a Moomin mug,2,0
hi there Patrick   love your crypto content   as a programmer and as a crypto enthusiast   can u give a review  over truebit    it suppose to has a good tech   but they seem not to do much   can u give me your honest opinion,1,0
Thanks for the video  I bet Altbase token  ALTB will be one of the best cryptocurrencies in 2022 guys ,2,0
I lost  65000 dollars buying into your million coin ,1,0
  I totally agree with what you are saying      The fact is  BTC is the future of crypto and the questions traders ask themselves now if this is right time to invest  before jumping into conclusion i think you should take a look at things first  for the past few days the price of BTC has been fluctuating which means the market is currently unstable and you cant tell if it is going bearish or bullish  while others still continue to trade without the fear of making lose  others are being patient  it all depends on the pattern with which you trade and also the source of your signals  i would say trading has been going smoothly for me  i started with 1 5 BTC and i have accumulated over 13 6 BTC in just three weeks  with the trading strategy given to me by expert trader Joseph Michael    ,52,9
please  some one  write a list from his video  Top 5,1,0
Are you insider trading ,2,0
