Comment,Likes,Reply Count
   NEW  Join me in DeFi Pro and make passive income with crypto  http   defipro dev    Check out https   defipro dev   a new online course on decentralized finance    Million Crypto Official  https   milliontoken org ,63,35
 Madie Zancanellatl INVEST YET,1,
I m new to crypto investment how do I get started with a professional ,1,
REAL   ,1,
IREAL   ,1,
 TechLead Your RATE OF SPEECH is fantastic  Finally  someone on Earth who speaks fast enough    In your future  you will send a FEELING   IMAGE  telepathy  for 50x info transmission speeds with greater accuracy   and that will be even more satisfying  But you ll learn more about that later  Peace    ,1,
You might want to look into comment moderation   Threads are popping up like mad here that are spammers replying to spammers to promote some trade or another ,6,
 techlead whats your opinion on solana for defi  Solend  francium  orca  solfire etc ,1,
But for real do I need to web 3 devpro cause I ll web 3 the f out of it if need be,1,
Cronos  MMFinance is where it s at  DeFi   NFTs with utility  Great team  solid roadmap  excellent rates  Really enjoy your content ,2,
I feel sad for Solana   t really has some cool project  but nobody wants to  nvest  n,1,
Thank you for the video ,1,
Stock market gonna crash  ,5,
Have you heard of reef finance ,6,
I can t stop thinking about the irony and insanity of Elon Musk becoming the richest person in the world why they individual who has spent  20billon,18,22
NICE VIDEO      PLSI HAVE INCURRED SO MUCH LOSSES TRADING ON MY OWN   I TRADE WELL ON DEMO BUT I THINK THE REAL MARKET IS MANIPULATED    CAN ANYONE HELP ME OUT OR AT LEAST TELL ME WHAT I M DOING WRONG ,6,3
INVESTING IN CRYPTO NOW IS VERY COOL EXPECIALLY WITH THE CURRENT RISE IN THE MARKET  ACT NOW ,50,161
As you can see we are already in April and I feel those who would allow the market dynamism to determine when to trade or not are either new in space in general or probably just na ve  the sphere have seen far worse times than this  enlightened traders continue to make good use of the dip and pump even acquiring more equities towards trading sessions  I d say that more emphasis should be put into trading since it is way profitable than holding  Trading went smooth for me as I was able to raise over 9 2 BTC when I started at 3 5 BTC  in just few weeks implementing trades with signals and insights from Ryan Donald s would advise y all to trade your asset rather than hold for a future you aren t sure about ,112,16
Bitcoin should be transparent and it is not as as people thinks it is  there are so many strategies to be learnt and unfolded about bitcoin trading ,1,
 Easter Lota All you need as a beginner to make good profit from Bitcoin is a professional trader who will trade on your behalf else you may make losses,1,
 Henry S  Russell thanks you  for the opportunity and recommendation,1,
  Orr tele   gram   ryan trading,1,
 Easter Lota   Orr What sapp 14382661548      ,1,
His success stories are everywhere  How can i reach him ,1,
The fact that i got to learn and earn from his program is everything to  me think about it  it s a win win for both ways  Ryan Donald is the reason behind my success story ,1,
 Rosie Achilles Bitcoin will continue to  go higher than expected and the best thing to do is to inIvest with any amount of capital  with Ryan Donald  you will accumulate more bitcoin ,1,
  Very much true  The man just know how and when to flip always to generate good gains  Ryan Donald  is such a Great personality ,1,
 Leesa Halik Building a good investment portfolio is more complex so I would recommend you seek Ryan Donald support  This way you can get strategies designed to address your unique long short term goals and financial dreams ,1,
Bitcoin should be transparent and it is not as as people thinks it is  there are so many strategies to be learnt and unfolded about bitcoin trading,1,
Thanks for continuous great videos  I feel those who would allow the market dynamism to determine when to trade or not are either new in space in general or probably just na ve  the sphere have seen far worse times than this  enlightened traders continue to make good use of the dip and pump even acquiring more equities towards trading sessions  I d say that more emphasis should be put into trading since it is way profitable than hodling  Tradlng went smooth for me as I was able to raise over 9 BTC when I started at 1 5 BTC  in just 6 weeks implementing trades with signals and insights from  Eugene signal  I would advise y all to trade your asset rather than hodl for a future you aren t sure about   reach him on his telegram handle  Eugenesignal,1,2
GuildFi  GF  is a hidden gem that can make 100x in next bull run      Binance and Coinbase just invested millions in the project      Follow the money       ,1,2
Best channel on the web  This guy is amazing  Love the content  attitude  and wardrobe  Excellent content and not complicated for a novice like me I came here to learn how to trade after listening to a guy on radio talk abou the importance investing and how he made  70 000 in 4 months from  16k  Somehow this video has helped shed light on some things  but I m confused  I m a newbie and I m open to ideas ,142,38
Please I need someone to help me trade or invest the forex or crypto market because I m tired of trading in losses myself  I ve blown my account twice and it s frustrating   ,12,5
GuildFi  GF  is a hidden gem  Can possibly make 10 20x in next bull run    ,1,2
 NICE VIDEO       I HAVE BEEN TRADING FOR MONTHS NOW  I KEEP MAKING MORE LOSS TRADE WRONG COINS PLEASE I NEED SOME KIND OF ASSIST OR ADVICE ON WHAT TO DO ,4,3
HDX of Hydranet has a chance too  staking it comes with such a high compound interest ,1,1
But i am bullish on  Lunafi    Biggest excitement is on LunaFi   LFI  which will launch this Q2  Promises an insane 150   APR    Lunafi  Safe Secure transparent defi Betting platform,1,0
 When it comes to the world of investing  most people don t know where to start  Fortunately  great investors of the past and present can provide us with guidance ,119,69
Her strategies are really good for beginners  I have been attending her online tutorial and it has helped me greatly,1,
 Amina Mohammed Adamu Of course  you can  They re different packages  I started with 2btc and I m earning massively right now,1,
Seeing this here really excites me because she taught me how to trade with her strategic signals to earn more and I grew my BTC from just I to 3 8BTC in my account in 13days,1,
 Ran Benjamin This is helpful for my situation   I will try her but Do you know how much is ok for a start ,3,
 Zakir A  Waseem Thanks for the opportunity  I look forward to hearing from her soon,1,
 Qwin Savage This is her contact info below  ,2,
 Zakir A  Waseem I m interested  Please Zakir  how and where can I do this,1,
 AbdulRasheed Hussein  I do trade with her and I made huge profits over   2btc and still counting ,1,
 Kayos LaRock Well I make 8 950  at the end of each trade cycle depending on what I put in and it has been good so far,1,
  ,1,2
Always feel  better after watching your daily streams  thank you  Wish I could make the Bitcoin conference but I can t  Keep up the good work  Bitcoin showed signs of wanting higher levels still on March 23 as Wall Street trading saw a return above  42 000  I really appreciate the fact that everyone is becoming more aware of digital assets and I no longer have to leave my house or stress myself to earn  More attention should be paid to day trading as it is less afflicted by the unforeseeable of the market  Ive made over 9 05 BTC from day trading with Grayson Miles insights and trade signal in few weeks along with the people around me  Utmost success with Grayson day trading signals buffering,40,8
The Crypto space is a very sensitive zone  It took me 2 months to learn the perks of trading the right way but I had to get help from mr Grayson daily signals,1,
people still believe the only benefit from crypto is get hold to it  BTC trading is the real deal  I am happy I ve started learning and earning from Grayson Miles daily signals for two months,2,
Funny Grayson is reliable and responsible to trade with  i was able to grow up my BTC from 0 59 BTC to 4 2BTC in four weeks  ,1,
Mr Grayson is my favorite when it comes to trading BTC  honest and straight to the point,2,
I agree Grayson Miles is top notch as I ve been using it since January to cash out steadily between the price swings ,1,
I ll agree with you because I ve used his strategy in the past and was able to raise a total profit of 10 5 BTC in 6 weeks ,1,
  ,1,
Hello guys I have been watching some video and I was thinking about investing in bitcoin Crypto currency but still don t know where to start from ,6,2
HELLO  I M NEW TO CRPTO AND FOREX TRADING AND I HAVE BEEN MAKING HUGE LOSES TRADING ON MY OWN BUT RECENTLY I SEE A LOT OF PEOPLE EARNING FROM IT  CAN SOMEONE PLEASE GIVE ME A NEW STRATEGY OR AT LEAST TELL ME WHAT I M DOING WRONG ,73,32
nettes Video  bitte  was ist der beste Weg  um mit dem Kryptohandel anzufangen  denn ich habe jetzt schon eine Weile meine pers nlichen Nachforschungen angestellt und wei  immer noch nicht  wie ich anfangen soll ,13,11
Investing in bitcoin Forex and some other selected cryptos is the best investment anyone can do this year 2022  Because bitcoin  ethereum  crypto  and Forex investment has made a lot of people millionaires    i have witnessed a colleague become a millionaire   ,3,2
Hello what s the best way to get started with trade cos I ve been making my personal research for a while now,4,2
Nice one here you re right  though I prefer trading with the help of a professional trader  I believe it saves me time and reduces the crypto risks involved in managing my trades  ,30,4
These comments here are absolutely nuts lol,1,0
I came here to learn how to invest in Crypto after listening to a guy on radio talk about the importance of investing and how he made  125 000 in 3 months from  36k  somehow this video has helped shed light on some things  but I m still confused  I m a newbie and I m open to ideas ,73,29
Kyl Babydoge Aquagoat Little Rabbit Kishu inu,1,0
I feel  those who would allow the market dynamism to determine when to trade or not are either new in space in general or probably just na ve  the sphere have seen far worse times than this  enlightened traders continue to make good use of the dip and pump even acquiring more equities towards trading sessions  Bitcoin is a volatile asset  and in times of uncertainty  harnessing that volatility which is usually a feature  not a bug  Bitcoin price usually undergoes long term consolidation phases  Although trading range bound price action can be rather tricky  the longer the stagnation period  the more bullish Bitcoin gets  Trading went smooth for me as I was able to raise over 8 4 BTC when I started at 2 7 BTC in just a few weeks implementing trades with signals and insights from Rico Alan  I would advise y all to trade your asset rather than hodl for a future you aren t sure about or hold it and risk losing all   ,1,0
Didnt u just learn about crypto not to long ago  Guess ur an expert now giving advice  jokes lol hahahahahahaha ,1,1
Options trading is the future investment  investing in it will be the wisest thing to do especially with the current rise,34,34
Only bots in the comments,1,1
Successful people don t become that way overnight  What most people see at a glance wealth  a great career  purpose is the result of hard work and hustle over time  I pray that anyone who reads this will be successful in life,46,27
Please make a video on GMT token ,1,0
this video is brought to you by  myself  that is BOSS,1,0
Most coins are going to 10x this Year  The recent bitcoin correction down from its alltime high has had themarket in a panic in the past week However noteveryone has seenit as a bad omen The digital asset s price had gone down below  50 000 causing investors to believe the bear market ,87,8
If you believe in the future  you understand that crypto becomes the future value despite fluctuations  so I m glad I started investing in crypto and I m still getting good returns ,4,6
We work for years to have    1million  while some people I know put thousand of dollars in some meme coins and they are millionaires ,1,22
To those who would allow the market dynamism to determine when to trade or not are either new in space in general or probably just naive  the sphere have seen far worse times than this   enlightened traders continue to make good use of the dip and pump even acquiring more equities towards trading sessions  I d say that more emphasis should be put into trading since it is way profitable than holding  Trading went smooth for me as i was able to raise over 9 2 BTC when i started at 1 5 BTC in just a few weeks implementing trades with signals and insights from Elias Greyson cooper fx   i would advise y all to trade your asset rather than hold for a future you aren t sure about or hold it and risk loosing all,152,59
HELLO  I M NEW TO CRPTO AND FOREX TRADING AND I HAVE BEEN MAKING HUGE LOSES TRADING ON MY OWN BUT RECENTLY I SEE A LOT OF PEOPLE EARNING FROM IT  CAN SOMEONE PLEASE GIVE ME A NEW STRATEGY OR AT LEAST TELL ME WHAT I M DOING WRONG ,68,44
I will advice you should stop trading on your own if you keep losing and start trading with  Kathy trading services ,1,
The easiest way of all to earn money from your crypto may be to deposit your funds into a platform that offers you an annual percentage yield  APY  on the money you hold on their platform  This is similar to depositing money into a savings account at a bank that gives you an annual percentage return on what you hold in your bank account,7,5
Have a video on the community that s so active because of revolutionary technology     Hype without false promise   RISE  EverRise     The entire team is identified and verified  and the project is a legitimate company  This is not a funny family business ,1,0
Great stuff  I watch several youtube videos on how to trade in the crypto market but haven t made any headstart because they are either talking some gibberish or sharing their story of how they made it and I do not want to make mistakes by taking risks in my own hands,88,10
Telegram,1,
The best strategy to use in trading is to trade with a professional who understands the market quite well  that way maximum profit is guaranteed  I highly recommend sara camilla  she is my current trader and her strategies are working,3,
So many SCAMMMS in the comment    wth,1,0
 looking closely at the longer term market may put bitcoin s current price difficulties in perspective  but it offers little help in predicting its future trajectory  Analysts remain divided over whether this is the end of a so called  dead cat bounce  within a bear market or if it is just a blip on the way to new all time highs in 2021  Either way  the price fluctuations are to be expected  that is why it is reasonable to trade with the guidance of an expert  Since October last till now I have accumulated up to 12 BTC with exclusive tips from Boaz Colson ,90,6
I m new to crypto trading what s the best way to get started with trade cos l ve been making my personal research for a while now I don t know how to trade on cryptocurrency,12,26
Please can someone tell me how best to do this because I m loosing a lot of money,1,
I have never seen a man so genuine as this guy  he s really a man of his words ,2,0
I have never seen a man so genuine as this guy  he s really a man of his words ,1,0
Have you looked at Jupiter and Metis messaging I am new to crypto and would appreciate your comments,1,0
Expert ALBERT RENSHU he s legit and his method works like magic  keep on earning every single week with he s new strategies,186,45
If there is one thing I have learned recently about  cryptocurrency is to remain calm  especially when it comes to Bitcoin  Learn not to sell in a panic when everything goes down and not to buy in euphoria when everything goes up  It took me years to truly feel comfortable charting and it s not really something you can take a class to learn so many times emotion comes into play  the true successors of day trading are the non emotional investors with small consistent strategies goals  I advise y all to forget predictions and start making a good profit now because future valuations are all speculations and guesses  The market is not predictable and you can not tell if it s going bearish or bullish  While myself and others are trading  without fear of making  loss others are being patient for the price to come up  It all depends on the platform  you trade with  I was able to make 1 6BTC from 0 3BTC  by implementing trades and  information  from Mr Christian   he guild and  trade for  newbie who don t understand how trading  work  You can  reach him on Tele gram    christian uk for any crypto info ,3,1
I m new to crypto and I find it difficult using these strategies well  Where can I find a legit broker  than will manage my account and also teach me how to trade ,4,3
Hey can u help me with defi,2,2
Thanks for making this video that I finally understand the options trading  options trading has really transform a lot of people  making money make me live a luxury life and give my family the best,43,40
Can someone actually make a living from bitcoin,1,
Money is a problem that everyone has for a better and luxurious life  life was hard for me until I started Bitcoin and now I m making  9 500 per week ,21,12
What do you think about OGN  Saw it rise in the last 2days  Their DeFi product OUSD is doing well too,1,0
No banking coins on the list  ,1,0
Success is about focusing your energy on what creates results and using what already know,38,59
 Egbebuike ginika Her contact details ,1,
You can start with as little as you can afford,1,
You can reach her here   tell her I referred you,1,
 Matt Davis I have been earning with her new strategy it works like magic  ,4,
Assets that can make you rich   1 Crypto   2 Stock   3 Shores  ,8,
 562 for Defi community  Seems a little steep but you do you ,1,1
HODL CRO,2,1
Thanks for making this video that I finally understand the options trading  options trading has really transform a lot of people  making money make me live a luxury life and give my family the best,18,20
Nice work  are you part of the hbar giveaway w Wayne ,1,0
I think it is 100k hbar or a car Wayne Dreadski is giving ,1,1
I wanted to trade crypto but got confused by the fluctuations in price  ,17,16
She is an expert in the field also helped me with my investments,1,
Thank you for your analysis  You shared an interesting idea zooming out the chart but do you think that the fundamentals and trends on the global financial market will make this scenario come true  If FED increases the interest rate the forecast for BTC is not so positive  unfortunately  I am curious about your thoughts on this topic ,53,12
I just keep getting the feeling that non traders will definitely regret at the end of 2022,127,31
Thanks for making this video that I finally understand the options trading  options trading has really transform a lot of people  making money make me live a luxury life and give my family the best,1,0
Most people venture into investments to be a millionaire meanwhile I just want to be debt Free,52,33
 Mbali Maka Catherine S  Woods,2,
Which of these assets can I invest in Bitcoin Stocks Real estate,7,
 I genuinely appreciate your  incredible withdrawal service thanks for a job done well by the above name,1,0
Success doesn t just happen   you need to be deliberate   committed and focused   Do not be a passenger in your own journey towards your desired success   Bitcoin trading serves as a short term investment which can provide a second consistent source of income   its Lego s and also most reliable wealth creation ,3,2
Building wealth involves developing good habits like regularly putting money away in intervals for solid investments  The stock market has plenty of opportunities to earn which I myself took advantage of  I made my first million from going diverse  mainly ETFs stocks  bonds etc   bitcoin  and gold  Investing in any of these should be in everyones mind ,63,25
Nice content  I m not a fan to saving my crypto assets  I simply trade them to make gains    say  500 on daily basis  and thanks to Mr Ryan who happens to be the one behind my success in this,48,8
Hello  I m so confused at my losses at this point  I really need help,1,
Investing in cryptocurrency have made a lot of people successful in life through forex option trade but i pray that anyone who read this because successful in life not only in life but become successful through forex option trade,1,0
Hello  I m new to Biticon trade and I ve been makin losses but recently I see a lot of people earning from it  Please can someone tell me what I m doing wrong,79,17
I earn  2 000 with every  500 I invest every 7days ,1,
STARTING EARLY IS THR BEST WAY OF GETTING AHEAD TO BUILD WEALTH  AND INVESTING REMAIN A PRIORITY  THE STOCK MARKET HAS PLENTY OF OPPORTUNITY TO EARN A DECENT PAYOUTS  WITH THE RIGHT SKILLS AND A PROPER UNDERSTANDING OF HOW THE MARKET WORKS ,38,40
Is only an expert who can identify Where Price Forms A Narrow Channel  I mean sometimes you see on your forex chart the price is neither going up nor down that can do what she s doing now ,1,
 Ndah Festus  I need an expert who I can trust and trade my money for me ,1,
Bitcoin will soon hit the moon  there people would be kicking themselves in few weeks should they miss the opportunity to buy and invest in Bitcoin ,1,
I heard there are Expert who knows how to forecast the   very well,1,
Nice video  not that we know it all  like someone rightfully said  it is not employee   problems  but when you have just one income source  what do you expect    That is why I have decided to start investing in crypto  I do not   know how to begin yet  I need advice from professionals ,203,8
 I believe this future is now and we all need to find a way to adapt to everything that s going on  I would really like to be kept updated so any sort of help is great ,449,4
 I believe this future is now and we all need to find a way to adapt to everything that s going on  I would really like to be kept updated so any sort of help is great ,1,4
 Everything here in the video is actually real and quite easy to do   but the real hassle comes in finding the right person for it ,1,4
 Outstanding   I knew it would be resourceful I just didn t know how much   I think I am finally ready and would appreciate any sort of help ,491,4
 Outstanding   I knew it would be resourceful I just didn t know how much   I think I am finally ready and would appreciate any sort of help ,2,4
 This is something I find very intriguing and keen to look into   my cousin tells me a lot about it but It doesn t change the fact that I am a newbie   I need to learn guys ,505,4
 This is something I find very intriguing and keen to look into   my cousin tells me a lot about it but It doesn t change the fact that I am a newbie   I need to learn guys ,3,4
There are actually real ways to make gains from this you just have to find the right person to guide you and all that  it s really helpful though,489,4
There are actually real ways to make gains from this you just have to find the right person to guide you and all that  it s really helpful though,4,4
 I found out if you want to be really successful in this you need to find someone who really understands the in and out of how it all works ,501,4
 I found out if you want to be really successful in this you need to find someone who really understands the in and out of how it all works ,5,4
 Do you know it s actually possible to make and earn enough even while staying at home  ,442,4
 Do you know it s actually possible to make and earn enough even while staying at home  ,6,4
 I will forever be in depted to you    you ve changed my life I ll continue to preach about your name for the world to hear   you ve saved me from a huge financial debt with just little investment  Thanks Mercy Greg ,2,0
This days so many bots in the comments section it hard to find the Experts trader   But thank god I keep on getting  7 000 every week from a new trading platforms in town that s success,5,4
                  I ve always believed in him and all his jobs have always been successful  But this time he blew my mind by getting me 3 5btc ,1,0
When investing for your future  make sure you invest in the right place  Invest with Mr Corey if you want to succeed in trading  Don t take this for granted because so many investors are now millionaires  Mr Corey is very reliable  he pays when due without stress and I can stand for that because i ve not recorded any loss trading with him for over 2months now ,24,0
I would like to express my respect and appreciation for this bright man  who brought outstanding contribution to the growth of my business  Mr Corey is absolutely accurate with all his tradings  he will always give his clients the best results using complete profit oriented strategies  Within a week s trade you will be able to talk about his competence  He has my highest recommendation  You can start up with him towards a rewarding trading adventure ,25,0
In all my years of trading and research  the most valuable insight and decision I made was getting in touch with an expert trader  Mr  Alex Valentino and  ever since I started investing with him   I made more profit than ever before  I will recommend him as one of the best trader in the market  feel free to contact him   Orr What sapp 14089060227       ,236,9
 I will forever be in depted to you    you ve changed my life I ll continue to preach about your name for the world to hear    you ve saved me from a huge financial debt with just little investment  Thanks Mercy Greg ,44,8
