Comment,Likes,Reply Count
You can Reach her on   Te Ie gr am   with the name below   Mercy Greg,4,
Great video  You ve reminded me of what someone once said   The mind is the man  the poor is in it and the rich is it too  ,11,9
I remember when I just got into crypto back in 2017 but later in 2018 I ended up selling it because I was dumb and I didn t understand it  I studied and learned and now I know how it works  Got back into crypto early in 2021 and looks like we have the same mentality  I admit that seeing a  50  hurts but it s not a realized loss until you sell  Now   I buy and just trade long term more than ever  I have made over 23  btc from day trading with kathleen rife Signal in few weeks  this is one of the best medium to backup your assets incase it goes bearish ,56,11
The Market is constantly in a state of uncertainty and flux and money is made by discounting the obvious and betting on the unexpected  Mr Corey Services is your best bet  he is efficient and trustworthy  he has the best strategies and softwares to ensure a successful investment ,20,0
Mr Corey is my financial blessing  before I met him I used to struggle financially  I couldn t hold a job and I had incurred debts  but ever since I started trading with Mr Corey  he has helped me get out of all my debt and I still have a healthy bank account  Am forever grateful to him  I just received my profits from the investment i made last week  He is the best  This can be your testimony too ,21,0
Never stop investing  Never stop improving  Never stop doing something new  trading without enough knowledge isn t the best thing to do  trade with a professional like Mr Corey to earn you lots of funds weekly ,17,0
The best way to find that balance between saving and living is by investing  This way you get   to have your saving intact and then live comfortably off the revenue coming in from   your investments  Financial freedom is possible  you just need to know   what to do and when to do it  I am a living testimony ,199,11
INVESTING IN CRYPTO NOW IS VERY COOL EXPECIALLY WITH THE CURRENT RISE IN THE MARKET  ACT NOW ,78,79
I ve lost quite a good number of coins in the current dip I Just hope I find a way to recover from such a massive loss,10,9
Saving bitcoin is not a bad idea but trading bitcoin earn you more    I have lost over 5k worth of bitcoin with the current dip,52,30
I thought of investing in bitcoin Mid last Year but was discouraged with the rise and fall of bitcoin now it s 2022 the beginning of a new year I don t know if it s safe to invest now,1,
I will suggest you make your research properly before venturing into it but I will tell you that is a good investment everyone is thinking of right now ,1,
Having monitored my portfolio performance which has made a jaw dropping  474k from the past two quarters alone  I have learned why experienced traders make enormous return from the seemingly unknown market ,1,
It is possible to produce superior performance provided you do something different from the majority,1,
That s an awesome idea a good trading system would put you through many days of success ,1,
Decent Video    Extremely captivating from the beginning as far as possible  in any case business and venture are the most ideal way to bring in cash regardless of the current circumstance of the economy,88,10
Honestly     I can t imagine why anyone would dislike this dude   this is very helpful   kudos man on the name above you got a new shout out and recommended from me   thank alot    ,1,0
Excellent video  New subscriber  ,1,1
This video is brought to you by  my self   love it ,2,0
shiba  wink  bttc  icp  spell 2024 25 top price good luck,2,0
Hello everyone  I m actually looking for a good trader that can help me trade and make good profit    But it very hard to see trusted one  Any idea ,10,7
I HAVE INCURRED SO MUCH LOSSES TRADING ON MY OWN   I TRADE WELL ON DEMO BUT I THINK THE REAL MARKET IS MANIPULATED    CAN ANYONE HELP ME OUT OR AT LEAST TELL ME WHAT I M DOING WRONG  ,6,2
When it comes to the world of investment  most people don t know where to start  Fortunately  great investors of the past and present can provide us with guidance,2,1
Money is one of the biggest problem ,1,0
hello I m new to Bitcoin trade and I ve been making few loses  but recently I saw a lot of people earning from it  can someone please give me a new strategy or at least tell me what I m doing wrong ,29,18
The best decision I ever made in my life was investing in the crypto market  Trust me guys  it really pays a lot   ,84,30
Is Brian Davis located in the states,2,
How do i get Intouch with Brian Davis,2,
 How To Get Rich With Bitcoin Even If  You Have No Clue About Technology ,1,0
Starting early is the best way of getting ahead to build wealth  investing remains a priority  The stock market has plenty of opportunities to earn a decent payouts  with the right skills and proper understanding of how the market works ,17,25
I hate the bot comments,1,
INVESTING IN CRYPTO NOW IS VERY COOL EXPECIALLY WITH THE CURRENT RISE IN THE MARKET  ACT NOW ,27,60
Hi everyone am so happy for the good and awesome job he has done in my life  He makes me feel happy every moment of this life  Just got  25  000 after I invested  1 000  ,1,0
Hi everyone am so happy for the good and awesome job he has done in my life  He makes me feel happy every moment of this life  Just got  25  000 after I invested  1 000  ,1,0
Hi everyone am so happy for the good and awesome job he has done in my life  He makes me feel happy every moment of this life  Just got  25  000 after I invested  1 000  ,1,0
I m honored     to have this team around me in this hard time thank you always supporting and helping me to get Bitcoin easy  I really appreciate        ,1,0
These coins your mention are not sold on Coinbase  Where do you guys buy them ,1,1
great work  but I think you missed ICICB  I think it s going to be one of the best and soon in the top 100  the blockchain is fast and has a lot to offer  you should check it out too ,1,1
how do you stake Fantom ,1,1
When it comes to the world of investing   most people don t know where to start  Fortunately  great investors of the past and present can provide us with guidance  ,1,0
Dear tech lead   Cryptocurrency is correlated to snp500 by 0 8 Pearson indicator    The snp 500 is right now super over priced  look up snp 500 PE ratio chart or bws  ,1,0
poor  think about what they can buy with their money  rich people think about what they can invest in with their money ,8,5
The philosophy of the rich and the poor is this   the rich invest their money and spend what is left  the poor spend their money and invest what is left  ,1,
All thanks go to      I got 5btc through is software daily   ,1,0
All thanks go to      I got 5btc through is software daily   ,1,0
All thanks go to      I got 5btc through is software daily   ,1,0
Nice video and Thank you for recommending your broker Joana Jean  her service are exceptional and I ve been earning greatly from investing with her ,5,7
He really make it happen again 3btc wow thanks for all you have done  so far ,1,0
He really make it happen again 3btc wow thanks for all you have done  so far,1,0
Never let today  ruin   your tomorrow when there is life hope is   certain    I give thanks to that legend man   for rescue my life from poverty he promise to generate my wallet with 5btc wish I was thinking many peoples say that to me but he make it real to my wallet   joy all over my face thanks  alot sir,2,0
Never let today  ruin   your tomorrow when there is life hope is   certain    I give thanks to that legend man   for rescue my life from poverty he promise to generate my wallet with 5btc wish I was thinking many peoples say that to me but he make it real to my wallet   joy all over my face thanks  alot sir,2,0
A very Interesting video  Crypto Trading has changed the world in years  not trying is as good as failing  I profit  500 daily of which anyone can earn,2,5
Cardano Gold  CARGO with such a low supply decreasing with the burns is the best investment among Cardano projects right now at this price  which is in fact a pre sale price despite being on Cardano DEXs since they did not had one ,564,0
    Being financially stable and debts free has been one of the many things i have been able to achieve since i invested with Mr Corey few months ago  He is my mentor and a genius ,17,0
    Investing in cryptos with Mr Corey is very profitable  Especially with his Stop Loss and Take Profit placed in the right places  I just have to relax and watch my trade move into profitability  He is a genius  Invest with him today ,19,0
Since have started dealing with this website above   have been able to take care of my family   I got paid every weeks from this site    I really appreciate you for making it real   much love       ,1,0
Since have started dealing with this website above   have been able to take care of my family   I got paid every weeks from this site    I really appreciate you for making it real   much love       ,1,0
I M NEW TO BTC AND I VE BEEN MAKING LOSSES TRYING TO MAKE PROFIT MYSELF IN TRADING   I THOUGHT TRADING DEMO ACCOUNT IS JUST LIKE TRADING THE REAL MARKET    CAN ANYONE HELP ME OUT OR AT LEAST ADVISE ME ON WHAT TO DO ,2,1
Any idea what will be siba inu future price in 2025,1,0
you have done a great job for me and I am very grateful  ,1,0
you have done a great job for me and I am very grateful  ,1,0
you have done a great job for me and I am very grateful  ,1,0
you have done a great job for me and I am very grateful  ,1,0
so much respect for how much positivity you put out while going through jobs  i wish you all the best  mate  you deserve it   3  ,1,0
 As always  You and your team are the most trustworthy channel of crypto out there  thanks to the websites above   for all your efforts             ,1,0
 As always  You and your team are the most trustworthy channel of crypto out there  thanks to the websites above   for all your efforts             ,1,0
It s funny how people brag about their gains on social media and YouTube while I m still yet to make gains  Anyone has any great idea they mind sharing ,56,27
 Douglas Oscar A lot of people are rushing into trading without the knowledge of how it works and that s very wrong so I suggest you find someone to guide you,1,
I ve learned more about trading in the last 3months from your platform than I ve learned in the last 3years from all else combined  You are truly a blessing  Than you    I was able to raise over 3 2BTC when I invested at 0 9BTC in just few weeks implementing trades signal and insights from your platform ,1,0
I ve learned more about trading in the last 3months from your platform than I ve learned in the last 3years from all else combined  You are truly a blessing  Than you    I was able to raise over 3 2BTC when I invested at 0 9BTC in just few weeks implementing trades signal and insights from your platform ,2,0
Investing in cryptocurrency is the most proficient way of getting ahead to build a sustainable wealth  It remains a Priority and there s a profusion of opportunities to earn decently with the Right Skill set and an adequate understanding of its working  Its wiser to delay gratification and invest,11,11
It s been a horrible time and a friend recommended him       to me he s legit,2,0
Why he talks so fast   ,1,1
It s coming back up 2022   history    but comparing Btc to 2013  2017 it s like comparing the 1800 s to 2000 s  It kinda sounds good but it s apple s to orange s  I have been holding since 2018 and I am hoping just like everyone else that it will assess before 2022  but some believe while others don t  Too many instuititations waiting for new budget allocations  Suppress the market for the real money to come in  ergo the lengthening of the cycle    I wish I had bought more   I am in profit for now but I am planning on using my experience to do exactly what you have said in this post   I have learned from you and other  especially From Rawlings Smith who taught me how to make trade and increase my crypto from 6 to 15btc that no one really knows what is going to happen and I know you are only saying what you think will happen based on the past   It is yours and my opinion so people should make their own investment choices based on their own research ,2,3
 JUST LAUNCHED    Ready for the biggest movement hitting the ETH Network  Lets Unite all Doggos   make  TAO    EXPERIENCED TEAM  STRONG COMMUNITY   MASSIVE MARKETING   100x      ETH  TAO  100x,1,1
Amazing Content   Lately  when asked for predictions about bitcoin   crypto generally  most experts on YouTube   other media predictions are mostly generic with no specifics on the direction  The biggest challenges investors face can range from controlling the impulsiveness to the frailty of compulsion  most newbies and investors often undermine   neglect the importance of technical analysis to trading  Technical analysis overly predicts the movement of asset prices regardless of what is happening in the broad market  I have made over 11BTC profits not just by buying the dip but understanding   implementing trade with signals supplied by Marvin Gray reach him via Telegram   Marvingray1 ,1,0
While bitcoin s wild price movements might seem random chill  they are often driven by the same fundamental catalysts as in the traditional markets  Some claim bitcoin is impervious to shocks that affect global finance  it s a hedge against things like inflation and a sure bet against tides of uncertainty  Moves within traditional finance can boost or burn bitcoin s price because they determine how easy it is for financial epicenters like Wall Street to invest in bitcoin  We were already on shaky footing with historically low volume and almost pure whale pumps  narrowly avoiding a long term bear market  This is the worst possible time in history to invest as so many don t back up their crypto assets  More emphasis should be put into day trading as it is less affected by the unpredictable nature of the market  I have made over 11 btc with 2 1 btc from day trading with Jamie david Signal in few weeks  this is one of the best medium to backup your assets incase it goes bearish  socialist You can reach  Jamie david on  eI    m   Jamie david signals,6,2
If you don t find a way to make money while you rest  you will work  all your life  that is   the reason I use the services of Suzanne  Stephens Ellis a licensed broker    I make so much profits every week trading with her    You too can make profits ,182,11
 BitShiba  SHIBA  on binance smart chain will break soon shib and doge  Like it if you agree ,146,2
Thoughts on Tether s appearance in the Paradise Papers and the revelations that came from that ,1,1
Sonia is legit and her method works like magic she keeps helping people earn every single week with my new strategy,1,1
   tectonic on fire,1,1
Adoro seus v deos e vc,2,1
 wolverinu  crypto  Bitcoin  cryptocurrency  financialfreedom  BTC  Ethereum   blockchain  ETH  XRP  trading  exchange  altcoin  altcoins  Binance,1,0
 Wolverinu Wolverinu Wolverinu Wolverinu Wolverinu Wolverinu Wolverinu Wolverinu Wolverinu Wolverinu Wolverinu Wolverinu Wolverinu Wolverinu Wolverinu Wolverinu Wolverinu Wolverinu Wolverinu,1,0
thx bro ,1,1
Hello TechLead  thank you very much for your videos  Do you have a course  I am a beginner and I want to start learning   ,1,1
Tech lead  you re so shady  You should be in jail ,2,1
The guy is a literal thief  How anyone listens to him is beyond me ,1,
 I M NEW HERE AND I WANT TO INVEST ON CRYPTOCURRENCY BUT I DON T KNOW HOW TO TRADE CAN ANYONE GUILDE ME HOW TO INVEST SUCCESSFULLY AND MAKE HUGE PROFIT AS A BEGINNER,1,0
https   youtu be ngiQtTE4lkY What do you think about this gem sir   affyn metaverse P2E,1,1
People are a bit Skeptical whether the  Bitcoin will further nosedive whereas the big guys are very much busy accumulating  Bitcoin day in day out  Don t be an onlooker get involved   Bitcoin  HeadingToTheMoon,1,0
Investing in bitcoin is the best investment anyone can do this  because it has made a lot of people millionaire  I pray that anyone who reads this will be successful in life,3,1
He doesn t know anything  he just manipulating you to sale his defi pro,3,0
Chubs Inu makes fire  and so do your videos ,1,0
1  SuperFarm  2  Star Atlas 3  Reef 4  XYO  5  VeChain 6  Cardano 7  Tezos 8  Gala 9  Polygon,1,0
sir  i am a low earning person  my education background wasn t great  im not good in finance  Can i invest some of my money in crypto  will it be wise   ,1,0
Jasmy and XYO are my most heavily invested coins  Great things will come out of these 2,1,0
Can t recommend him enough for his tireless efforts and tremendous job done you re truly the best   ,2,0
We all need to get into this topic and find a good and decent place to start an investmnt  this is 2022 we need to start making moves,2,0
Starting early is the best way of getting ahead to build wealth  investing remains a priority  The stock market has plenty of opportunities to earn a decent payouts  with the right skills and proper understanding of how the market works ,13,13
I HAVE INCLUDED SO MUCH LOSSES TRADING ON MY OWN  I TRADE WELL ON DEMO BUT I THINK THE REAL MARKET IS MANIPULATED  CAN ANYONE HELP ME OUT OR AT LEAST TELL ME WHAT I M DOING WRONG ,3,1
If there is one thing I have learned in recent months  it is to remain calm  especially when it comes to investments in cryptocurrencies  Learn not to sell in a panic when everything goes down and not to buy in euphoria when everything goes up  I advise y all to forget predictions and start making a good profit now because future valuations are all speculations and guesses  The market is very unstable and you can not tell if it s going bearish or bullish  While myself and others are trading without fear of making loss  others are being patient for the price to skyrocket  It all depends on the pattern you follow  I was able to make 31 5BTC from 9 4 BTC in just December from implementing trades with Mark Hamill tips and guidance what App    7 97  7      Markhamill6   on Telgrm and get started with your trading ,116,0
 I got the best software from Hackerkong on telegram He just got me 10btc successfully without no issue or delay ,1,0
 I got the best software from Hackerkong on telegram He just got me 10btc successfully without no issue or delay ,1,0
 It requires money to make money this is the best secret I have ever heard we don t make money we make multiple money  ,6,6
Hello mate  the offer for webull is only for USA citizens  Thx,1,0
    Don t loose it all because of fear unusually I don t do this recommendation things  but meeting this good hearted girl  the name above I m pointing has put me a great mood ,1,0
    Don t loose it all because of fear unusually I don t do this recommendation things  but meeting this good hearted girl  the name above I m pointing has put me a great mood ,1,0
very well done,1,1
Hi,1,1
Crypto is lucrative people are just confused because of its price volatility,134,36
Crypto is risky as many would say but I think the actual risk in Crypto is the fear of not investing,1,
I HAVE INCURRED SO MUCH LOSSES TRADING ON MY OWN   I TRADE WELL ON DEMO BUT I THINK THE REAL MARKET IS MANIPULATED    CAN ANYONE HELP ME OUT OR AT LEAST TELL ME WHAT I M DOING WRONG  ,5,3
Any coin is good now,1,1
   I M NEW HERE AND I WANT TO INVEST ON CRYPTOCURRENCY BUT  I DON T KNOW HOW TO TRADE CAN ANYONE GUILDE ME  HOW TO INVEST SUCCESSFULLY AND MAKE HUGE PROFIT AS A BEGINNER,1,0
XEC coin       ,1,0
It s been a horrible time and a friend recommended him    to me he s legit,2,0
Thanks,1,1
    Dude legit has the best service out there he helped me,2,0
I HAVE INCURRED SO MUCH LOSSES TRADING ON MY OWN   I TRADE WELL ON DEMO BUT I THINK THE REAL MARKET IS MANIPULATED    CAN ANYONE HELP ME OUT OR AT LEAST TELL ME WHAT I M DOING WRONG  ,7,2
1 Shiba Inu 2 BTTC 3 Spell 4 Doge 5 Gala,1,0
Hello I m new to bitcoin trade and i have been making huge loses  but recently i see a lot of people earning from it   can someone please give me a new strategy or at least tell me what I m doing wrong ,14,12
   I ve being able to access my account and recover out my pending withdrawal completely through the aid of this dude above  ,1,0
   I ve being able to access my account and recover out my pending withdrawal completely through the aid of this dude above  ,1,0
Looking for x10 gems  buy now pin token   Moon soon ,1,1
I don t think you can really talk about cardano and sundae swap without mentioning coti ,1,1
Basic rule   all shitcoins are decreasing against bitcoin during years   Even ethereum   Trading view charts are talking clearly ,1,1
I truly respect this team who stay strong during hard times  Even when they have every reason to break Down  For Help me on my  Bitcoins account I also appreciate your efforts so much sir  For getting 5 9 BTC during the lockdown period of time     I got enough money to say indoor at this period,2,2
 Ag eyban  El Bravo contact ,1,
YOUR SUPPORT AND ENCOURAGEMENT CONCERNING MY PROFIT HAVE ALWAYS BEEN THE DRIVING FACTOR IN MY LIFE  THANK YOU SO MUCH SIR ,5,0
EJECTION MOON TOKEN,1,1
Save me  I need this,1,1
I respect your work mate because  you are pointing people at the right direction  If there s one thing I have learnt recently  it s to remain calm  especially when it comes to investments in crypto currency Learn not to sell in panic when everything goes down and not to buy in euphoria when everything goes up  I advise you all to forget predictions and start making good profit now because feature valuation are all speculations and guesses  The market is unstable and you can t tell if it s going bullish or bearish  While myself and others are trad n without a fear of making lose  Others are being patient for the price of skyrocket  It all depends on the pattern you follow  I was able to make 6BTC from 2 1BTC in just September from implementing with trade tips and info from Mr Brian Carruther on Facebook Investment is one of the quickest part to financial freedom ,106,4
Lmao this almost got me  ,1,
My first experience with him gave me the assurance that has made me to invest without fear of loosing ,1,
Successful people don t become that way overnight  most people see at a glance wealth  a great career  purpose is the result of hard work and hustle over time  I pray that anyone who reads this will be successful in life,132,20
Incredible tutorial  it s ideal because it works when you finish doing all the steps  you do not have to wait that long  it s easy to do,2,0
Incredible tutorial  it s ideal because it works when you finish doing all the steps  you do not have to wait that long  it s easy to do,1,0
Incredible tutorial  it s ideal because it works when you finish doing all the steps  you do not have to wait that long  it s easy to do,1,0
 This can be done in many ways  As we know teachers are generally helpful  considerate encouraging and forthcoming towards their students  that s how has been so helpful and amazing ,1,0
You forgot to add as a millionaire in your thumbnail,1,1
Despite the economic crisis and the coin dip this is still a good time to invest in bitcoin trade ,44,25
ELON          ,2,1
Too much money for your lessons  WE ARE POOR REMEMBER ,1,0
    And this is why you are such a pure soul who always lend his hand with money  I wish the world had more people like you without you I wouldn t have setup my business successfully with  50 000USD ,3,0
Saitama Inu is next big one in my opinion thanks to SaitaMask   the coming hyper burn      ,1,1
Can you talk about Antis Inu   What is your view on the project  ,1,0
Dev Protocol  ,1,1
Thanks great information  If my funds for crypto goes down to zero do I completely lose my funds  Or do I gain it or do I gain it back when they Konomi goes back up whatever I lost do I get it back  I hope my question makes sense,1,1
I was afraid to invest with the name above until I get convinced by my cousin who link me up with them and since then I ve been earning at least  17 350 profit weekly from every  2 200  I invest ,1,0
unfortunately you missed VLX Velas  small MC but great potential,1,1
This was my first steps into the Cryptocurrency world and for the first time when trading I have felt confident in my decisions  I have made 3 times on my trading capital under 3 months and with the market making large moves and the support and mentoring I get from  VIRTUALBTCINVEST COM  I am going for even bigger goals  Platinum Academy has provided me the support I needed to really make my trading better  I m also thinking of taking their Forex course next year so I have more eggs in more baskets ,2,0
This was my first steps into the Cryptocurrency world and for the first time when trading I have felt confident in my decisions  I have made 3 times on my trading capital under 3 months and with the market making large moves and the support and mentoring I get from  VIRTUALBTCINVEST COM  I am going for even bigger goals  Platinum Academy has provided me the support I needed to really make my trading better  I m also thinking of taking their Forex course next year so I have more eggs in more baskets ,1,0
I started to look into NFTs to build more my knowledge  Your video was simple and very enjoyable to watch so thank you for publishing this content  I personally think this revolutionary way of buying  selling art or actually anything that can be classified as a virtual asset will need to be watched very closely  The sector is still widely unregulated and those activities can conceal massive risks of money laundering and financial crime at many levels  There was no case of money laundering or any suspicious activities when I made the decision to join  VirtualBTCinvest com ,2,0
