Comment,Likes,Reply Count
 No point selling unless you re into risky alts  If you re in good projects just hold and ride the wave ,4,
At this point in time if there are people believing this punk we have a problem Be careful of anything he says and take it with a grain of salt  Obviously do not do not do not invest in any of his projects unless you ve made sufficient research ,1,0
If the FED increases interest rates  it is to combat inflation   If the  government  needs more money to pay its debts  due to increased rates  they will print it or increase taxes ,5,1
They could also run off their balance sheet which would technically reduce the amount of debt they would have to pay  They most likely wouldn t print more money to pay off the debts unless it was the last resort because it would increase inflation which the interest rate hikes aim to lower,1,
I will forever appreciate this channel  you ve helped my family alot  your videos  advice  lessons and funny words are inspirational and helpful to us  My husband and I have been able to be minimal  conscious in spending  saving and investing wisely  I now earn every week  You re such a blessing to this generation  we all love you   ,76,26
Lmao talking to yourself on every crypto video with same comments must be hard work I believe that is called certifiable    ,1,
The bots having a wholesome conversation helping themselves wow,7,
You re creating a great reputation for this channel and everyone I will love to achieve this great goal you re enjoying now ,1,
 I used to trade stocks for a living as a day trader  I didn t make that much money  I actually lost like 500 thousand dollars    transitions to ad about him teaching decentralized finance   ,15,2
Solana is sql powered  What ,1,0
Well said that FED is actually bluffing   this is how they want to make rich richer and keep middle income  in middle income group,4,0
    And this is why you are such a pure soul who always lend his hand with money  I wish the world had more people like you without you I wouldn t have setup my business successfully with  50 000USD ,1,0
No worries for long term investors crypto will go up  it s not going to zero that is a guarantee   Look   Who own crypto  Mark C  Elon M  Tim C  and other institutions  etc  They are not stupid to buy crypto if they did not believed in crypto ,2,0
40  interest rate and no risk     haha for sure ,1,1
in which platform i can trade on usdt dai  i am on binance and i cant find it in future list  i found it in spot list but commission is  0 1 and impossible to make profit due to stability of the parity ,1,0
hey techlead  great videos  great content  keep it up  You were saying ohm was a kind of a ponzy scheme  do you believe Thor nodes to be the same deal ,1,0
Great content  TeachLead  My strategy  just buying in layers and selling in layers when there is a weak releave rally  Beeing prepared for both  upside and downside movement  Not using leverage  just buying the coins on spot  Hope it s usefull for some of you guys  good luck investing,3,0
ok   you taked nonstop for 13 minutes    what s the game plan       dude,1,0
This guy jumps from one subject to another every 5 seconds jajajaaa,1,0
 As crypto traders suffered last week through the market s worst stretch in months  investors in digital asset funds appear to have bought the dip  ,40,14
    Nice video I m new to cryptocurrency and I don t understand how it really works  Can someone guide me on the right approach to investing and making good profit from cryptocurrency investment  ,4,5
So tech lead is now a day trader  ,1,0
When it comes to the world of investing   most people don t know where to start  Fortunately  great investors of the past and present can provide us with guidance  ,51,35
The market will crash  but I will not  Will you ,2,0
Yes you are     the man for the job l got 3btc this morning,1,0
Your support        and your encouragement has always been the driving factors in my life thank you sir     ,3,1
I can t not     believe this was really until l confirmed  20 000 to my account with the recommendation of his service     ,2,0
Thank you so       much for the  7 000 you keep sending to my wallet in every 3hours l really appreciated all your effort,4,0
I M HUMBLE         AND APPRECIATE  ALL YOU VE DONE FOR MY SCHOOL  BILLS  THE FLIP REALLY  GOES A LONG YOU RE THE BEST       ,5,0
I really appreciate   your help  sir l got my profit return of 10btc in my bitcoin wallet just now  ,5,0
I Was so    excited when l received my bitcoin from  the real source thank you   may god continue blessed your work sir  ,6,0
Excellent information        a very complete work  without  a doubt and your    information as being useful to me from  1000  20 000 thank you  so  much,7,0
I asked him      can your software generate bit coin to my wallet he said thought he was laying not until l received 10btc in my wallet you are really surprised me,8,0
Everything       comes back to position since I meet him my life now perfect     ,8,0
MY INFINITY   GRATITUDE FOR YOU FOR DOING THE IMPOSSIBLE YOU KNOW I WAS TRYING FOR SO LONG SO THAT I COULD COMPLETE THE TASK YOU DID FOR ME AND I THANK YOU FOR EVERYTHING       YOU RE SIMPLY THE BEST,9,0
YOU HAVE BEEN     THE BEST I ALWAYS THANK MY FRIENDS SO MUCH FOR INTRODUCING ME TO YOU SIR,10,0
I love this guys dry humor  It is practically like it s made up by a genius ,1,0
Millionaires don t say they are gonna become millionairs  They just do it   That s how I know you re not gonna become a millionaire ,1,0
So let me get this straight  A dude who lost  500 000 is going to tell people about how the fed  can t afford  to raise rates more than fractional percentages  They ve been very definitive that they will be raising rates at least twice in 2022  and have stated that they will be raising rates by at least 6  no later than 2026 ,1,0
Great Content man  Keep up the good Fundamentals and Deep Analysis on Those proyects  Huge Phantom Fan here,1,2
US dollar is not certik audited  ,1,0
Love the video  Thank you,1,0
Everyone calls them lol  at some point someone is right even if they are just guessing,1,0
Crypto is lucrative people are just confused because of its volatility,133,37
Who are you going to pay to run your youtube channel while you re in prison ,1,0
Thank you big bro,1,0
LunaChow swap coming soon ,2,0
those defi plays in the video will definetely make you a millionaire    from a billionaire    USDT MIM pair is 0 risk  lol,1,0
Well they increased rates,1,0
0 03 First laugh comes after 3seconds lol,1,0
so what was your game plan,1,0
 everyone crypto is finished  gg  https   youtu be yb7UEPNxMWE,1,1
The content is really great    Ooooh    I can t wait for the KRRX token to take off    by the way  who heard about that  ,93,0
Nft s are a tough equation  Honestly I think nft s are gamble  You collect as much as you can and when the news hits maybe one of your selected nft s is the winner  Since I have been watching your vids Tech lead I finally found someone that speaks my language when it comes to crypto  Initially crypto was created to support all communities and help people find an alternative source of either passive or active income  but now the crypto space is dangerous and only those who are risk takers and do their research properly prevail  Or one might just be lucky and score too ,1,1
Feedback appreciated  Wanting more info and insight  WatsApp the numbr above Endeavour to reach out ,1,
First time I ve watched your video  you get straight to the point  great info ,1,1
Buy oil and gold   You ll do a lot better in massive depression that s definitely coming  100  rates are going up  First America followed by Australia  Appreciate an opinion but if you lost 500k as a day trader it shows your either in highly volatile stocks and or not reading the market very well ,2,1
Ok  so the bottom is not in as newbs think it s over  Guy knows nothing about crypto  he doesn t understand eth at all  Better alternatives lmao  People use it because network gives them more than they pay in fees  You pay for security and decentralization  Of course  you can use VCs toy aka solana lol,2,1
A wise man once asked a kid if he prefer one million dollars now or one million subscribers  the kid replied    hey man  I would like one million subscribers so that I could sell them my worthless course for 2 dollars each   raking in 2 million  Next I will just create a new token and back it up with that  1 million  Now I will leave myself with 100k worth of million token and slowly sell it as the price increases as I advertise it on my own channel   After hearing the kid  the man gave up on humanity ,1,0
Nice    ,1,1
Thanks for your analysis   May I ask where should I stake MATIC ETH and AVAX to get some passive income ,1,0
What do you think of  XRP  ,1,0
Great Video ,1,1
The global reset 2030 according to the World Economic Forum  In their world communist government you own nothing  As soon as they finish off the US dollar and get their technology in place  In their world you own nothing and if you complain they just cut you off,2,0
FED cannot afford to raise rates  this guy seems to have no clue   ,2,0
  Thanks,2,0
Lets all drink wine at the rise of the sun ,2,0
Wonderland is imploding ,2,1
WHAT IS THE BEST WAY TO MAKE MONEY FROM INVESTING NOW ,3,6
Trusted this guy until he came up with MM Token endorsement  If you look at the long term chart it is no different than wonderland  How can you recommend such project to people in time like this  ,1,1
throwing the baby out of the bathtub hehehehehe,1,0
Good day everyone  l enjoyed watching the video  But sincerely l m a newbie to trading  Please I need someone to help me trade or invest the forex or crypto market because I m tired of trading in losses myself  I ve blown my account twice and it s frustrating  please recommend a good expert that can trade on my behalf and generate profit for me ,4,1
do you use options to trade  ,3,1
But can I buy a cheeseburger with it ,3,1
Eth won t go down that far until there is a better polygon Dex that is actually the polygon token on the polygon network  or IMX gets more popular ,1,0
how do you call eth a commodity when its used for NFTs  its the primary NFT network  i hate eth ,3,1
Some good advice here  except the etherium bit  I think eth has some good use cases  yes the gas fees are very high  but it is the OG of smart contracts ,2,2
Love the videos bro  ,1,0
I had to pause for you to breath then resumed so you continue,1,0
If I were to buy anything other than bitcoin  it would be SOL  that is the only real VIABLE change about transactions  speed  and lowering costs against ETH that I can see   But for now  just bitcoin at these prices is the way to go ,1,0
35 percent   Zero   Data   I do not understand this ,2,1
the shade on solana is appreciated,1,0
I have been trading for about 6 months now and just about every trade backfires and slaps me in my face  Nearly impossible for me to catch more than a few points    I try to do top down analysis but it doesn t work for me   I say to myself  clearly I m in the 90  that lose money  so I open a demo account  do my analysis  then take the opposite of what I would normally take and get the same result  I m starting to feel hopeless  any advice for a struggling trader ,62,22
Don t trade  DCA into something like S P500 and be patient  Sounds like you re trying to day trade gamble You can use a lil money to do that gambling stuff once you ve established several years dollar cost averaging into a good fund  Just what I would do  not investing advice ,1,
 Mr Fashionboy lol,1,
These God damn bots convos    I was really starting to root for Anne Stewart   ,1,
No you are not in the minority I think a lot of people should be taking profits when somethings up 20  take profit hold onto the cash look for some thing else to go down put your money into it as long as it s a solid project get another 10 20  and never sleep on a trade I think that s my new strategy ,1,
Hey folks if you are reading this  This entire thread is posted by bots  Not sure how they do it  But I ve read this whole conversation between these people on many other videos  Don t fall for these  These bots getting sophisticated  Gawd damn ,29,
 Ray smith You re correct  I don t lose money every single trade  but my main problem is trying to let my runners run  Very rarely do I catch big moves   Instead they go a few pips in my direction  then go against me if when I try holding them  Also my entries could use a lot of improvement  A mentor would be amazing  but getting one is easier said than done  If it s not too much to ask  do you know any legit ones ,1,
 robert anderson Don t listen to him  don t give up  Trading takes time months  even years  to master  even the pros learn everyday  Never the less  if you lose money no matter which side you take  maybe you need to look at how you are managing active trades rather than how you are entering them  My advice  find a mentor   And also  try incorporating the use of oscillators  Bollinger and pivot points into your strategy  And most importantly move to higher TFs 4h or 1D preferably   you ll thank me later  ,8,
Your problem could be your stop loss is too close or you re watching your trades too much  Place it and walk away  Or you could just give up  trading isn t for everyone ,2,
Slow your talk any one got to catch you,1,0
US dollar is not certik audited ,1,0
Inspiring   I m 31 and happily retired from my job last year  built over   1 million in net worth Just being smart and frugal with my money right now  For example last year I invested 70k in blue chip stocks and crypt0s  with the help of my advisor of course  and made about 380k  but guess what   I put it back and traded with her again and now I m rounding up close to a million   Delayed gratification always pays off,53,17
Youre an AD BOT Ray ,3,
Don t listen to this thread    all bots,6,
I have made quite a stride investing on my own but I am aware of the benefits of consulting with a professional but haven t found one yet,1,
Good for you  Why are you blabbering over here for ,5,
If you think the govt doesnt have a problem digging a finacial grave  you havent met Joe Biden ,4,1
Is Million token decentralised  Would love yo see the architecture and understand more   Thanks,2,1
You going to make a million trading when you lost half a million trading last time   aaaaannnnd we should listen to you why  ,2,1
Hidden dislikes is really helping this guy out ,21,2
El dinero es un problema que todos tienen para una vida mejor y lujosa  la vida era dif cil para m  hasta que comenc  Bitcoin y ahora estoy ganando   9 500 por semana,35,29
so i have watched the video and i have one question   what is the game plan  ,1,0
I would like to hear what you have to say about syscoin and pegasys,1,0
Do the opposite of what ever he says to do  Tech  rug pulled ny grandma  Lead ,1,0
Would love to see a regular video series talking about each coin  what it does  is It actually being used or is it theory  looking at the docs and testing how well it actually works  I feel a lot of crypto is just hype and the blind leading the blind  Last big crypto I saw analyzed was kadena  Flowing the docs and testing  it had tons of errors  didn t hardly work etc    basically just a bunch of hype back by theory pumped it ,12,0
After watching I didn t hear any strategy on how to make money during this crash talk less of becoming a millionaire lol,2,0
Cryptocurrency is now on the rise I m new to crypto trading and I find it difficult using these strategies well  Where can I find a legit broker  than will manage my account and also teach me how to trade ,7,3
1 50 too much sarcasm here  be careful or people will actually start to believe in TA,2,0
To be honest  from my point of view this approach that you want to present to us is not real  If you have managed to lose so much money from stock trading which by definition is a much safer place and with a much lower validity shared with crypto  automatically I will not follow your advice in a much more difficult field  crypto world   I wish you good luck ,1,0
My plan for becoming a hundrednaire from a thousandnaire,1,1
I really appreciate how Tech Lead first told that  I actually lost like 500K dollars  and then sponsored himself ,24,2
Bruh this is the funniest thing I seen all year,1,
Wow that was a juicy capsule   Just caught up with the techlead after a while ,2,0
I have no idea what 3 4 of the words you are using mean  This video makes my brain hurt  My plan  I ll just invest in beer instead ,1,0
Brilliant man     Thank you,1,0
thats bullshit  seriously most of what you ve told is  bullshit  ,1,0
My english  humor and knowledge about crypto is too bad to get the message of this video but i still watch it cause this guy is just funny,2,2
So if u SWITCHED to cryptos then you may also make some videos on becoming a millionaire as a producer in  PORN  industry  It could also bring a lot of publicity and controversy   PH is also a good platform ,1,1
What s up with all this crypto stuff  as a millionaire I need more ways to grow my riches,2,0
The Market has been pretty bad lately  Almost everyone  have been crying  Practically  but It kept  dipping  That s what you get when you feel you can navigate the process on your own  Big thank to  Ryan Willer  I m not bothered with how bad the Market is because my assets are insured due to her advice and I still receive my profits ,2,3
FTM is centralized too,1,0
Don t day trade  Period,1,0
My girlfiend takes all my money and buys crypto and goes on vacation with some other dude,1,1
Had a race war with my own parents,1,1
Hello  I m new to Biticon trade and Ive been making huge losses but recently I see a lot of people earning from it  please can someone tell me what l m doing worng ,3,1
Success depends on the actions or steps you take to achieve it  Show me a man without investment and I ll tell you how long it takes to go bankrupt  Investing creates a safe haven for the future  With the right investment choice that has at least a 2  minimum risk and with the advice of an expert  profits and interest are    guaranteed ,19,21
                       ,6,
 Sunday Musa wassap ,3,
 Sunday Musa She s a goddess when it comes to FX trading  ,1,
Can you do a video on vvs finance and cronos chain Defi projects ,1,0
i bet u they will raise it  just to slowley drop it down again to kick the can down the road  if we all get out of there system we can bring back our on money backed by silver  along side blockchain  so we can bankrupt the deep state,1,1
I love how much of an honest crook this chinese is  He really knows how to rob people in style  A true mastermind ,2,0
Eth my g  Eth,2,0
Ethereums gas fees are ridiculous  That s why it s going to tank,1,2
Ex ex ex  you re a joke,1,1
My strategy  deploy reserves  Question  is STX worth a look ,1,1
Getting out of debt and buying a house and maybe a new car is fine with me  Being out of debt is being rich ,1,0
I wonder how he breaths  ,2,0
  I totally agree with what you are saying   I started in crypto in August 2017  and I bought in   I was up 5x by December only to watch that disappear quickly and then watch  the original investment go down by about 85  during the ensuing 4 year bear market   I took the opportunity to accumulate more over the last 4 years which was hard to do and at the same time a smart thing to do   I wish I had bought more   I am in profit for now but I am planning on using my experience and what i have learnt from Richard I have learned from you and other Youtubrs  especially my mentor Richard Golod who taught me how to make trade and increase my crypto from 11 to 27btc that no one really knows what is going to happen in the market and I know you are only saying what you think will happen based on the past   It is yours and my opinion so people should make their own investment choices based on their own research      I left his contacts in the comment below take care ,53,8
hmm,2,0
INVESTING MAKES UP THE TOP NOTCH HEMISPHERE OF WEALTH  THAT IS MORE REASON ONE SHOULD SAVE AND INVEST TO SECURE MORE PROFIT AND ENSURE SUCCESS   ,17,14
omg it s over    btc to 0    omg omg   oh wait we did that one before   ,2,0
Lol wtf is this channel,2,1
my advice is to time the market by buying high and selling low,1,1
The pattern on the head and shoulders of the BTC is a sign of great danger Which has targeted 20 000 for BTC,1,1
Bitcoin pump hard 50K  on this week  ,2,2
look head an shoulder position  on btc  soon  btc  around 30000 usd,1,
what you think of egold and mex,1,1
We have a problem  we need some    around here,1,1
Great content,1,1
Thank you ,1,1
What is with these exchanges they won t let you cash out  ,1,2
Is that Varmillo keyboard you are using  Omg I am using one too and it s so good,1,1
trollcoin yah,1,1
Worst case scenario    TechLead loses a million in crypto     as a millionaire ,1,1
Where do u buy Million token ,1,1
thats a dope kobe hoodie,1,1
Explained Level 3 in 30 seconds  Thank you  ,2,1
I sold all crypto and I invested in CLPS stock,2,1
I m no longer waiting for the stimulus check because I earn  22 000 every 14 16 day s ,4,3
lol are you going to issue another poop token to your viewers ,1,1
nice ko6e shirt   gang gang,1,1
solid info   i subbed,1,1
i dont get it  whats will make us millionaries   very misleading title  shame on you  u just talked about few coins and thats it,1,1
Pulse Chain and PulseX will be released soon   I would look into those new projects ,1,1
hi at 7 51 you show graph of oxdao but today the TVL is massively lost it went from 4 billion to 722 M   can you explain why   how this happened,1,1
Building wealth involves developing good habits like regularly putting money away in intervals for solid investments  The stock market has plenty of opportunities to earn which I myself took advantage of  I made my first million from going diverse  mainly ETFs stocks  bonds etc   coins  and gold  I m also working on an investment plan that includes NFTs with my advisor Kelvin Maorgan  It s been a year and half of steady growth ,29,19
If you fall for this BS thread  then you deserve to lose your money ,1,
 Terfas Tarik the above listed investment are really good but crypto is definitely the best if you have good knowledge of how the market works,1,
This season has really been great  I ve been making massive profit 500  to 8000   on my crytop Investment it really amazing   ,1,1
I really impressed with you and have admiration  You have financial independence through hard work and learning from your mistakes  Is it hard to start in Bitcoin trading I haven t got a clue  I seems scary  Where do I start  I d appreciate any advice I m 55 yr old and have worked hard all my life as an immigrant in Canada I just never could get ahead  Thanks,2,1
Ethereum is number two  It will remain number two and potentially over take bitcoin in the coming years  Eth will be at 10k soon enough too,1,1
i wanna be a millionare,1,1
 I m new to cryptocurrency and I don t understand how it really works  Can someone guide me on the right approach to investing and making good profit from cryptocurrency investment   ,1,11
Is he still working on Million  He never talks about his own project wtf ,1,1
 120 000 in just two weeks in stock market and in crypto trading with  robertcoil trading strategy   Robert you are amazing,1,1
  AYE    IDK WHO NEEDS TO HEAR THIS BUT ALL I KNOW IS IVE TAKEN SIGNIFICANT LOSSES LAST YEAR   I CANNOT WAIT TO DO MY TAXES PLEASE FEEL FREE TO THREATEN ME WITH A GOOD TIME AGAIN FUHK YUH VERY MUCH  ,1,1
Does anyone know the true cost of the defi pro course  77 00 one time purchase  or 6 monthly payment of 95 ,1,0
The man dont what to touch ethereum fees  as a millionaire    ETH the future of finance   we have come a long way    ,1,1
i mine troll coin,2,1
Avoid speculation or betting on ifs and maybes ,1,1
Okay but the crash is largely due to the Ukrainian crisis ,1,0
Exactly  Financial stability can come in anyway rich background or not  Most people think     Investing in crypto is all about buying coins and holding  till it rises    come on it takes much analysis to be a successful crypto trader I ve made  47k in just two weeks of trade  Thanks Natasha Byam Jativa an excellent example of a professional portfolio trading manager ,25,24
I ve seen different testimonies about natasha  she must be very exceptional for people to talk this good about her services ,2,
Indeed crypto currency is the best digital investment  Earning 3  my salary soon I won t have to work anymore  people should start taking part in these kinds of digital investment is the best,2,
My previous trade with her gave me a total profit of  42 000 so am definitely going for a new trade this week ,3,
Needed her info as well  will reach out to her now  thanks    ,3,
Thanks I really appreciate  ,4,
                        ,5,
Hello Dorris pls how can I get in contact with her and amount needed for a nice start up  I m interested to invest please  ,4,
I met her last year for the first time at a conference in London  I invested  25 000 and traded in one  month making close to  200 000,3,
I ve never heard or seen any of her clients complain of lost    I think she s just too perfect ,3,
Just made my first withdrawal last week and I wasn t happy with myself because I was skeptical which made me invest so law meanwhile I m on my second trade with her and this time I invested in a big way ,4,
My first investment with Natasha Byam Jativa gave me profit of   80 000 US dollars and ever since then she has never failed to deliver and I still stand by saying she s the most sincere broker I have known ,4,
Mind blowing wow,4,
Thanks to my crypto portfolio manager natasha    Just invested  20k alcoins and  50k worth Ethereum  With the recent dip in Crypto I was told it s the right time to invest and set down and see myself turning to a millionaire soon ,3,
