Comment,Likes,Reply Count
Larssia mentioned a pro Natasha already how good is she  I really have much retired funds to put into cryptotrading ,3,
 Bitcoin  is a very exciting development  it might lead to a world currency  I think over the next decade it will grow to become one of the most important ways to pay for things and transfer assets ,3,
Most people remain poor only because friends and relatives discouraged and advised them against investing and trading crypto  while the wise ones kept investing and growing higher financially ,3,
Crypto currencies especially bitcoin is the future investing in it right now will be on every wise one s list and in a month you ll be ecstatic about the decision ,3,
Pls Guys How does this whole bitcoin thing work  I m interested in it and I m willing and ready to invest heavily but I need an assistant to properly guide me through on how to make a good start up and be successful in it without making mistakes   ,3,
Rajeev C you ve a good point here  ignorantly people don t know the crypto world is more of a lucrative business and investment currently ,3,
After my crypto experience I now believe investing today is a simple logic that creates you a future you don t need to work  I invested in both Stocks and Cryptos but I can now see Cryptos are more profitable and easier to invest in more than stocks ,4,
You say how you hate eth  then you place ad for milliontoken which you can buy with eth     ,1,1
The rich stay rich by spending like the poor and investing without stopping then the poor stay poor by spending like the rich yet not investing like the rich,6,2
New sub here  Sharp info,2,0
2 50,1,1
Finally you getting smarter  Lol  You are a poor tech millionaire   You too late in crypto   Go back to coding for Facebook and work your 9 to 5 shift,1,1
You are a f cking G     ,1,1
MM to the gutter  ,1,1
So we need Proof of View for NFTs  Like verasity ,1,1
Brilliant  https   youtu be jdCRAl1uQhk t 310,1,1
Most people venture into crypto investment to be a millionaire meanwhile I just want to be debt Free,65,22
Spend less and invest more,1,
 Mbali Maka Kamilia S  Woods,2,
Now is the best time to purchase and invest in Bitcoin  stop proscastinating  ,1,
I m from spain  I have been an investor in the crypto market for over 2 years,1,
100million Satoshi in 1 bitcoin  21 million X 100 million   shitload of crap ,1,1
u are bot sir ,1,1
Time to buy the dip  I was able to buy UDO at 0 07  what next to buy ,2,0
THE BEST DECISION I EVER MADE IN MY LIFE WAS INVESTING IN FINANCIAL MARKET  TRUST ME GUYS  IT PAYS ,6,7
You are awesome,1,0
Techlead   Now lets do some TA  By the way I wasn t successful in the past and lost 500k  Anyways heres what I think   You re a crack up mate  I cant tell if you are being serious or not,1,0
Keep covering crypto  Now I am your regular viewer because of this,2,0
Simply fabulous           ,1,1
An Awesome Example of the Beauty that  Nature Creates Just stylish  ,1,0
Please do  DM to me,1,0
Great cute looking,1,0
Don t panic huge pump   ,1,0
That segueway from losing 500K to Defi Pro sponsor tho  ,1,1
 Bitcoin is at the top of this pyramid  pyramid scheme  How to describe the entire crypto industry in one sentence,19,1
When are you making your own nfts ,1,0
 How is everybody doing out there  Actually  I shouldn t have asked that question    Sums up what makes Techlead    Awesome   ,20,0
  I got scammed of  7k from an investment platform  thinking the world was gonna be over for me  but when I came across with the number mentioned above I was able to recover my lost money back,1,0
  I got scammed of  7k from an investment platform  thinking the world was gonna be over for me  but when I came across with the number mentioned above I was able to recover my lost money back,1,0
What I love about you  TechLead is that you re straight to the point ,43,2
fact  ,1,
Dude  your content and personality are so entertaining  Thank you     ,6,1
I really like this guy  He s direct to the point and unlike others  having many says  You deserved more subscribers,9,2
Great video,1,1
I love you TechLead  You are the best   ,1,1
I make huge profits on my investment since I started trading with Rebecca emma  her trading strategies are top notch coupled with the little commission she charges on her trade,9,7
You said trading volume is high due to the outraged of 48 hours  the volume has increased just because there was a spike when the network got live  this is the thought process ,1,1
It feels like a robot is presenting  this episode,1,1
great video   from a pro     keep it up man,1,1
I used to day trade stocks for a living   I lost  500K   Ahhhh  you cracked me up there ,5,0
thank you ser,1,0
Has anyone tried his defi program ,1,0
Cardano is vaporware  Solana is centralized  This man dropping truth   s right here,4,6
 Stephen Davis you should look deeper into Cardano by yourself  ,2,
 MIXING WORLDS Tech Lead is right  Eventually investors will see Cardano is not actually producing anything more than empty promises,1,
 Stephen Davis I think he s delusional with Cardano loll even said it s not going to make it in 2022 haha,2,
Love your channel  but I disagree with your comment about Cardano being vaporware  Just wait and you ll see     ,1,1
 Fed is bluffing  glad someone said it  They can t afford to pay the debt if they raise rates  Dollar is going to zero,2,1
Right now  timing the market risk is incredibly high   The most important thing anyone making an entry into crypto can do is buy a combo of 60  liquidity pools and 40  crypto assets   This reduces the timing the market risk as well as provides a stable return   Long term the crypto asset if it a productive asset  will give you outstanding returns and long term that will provide you with reducing the timing risk that comes in a highly volatile market such as this   Since LPs tend to perform way better in such a high volume  Long term when volatility shrinks in crypto  it will be the best return   high volume low volatility is what you want in an LP    But right now and pretty much any long term crypto purchase  you want to do a combo of 60  LPs and 40  DAOs or gas tokens that can be put to work ,11,4
Good tip appreciate that for real   ,1,
 TeckLead do you have a link to this awesome NIKE hoodie please  I could not find it   ,1,1
I cant even keep up with this guy,2,2
very good points  I learnt a lot  I totally agree about Eth ,1,1
Opensea contract hack ,1,1
i missed the game plan,1,1
Nice video thanx    What do you think about moonriver ,1,1
I love this guy  ,2,1
Please who can recommend me to a professional trader  ,7,11
This dude has never got beat up in his life the way he talks arrogantly    everyone needs a chin check once in a while   I wanna do it just to say I beat up an ex Google tech lead   did i mention he was a Millionaire   lmao,1,1
Thanks,1,0
Or you could get a real Job ,1,0
Feds are definitelly raising rates at least 3 times this year and more next year  I don t understand why everyone is making big deal of this though  4 raises of 25bps each is only 1 ,13,1
Everyone should buy bitcoin and hold and the rest will go up and down like a yoyo in a swingpark,1,1
SOLANA  i dont have Eth never liked it,1,1
Great  Fantastic no worries   ,1,1
TechLead is one of the best crypto channel out there  as a millionaire ,4,1
nice,1,1
SELL GOLD AND BUY  PLATINUM         ,2,0
I have lost over 2k getting into crypto in a short period of time  Maybe it was a mistake getting in  And I have it 6 months  Very frustrating ,9,6
me too  I don t know what to go for or anything,2,
still not clear if this guy is trolling or not lol,3,1
Love  your work     as a millionaire  would you buy nodes now ,2,1
What s the best way to make money from crypto trading ,4,1
Yesssss i agree mate ,1,1
The Nft vaporware has promising days ahead with the twitter handle and  tv display  At least in the short term  They have bragging value,2,1
what are you going to do about million token ,2,0
I think the issue we are currently facing is trying to build a trustless solution on a decentralized platform while keeping the management centralized  I believe that where DAO should be employed to make the solution project 100  decentralized ,39,6
 AARON MERCER  a DAO is not centralized   Hows that,1,
Except a dao    is centralized lol,2,
I m proud that a Nigerian is making this intelligent point,1,
Cardano is building a DAO,1,
Great analysis    very informative  ,4,0
Thanks man    my strategy   listen to you lol,1,1
Hi  what do you think about Metaficial World crypto listed on CMC  It only has 100000 token in circulation and the team states that 50  would be burnt  Is it any good,1,1
Wow interesting   Anywhere I can learn how to do options wheel  ,1,
very fruitful analysis lead    carry on the rocking work,1,1
Nailed it on trust at 9 20   That is the key success of any financial system   20th century American fiat was established at bretton woods and secured by the strength of the dominant power   Could permissionless code of web 3 replace the need for 11 aircraft carriers and the most lethal force the world has ever seen to protect its dominant position ,23,4
 Insider trading regulated by the government      Cough  Pelosi ,1,0
Check the MACD on a monthly weekly period for the entire bitcoin history ,1,0
Again do you own million token   how much did you invest  ,2,1
I feel like I m listening to a very intelligent Alien when I listen to this guy ,6,1
I got out before the crash   just waiting to clean up ,1,0
Love seeing me some red,1,2
You have some great logical points in a mad world   ,1,1
Thanks for watching and  don t forget to Hit me up for more explanation               ,1,
I was cracked up when he said MM even beats US     ,2,1
I checked some DeFi blogs on youtube and I think this one is the best  No water strait to the point ,1,1
Its very hard to take you seriously when you clearly have personal vendettas against certain coins  as opposed to objective research  I ve notice in your last few videos you always make time to badmouth Solana  Cardano and Ethereum  yet you always talk Bitcoin up    the same coin you said was going to 0 in a vid you made last year  I don t know what Ethereum did to you  but spreading misinformation isn t going to stop it from flipping your primary holding  Bitcoin   You mentioned that Eth is down 25  while Bitcoin is only down 15    What you didnt tell your audience though is that while eth and altcoins drop more than BTC in dips  they also gain much more than BTC during bull markets  this is very common knowledge  Also  why didn t you tell your audience that Ethereum s return on investment over the last year has been more than 4 times the return of Bitcoin   Just be honest  and tell your audience that your shilling bitcoin because you want to protect your investment   I ll see you in 1   2 years  when Ethereum is worth more than Bitcoin ,6,4
Breathtaking  Magnificent  Outstanding ,1,1
Amazing  ,1,1
Breathtaking   ,1,1
I love u so much   you are my idol you are my everything thank you    That means a lot  especially coming from you,1,1
King Of Hearts   ,1,1
Wonderful     with Love,1,1
did this man just say he lost 500k trying to be a day trader then try and sell his course    ,1,1
10 10 most adorable Videos,1,1
   Magnificent  Snapshot   ,1,1
Your videos are all sharp  precise and very interesting   Myself trying to identify the best opportunities in crypto space    One of the most interesting protocols in this space is ampleforth  Which is kinda   Reverse of bitcoin Where bitcoin is fixed supply with elastic price Ampl is elastic supply with fixed price   Meaning the quantity of ampl priced around 1 USD will keep increasing in your wallet based on the increase in demand for AMPL  Please share your opinion about ample in one of your videos   Regards ,1,1
These youtubers try to trick you into buying by using misleading titles,1,1
Super video  Thanks for sharing,1,0
Timing the Market beats Transit Time to the Market ,1,0
He s not putting as a millionaire anymore   does this mean he lost all his money in crypto  LOL His next video gon be  Moving back in with my parents as a not millionaire anymore  ,1,1
Digital Currency is tied still to Stock Market   DJ has a ways to go before being corrected for hyper inflation   And Fed is raising rates   So inflation or recession   I bet both   Digital Assets are going below 80  of major values and 80  of Digital Assests will get wiped out ,5,1
Bought some  hbar and  crv today     ,1,0
Great video thanks  This is a huge sale wish I had more savings to buy   Unfortunately I m all in lol,2,0
I like how you put out your content    your facts your research your sarcastic attitude  Everything about your content is LiT   Keep them coming Boss    ,3,2
 I lost  500 000 as a day trader   the only honest day trader evar   Goes on to give day trading advice,655,39
Lessons are learned from failure ,1,
 user scnamesux the people losing from day trading are actually around 97   not 80 ,3,
You should have short your position with 5x leverage,1,
YouTube needs to bring back fucking dislikes,5,
back in 2006  I day traded    and learned that 9 out of 10 day traders stopped doing it within 6 or 12 months  not earning much or losing money    At the same time    I was day trading with US 180 000    I used  30 000 to short Apple according to the tech indicator  and earned  3 000   If only I put US 60 000 in Apple back in 2006 and then go on with my own stuff and not touch that money  I can retire today already  at about US 4 5 million ,2,
Most are missing the point   He had  500K to lose   Most of the critics in this thread don t have enough to pay their rent ,10,
Most failures and loss on Investment usually happens when you invest without proper knowledge of the market  I was able to recover my losses with Craig Zach,1,
 cryptiama x Only trying to be in the 20   why watch other people who lose money day trading who are in the 80    I can invest in the S P 500 Index   be in the 20  without watching these videos ,2,
Haha you beat me to it  ,2,
 user scnamesux  so would you have continued watching if he said i am in 500K profit from traiding ,30,
That s when I turned off this video ,22,
People are sheep  He will have no problem wrangling the herd ,11,
lol  he s hinting at Pulsechain,1,1
Why would I listen to someone who lost 500k on day trading  Loooool,1,1
Giving out free b t c  Reach out admin above    ,1,0
The fed will declare bankruptcy to save crypto,3,1
I love this guy  I can not tell if he is serious or not ,1,1
Huge fan of your content TechLead  Paying close attention to your advice during this downturn    I m in Fantom  Jacy  and Ethereum for the long run  You should really check Jacy out since I haven t seen you mention it yet ,2,0
IDK about you but I don t normally through my bathtub out at all    ,1,0
Buy fucken everthinh,1,0
Logistics how does one buy phantom w out crazy fees via coinbase wallet  ,3,0
Apparently there are people working on EVM compatibility for Algorand hoping this is true,1,1
You think coins like SOL and AVAX are worth holding at this point ,3,3
First time viewing  very refreshing  hoping all your content is the same  new subscriber here     ,3,1
You deserve way more exposure in the crypto community  You re very knowledged in the topic ,35,7
 UUB Repus that was day trading stocks like a decade ago  He deserves credit for being open about it actually  unlike many others that only advertise their winning trades to suckers like you so they pay them a fortune for lousy signals ,1,
if he s very knowledge  he wouldn t have lost 500K as he stated in the beginning,2,
No he really isn t he s known in the community for shilling his own investments and speculating heavily without much knowledge  This is the same guy who said Bitcoin was going to 0 last year    He has been making a point recently to drag Ethereum in every one of his latest videos  but he doesnt tell you that Ethereum s return on investment over the last year has been over 4 times higher than the ROI on Bitcoin  and its projected by many to flip BTC within the next year or 2  Do yourself a favor and watch someone who actually knows what they re talking about  like Sheldan Evans  or Andrew Jikh ,7,
Nope  he is making guesses and talks fast  No knowledge here ,13,
I m so happy he don t like ETH and I ll never buy ETH   D,1,1
You re simply a genius  Keep going brother ,2,1
He s so adorable I love you little accent,1,1
like the kobe sweater,1,1
please suggest best coin token to buy in dip  ,1,0
What happened to your million token ,1,1
I am fully subscribed  I wish I could have found you long ago  Anyway  I think you are a true genius with an incredible vision of all markets     I hope to learn and make a good living  Thank you so much  From Durban   South Africa   ,2,1
Just a single lonely guy making youtube videos about the latest trend  Coffee in the morning and zombie for the rest of the day  I feel you man  You do you and don t let anyone convince you not to wear your hoodies ,3,0
I like that hoodie  where is it from ,1,0
Good job keep it Coming  ,2,0
 I used to trade stocks for a living I didn t actually make money I lost 500k  why I don t try do this for a living  ,28,4
MUST BE SADDD IM NOT TRYNA BE LIKE YOU MY BOYY  ,2,
I will always let everyone know to forget predictions and start making good profit trading bitcoin is a great way to make money particularly in today s economic climate a successful trader has an appetite for risk and understands the risk profile of his trade Professionals who have a profitable investment career make a sound calculation of the risk they make sure their gains include a risk premium the key to success is getting consistent profits Bobby Mickael gave me best trip to excel in the old of crypto today,1,2
Good vid ,1,1
Million token is the future stack up now or regret later  ,1,0
I learnt so much you  Thanks Bro ,2,0
The market is very unstable and you can t tell if it s going bearish or bullish You certainly can profit from trading Ethereum and your ability to achieve a profit will depend on the depth of your market analysis and has had a long history of delivering huge ROIs for investors  But there are also many other ways to make money from Ethereum including Ethereum faucets  referral programs  Ethereum mining and Ethereum staking your market knowledge and the underlying market conditions some of us don t know how to take advantage of this Eth ,1,2
So         how do we get rich you didn t say,2,0
 USD not even Certik audited you guys     LOL ,3,0
Can you make a video on shiba inu coin ,1,1
 My plan to become a millionaire  as a millionaire ,441,21
 Tim Carey as a millionaire,1,
 Ryan M  Reminds me of a certain mayor who started smoking crack to prove to his addicted friend that it was possible to stop  ,2,
Takes money to make money ,2,
 Ryan M  everything is part luck  But our attitude and error is what creates either bad or good luck ,2,
This is like the guy who becomes homeless to prove anyone can become a millionaire  While impressive to where he gets  he practically kills himself in the process with stress and being overworked  most driven by pride and ego I believe  only to never finish and become a millionaire again  Honestly  some people can work hard and have great ideas and still never make it  Sometimes part of it is just luck ,4,
 Tim Carey you are rich and a millionaire if you are healthy and happy  ,8,
Oh sure 18039938810 oh sure,2,
                    ,1,
This video will make a million millionaires,4,
Dude  breathe ,1,
 Moving back to my parents house because I am no longer a millionaire ,27,
          look up for more details    let s get this crypto    ,2,
You re always skipping Terra LUNA     ,1,1
USD is not Certik audited  FACT,1,1
1st time watching  slow down bro ,2,0
Or you went too fast or I m very slow but I didn t catch which is your strategy     ,1,0
You re a very intelligent man  Keep up the good work sir  ,3,0
THANK you SIR for INFORMING us your knowledge,9,0
Can you do an Hedera Hashgraph video next    ,1,1
For anybody on the fence about the course  I bought it and went through most of it this weekend   It was super worth it and I learned so much  Changed the way I look at crypto investing and I m stoked to be on board for the remainder of the course  Thank you techlead for taking the time to make it ,4,3
Will it give steps on how to purchase liquidity or do I need to know where to go to purchase them  I d probably do it if it could step me through process step at time   Go here  then go here  do this  do that  place your bet ,1,
Does it have a course that tells you how to use the dapps   What about how to pay taxes   I am on the fence but  500 is steep without knowing these,1,
make ur defipro class cheaper please,2,0
Always appreciate your perspective,2,0
Quick pause    Finance by me    ,1,0
Solana sux  Radix is coming ,1,0
When I see Fantom   matic  ADA   mana  and algorand trading at 5 cents or less it ll be time to buy  100X time,8,5
 Richard Johnson that doesnt make sense    and what  mainstream stock  could you  buy at 50cents and hold 12 months for a 6  bagger       because you really can t      AND if you could  then how could a 6  bagger not be worth the time when you just said  holding        and if you were just holding over medium term   if that was the plan   then it doesnt seem like that would be  trading or looking at the stocks all day,2,
 Richard Johnson  That s a fair point  but that also comes with a lot of disappointment if the coin you re staking doesn t do what you want it to do,2,
Nice break down ,1,1
i dont belive you guys still watching this no integrity person,1,0
I like u bro   but only one perception is wrong I find on u  u r trying to put down time crypto against btc  time is designed for metaverse currency     Not like to replace btc real world currency    please read their white paper again  the while global market is down how u can expect Time token without any drop ,1,0
I need million token    How do we use million token to get discounts on NFTs,2,0
HEC DAO just dropped HEC bank super excited to see what happens with FTM network  ,2,0
I actually lost 500k  i almost choked while eating somthing   ,2,0
Speaks fast but I think he mentioned he lost 500k in the trading market   I respect that,4,0
Techlead is at the top of the pyramid ,2,1
I will start accumulating fantom  harmony  nervos network  osmosis and cronos and dollar cost average them as they down and become more and more attractive ,1,0
I just swapped to UST and deposited in Anchor Protocol of Terra and enjoying yields of 19 5  on a stable coin ,6,2
Xrpppp,1,0
Game plan is great   what a lot of people don t know how to project their investments strategis  One intelligent form of investing is figuring the worth of an asset and buying it for way less  In trading especially for a large portfolio is s gnal algos which are automated  Few traders I know use state of the art s gnal algos for their trading activities  My best pick is that of career trader Callum Lucas  his s gnals are based on unique combinations of trend  momentum  volume scanners and onchain analytics in which I ve accumulated over 9 2BTC already  Last week his analysis about the price action of bitcoin hitting 38k target was a hit  I think we all agree that the recent market drawdowns wasn t expected as it lead to cascading liquidations  Automated s gnal algos removes you from the crowd   If interested then reach out at Te  E G  m  callumlucas,78,2
As far as crypto goes  I m all in on Bitcoin  Let s go    ,15,5
LOL he failed to mention in this video that Ethereum had 4x the return on investment that bitcoin did last year   If you follow his advice and get in to bitcoin  you ll be bagholding just like him when Ethereum flips BTC in 1   2 years time ,2,
Sorry to hear that ,5,
Everyone start your own crypto  There s time before people realise they are worthless ,1,0
Hilarious content as always   this guy is sarcastic but dead on as a macro futurist  2022 flight to safety will be defi   stablecoin yield    Long FTM and LUNA,13,3
Witty Jack is back  Long live our state president   ,1,0
This bull run looks a mix of the previous two  Currently the  PI indicator is about to indicate a Bitcoin top   According to bitcoin halving cycles  there should be at least other 4 months in this bull run  so  if  the PI indicator  and Bitcoin  might repeat asimilar bull  run to 2013  That would mean a local top relatively close in time and then another top to end the bull run towards mid year I was able to grasp the knowledge of tradlng crypt0 assets early enough  but I was still limited due to my lack of technical understanding of how to analyze the digital market  all this changed when I encountered peters  s service   although I have been into numerous services but Armstrong peters stands out with experienced expertise in the field  I must confess it wasn t an easy task learning the routes on trading but with his assistance   it was more  easier to understand   here are his details on          as  Goldsfolio  STAY SAFE    ,69,1
Nothing like coming for financial advice to a man that loss half million dollars day trading lol   love this guy,77,8
Actually that s the best person to come to for financial advice  because he already made the mistakes he s saving you from ,2,
 seVenth draonball techlead talks about losing that much money trading stocks in this video and in his past videos  And he knows way more than the average trader  But it sounds like he s made pretty good money from crypto,5,
Hey man  He doesn t want us to repeat his mistake  ,4,
I got to be honest  this is the best crypto Chanel on YouTube   He just gives it straight with no sugar ,75,6
Zero sugars     ,1,
