Comment,Likes,Reply Count
 NEW  Join me in DeFi Pro and make passive income with crypto  http   defipro dev     Million Token  https   milliontoken org ,57,29
Pump Df coin  Best way to make your money 2x  3x or 4x     dollars  ,1,
 Madie Zancanellatl Kamilia S  Woods,1,
I m new to crypto investment  how do I get started with a professional ,1,
Can you do a video on strong block  I d love to hear your thoughts on it ,1,
My guy do some fundimental analysis on Elrond  since you re a developer you d be pleased to hear that they have automatic smart contracts royalties  And imo its the most scaleable L1,3,
Can you explain what 24  APR means  If I invest   100 in USDC MIM does that mean I get  24 per year  Per day  I see you don t answer comments but can answer this please ,1,1
Starting early is the best way of getting ahead to build wealth  investing remains a priority  The stock market has plenty of opportunities to earn a decent payouts  with the right skills and proper understanding of how the market works ,3,2
INVESTING MAKE UP THE TOP NOTCH HEMISPHERE OF WEALTH  THAT IS MORE REASON ONE SHOULD SAVE AND INVEST TO SECURE MORE PROFIT AND ENSURE SUCCESS,15,66
Curious if anyone here has tried copy trading   What was your experience  I m relatively new to trading and I am looking study some traders and copy their open trades rather than investing myself and lose money emotionally ,84,4
 clark  I usually go with registered representatives  Nicole Ann Sabin  for example has the best performance history  in my opinion  and does offers 1v1 consultation to her copiers which I think is amazing  You can check her on the net if the need be  ,1,
 Ivy Theodore  Hi  where can I find traders to copy  ,1,
 Anthonio Rodriguez  I also have copied the trades of some experts in the past  Tbh its the easiest money I made on the market  plus you also get a learning opportunity while you earn off their expertise  Unfortunately  I still haven t gathered all the knowledge I need to DIY trades  but I m on my way  As long as you do your homework on who you re copying and what their strategy is  it s a nice hands off way to invest ,2,
I successfully trade in my own portfolio  and also follow others because I m interested in their strategies  I realized I ve got better at managing the trader s strategies too  There s nothing wrong at all with having someone far more dedicated manage some of your portfolio ,1,
My top Cryptos for march  SHIB  XMR  POLY  ADA LUNA SOL  HBAR   XRP ,100,4
 Ivy Theodore Nicole Ann Sabin  she was in the news when she revived Grumac in 2018   You can look her up online  there isn t much I can say here so it doesn t seem as if i am promoting an agenda,1,
 Smart Uther Hi  please could you share more insight for someone who is just starting out and  how do I reach the expert that assists you ,2,
 Anthonio Rodriguez I d suggest you look into passive crypto investing like liquidity farming  Staking and DEFI  Buy tokens which you know have huge potential to grow   good use cases  For me  I am under the guidance of a digital assets stock pundit and she provides entry and exit points on the security I focus on while I go about my other businesses  Investing has no one way to do it  eyes on the prize    Mistakes are expensive ,2,
A lot of stocks are down as well as crypto  Buy gold  30  in crypto  Investing is a long term game  don t worry about the short term As long as you invest in strong blue chip companies that you have conviction in  they will recover in the long term  DCA if you can ,3,
keep buying and investing in stocks or crypto soon Bitcoin will hit  100 000,9,10
Getting a way to make income without having to leave home isn t exactly as easy as you all think it is   talk is cheap and it s sure easier said than done   I have my source   and I would rather stick to that  it pays well  even my stepdad quickly joined before it s too late,173,2
Starting early is the best way of getting ahead to build wealth  investing remains a priority  The stock market has plenty of opportunities to earn a decent payouts  with the right skills and proper understanding of how the market works,112,2
Its never too late to start from somewhere   I am lucky to have found this source  it s the future,177,2
I m honored to have this team around in this hard time Thank you for always supporting and helping me with your investment plans  to the fullest ,180,2
Wow this is really on time THANK YOU FOR BEING YOU AND YOUR KNOWLEDGE     your videos are perfect for motivation and ideas and we enjoy and learn so much from them Thank to this professional Investment team below for your assistance and being helpful ,179,2
Bitcoin and other cryptocurrencies are a form of money that s a stable field that the government can t destroy and can t distort  Because its creation is governed by the laws of mathematics  It can t happen any faster or slower than a certain rate  and it all sort of self adjusts ,33,2
Big thanks to this great investment and passive income team below for your consistent work in assisting my family out off debt and I believe they will keep on doing so,184,2
In 2019  people have realized there isn t going to be one crypto to rule them all  You re seeing vertical solutions where XRP is focused on payment problems  Ethereum is focused on smart contracts  and increasingly  bitcoin is a store of value  Those aren t competitive  In fact  I want bitcoin and Ethereum to be successful,178,2
This passive income and bitcoin miming team below         of professionals are experts who loves to take on challenges and mostly working on providing quality services to their customers,178,2
It hurts so many people end up in debt well shout out to this investment and passive income team below for saving me and my family from a huge debt,183,2
Keep your positive attitude alive  and never let the enthusiasm in you fade  this is your strength to make that money through passive income keep thanks too this team below   ,186,2
The way this team below    handled my  investment and passive income project showed resilience  experience  Knowledge  and critical thinking  I would love to get his perspective on our next project,182,1
Thanks for this kind of info man  Anyway  off topic I just wanna ask if have you heard about Mercor  I d love to hear your toughts about it ,2,0
 I will forever be in depted to you    you ve changed my life I ll continue to preach about your name for the world to hear    you ve saved me from a huge financial debt with just little investment  Thanks Mercy Greg,47,7
I invested  1000 and I made  13 500 weekly trading profit with her  I always trust Mercy Greg  I am now able to send my kids to a great school in LA ,1,
You are right because my first investment with Mercy Greg was  1000 and I earned profit worth  16 400,1,
I remember when I just got into crypto back in 2017 but later in 2018 I ended up selling it because I was dumb and I didn t understand it  I studied and learned and now I know how it works  Got back into crypto early in 2021 and looks like we have the same mentality  I admit that seeing a  50  hurts but it s not a realized loss until you sell  Now   I buy and just trade long term more than ever  I have made over 23  btc from day trading with kathleen rife Signal in few weeks  this is one of the best medium to backup your assets incase it goes bearish ,60,11
INVESTING IN CRYPTO NOW IS VERY COOL EXPECIALLY WITH THE CURRENT RISE IN THE MARKET  ACT NOW ,71,78
I ve lost quite a good number of coins in the current dip I Just hope I find a way to recover from such a massive loss,9,7
I have been trading for about 6 months now and just about every trade backfires and slaps me in my face  Nearly impossible for me to catch more than a few points    I try to do top down analysis but it doesn t work for me   I say to myself  clearly I m in the 90  that lose money  so I open a demo account  do my analysis  then take the opposite of what I would normally take and get the same result  I m starting to feel hopeless  any advice for a struggling trader ,194,13
 Adam Jerome I m actually doing a long term investment with him  which I realize more profits at the end of the trade  I m not really going to state my earnings here but yes  his services are really good I recommend him,1,
 Marko Aidan I really don t do much  I have an account manager Alex Valentino who handles me trading  His trades are top notch and realistic  it s been a year now and he is still beats my expectations ,2,
I liquidated all of my coins and bought gold yesterday night  Got spooked by the downward trend across the board and decided I had enough of crypto  Pretty sure its best days are behind it  Got lucky this morning with Russia moving into Ukraine   although I really hate to profit off of the misfortune of others ,1,0
Good for those who did not buy ,1,0
Look at CATCOIN Hot like a P   ,1,0
How can I speak directly with you prior to joining  as Im about to purchase million tokens and the  77 is a great price,1,0
Honestly     I can t imagine why anyone would dislike this dude   this is very helpful   kudos man on the name above you got a new shout out and recommended from me   thank alot  ,1,0
When it comes to the world of investment  most people don t know where to start  Fortunately  great investors of the past and present can provide us with guidance,2,1
While bitcoin s wild price movements might seem random chill  they are often driven by the same fundamental catalysts as in the traditional markets  Some claim bitcoin is impervious to shocks that affect global finance  it s a hedge against things like inflation and a sure bet against tides of uncertainty  Moves within traditional finance can boost or burn bitcoin s price because they determine how easy it is for financial epicenters like Wall Street to invest in bitcoin  We were already on shaky footing with historically low volume and almost pure whale pumps  narrowly avoiding a long term bear market  This is the worst possible time in history to invest as so many don t back up their crypto assets  More emphasis should be put into day trading as it is less affected by the unpredictable nature of the market  I have made over 11 btc with 2 1 btc from day trading with Sarah D Barton Signal in few weeks  this is one of the best medium to backup your assets incase it goes bearish  socialist You can reach  Sarah D Barton on  eI    m   sarah signals,2,1
As a newbie about to invest  you must have these three things in mind  1  Have a long term mindset     2  Be willing to take risk   3  Be careful on money usage  if you re not spending to earn back  then stop spending   4  Never claim to know   Ask questions and it s best you work with a financial advisor   I made it as a newbie by working with Brian Davis  and today I can show alot of my achievements,114,28
Can you tell us about  eCash  XEC  ,1,0
Did he say he lost  500k and then go on to give trading advice    ,1,0
Legit question  Are you rich  If not are you like well off  Cause I want to get to that point where one s worries are reduced  Living paycheck to paycheck is not fun,2,0
INVESTING IN CRYPTO NOW IS VERY COOL EXPECIALLY WITH THE CURRENT RISE IN THE MARKET  ACT NOW ,70,81
The best decision I ever made in my life was investing in financial market  Trust me guys  it pays  ,2,1
      I can t imagine life without this dude  he s the greatest guy in the world  I really appreciate he s good work    ,1,0
      I can t imagine life without this dude  he s the greatest guy in the world  I really appreciate he s good work    ,1,0
Got my attention ,1,0
conman  lol,1,0
If you don t find a way to make money while you rest  you will work  all your life  that is   the reason I use the services of Suzanne  Stephens Ellis a licensed broker    I make so much profits every week trading with her    You too can make profits ,176,10
Successful people don t become that way overnight  What most people see at a glance is wealth  a great career  which is the result of hard work over the time  Is there anything you can tell us about this expert broker ,1,
 INVESTING IN CRYPTO NOW IS VERY COOL EXPECIALLY WITH THE CURRENT RISE IN THE MARKET NOW ,67,84
They will be big crash crypto will crash too  It s coming  You are going to lose a lot of money if Ya knew what was coming  you would pull out even on crypto  no fear it coming,1,1
So you re out of prison ,1,1
I like the integrity   Thanks for sharing   ,1,0
I can unequivocally say that trading is one of the most profitable and lucrative business for every investors with the right expert ,25,7
IMO  day trading is all luck  good or bad   No one knows anything   The only sure bet  very nearly  is investing long term in an index or otherwise diverse portfolio of stocks ,1,1
Techlead lost 500k dollars in trading stocks   as a millionaire   ,1,1
Love the light up keyboards in the background ,1,1
Last year why i left Google  this year why i sold all my ethereum  Over a year everyone becomes a crypto guru  People like you  know very well what to sell the people what they want to hear and make us fool easily,5,1
Only seems like those who are invested are the only ones trying to make ppl hopeful and buy back in so they won t lose their stock tbh,3,0
GLAD I GOT INTO CRYPTO WHEN I DID BECAUSE IT S BEEN A TURNING POINT FOR ME FINANCIALLY  BEEN MY BEST DECISION SO FAR,28,8
I m so happy my life is totally changed I ve been earning  10 250 returns from my  4 000 Investment every 13 days,1,
it s throwing the baby out with the bathwater       ,1,0
Life is so precious  when you know you own a property or an investment to always keep you go  I have no regrets starting my journey in crypto  It s been nothing but perfect ,71,20
dude hates eth   ,1,0
As you can see we are at the beginning of a new month and I feel  those who would allow the market dynamism to determine when to trade or not are either new in space in general or probably just na ve  the sphere have seen far worse times than this  enlightened traders continue to make good use of the dip and pump even acquiring more equities towards trading sessions  I d say that more emphasis should be put into trading since it is way profitable than hodling  Trading went smooth for me as I was able to raise over 9 2 BTC when I started at 1 5 BTC in just a few weeks implementing trades with signals and insights from Gonez Nas  I would advise y all to trade your asset rather than hodl for a future you aren t sure about or hold it and risk loosing all  hes also mentioned by most youtubers and trades via only telegram  Goldsfolio,96,0
just one thing  million dollar coin hahaha,1,1
Hi  enjoyed your input on crypto  What do you think about xyo   Will it go to  2 91 like polygon  or  5 91 like mana  Is xyo going to be a partner and collaborate with mana ,1,1
Interesting that these videos are no longer hosted by an ex google  ex facebook  tech lead  millionaire  Are you saying something by not saying something ,1,0
First time watching one of your Vids  Impressed with your overall knowledge  which comes through in this  So  the money lost as a Trader was hopefully just an investment in the Future for you and Us  Be well and thanks for sharing your experience and knowledge  I have followed you on Twitter     ,1,0
Simple step by step process  excellent communication and response times  the service was extremely streamlined and friendly throughout  Would recommend anyone to Cora James and  give a try,38,24
Thank God for Shiba Inu   The next Bitcoin  ,1,0
 I lost  500 000 as a day trader    LOL,1,0
WTF are you saying     Man you seem like you know your stuff but your knowledge in this vid is so confusing me that  I am considering to believe that the earth is flat    as it may make more sense to me than what you just said ,1,1
Very knowledgeable  Awesome content,1,1
 Personally you don t touch ethereum these days   OK  Good you are not a financial advisor hope you write somewhere that ,1,0
The problem is that although this flaw in bullion banking is absolutely true  when phrased like the way you did especially on a platform like Youtube where most viewers are just the average joe  everyone thinks that you re nuts or some conspiracy theorist  When crazy things are done by global institutions  they are somehow perceived to be legitimate  and you d be mocked by the masses for believing otherwise  Just read some of the comments above  I never bother explaining things to others on Youtube  Not my job to do so ,17,13
 tomas rousseau FXkatharine,5,
 tomas rousseau you can communicate with her through her telegrm page,4,
 Cindy silver hey cindy how can i contact her pls ,3,
she s definitely the best  she  keeps surprising me with results  We are planning on surprising her too  You must have heard about that ,3,
she  s related to the famous youtuber matt borchert,3,
 tomas rousseau you re right  ,2,
 kelvin hamton    How can someone know a professional account manager that is trustworthy when legit once are hard to find this days,3,
 tomas rousseauOr get yourself a legit manager,2,
 tomas rousseau Before trading for yourself you need to learn how to trade,3,
HEY KELVIN   CAN YOU ANSWER PLEASE,2,
Hi kelvin   Can one actually trade alone depending on his skill   tried doing that but made a lot of losses I lost over 80k 0n my m4 trading acct last summer,3,
Good point   ,5,
Hello  I m new to Bitcoin trade and I ve been making huge losses but recently I see a lot of people earning from it  please can someone tell me what I m doing wrong ,154,40
Techlead  I admire you,1,0
The best way to find growth stocks  key features to keep in mind is as follows  1  Ensure gross margins are greater than 50  2  Ensure P E ratio is less than 100 3  Buy companies that are PROFITABLE  very important irrespective of sector  4  Debt to equity ratio is less than 30  5  Current ratio is above I 6  and a Float under 100 million One stock that fits the bill is FLGT  Fulgent ,22,21
a total noob here  how did you get this informed on your picks  I m looking to score big on the market now,1,
Her trading signals and strategy has been useful even to me as an old trader and mostly newbies out there     I m still earning daily and growing my wallet monthly with expert Vanessa daily signals ,1,
 Gorge Patrick Thats because the metal in coins is or going to be shortly worth more than the face value of the coin  They are aware inflation will make the denominations worthless and not producing any more whilst taking them off of the markets to stop people hoarding them  Like the silver ones    ,2,
Thanks for the insight and support I have no idea of how the market work unfortunately having a job doesn t mean security rather having different investment is the real deal       So I really appreciate your transparency ,1,
Every shibah investor right now just smiling at the price of shibah as it held strong and indeed valuable enough to generating good Rol more person are gonna become millionaires and we have shibah thanks for that,2,
Investing in bitcoin is the best investment anyone can do this  because it has made a lot of people millionaire  I pray that anyone who reads this will be successful in life,1,2
Once again such an informative video  Amazing work Thor ,1,1
actually in not zero risk the stable coins like DAI UST MIM can debeg and worth less than 1  research more to learn about that,1,1
Indeed NFT is coming and good to buy too  investment is key in 2022  crypto gives me residual income every trading week,7,8
My strategy  stay the course  strategically take profits ,1,1
    Dude legit has the best service out there he helped me,2,1
What do you think about FLOW ,1,0
 Every crypto investor right now is just smiling at the price of bitcoin as it held strong and indeed valuable enough to generate good ROI  more persons are gonna become millionaires and we have crypto to thanks for that  ,61,27
wow  You lost 500K daytrading     oh  you will own nothing and be happy ,1,0
The Fed is just bluffing about raising the rates  How  Why  Are you delusional   how much is 2 2 ,1,0
So smart   Cost benefit analysis  5 00  Thank you  Hadn t occurred to me ,1,0
 I will forever be in depted to you    you ve changed my life I ll continue to preach about your name for the world to hear     you ve saved me from a huge financial debt with just little investment  Thanks Ms Dora Trades      ,41,10
Please how do I Reach or Contact  Her       ,1,
I heard that her strategies and Profits are really good    ,1,
Her success stories are everywhere  No doubt Ms Dora s tradlng service is very good  i lnvested  2 500 and made  15 700 in 2days  Her analysis are awesome ,2,
What are you thoughts on BOSON please ,1,1
ETHEREUM SUCKS,1,1
Great job dude intellect webs I received my transfer without any problem I really appreciate your work I will hit you up soon for more business,1,0
i lost 500k  ok and why should i listen to you,1,0
Lately  I ve been less dependent on my 9 5 job to cater to my needs as my investments in the crypto market cover my lifestyle ,69,9
If you hold over 10million shib tokens we each need to burn a minimum of 50 000 tokens each and we can get there Lets have a financial revolution   ,2,0
Why not invest in crypto today and be financially free tomorrow  been retired since 42  and till date still make weekly income from crypto trading,170,12
RektLead,1,0
your game plan is to shill another millionaire token you made  lol,1,1
120  paid in eth wen staking GLP,1,0
I really appreciate your    effort in my life with your mining software i got the 2Btc yesterday night wow I thanks you sir      ,1,0
I really appreciate your    effort in my life with your mining software i got the 2Btc yesterday night wow I thanks you sir      ,1,0
I really appreciate your    effort in my life with your mining software i got the 2Btc yesterday night wow I thanks you sir      ,1,0
I really appreciate your    effort in my life with your mining software i got the 2Btc yesterday night wow I thanks you sir      ,1,0
Crypto currency is gradually moving towards something big and the price surge over the past few months is just the beginning of greater things to come  you got any advice for someone that is fresh to crypto  Don t know where to start  ,8,19
Investing in bitcoin is the best investment anyone can do this  because it has made a lot of people millionaire  I pray that anyone who reads this will be successful in life,3,1
Money is an issue that everyone has for a better and luxurious life  Life was hard for me until I started trading bitcoin and am now earning  18 435 per week ,5,2
 Blue Pill  as a millionaire ,1,2
 The biggest mistake you can make when investing is to think that you are smarter than the market  It s almost impossible to time the consistently  you will miss out on great opportunities if you do this  simply DCA into high conviction stocks and let your position grow  ,100,6
 John Wes  what a testimony  how can i reach this person if you don t mind  ,2,
 you will potentially lose more money anticipating a stock market crash than an actual crash I have set aside a lump sum of money to invest into great quality companies that have good market cap both the fear for constant fluctuations won t let me be  ,2,
The market is growing daily with new strategies and trading opportunity  Financially empowerment is our everyday chase and James Lucas has proven to be part of this mission  his strategy is the best,20,40
Thanks for the insight  but I m still confused why Bitcoin and crypto prices keep dropping  This drop follows a number of other significant drops in recent weeks  I m still hodling my coins and it scares me  Whats your advice on this ,2,0
this dude is cracking me up  he s so likeable,2,0
Are you giving me Financial advice when you are telling me you Lost five hundred thousand dollars ,1,0
Successful people don t become that way overnight  most people see at a glance wealth  a great career  purpose is the result of hard work and hustle over time  I pray that anyone who reads this will be successful in life,104,17
you are too cute,1,0
Why do you call cardano vaporware ,1,0
The Fed plans on crashing the economy  They plan on going to crypto ,1,0
The FED is bluffing  they have zero commitment on raising rates   ,1,0
Cryptocurrency is now on the rise I m new to Crypto trading and I find it difficult using these strategies well  Where can I find a legit broker  than will manage my account and also teach me how to trade ,18,10
How can stable coins offer such high interest  And which is the most liquid in order to make sure you get your money out at the end   Forgive me I m new here ,1,0
Hows the Milliontoken doing ,1,1
 I will forever grateful sir     ,1,1
Thnx for speaking truth salutes,1,0
Fantom website just copy the design of stripe,1,0
Can you offer real advice for once ,1,0
 Successful people don t become that way overnight  What most people see at a glance wealth  a great career  purpose is the result of hard work    ,14,5
 CRYPTO CURRENCY IS THE FUTURE INVESTING IN IT WILL BE THE WISEST THING TO DO ESPECIALLY WITH THE CURRENT PRICE NOW ,34,47
The rich get wealthier as they trade  the poor remain and get even   more poorer because of skepticism and fear of taking risk ,1,
I loved watching coffeezillas vid about u,1,0
 Hi everyone  I m actually looking for a good trader that can help me trade and make profits  but is very hard to see a trusted one  Any idea ,17,25
   ,1,1
ELON          ,1,1
I have been making losses trading myself      I thought trading on demo account is just like trading the real market    Can anyone help me out or at least advise me on what to do ,1,1
newly sub,1,1
 I ve already fully bought in over the past few weeks  Would u recommend selling and waiting for bigger dips or just keep holding  ,98,3
 Ella Robert  You can just check her up on the web to see if you will like her services  ,1,
