Comment,Likes,Reply Count
I never bought a lottery ticket  scratcher  or  COIN  in my life  Got rich off productive assets like stocks  Simple business  no gambling needed ,1,1
This guy is very new to crypto and it shows  All his FUD has been known for many years  And its just that  FUD,416,35
No this argument is definitely different  For the longest time digital yuan argument was pretty much limited to a central banks ability to inflate the currency oooooo spooky Now its become readily apparent that as cryptocurrency technology has advanced  cbdcs value as currency is really the last in importance  What a cbdc will can afford is unprecedented control  an end to money laundering  thus denying important legitimate purchases like property and black market activities  more effective pushing of economic initiatives  especially in a planned economy  and political initiatives etc due to the data gathering these currencies will allow  Soooo ironic that technology invented to life the yoke of oppression from the haves will wind up instead tightening the noose on the have nots ,1,
This   and it s been audited and investigated and settled by NYAG   Not to mention if tether was actually collapsing all that money would flow into BTC crypto and pump the prices even more ,1,
 Alg Prei go find the channel crypto teacher,2,
 Alg Prei bitcoin lightning is ready   but kept back for the theatre to continue,1,
 ThePhilosopher it s the FEDERAL RESERVE  using  USDT and USDC to manipulate the stocks and the cryptos     FED has  50Billion  per day at disposal     for the real truths  find the crypto teacher channel     he explains it all,2,
 WhiteArtsMagic not sure that matters much since why would you use that energy for Btc if you could use thousands of times more electricity efficient cryptos and remaining electricity be left to light homes  The ecology is not the only problem  it s inefficient tech which can t scale and at the moment no solution is good enough or working ,3,
 Alg Prei 76  of all bitcoin mining is green,1,
 WhiteArtsMagic regulations will help crypto which passes their normative  BTC s red flag is energy consumption  it can t pass regulations ,1,
 Alg Prei Go watch InvestAnswers  Maybe this will change your mind  All this FUD has been around for many years  Do you know how many times china has banned bitcoin in the last 10 years  Regulations will only help crytpo  they are much needed actually ,1,
yeah  it was but how can you be sure it ll last much longer  Look at the crypto and world economy situation   regulations are coming  BTC is getting heat for being not ecologic  world economy as is crypto is in a bubble  Perfect time to pop it  Maybe it ll take some more months but the end is inevitable   propped crypto market with non ecologic crypto will pop hard ,2,
 Dr Tune I agree with you on this  The video showed the white paper from Tether claiming they only have 3  of the currency they re backed by while having Billions in value  Coupled with the charts that show BTC moving along with Tether and the fact they re in the BVI  Yea they re manipulating the markets ,6,
Cope,2,
You re all calling it FUD but you re not addressing the evidence,18,
There are rumours that several youtubers and twitter influencers etc have been pressured and or paid to spread FUD  We might have found another one of them ,7,
Lol weak hand please sell I need to buy more,5,
 Natriumcitrate55 he is just like that a sheep,2,
I guess he is paid to spread fud to his sheppy followers ,14,
The tether FUD is as old as 2017,9,
It worked  Weak hands are out  Now we can finally go back up  The fact that he is keeping Dogecoin absolutely invalidates the whole video,54,
Nice Fud  see you when Bitcoin reaches 100k    ,2,0
wow even someone as smart as you got shaken out ,1,0
Great job man buy high sell low  Great strategy  Looks like you never been in crypt lol,3,0
Your coins  greatfully accepted  They will be needed ,2,0
Good day friends I have a good news   Despite the economic crisis  this is a Still a good time to invest in Gold and Crypto,4,34
I bet you feel stupid now ,1,0
I was once swayed by this argument until I discovered that most banks only require 10  reserves  They don t ever anticipate the day everyone will want their money all at once  But the truth is  if every customer wanted to go to a bank  any bank  and take out all their money  the bank would collapse  Because they don t have the money ,2,0
Hahah  Tether just prints their stable coins    you mean just like the Fed prints funny money out of thin air      ,8,1
Just tell me what will happen if lets say the market crashes and people start liquidating tether  Will they be able to cash out or will tether collapse   If it does collapse then its worse than any FIAT and provides not real life benefit over them,1,
Hodl,1,0
I understand your hesitance with Tether  I think it s suss too and that makes sense  but why would that cause you to dump all of your BTC and other crypto except for Dodge coin when BTC is BTC and not USDT    Even if USDT became inert the money has already flowed into other cryptos  how would it affect them  It seems only people who hold large amounts of USDT  China institutions cough  would be holding a worthless coin if USDT is disassembled  The only thing is  people would simply have to convert to USDC or another Stablecoin since USDT isn t available ,1,0
Makes no sense ,1,
TechFUD,1,0
I guess when you look back in the next few months  you would have wonder why you ve made this decision   Tether has been having this issue since 2017 when I first knew about cryptocurrency  Simple  don t hold any Tether ,1,0
FUD  Have you bought your crypto back yet ,4,1
Banks have RR of 0 10  do we stop using banks because they are a Ponzi scheme   No  Do we have constant bank runs because people are scared  No   Exact same  stop the FUD,1,1
Well this didn t age well ,1,0
Stop this bullshit    U know nothing    Everyone  is stupid     U are the smart one   Sure   b U holding Shiba inu n Doge,1,1
Hello  I m new to forex trade And have been making huge losses but I recently see a lot of people earning from it  Can someone please tell me what I m doing wrong,2,0
Paper hands,1,0
Guys he s not bashing crypto in general he s skeptical about usdt and I believe that usdt should be regulated so that no single organisation or individual should manipulate the market so efficiently ,1,0
In the US small banks must keep 3  in reserve and large banks must keep 10    Tether should be holding more in reserve particularly because of the volatility in crypto currency    However I would not expect them to keep 100  in reserve  a company needs to be able to make revenue to stay solvent ,1,0
If there s a run on exchanges they all turn insolvent where the first quarter of people get to cash out while the rest end up with nothing  you ll see,1,0
lmao noob,1,0
If you re American and you sold all your bitcoin  its a  taxable event   Get ready to pay out the butt  BTW  you have to report that to the federal govt or it s a felony ,1,0
  LOL   Sells and goes right to parroting ancient Tether FUD  Tether literally just provided audited Financials to NY  All this stuff about a total lack of transparency is such bunk ,4,1
Stfu,1,0
the whole market is a big ponzi scheme  jeez hahahaha is this guy for real man,3,1
should i really trust a guy that hold dogecoin   lol,3,1
Let market tank than fill yr account with btc ,1,0
Poor guy ,1,0
I don t know you but I know you are one of those with paper hands and I m glad that such people like you are washed out of the market  It s very healthy for long term viewing,20,1
Weak hands    enjoy  ,1,0
This will not age well,3,0
the second he said  dog  coin i was out,4,0
good for you   BTC  will come in 4 figures at the end of this price correction   as the price was inflated by media   i personally feel ETH will be good bet in longterm   700 to 850     bye for now,1,0
Don t be scared  Sell your house and buy more crypto ,1,0
How does this guy have a million subscribers ,2,0
Hope you sold at a loss,2,0
Get Rekt noob,2,0
Doge not dog,1,0
Well  when Tether is gone  won t it just get replaced with something else  So not all is lost,1,1
So basically also fiat is a ponzi scheme   ,1,0
This guy is full of crap  He just wants to drive down the cost of Bitcoin to buy in  It s a cheap trick that Elon Musk pulled a few weeks ago ,2,0
I Believe what you are saying can you tell me why Coinbase listed Tether ,1,0
Look at a chart  Crypto has been doing this for years now and has always bounced back stronger  Also it s NOT a currency  it s an asset like real estate or stocks  I agree it s easily manipulated but  if you hold out you ll do great ,7,0
Bozo,1,0
doge,1,0
Bro your fucking up big time  Lol ,1,0
The whole thing is going down fullstop,1,0
when missed that 50  bounce on alts because you panic sold,140,8
He didn t panic sell he just tells people that because he is an sake he really thinks we are all so stupid,2,
 Michael Subroto yeah    oh thank god I didn t loose everything   Probably shouldn t have bought in the first place with that mentality,2,
Sell in absolute bottom feels really good for some people  ,5,
Imagine selling at the absolute bottom  You gotta be king FUD,12,
You misunderstand Bitcoin  Risking everything in buying  bitcoin is as an investment in something as an divestment in something  it is for  the future of the planet   Once you understand this   you will never sell your Bitcoin  All other Crypto is money hungry hypocrites  Bitcoin is not about getting rich   it is about making the poor rich with a beautiful peaceful world  I hope you buy Bitcoin again  I think You are a very courageous man   thank you,1,0
Quick question  when you told about tether get backup by fiat usd  and we didnt know if tether can prove that  can you prove when US goverment print dollar are they print dollar with same ammount gold they have or they just print dollar out of nowhere ,1,0
Tech lead  this is old news  NY AG  has investigated,1,0
If everyone go to banks and ask for money  cash  fiat  or golds  silvers regulated banks tear down as well   cause they dont have that amount money or gold which we see on digital wallets  ,1,0
lol conspiracy theory,1,0
Sold all of his bitcoin  eth  and cardano     But not Dogecoin    Hmmm interesting  ,1,1
Thanks for your coins i buy them at low Price   ,1,0
Do u sell keyboards ,1,0
Dude only noob sold BTC,1,0
Why I sold all my Bitcoin today as a millionaire sounds better ,1,0
communists gonna be communists lol    china pay ya for them fud paddies ,1,0
Lol   market moving up now,2,0
LMAO bro  what  You still hold dog coin lololol,1,1
Bitcoin  and its forks  and altcoins have experienced a good amount of volatility  It s no different  this time around  BCH is currently tr diing sideways after registering a price correction  Nevertheless  the current dip serves as the perfect opportunity for traders because now s the time to acquire more assets  BT C and E T H are moving towards their worst weekly candle close of 2021  If the previous week is clubbed together  the losses are tragic  creating a significant sense of panic in the market  BTC  ETH were respectively down by  46  and  53   Hence  the case for a fractured bull cycle is becoming more evident and also both assets do not exhibit structural market strength at the moment  Both assets have not held positions above their supports  Right now  sliding strongly towards their low from May 19th  the sell off can be considered to be a reason for the invalidation of market supports  As Bitcoin is firmly driving the sentiment  the Alt markets are facing a similar decline  Though the m rket is not favorable and pr ces are down  this is a good opportunity to get more  ssets through buying the dip and also through profitable tr diing  I tr de daily with signals from Dr Tom  You can reach Dr Tom on   l       DrTom206   with his tr de slgnaI being copied in my tr des I have gotten over 12 bt c in profits   Dr Tom is an expert tr der and signal provider and he runs a program for less experienced tr ders looking to stay profitable in their tr des and I must commend his Tr de Courses as being insightful  broad and relatively easy to comprehend ,20,7
 Activate ze Tether FUD    Bogdanoff  2017,1,0
check  PROS to get more ETH ,1,0
Great    views my friend  I m bullish on ADA because I share the same views of the founder  I don t believe the USA    UK    and corrupted governments should have such financial strangle hold  on the citizens of the world    So for that reason I m investing my money to bring change ,1,0
It looks like they are modeling the banking system  The banks do the same thing  A bank can loan out on leverage 1 dollar in reserve to 10 dollars loaned out  Look it up  The government will not allow a competing fiat  China is an example as they are targeting crypto ,1,0
You re sharing an article that happened before the NY AG looked into them   I was also concerned about this item in the past and for sure it s got a shady company behind it  But you haven t researched this very well and so much of this has already been debunked   Binance and Binance US are different   The Bahamas bank has also responded to it and debunked the article you shared  The numbers they share for Bahamas aren t the whole story  ,10,1
Can you share the debunking articles ,2,
I am also a Tech Lead working for an IT MNC and coding since past 10 years   but on this Crypto thing   I am very bullish and not going to sell any of my HODlings  I don t have any DOGE though    Will get back to you in 2022   ,14,0
Sorry but bullshit ,2,0
The sell off will create another opportunity for the wealthy to buy up  crypto on the down low  This happens once the bleeding hits a high  point  The average investor will be just trying to keep from losing their entire investment  This also opens the door to a government regulated crypto which is exactly what the global elite want   Just remember all currency and commodities can and will be manipulated by those who create the markets  Think of it like a sadistic game of musical chairs with the three blind mice being played backwards ,1,0
Now it will got to 100k,2,0
If one person s comments can tank the market  how safe is your investment ,1,0
This won t age well  No  it s not going to zero in our lifetime  Crypto is an asset that is trustless  permissionless  best cross border payment process  deflationary  decentralized  liquid and accessible and tradable 24 7 of the week ,8,1
Yeah im pretty confused by his recent videos lol  The entire crypto market cap only goes up from here,1,
Start with      Rich people own almost everything which means they meet on the golf course and decide everything,1,0
thechinahacks helped me out financially when i was broke  They are super awesome  ,1,0
I thought the video speed was at 1 5x,1,0
just hold usdc  dai  busd or any other stablecoins  this tether fud was quite effective in 2017 because it was the only stablecoin but now nobody cares  the market is down 1T in the last week yet we should get scared because of 60b usdt  whoever cares about fiat in the first place clearly doesn t understand BTC ,2,0
Catcoin anyone  ,2,0
Fool lol,1,0
Very well said  that part where its not popular to have paper hands   people want to pump btc and because of emotional ties to their positions  Thats when the logic goes out the window  The truth is crypto is done  its a fiat currency just like the dollar  And its weakness has been exposed  Its still a tradeable and profitable financial instrument but cryptos will never replace any  currency  Period  95  of these crypto fan boys and girls don t even know what the IMF SDR is  which is likely to be a global currency which will likely run on blockchain tech ,1,0
By the time bitcoins take over normal cash we will be dead ,2,0
LOL THIS GUY LOST,1,0
China    bans crypto every year     ,2,0
The US dollar   us stock market all a Ponzi scheme,1,0
This guy is spreading FUD to buy it all at a lower price   China bans after they sell    ,61,6
 reissone One and what s the difference again  Both are neither worth of my investment IS my original point  regardless of their technological point of view  Why I should care  what a waste of time learning    I invest only in cash flow positive bussiness  Now that is worthy asset that I mean ,1,
This guy calls doge    dog coin instantly discredited   this what you fud and paper hands,2,0
Is this 2017   This is old FUD and you are missing out on the bull trap pump ,6,0
So why not just use USDC ,1,0
As other people have said    you own doge    but have got rid of everything else  Sorry but that is mental ,6,0
Alright   not going to lie   this man   if indeed he is a man    is either a sad or mad man     American Canadian Dollar is based off of FAITH in the Currency No longer based off of Gold Silver or Any precious metal     so   there s that    Crypto is based off of work done on solving and computing blockchains equations and isnt controlled by any Country    so    which  Currency  is more Legitimate  ,1,1
This is the same with all banks    every single bank in the world  If everyone pulled out their money from banks   every single bank in the world would collapse ,2,0
Dam all those monitors and u still stupid,2,0
Lol womp womp,2,0
When talking about crypto currency  I have come to understand that only a handful of people really understand its mechanics and make money of it ,1,0
So  you sold all your Bitcoin  Cardano and Ethereum because of Tether  TETHER  ,2,1
Be a muppet like me and sell all your crypto    TechLead,1,1
Tech lead investment strategy  Buy asset at all time high  watch FUD crash market  when market reaches local bottom self FUD with one last story and sell ,1,0
It is never over until it s over,1,0
you sold because you are very stupid or manipulate    This is a game made by China to destroy the crypto and after to buy it for nothing  After you will that the crypto are good  Exactly like this pandemic  Scare de people and we do bussines ,1,0
haha  sorry to hear that you fell for it ,1,0
Digital currencies hold zero value in the commercial market  if you can t buy anything with it then it s not worth anything  You were smart to get out when you did and hopefully made a profit  hang on to your fiat currency  invest in the stock market  make your mortgage payment and buy food for the home   now try all of those things with digital currencies ,1,0
China definitely isn t playing the market fairly ,1,0
cash out early before the bubble burst  its good of quick profit  but blockchain technology is real,1,0
There is no putting crypto back in the box  The central banks shall be destroyed and that is inevitable and your slavery shall end ,1,0
Crypto is Fiat  2 0,1,0
The crypto market is also rigged with manipulation,1,0
i thnik it will fall to 1trilion market,1,0
Smart guy  Bitcoin is pumped and has no fundamentals to fall back to like a profitable business  No way to value this ,1,0
NGMI,1,0
 Nice video well I highly recommend raczhack   on Instagram his got the best skills of getting back your coin  ,1,0
But same goes for the federal banks  They don t have all the money if we were all go to the bank to cash out  They would print it as well ,1,0
I share your doubt of tether   potentially leaving everyone holding their bags   But why say you sold everything and kept doge   that s more iffy that Tethers cash holdings imo,1,0
smart man  i know ur just downramping bro   ,1,0
He is definitely missing the entire fact that Tether was audited by the NY AG ,3,1
I dont see why tether being shady is your reason for selling  The bull run isn t over yet ,2,0
I m sad for you   ,1,0
I didn t know Tether was that suspicious but I remember checking on Coin Market Cap one day and seeing Tether as the third most valuable coin and I was kind of taken back because I barely saw anyone talk about Tether  It actually makes a lot of sense that they re just creating them out of thin air and increasing market cap ,2,0
Tether is used to hedge by traders in between trades  Most of the volume from most markets come from traders market makers in this way,5,0
I can t believe i watched the whole thing  What a load of FUD ,134,46
  NonExistant  MolecularCandy funny thing is that btc is NOT even a currency  You are correct that is it NOT a store of value  Too expensive  slow and easily replicated via other coins popping up out of thin air ,1,
 Ended the fed Wow    You must do all your research on bing  ,1,
 Ended the fed Social Security is a Ponzi Scheme   Fiat money is a Ponzi Scheme  The  Zimbabwe Dollar is an example ,2,
 Ended the fedNo  Bitcoin is the opposite of a Ponzi Scheme ,1,
 Ended the fed OK BOOMER,1,
 Hal Hyman So crypto is 2 degrees worse than a ponzi scheme,1,
 Ended the fed The U S  Dollar is worse than a Ponzi Scheme ,6,
 Ended the fed OK BOOMER,1,
 UnReal23 ANYONE CAN MAKE A COIN  EASILY REPLICATED  SLOW  EXPENSIVE  PONZI   Ponzi,1,
crypto is a ponzi lol   Not a store of value  Not a currency ,3,
 John Apple doge has nothing  It was created as a joke and developed in 2 hours  There s a reason why we want those hands out ,2,
Could you explain why please  I m curious  thank you ,2,
Tether prints 60billion  Govt prints Trillions   so long as people believe in it  it doesn t really matter  Tether FUD has been around forever  Anyway I have good news for you   You can still buy the dip   ,1,0
Whales   are manipulating the prices as much as they can so that they can let it shoot up and pump for the super cycle ,1,0
that is not bullish that is bullshit,1,0
And what exactly do you think the United States Federal Reserve is doing   The US   which affects the globe as it s the global reserve currency  is backed by absolutely nothing     debt and taxes   It is a promissory note   Do you think all of the billionaires in the US could go and actually withdraw their dollars from a bank   Absolutely not    Bitcoin is the best form of money our species has ever seen  perhaps you should have educated yourself a bit more before apeing in ,1,0
people have been saying this for 8 years now  first time people spoke about this was 2013 ,1,0
To be fair everything is inflated like the real estate market and stocks ,1,0
Hahah this is old news  Tether has always been manipulated and a big down fall of bitcoin  This won t kill the crypto market but you re right about the bear market ,1,0
I have about 5  of my portfolio in uranium stock any advice on any other stock that I can   grow my  300k capital to a million dollars ,10,25
Trading crypto with Expert Daxton has being a game changer for me,1,
Thanks   placing my trade with expert Carter ASAP,1,
 Mercedes pope   Thanks for his contact I will reach him right away,1,
 Jesse James Really y all know he s   I even thought I m the only one he has helped walk through the fears and falls of trading,1,
Please how can I start trading with Mr Daxton ,1,
No doubt Mr Daxton trading service are really great  I invested  5000 and cashed out  14 700 on just 3weeks ,1,
 Malkeer Singh You don t need to be surprised because I m also trading with Expert Daxton he helped me recover all that I lost trying to trade by my self ,1,
Most people have been having alot of failures in forex and crypto sector because of poor orientation and bad expert ,1,
 Kristian Nordgrad   I ve heard alot about Mr Daxton on my social media   I m little surprised someone mentioned and recommended his here too  his service are awesome,1,
Access to good information is what we investors needs to progress financially and generally in life  here s a good one and I am grateful ,1,
No doubt i have been getting the best from using his trading system,1,
I would really like to have an insight to this skill of yours because my portfolio shows little to no progress,1,
 James C  Guillory This is impressive how could someone go about getting investment guidance from a coach like that  would you mind sharing your coach info ,1,
That is totally true  but how well does a financial advisor improve your profit  What is the experience like using an advisor ,1,
You should know it s easy and hard to make that much profit  I say EASY because it s very possible to make that much  and Hard because you ll need professional assistance to do it  I d suggest you get assisted by a market advisor ,1,
You should buy and hold tech stock Crypto investment,1,
What a paper hand,1,0
Hypothetically  if I have 100Million in my bank account  and one day I decided to withdraw 99 million all at once  the bank might closed down due to liquidity problem  Same in crypto  it just copied the banking system but upgraded it and empowered people to decide  Basically  the middle man bank will be obsolete ,41,5
 Wandy Wexler Weslon no but they can t make something illegal   easily,1,
 Wandy Wexler Weslon government don t have interest in drugs  It s a real problem for all and they want to eradicate it too  Now government would have interest on tracking money activities on all its citizen  they would approve crypto but its came from their central bank invention  Do you think you can using bitcoin to buying thing as everyday usual  That s why most government in the world accept bitcoin just inside category of asset  not currency or money ,1,
 Griffith F K  More than  1T went out of the crypto market over the course of 2 weeks  That sounds a lot  It is a lot  No company filed for bankruptcy  no one died  Some overleveraged people  not managing their risk properly lost money  Good  Re start all and everything again  Buy the dip  Apes strong  fundamentals stronger    ,3,
Crypto holdings are vastly less liquid than real banks   you actually could wire out  100M and a big bank wouldn t bat an eye  let alone go bust  Companies engage in transactions that size all the time ,8,
This guys videos are laugh out loud funny  good content techlead,1,0
Selling low  a real winning investment strategy ,34,0
