Comment,Likes,Reply Count
 update  Follow up video here   Why Bitcoin is going to Zero    https   www youtube com watch v iomRREashI0   Still in  Get 2 FREE Stocks  and pick up some DOGECOIN  on WeBull valued up to  1850  when you deposit  100   https   act webull com k S4oOH2yGOtHk main,151,119
 Katano Martinez I agree  my thoughts are the BCH will be  50k within 5 years when they run out of BTC ,1,
 Cathy Lake Cathie Wood has a prediction of a 500k Bitcoin this year at a 7 trillion markertcap  Bitcoin had a 2 trillion Marketcap and peaked at 65k  So if you 3x 1 2  65k that will get you a  227 500 Bitcoin  That s where i think the approximate all time high will be at for Bitcoin this year  That being said  Bitcoin Cash follows the same exact pattern as Bitcoin  Bitcoin Cash all time high this year was about  1 600 and so 3x 1 2 that price will leave you with a  5 600 BitcoinCash   Regardless of the energy consumption it doesnt matter  Miners will adopt solar panels for mining  It reduces the cost of electricity while increasing their revenue  Mining Bitcoin already used a lot less energy than anything else  Look at the comparison charts on google    The 4 top coins on every exchange is Bitcoin  Ethereum  Bitcoin Cash  and Litecoin  That s what the fund managers are going to offer at the banks    meaning at some point more money will flow through those coins before anything else  Bitcoin Cash has halvening just like Bitcoin during the same year as BTC  I expect in future for Bitcoin Cash to be the next Bitcoin  Once Bitcoin is too expensive for the average person  people will look at Bitcoin Cash as the alternative ,1,
 QT LOL We are laughing all the way to the bank ,1,
Bitcoin is a joke,1,
 Katano Martinez I think you are right 100k BTC this bull cycle is likely  How do you think BCH will do since it is capped at  21 million also  uses way less energy to mine and had an all time high of  4k but is now on bargain sale price for about  600  BCH is being used by paypal and bitpay ,3,
 IE Ok you won t say that when you  have to wheel a wagon  full of fiat to get a loaf of bread and everyone who has 1 bitcoin is a millionaire in 10 years  my opinion not advice   You do not understand hedge against inflation  so I am wasting my time debating you  Bitcoin has proved itself  to institutions to to be a long lasting currency or their advisors would not have gained the ok to sell bitcoin to investors  Once you have institutional buy in that is my signal to buy a coin based on price history and use case  so I don t have any doge coin or any other such risky coins ,2,
 M C Don t close yourself off to the amount of opportunity out there  If you like ADA which I love myself  then you love Hedera  They are backed by Industry Giants like IBM  BOEing  Deutsche Telekom  and you ready for this  GOOGLE  Dotcom Bubble Veteran Google has chosen to jump into the Crypto space while it s still in it s Bubble Era and chose Hedera out of several THOUSAND projects  That tells you everything you need to know right there   Follow the smart money    And the Bubble surviving Industry Giants ,1,
 JCT343 Cardano is the only crytpo I am comfortable with ,1,
 Cathy Lake Crypto is the biggest risk  Riskier than fiat  It s also unregulated  Fraudsters galore ,1,
After thinking for  while  you have a serious point ,1,
 DeathSleep Not sure what you are doing but with most stable coins you earn 12  interest  Depending on the crypto currency one has can also earn interest on it  I compensate by buying the dip  trading when its convenient  and leverage  Leverage can be shorted or long  So a person can make money regardless of the direction the market is going  Don t panic sell  I have inside info on the situation  You will be seeing a 100k BTC soon,2,
 IE Stay broke you had your chance  Bitcoin stopped being a casino gamble and became an investment this year  when the investment banks and corps added it to their portfolios  Bitcoin is a hedge against inflation  Like a rare piece of artwork  but fractionally spendable  You know what is riskier and more of a gamble    Keeping all your assets in worthless paper they just keep printing with no end in sight  That is why i have also invested in physical platinum   gold  silver and land with a pond and spring  Diversification is key  but all the smart money has at at least 10  of their assets in  capped big name crypto ,1,
 IE Scared money don t make money  To make money in anything you have to risk money  I wish I had put a  1000 in bitcoin when my friends told me to when it was less thank a  1  I ended up investing when it was  10k  Although I am not a whale and neither is Tech lead he can afford to make an educated  gamble  on one bitcoin  Look at the price graphs there is clearly a pattern now and it is being adopted for purchase by investment banks and states like Wyoming ,1,
 IE The Federal Reserve isn t run by banks  It is the largest PRIVATE bank  Most people think it s a government bank because  it holds the word  federal  in its tittle   Certainly this bull cycle as the last was orchestrated by a large institution or collection of  but why do you think it was bankers and not an institution like Ark investment or even Tesla or both   Elon adopted Bitcoin for Tesla to make one of the big 4 pump legs  Then he put out negative news to cause a drop  Then when Bitcoin and Ethereum already pulled back and found crucial support  he put out another negative tweet causing a drop below that support level to the next level of support  Cathy Wood from Ark is always putting out bullshit propaganda about how Bitcoin is going up to some astronomical number  And she is close with Elon  A so called former Ark analyst  an Asia fellow  says Ethereum is going go 40k then 120k   The evidence is pointing to Ark Investment and Tesla working together if you ask me ,2,
 revo1974 I bought Ethereum when it was somewhere 285  Just Increasing my position ,2,
 IE hahahaha ok mate  Did the US Fed sell 4 Trillion dollars of Oil to fund the expansion of the M2 money supply this year  Nope didn t think so  Try again,1,
Lol isnt that what the US Fed does  ,1,
 IE Except in some countries they are already being used to purchase goods and services so they are not worthless outside of the casino  Paypal is taking bitcoin and bitcoin cash also  He is being paranoid selling ALL of his bitcoin and he will regret it in both short and longterm  It should hit at least 100k by EOY and  500k in 5 years in my opinion ,1,
 GoofTuber But sell all    Why not just take a little profit above what he invested so he has no losses    People who have completely withdrawn are being paranoid ,2,
 John Elly Calipusan long term this meme coin is probably going to nothing  It s bs,1,
I own crypto because I know the us dollar is going to inflate into our death  I own my bitcoin  etc regardless of what its usd is worth  Because to me the tech is brings more value than the literally nothing the usd brings ,1,
The only thing that has always had unquestionable value has always been gold  Simple  Gold that you possess and take care of ,2,
You are not for stock or crypto   Do what you are good at     Coding ,4,
Normally one can t sell their position in a ponzi and tether news like China ban is 3 years old  re packaged as new news ,1,
 Captain Seal No but I do have a background in statistical analysis and you are wrong ,1,
BUY BITCOIN WHILE ITS CHEAP  IMO ,4,
 Neil Meleo The whole financial system and this world is fake anyway ,6,
Doge to the moon ,3,
Complain about crypto and promote a crypto affiliate link    hmmm  ,5,
Similar to the Dogecoin at the beginning  I recommend the Gulden Coin  Website   Anycoin ,1,
 Satoshi Analysis it s a good price right now,1,
Thank you so much I thought I have lost it all but you came to my rescue get all my investment back was a work of genius never could have believed it ,1,2
I can guarantee everyone that you re legit     this profile above generated huge profit into my wallet without any complaint or errors      ,1,0
I found bitcoin in 2011 while i was kid  I lost opportunity to buy 200 BTC   it was around 0 5    Thanks to my dad  he didnt want me to buy that  useless   think  Now i am poor  he is poor and i am planning to live in jungle and die alone ,3,2
u can still make it mate i hope u will i beleive in u,1,
Investing with expert Nora has been the best step I have ever took in my life  may God bless that day I meet her,9,5
She is the best broker I have ever seen,1,
I m glad I did Invest with her and I still reinvested and the trading is going,1,
I m from Germany I used to take loan from bank for surviver but after trading for real expert Nora She changed my financial status for real,1,
 I got to believe this Guys immediately after my     was recovered by them   ,1,0
Feedback appreciated   Wanting more info and insight  WatsApp the number above Endeavor to reach out ,1,
 Thanks to everyone out there for introducing  this life saviour to us AI can t stop appreciating his thrustworthiness in my life am sure many will have been helped and saved  me and family are grateful to you once again Sir   ,1,0
 Thanks to everyone out there for introducing  this life saviour to us AI can t stop appreciating his thrustworthiness in my life am sure many will have been helped and saved  me and family are grateful to you once again Sir   ,1,0
Hello  I m new to forex trade And have been making huge losses but I recently see a lot of people earning from it  Can someone please tell me what I m doing wrong,4,1
This aged poorly  ,2,1
This didn t age well,1,1
loool  Well done mate    D D D Today Bitcoin worth 67K   ,1,1
Y O U      A R E    A    C L O W N,1,1
Someone didn t understand the market ,2,1
So did you buy back yet ,1,1
This aged well,11,2
 me jeff same,1,
lol i clicked just to write the same post as you lol,1,
He sold  pump it  New ATH,2,0
I FEEL BAD FOR BRO                     BITCOIN HIT  64k today     ,2,0
ouch sometimes we get em wrong,1,0
        ,1,0
WHY IS BITCOIN GOING TO ZERO   ,1,0
This guy is the definition of buying the top and selling the dip ,3,1
This is aging really bad  How s your dogecoin ,2,0
A successful transaction   dealing with him my bitcoin wallet keep popping up investing with them,1,0
A successful transaction   dealing with him my bitcoin wallet keep popping up investing with them,1,0
THESPACEHACKERS COM      YOU ARE A GOD SENT THANK GOD FOR BRINGING PEOPLE LIKE YOU TO HUMANITY      ,3,0
I highly recommend        In his time at Pacific  he has shown the technical  organizational  and interpersonal skills that make for a truly exceptional administrative assistant  In particular  I know that you re seeking someone with exceptional customer service and skills  as well as the ability to get up to speed quickly with proprietary software  he  offers all these skills  plus adaptability and grace under pressure ,3,0
I highly recommend        In his time at Pacific  he has shown the technical  organizational  and interpersonal skills that make for a truly exceptional administrative assistant  In particular  I know that you re seeking someone with exceptional customer service and skills  as well as the ability to get up to speed quickly with proprietary software  he  offers all these skills  plus adaptability and grace under pressure ,3,0
EVERY TIME ITS THE MOMENTS AND MEMORIES WHICH WE LIVED FOR I JUST GOT MY MTCN THANK YOU FOR GIVING SUCH MEMORIES TO CHERISH FOREVER ,3,0
EVERY TIME ITS THE MOMENTS AND MEMORIES WHICH WE LIVED FOR I JUST GOT MY MTCN THANK YOU FOR GIVING SUCH MEMORIES TO CHERISH FOREVER ,3,0
   All thanks to the name above for the successful recovery of my coin sent to a wrong address without delay,1,0
THIS AGED WELL LOL,1,0
This video didn t age well lol,1,0
Hello  I m new to forex and bitcoin trade and I have been making huge losses but I recently see a lot of people earning from it  Can someone please tell me what i m doing wrong,14,29
It s been a horrible time and a friend recommended him    to me he s legit,2,0
Now what  BTC is currently at 56k right now  you scaredy cat techlead,1,0
    Helped me with enough bitcoin now I can afford whatever I want     ,2,0
You re a maniac ,1,0
I think this Video is not ageing well ,1,0
Meeting you was the greatest thing that has ever happened to me  Mystercracks   ,1,0
Meeting you was the greatest thing that has ever happened to me  Mystercracks   ,1,0
 Mystercracks best hacker   Mystercracks best hacker   Mystercracks best hacker    ,1,0
   Greatful for the great job all around done  Never realized programmers like you despite everything exist  I own condo and a major store     made it worked im appreciative to alll of you ve done,2,0
May the peace    of the lord guide you and your family  Mystercracks ,1,0
May the peace    of the lord guide you and your family  Mystercracks ,1,0
 MYSTERCRACKS if everyone was like you the world   would have been a better place   THANK YOU    ,1,0
I BLESS THE DAY I MET YOU  MYSTERCRACKS MAY YOUR LIGHT   KEEP SHINING ,1,0
I BLESS THE DAY I MET YOU  MYSTERCRACKS MAY YOUR LIGHT   KEEP SHINING ,1,0
Mystercracks you re our God on earth  You meet up with our needs thank you   sir     ,1,0
Mystercracks you re our God on earth  You meet up with our needs thank you   sir     ,1,0
I will let the world   know about you sir    MYSTERCRACKS         ,1,0
 Mystercracks   Mystercracks Mystercracks  I pray to meet you in my next world   you re the best    ,1,0
 Mystercracks   Mystercracks Mystercracks  I pray to meet you in my next world   you re the best    ,1,0
 Mystercracks  Mystercracks   Mystercracks      Thank you   for your kindness  may the lord almighty reward you for your good   work to us  ,1,0
 Mystercracks  Mystercracks   Mystercracks      Thank you   for your kindness  may the lord almighty reward you for your good   work to us  ,1,0
I am so glad that I still have my crypto  I think the reality of the situation is a lot of people are using crypto as a hedge against inflation rather than a way to get around Financial regulations  With regulation also comes opportunity  With Bitcoin now being legal tender in El Salvador  the demand for crypto will only grow ,1,0
      is simply the best when it comes to forex investment ,1,0
 DEPLUGHACKS I just wanna say thank you for your good works     ,1,0
 DEPLUGHACKS I just wanna say thank you for your good works     ,1,0
 DEPLUGHACKS For what you ve done for me I will tell my friends and family of your good works  ,1,0
 DEPLUGHACKS For what you ve done for me I will tell my friends and family of your good works  ,1,0
How can I pay you back for what you ve done for me  DEPLUGHACKS ,1,0
How can I pay you back for what you ve done for me  DEPLUGHACKS ,1,0
 DEPLUGHACKS you are the best thing that has ever happen to me since I starting crypto investment  ,1,0
 DEPLUGHACKS you are the best thing that has ever happen to me since I starting crypto investment  ,1,0
 Mystercracks  I pray you never lack anything in this life because you re such a kind and genuine man to all    ,1,0
 Mystercracks  I pray you never lack anything in this life because you re such a kind and genuine man to all    ,1,0
 DEPLUGHACK  DEPLUGHACK The best recovery agent in the building     ,1,0
God bless you retrieving my lost funds   DEPLUGHACKS   DEPLUGHACKS ,1,0
God bless you retrieving my lost funds   DEPLUGHACKS   DEPLUGHACKS ,1,0
DEPLUGHACK  DEPLUGHACK  DEPLUGHACK you re the best ,1,0
DEPLUGHACK  DEPLUGHACK  DEPLUGHACK you re the best ,1,0
 q5cyber  q5cyber This dude  seems to be the only true reliable and trustworthy guy you should trust    ,1,0
 q5cyber  q5cyber This dude  seems to be the only true reliable and trustworthy guy you should trust    ,1,0
many see forex say a get rich scheme but forex is not like that  it s a gradual process with the right tools and application you can make a living from forex trading    ,19,19
I m even surprised to see someone talked about are here on YouTube miss Stacy Griffin is a professional trader who has been helping a lot of people in different country through her trading platform,1,
 Donna Gillard you re right  i thought I knew it all when I was practicing with my demo account,1,
 Alisha Rodriguez please  can i invest in forex trading on my own   I have been practicing on my demo account,1,
stock are good but I swapped and invested in forex   Bitcoin and other cryptocurrency  I have been making good profits,1,
Here are some investment you can try  forex Bitcoin stock cryptocurrency,1,
successful people don t become that way overnight   what most people see at a glance wealth  a great career  purpose is the result of hard work and hustle over time,1,
Can t thank you enough for your help  SPEED TOOLZ  SPEED TOOLZ                  ,1,0
Can t thank you enough for your help  SPEED TOOLZ  SPEED TOOLZ                  ,1,0
SPEED TOOLZ SPEED TOOLZ SPEED TOOLZ                   YOU DESERVE AN AWARD FOR YOUR GOOD WORK AND GOOD DEEDS  ,1,0
SPEED TOOLZ SPEED TOOLZ SPEED TOOLZ                   YOU DESERVE AN AWARD FOR YOUR GOOD WORK AND GOOD DEEDS  ,1,0
 SPEED TOOLZ  SPEED TOOLZ   SPEED TOOLZ  THANK YOU FOR PUTTING SMILES ON MY FACE   ,2,0
 SPEED TOOLZ  SPEED TOOLZ   SPEED TOOLZ  THANK YOU FOR PUTTING SMILES ON MY FACE   ,2,0
 Hemcracks   Hemcracks Hemcracks  I pray to meet you in my next world   you re such amazing,1,0
 Hemcracks   Hemcracks Hemcracks  I pray to meet you in my next world   you re such amazing,1,0
Hemcracks is like a brother to all he s a kind hearted young guy he s ways are the best ways  I rate him with my life     I strongly believe in his job   ,1,0
Hemcracks is like a brother to all he s a kind hearted young guy he s ways are the best ways  I rate him with my life     I strongly believe in his job   ,1,0
Am very certain that Hemcracks is the best out there  All these positive reviews about him speaks   volume     ,2,0
Am very certain that Hemcracks is the best out there  All these positive reviews about him speaks   volume     ,2,0
It came out way better than I thought thanks  Hemcracks for the transparency and accountability   ,1,1
It came out way better than I thought thanks  Hemcracks for the transparency and accountability   ,1,1
Hemcracks    ,1,1
Hemcracks    ,1,0
Nobody but Hemcracks whom I see everywhere so great and a legend  ,1,0
Nobody but Hemcracks whom I see everywhere so great and a legend  ,1,0
Job will come your ways  helping people will make you rich    Hemcracks the future is inevitable  you re the best      ,1,0
Job will come your ways  helping people will make you rich    Hemcracks the future is inevitable  you re the best      ,1,0
 Cybercr3ck  Cybercr3ck You re truly a God sent you deserved all the recommendations I m seeing about you ,1,0
 Cybercr3ck  Cybercr3ck You re truly a God sent you deserved all the recommendations I m seeing about you ,1,0
While you were selling  I was buying lol,1,0
lol i cant wait for this to age like milk,3,1
Well this video aged well,1,1
Gooo away,1,1
well it just hit 40k,2,2
Bitcoin,1,2
Tether doesn t change Bitcoins value nor value proposition one bit  Only exit if you re afraid of short term volatility ,2,1
There is no reason not to back your usd stable coin 100  with real usd  Thether I do not wish to have  sound like scarm only 3 8   backed by cash  Worse than a bank       But 1 btc is 1 btc     even if Thether crashes and btc is limited supply ,1,1
 But I m never joking  Unfortunately  that s what you look like ,2,1
USD will go to 0 faster than bitcoin,2,2
yeah let s take advice from a guy that says  dog coin ,2,2
Same narrative is in 2017 aye   ,1,1
So he s worried that a fiat currency is not backed by another fiat currency  He s way behind lol  It s only to facilitate trading outside of the dollar,3,1
Lol  welcome to crypto  Enjoy the ride,1,2
Just use BUSD guys  Its regulated and backed 1 1 cash,1,2
Good content   However  if you re selling all your Bitcoin   Tesla stocks  where are you transferring your funds   Which decent yield is better where you have moved your funds to   TIA   ,1,0
Prove that you sold em all      bet you wont ,1,0
I tell u why u sold all ur bitcoins cause u r very uneducated about bitcoin,1,2
Philippines just got scammed just now by Tether  Ran away with all our money  Sheesh ,1,2
Crypto is just digital fiat ,1,2
wait you sold your bitcoin but you have your doge    ,1,2
Gold and silver all the way  Once the big players I won t mention got into Bitcoin  for me  that was it finished ,3,1
like dislike ratio tells me a huge number of idiots are going to left with their stablecoin that is pegged to dogshit i ll wait till they start crying in comment section,1,2
This guy sold his bitcoin and kept doge  says it all   ,1,1
I ll be buying your Bitcoin    ,5,1
Tether do what the federal reserve do  Print money  it s nothing new ,1,2
Easy trade daily  don t hold for long term,1,2
Have you look at USDC  ,1,2
OY this guy is so annoying ,1,0
glad I never got into crypto coins,1,2
Cryptoweevforhelp helped me figured out my lost wallet fast and trustworthy I must say I appreciate the good work  ,1,0
From a personal point of view I feel crypto got to be best thing that has happened to the financial market for awhile now  it continues to open room for bulk gains whether in holding or most importantly trading  looking closely at Ethereum it started a fresh rally above the resistance zone against the US Dollar and it seems there is high chance for more upside  and the current trend would reveal the amount of institutes that have embraced the use of the crypto assets to optimal results thats why i will say ETH is only just in the early stage of a bigger surge  Considering the the bulk return one get from trading than just holding it might be too late buy an asset while holding but its never late to buy in while trading crypto and with trading crypto i have gained  170K in my portfolio but i didnt do it all by myself but with accurate strategy and signals from an expert trader Chen lawrence   With Adam help I no longer have to worry about the rise and dip of Bitcoin  you can easily get to Isaac  on  Teleg  ram   chentrading1   1 724 228 4787 on whatpp,2,0
Honestly just came to read the comments  A bunch of y all are ngmi ,1,2
Always invest want you can afford to loose  Investing is not for the faint of heart       ,1,2
This is like saying I sold all my gold coz some fake gold I can t verify have infiltrated real gold  Or I sold my real house coz there were fake gadgets installed behind the wall I can t see ,1,2
  I PRAY THAT ANYONE WHO READS THIS WILL BE SUCCESSFUL IN LIFE   SUCCESSFUL PEOPLE DON T BECOME THAT WAY OVERNIGHT  WHAT MOST PEOPLE SEE AT A GLANCE WEALTH  A GREAT CAREER  PURPOSE IS THE RESULT OF HARD WORK AND HUSTLE OVERTIME    ,3,5
In as much as nobody wants you to be right  Nobody can honestly say you are definitely wrong  I always say the Cryptosphere is the Modern Wild West and that s what it is   But you need to understand that we are driven by hope   when you have nothing to lose there is absolutely nothing wrong with trying  Cheers     to eating the dips       ,2,1
Dont think it is over  From 2017 btc only moved 3 5X I dont think so ,1,3
Tether is definitely sus and needs to be investigated and less used by crypto users,1,2
Buttcoin in the backround    ,1,2
Tether always been crap   we all know this  ,1,2
so tether could be the imposter among us    that s creepy,2,1
19 may 2021 Ouch  did you sell on the floor ,1,1
PAPERHANDS  Don t listen to this guy he probably still owns BTC ,3,1
And fiat    Not like that is just fake and printed by the government  Lmao,3,2
buy cardano     ,2,2
 I sold all my bitcoin  It s done    I have doge coin     okay buddy hard to believe anything you say ,20,3
Dogecoin is better than bitcoin fundamentally  lower transaction fees  lower energy consumption  more utility  and the biggest crypto community  which is only gaining more traction   ,2,
No one holds tether  It s a network middle man ,1,0
I love this guy      Salient point for me  despite all this  he does somewhat trust doge   I whole heartedly agree ,3,1
          aaaand its gone    ,1,1
I told you before get the hell out of all Crypto currency  and invest in anything but the Crypto world                ,1,0
The ultimate beta,1,2
when I lost my Bitcoins   Romiunlocks  helps me to get my lost Bitcoins back so fucking happy to meet him  ,1,0
when I lost my Bitcoins   Romiunlocks  helps me to get my lost Bitcoins back so fucking happy to meet him  ,1,0
Little penny while investing  even when they haven t finish that percentage advance try them and thank me later cause realsourceinvestmentdotorg has been the best among lists of miner ,1,2
I really appreciate what the investment signal of realsourceinvestmentorg has done in my life it a pleasure to be in the midst of enjoying the profit and gain of investing ,1,2
I ve seen different people speak of different trading strategy   while some get to lose on a daily and weekly   bitcoin is the biggets asset anyone should posses rght now at this time   having a better trading plan will help skip lose on every trading session  i pray everyone reading this will be successful in life,44,11
Let him know I referred you okay,1,
 Jory Henrika Carlton is a good mentor i can talk about right now i was referred to him by my students in school  he has been a blessing in the life of me and my family,1,
I use to see crypto as a side thing until i came across mr carlton jefferson s strategy   i met him in a conference i enjoy his teaching   his experience in the market is best to work with   i was very happy when he accept to trade for me till now,2,
You are right about better trading routine  people only lose bcos they lack proper knowledge about the market and how to control it as well,3,
What do you think about the john mcafee suicide in jail  ,1,1
What in the soy is this channel,1,0
