Comment,Likes,Reply Count
Even if 50  is like what you say  it is already bad enough  Not that your story is not correct  coz it is  I also hear this about Tether a few weeks ago  Make sure your stop limits are set ,1,0
check USDC    60 billion in USDT doesn t make the entire crypto system go up,1,0
Simply NOT  OVER ,3,0
paper hands,1,0
Thank you for your donations brother,2,0
Ur accent is worst out there  Real pain to listen  Hire  a dubbing person ,1,0
as a trillionaire  boku no pico was a good anime series,1,
Excellent job ,1,0
Bitcoin is exciting because it shows how cheap it can be Bitcoin is better than currency in to that you don t have to be physically in the same place and of course for large transactions  currency can get pretty Inconvenient ,15,34
Tether   We operate just like every bank in the world   with less than 5  backed by actual dollars ,35,4
 Human Centered actually they kinda do  If you have heard of the Basel framework  banks have to put up with all kinds of capital requirements  I understand why people like to evilize the banking industry  But if you examine the facts  banks are not the same animal they were in 2007 2008 ,2,
yea  that s why banks are heavily regulated ,4,
That was beautifully reasoned and articulated   I think the church of bitcoin might want to burn you at the stake ,1,0
He s an Asian on a computer talking about math    okay Im sold  ,3,0
 All of the miners in china   what are they doing    Me  SELLING GRAPHICS CARDS LETS FUCKING GOOOOOOOOO   ,2,0
The market appreciates your donation ,18,2
I really hope the GPU prices come down again ,24,1
I smell bullshit   Im exiting this techlead,1,0
Ok so basically what this guy is saying is that USD Tether does pretty much the exact same thing as the Federal Reserve  Therefore the United States Dollar is a ponzi scheme  interesting      I guess I should take my money away from the ponzi scheme and buy bitcoin      ,1,1
Jesus so many fruad comments smh,2,0
Tether has been around a long time  it s always been  very dodgy  What s actually changed or were you not aware before buying crypto in the first place ,2,2
Regardless if you think BTC is going up or down in price  and I could care less about that  it is incorrect to call Bitcoin a Ponzi scheme   A Ponzi scheme has some very specific criteria and there isn t a single aspect of BTC that meet that criteria ,1,0
You right about it  it crash now,3,0
That may be the single most informed  intelligent and comprehensive synopsis of the crypto space I have seen to date    I thank you greatly for this information ,1,0
thanks,1,0
Fails to understand that when someone adds fiat to a crypto exchange they automatically buy USDT  this is the reason why USDT issuance and crypto prices correlate ,1,0
I watch a lot of YouTube videos and see a lot of traders earning massively and then I start to wonder what I could possibly be doing wrong because I ve been trading for a couple of months and every trading attempt seems to be red  never have I seen a green day  It is really frustrating seeing loses without any profit  So  I decided to work a bit more on myself and then opened a demo account  do my analysis  then take the opposite of what I would normally take and get the same result  I m starting to feel hopeless  any advice for a struggling trader ,17,9
Lost most of my trades of lately  I hope this is actually worth it as i need someone with very good record to guide me  I just sent him an email now,1,
Trading is hectic and sometimes stressful  it is always advisable to hire a special advisor  Don t beat yourself,3,
Great   I could really use such expertise  such profitable trades requires great skills ,2,
 Eric Donald You re correct  I don t lose money every single trade  but my main problem is trying to let my runners run  Very rarely do I catch big moves   Instead they go a few pips in my direction  then go against me if when I try holding them  Also my entries could use a lot of improvement  A mentor would be amazing  but getting one is easier said than done  If it s not too much to ask  do you know any legit ones ,1,
Do whatever it takes not to listen to him  don t give up  Trading takes time months  even years  to pro  even the experts learn conventional  Never the less  if you lose money paying little mind to which side you take  maybe you need to look at how you are directing powerful trades rather than how you are entering them  My proposal  find a mentor   Also  besides  try combining the use of oscillators  Bollinger and turn centers into your method  Additionally  specifically move to higher TFS 4h or 1D in a perfect world   you ll offer thanks toward me later  ,4,
Your problem could be your stop loss is too close or you re watching your trades too much  Place it and walk away  Or you could just give up  trading isn t for everyone ,1,
OMG  DAHCYBERY ON INSTAGRAM  SAVED MY SON   I WAS ABLE TO PAY HIS HOSPITAL BILLS WITH THE SOFTWARE WORKING PERFE TLY I M SO HAPPY,1,1
Smart  I m going to do the same  Thanks for the insight ,2,2
Bitcoin is an experiment ,1,1
Thanks To  COINSPOTCRYPTO UK  I don t buy bitcoin again rather  I earn them form trading and mining my bitcoins with them  Safe and Secure mining Process guaranteed,1,0
Thanks To  COINSPOTCRYPTO UK  I don t buy bitcoin again rather  I earn them form trading and mining my bitcoins with them  Safe and Secure mining Process guaranteed,1,0
I hope it crashes so I can buy in low over 2 3 years and watch thr next bull run make me    ,1,1
Is this poindexter for real ,1,1
late september early october   prepare  ,1,1
CHINA MAN LIKE DUMP,2,1
Honestly  this is the first time when I understand the dangers of Teher for the whole crypto market  It seems to be like really powerful and promising technology is valued through the absolutely wrong  risky  and toxic instrument ,2,1
Stop scaremongering crypto is going nowere,1,1
Can you review our retail loyalty reward blockchain project  I think its a real use coin  Were different,1,0
It s as much a ponzi as the S P500 etc ,1,1
You sold the bottom  Well done,2,3
I just have to come back and say a big thank you to those who recommended  DOAVERCRACKS  on   g  such a n ce man  ,1,0
I just have to come back and say a big thank you to those who recommended  DOAVERCRACKS  on   g  such a n ce man  ,1,0
The fluctuations of the market only affect those that odd coins  but traders makes money on both sides  when it s bearish they go short when it s bullish they go long,23,8
I like this guy  Thank you for your honesty and reminding us all that no one is to be trusted without the proper data ,7,0
I d recommend  Doavercracks  for his extreme wonderful fast service,2,0
I d recommend  Doavercracks  for his extreme wonderful fast service,2,0
Exactly this is what i thought when i went into the stock market  Even if it is fun  interesting and hyped the fact that one hedge fund or organisation or one rich person aka musky is driving the price high or low in a big factor is exactly the oposite of what  investing  or a  stable investment  is  Everyone is saying decentralizing is good but it feels like it is way more unstable than vise versa ,15,0
hey look the the 100000000000th tether discussion   ,1,1
Of course it s a ponzi scheme  The creator of cryptocurrencies win ,1,1
 I PRAY THAT ANYONE WHO READS THIS WILL BE SUCCESSFUL IN LIFE     SUCCESSFUL PEOPLE DON T BECOME THAT WAY OVERNIGHT    WHAT MOST PEOPLE SEE AT A GLANCE WEALTH    A GREAT CAREER    PURPOSE IS THE RESULT OF HARD WORK AND HUSTLE OVERTIME    ,7,112
Personally  I think people should venture into trading since the economic meltdown  having one stream of income is not really a good idea cause your job doesn t secure your financial needs  Especially with this pandemic   I met sochinatyler and everything has been good since I started investing in crypto,9,19
Trading without a professional or Expert is like gambling with your money,1,
Nothing good comes easy in this world so either work for it or don t complain,1,
The points you address have already been answered  You will miss out  Good luck ,2,0
I think the question is  when is this all going to fall ,1,1
I find it funny that people are rushing to buy or sell crypto in general just on hearing Elon tweet  despite the recent challenge at 40k USD  for market value   The truth is  Bitcoin is way bigger than anyone in the world currently  this is merely a start to the rise of btc and crypto in general this year  What i m trying to say is  btc is bigger than Elon and would sooner than later see better figures irrespective of his purchase This is the very reason I am focused on accumulating more btc by way of trading with high indicators and expert signals I use for personal trading from pro trade analyst Adam I ll admit it  His guide has been the reason I ve gotten 17 BTC in portfolio trading since march  he can be contacted on Tele gram   Adamfxtrading  for crypto inclined challenges issues ,1,0
so to summarize i shouldnt invest in cryptocurrency   ,2,3
A little bit of  dog coin  left  U go ahead and sell that too   ,2,1
Using crypto cash to pay for goods and services  both online and in person has the potential to revolutionize the way we use money on a day to day basis  Additionally  trading and investing in cryptocurrency can be lucrative and rewarding  providing the potential for high ROI thanks to how insulated the digital currency market is to conditions that would otherwise throw a wrench into a Forex or binary options exchange  That being said  using crypto in everyday transactions or crypto investing and trading is not foolproof  It often requires specialized knowledge to navigate the sometimes murky waters of the underlying technology  and crypto exchanges are subject to their own unique market conditions that may be inscrutable to the uninitiated  However  cryptocurrency is undergoing rampant growth in both popularity and use  It won t be long before major banking systems begin using adapted versions of blockchain technology to make electronic payments in fiat currency  Soon  even the most conservative financial advisors will begin recommending incorporating some cryptocoin into your investment portfolio  It s likely there will always be a place for physical money  Cold  hard cash is hard to beat  and in situations where there s no access to technology  it s still the only game in town  The rules of the game are rapidly changing  though  and cryptocurrency is one player that s not leaving anytime soon  that is why we recommend amateur trader to have a mentor and someone who trade for them with this you have an Eighty Eight percentage return  I recommend Alvin  lfred because he is the real deal when it comes to trading and learn new skills in the Crypto world  you can reach him on T E L E G R A M     lvincryptotrading   W H A Ts A P P  1 516 882 3859   Thank me Later     ,1,0
damn paper hands  How is that working out for you  Here comes the double peak ,1,3
You are jumping to very big conclusions based on limited information  You sold the mid cycle low because of that  RIP,1,0
plot twist  he is Satoshi Nakamoto,2,2
omg you just learned how the dollar is made    lmaoo,3,3
No one does it better than  DEPLUGHACKS  when it comes to something like this  They are simply the best ,2,0
Jesus man   You love selling good assets AFTER the drop   TSLA  now btc   Everyone  do the opposite of what this guys does ,1,0
You re going to cry when the market goes up again and you re going to be screaming why why why ,1,1
This coin will boom again even BTC down 50 percent  as far as im concerned im here for profits and this coin is one of them ,1,2
as a cat lover I m waiting for Kittycoin ,1,1
If everyone went to a traditional bank and asked for their money the traditional banks would fall over  Does this mean they are a Ponzi schneme ,1,1
Guys can anyone tell me  please  tell me   Is this a joke  Did he actually sell all his crypto  We have been hodling since 2009  well not me  but alot of people  I didnt hodl ,1,2
Whether all of the crypto currencies realize it or not  the Fed and Governments are gonna step in  trace the coin changes  send numbers to IRS  because of tax avoidance   Promise you ,1,1
Not to dismiss the Tether issue  but this guy admitted he not only bought dogecoin  and mispronounced it  but that it remained as the only token he s holding  And I m supposed to take his advice on anything at all ,1,3
Good lord I hope nobody watches this video and takes it seriously  Tether makes up 9  of the Bitcoin market cap  Would a collapse in Tether tank Bitcoin  Yes    there would be a price dump  but to act like Tether is some sort of foundation upon which Bitcoin is built is total nonsense  The reason why Bitcoin is dumping right now is because the Pi Cycle Top just flashed  which means Bitcoin will dump down to roughly  20 000 before we can progress higher in the future ,1,2
You not understand about Crypto  what was you talked about not happen  You need learn more about Crypto ,1,3
 I must say  Bitcoin s price action has been fluctuating throughout the past few days and weeks  with bulls and bears both reaching a clear impasse  the aggregated cryptocurrency market has been following in Btcoin s lead and is struggling to garner any decisive momentum  One analyst is now noting that BTC has been holding above a key macro level throughout the past few months  He believes that the recent consolidation above this level bodes well for its near term outlook and could indicate that significantly further upside is imminent in the weeks and months ahead  Tips like this are why it s advisable for investors and newbies to trade with the help of pro traders like Dr  joe Olsen  He is always one step ahead of other traders  he fully monitored all my trades to avoid me making mistakes and losing my money  My earnings have increased drastically from 1 01 BTC to 9 700 BTC in just 4 weeks using his strategy  You can easily get hold of him for a profitable system on TE LE GRAM    joehackbtc   ,2,0
Is this satire  ,2,1
And I m not selling my Bitcoin     E V E R    ,1,2
Tether is a necessary tool to torch normies ,2,1
I can see why you re no longer working as an engineer  You have a very tenuous grasp of cause and effect,1,1
There are weekly notable scams and expolits on the China Binance group and sister affliates like Thorchain Inc   The Binance weekly unlawful exploits are a huge market overhang and is being investigated worldwide   The newest NFT issue may be with Thorchain Inc of Binance and the so called sovereignsky ruon ai faux  space  charity that is not transparent and taking in funds of artists and investors in irregular ways for over 2 years now   May be Ponzi Alert  It is so bad for Thorchain and ruon ai that the value was completely flipped in just days with people trusting COMOS ATOM1 whose market share eclipsed the collapsing Thorchain Inc rune ruon tokens  Is ruon laundering money abusing NFTs and investors in a Ponzi  Are key players in ruon ai in UK and USA associated to Diamond Resorts International timeshares huge PONZI schemes of Las Vegas NV  Florida and Brazil ,1,2
I think this misses the point of crypto  I might not understand it completely but I d guess that buying Tether is just like buying any other crypto except it s programmatically pegged to one dollar  It s not like doge coin is 100  backed by USD  The point of a stable coin is simply to act as a vehicle to transfer fiat  or hold fiat as a synthetic form of the fiat  Most fiat is digital anyways just like Tether and also isn t backed by anything  That ended when we were taken off of the gold standard  Fiat currency is simply a Ponzi scheme just like a lot of crypto currencies  The only true value to be had in this world is in real hard assets like real estate  food  and other commodities along with labor and knowledge among many other tangible and essential things that provide real value  The fiat system  has just become a rigged game to keep most people from being able to obtain things of real value ,1,2
what about buttcoin ,1,2
So sell my bitcoin but buy doge  I m glad this is not financial advise ,1,0
You re right  Seeing Tether grow has made me worried  It was adopted quickly because of the DeFI market ,2,2
If you express a different opinion about bitcoin to those toxic bitcoiners  they would immediately get butt hurt and attack you  it is scary  like a cult   They are ruining Bitcoin s reputation  ,1,0
Are you serious      you said  this is why bitcoin is dodgy  then proceed to literally describe the current dollar system       All the issues you explained already exist in the fiat currencies lol  ,1,2
you are a financial prophet,1,0
Isn t the real problem we are facing following   if said percentage of people try to liquidate their real usd savings the banks couldn t handle them the money in cash     All of the shares bought with usd would also be inflated   Don t get me wrong I don t say this whole usdt thing is not real  But it fits for most of the currencies circulating in our world economy    This is how our financial system works and usdt adapted it   That s why I am still holding onto all the kryptos because through the decentralisation they shouldn t be affected by this system   Honestly it s the only reason I hold kryptos  It seems like they are the only way out of this financial system in the future ,1,2
you pretty much just explained word for word    the federal reserve lol   anyway  truth aside  people are using tether to match the dollar so they dont  cash out  and its considered a trade  why cash out at high to buy low and lose majority of profits to the competition  fed  instead of trading to tether to wait for your position  not a cpa but arent trades cheaper than cashing out ,1,2
Dude this sounds like the federal reserve  Print stuff and say it is worth something  They could be interchangeable ,2,0
Aren t they using investors money to buy bitcoin then just disappear  In other words   ,2,0
Hmmmmm       Bitcoin     1  Does it have seigneurage     NO  2  Does it have sovereignty   NO  Is it backed by some sort of real world production of tradeable goods and services    Not that I know of               So what is it really      A casino chip  Please educate me on this              ,1,2
Because you have paper hands,1,0
Guys dont sleep on OMI ECOMI    Their Veve app has an great future  ,4,2
 Tom Erik Brauer Everyone said  its a long term investment  Im planning to hold for atleast 2 3 years ,1,
This guy is so out of touch with the space  BYE,1,1
I bet he stands in the mirror every morning   saying I am satoshi,1,1
If you actually got rid of most of your crypto  post up your wallet and show us  stop with the fear mongering,2,2
Brother  be a genuine human  you and I both know that we should be buying now  teach people to buy around June and July and teach them to HODL there coins   The Gods will pay you back handsomely my friend,1,
So you think because of this tether situation crypto is going to be banned worldwide ,2,1
Dude  you re not very bright  Go back to school ,3,1
This tether news is YEARS OLD,1,0
Wow    Just wow    SELL IT ALL            ,1,0
we are still in a bullrun     you sold the bottom,1,1
Great video   I was always looking for a good explanation on what was going on with tether   Just speculating but im guessing the whale bitcoin miners own 90    of the tether ,1,0
I M VERY GRATEFUL AND THANKS FOR BEING THIS TRUSTWORTHY   CYBERACTII  ON INSTAGRAM OH LORD IDK WHAT I WOULD HAVE DONE WITHOUT HIM   ,1,0
As a millionare  you are bad at it,1,1
I KNEW it      Haha  didn t Tether have some very unsuccessful audit attempts a couple of years ago ,1,1
So how exactly is Tether different from the US Federal Reserve ,1,1
Thanks for putting this out there  people need to know so they can make better decisions,1,1
Lolllll,1,2
Lol you will bought back at the lower price trader mentality,1,1
The US Dollar is also a Ponzi Scheme,1,1
Fkn brokers are panicking now trying to push up Bitcoin  good luck  ,1,1
There is a lot of other stable coins besides Tether  I understand this is a big deal  but not really a massive deal  You can always purchase and cash out BTC through FIAT ways ,1,1
tether has been the same for a long time  its also not the only stable coin in town anymore  1 bear market and you call it quits  man  that s not a power move  those are paper hands  unless you are actually shorting the market     and you want as many people to dump coins as possible   ,2,0
Moonsafe,1,1
No diamond hands on this channel  They are clearing out the suckers and buying at discount  Why are all the big banks offering crypto to the high end portfolios ,1,1
Wait  you mean all those hacked accounts advertising crypto aren t doing it because they care about our financial futures ,1,1
The end of the day BitCoin is valued in Dollars or other paper currencies    So that being said  why the paper currencies collapse   the Dollar will  don t forget Biden just printed 6 trillion in his FIRST YEAR  That means BitCoin won t last         Better to sell now,2,1
                             ,3,0
Haha have fun staying poor,2,1
This is the first guy that s figured out the truth and all the bitcoin pumpers don t want to hear the truth because it would expose their ponzi scheme for what it is   All the sheep following the one in front to the slaughter house and no one asks where are we going because they have no intelligence   Bitcoin is going to zero and come back here in a year and see,2,1
bitcoin is like pyramid schemes      the risk is too high      1 person win and 1 million lose        bitcoin has no value in itself     the value of bitcoin increases or decreases based on demand from people     if people no longer trust bitcoin its value goes to   0 and all those who have invested will lose everything    there are thousent of people that lose everything money house family about Bitcoin    if you want to lose money it s better give all your money to an associate Caritas that help poor people around the world      better burn all you money that give to Rothschild family Jewish most powerful family that control everything       Bitcoin is dead now,2,0
i am really impressed by the services of bithacoin platform they are helpful and reliable they really offer great services,2,0
He s just now discovering tether lol This is why you shouldn t invest if you don t believe in the blockchain    Also you sold everything but DOGE    Don t listen to this guy everyone,9,0
 I must say  Bitcoin s price action has been fluctuating throughout the past few days and weeks  with bulls and bears both reaching a clear impasse  the aggregated cryptocurrency market has been following in Btcoin s lead and is struggling to garner any decisive momentum  One analyst is now noting that BTC has been holding above a key macro level throughout the past few months  He believes that the recent consolidation above this level bodes well for its near term outlook and could indicate that significantly further upside is imminent in the weeks and months ahead  Tips like this are why it s advisable for investors and newbies to trade with the help of pro traders like Dr  joe Olsen  He is always one step ahead of other traders  he fully monitored all my trades to avoid me making mistakes and losing my money  My earnings have increased drastically from 1 01 BTC to 9 700 BTC in just 4 weeks using his strategy  You can easily get hold of him for a profitable system on TE LE GRAM    joehackbtc ,1,0
Wow  Just have a look at the comptact token  CPAC   great Team   great Community,1,0
lol,1,1
You  sir  are not a multi millionaire  You are a fake and a liar  as far as I m concerned ,2,1
As a guy who seems kind of technical he should know that correlation doesn t mean causation  and that s precisely what he s saying is happening   Tether happens to go up with Bitcoin and Dogecoin therefore they must be being pumped by fake tether coins  ,1,1
I m sure he ll be back ,1,1
Mr Troy  I Got a strong heart for Bitcoin and ethereum too  Holding some and planning to add more  very optimistic on the two ,1,1
Bitcoin mining is the process by which new bitcoins are entered into circulation  but it is also a critical component of the maintenance and development of the blockchain ledger  It is performed using very sophisticated computers that solve extremely complex computational math problems ,12,10
This sh1t is indeed a stupid ponzi scheme    never got into this stupid crypto bulshit,1,1
I make huge profits on my investment since I started  trading with Nani Pershina  her trading strategies are top notch,2,0
I love this kind of video  it s how I made so much money coming out of the last bear market   More fear   Better entry prices  Warren Buffett said it best     Be Fearful When Others Are Greedy and Greedy When Others Are Fearful ,6,3
Warren Buffett said it best  You mean when he said BTC has no value and equated it to tulips    ,2,
Wrong wrong wrong  This is not a crypto guy   he s so dramatic  it s over    we might see another dip or a lower dip but the overall bullish trend is still insane   just buy the dips and hold and you ll be rewarded in the next few months handsomely   ,1,1
Thank you for the interesting video  I find it sad that you never joke  You should try it once  It s fun ,2,1
Lmao,1,0
Thank you for speaking your mind without being afraid of downvotes or bullying from BTC maxis   I sincerely hope you can keep this up ,3,0
HOW TO BECOME A MILLIONAIRE  tHE SIMPLE TRUTH NO ONE TELLS YOU   INVESTING ON SOMETHING EITHER ONLINE OR OFFLINE WILL MAKE YOUR DREAM MANIFEST ,8,9
SINCE THE DAY I STARTED DEALING WITH  IMMUNIWEB  ON TELEGRAM I HAD KNOWN THAT MY LIFE IS REALLY CHANGING,1,0
Chinese government funded video   how lovely,2,0
