Comment,Likes,Reply Count
 Great analysis  ETF launch so far has caused a major dump at the peaks of BTC  Hodlers are getting used to the pumps and dumps with a minimum of fear   Being calm and level headed will save yourself from the inner gambler  Waiting for the drop  it s inevitable  This current dip has no effect on my portfolio because hold without trading is actually one of the worst possible strategy I can think of  I trade with Matthew Brand his skills set is unique  I have made over 7btc his analysis boosts my realistic expectations  You da man  TS  ,38,8
i love how you say   gold   i just love you  in general ,2,0
biggest troll on the internet,1,0
I m no longer waiting for the GRANT LOAN because I earn   59 700 every 10 days recently,114,33
                  ,5,
Nice Content You have here on this Channel  I ve been following your videos  but I still don t have a knowledge on how to trade on Cryptocurrency but where can i find a legit broker that we teach me how to trade ,23,8
Has TechLead ever said which wallet he uses for Bitcoin  Metamask is only for ETH  unless you want to use those  wrappers  which seem like too much complication  yet another step where things can go wrong   costs could be added and whatever else ,1,0
  With my sniper reports I can see companies that will become hot and then open positions on them and rake in some good profits daily and everyday for a long term that s one and also to know trades to watch  I teach you how to analyze technically and fundamentally every market  talking about risk management  you will learn how to maneuver your way to the good side of the market when the market is down  but for you to learn effectively you have to be earning while I teach you ll understand it better ,1,11
  Jonah Howie has a  private trqdling group so active and  educative filled with both noobs and expert trader s,1,
 Valarie W  Waldrup  It s not about going short but doing it right  Get help from Jonah s Channel ,1,
  Bitcoin is the way of the future  and investing in it will be the smartest decision you can do  especially with its present RISE,1,
This is a perfect description of Jonah  You always seem to find a way to milk this market  and I m glad to be one of your followers  My portfolio now stands at a whopping 88 B T C and 120 E T H  Without you  none of this would have been possible ,1,
May god       continue to blessing your platform milly  Since the l got 3 1 btc hit my wallet l don t know  for  sure you are the best and real  you are the best one that hold my my heart   ,1,0
It another successful       withdraw of 5btc with the  perfect  script from god continue blessed you sir,1,0
BTC s definitely going to 150k  the question is in which timeframe  Although I dont care and just shoot usdt at it every time it dips and hodl for my life while having an odd job  I m still in no way a trader lol,2,3
Excellent information        a very complete work  without  a doubt and your    information as being useful to me from  1000  20 000 thank you  so  much,2,0
I asked him      can your software generate bit coin to my wallet he said thought he was laying not until l received 10btc in my wallet you are really surprised me,1,0
BTC lets go ,1,0
Honestly I can t imagine   why anyone would dislike this is very clear and very helpful  kudos to  you just got a new investor and recommendation  from me    so much sir ,4,0
YOU HAVE BEEN     THE BEST I ALWAYS THANK MY FRIENDS SO MUCH FOR INTRODUCING ME TO YOU SIR,1,0
MY INFINITY   GRATITUDE FOR YOU FOR DOING THE IMPOSSIBLE YOU KNOW I WAS TRYING FOR SO LONG SO THAT I COULD COMPLETE THE TASK YOU DID FOR ME AND I THANK YOU FOR EVERYTHING       YOU RE SIMPLY THE BEST,1,0
What about the future of MillionToken  ,1,0
thank you for this info   i am new to crypto and a sponge for soaking up whatever i can learn,4,1
damn dude you sold me   im in,1,0
Hey Tech  thank you for you content I enjoyed your analysis but I have a question  just a few days ago you said you d go balls deep in crypto anticipating the rising of the market thanks to the massive ads buy in for the super bowl  you said youd ride that wave until just after the super bowl and then sell out Is this still your plan  sell off on the 14th february after the super bowl and then slowly transition in again in the upcoming months  Everybody in the space is afraid of March for bitcoin  and while I appreciated your video  you didnt give us any entry or out points or any timing  can you tell us something about that  I ll appreciate if you reply  but if it s the  contact me on what s up botting   just abstain from it peace,1,2
  Ami bue worry not i am studying intensively  any resources youd recommend ,1,
Stop merely investing on Assumptions    take your time to gain in depth knowledge that would help you stay 3x ahead of the market cur,1,
Thank you for all of your content  I am a newbie and your channel is very informative  Any thoughts about pulsex ,2,0
I think BTC will stay below 80k all year   we ll see who s right   ,1,0
Inflation is going insane  Mass adoption is only a year or two away  And today crypto price is dropping   Huh   Makes perfect sense ,3,0
  I can here to learn how to invest after listening to a guy on radio talk about the importance of investing and how he made  460 000 in 4 months from  160k  i Contacted his broker Mrs Natalia Watson she has helped me greatly My portfolio has grown much few times i traded with her ,10,8
Techlead well done  this video is your most profound macro analysis of the current crypto sector  You mentioned all the pertinent factors  Kudos  l will rate this 5 out of 5 stars  Keep the quality and concise format  You re gaining discerning subscribers ,20,1
you know you are getting trolled right  lol,6,
You don t get it  People and institutions are still going to eth because of its security  They re trading off the high gas fees for one of the safest secure networks,2,0
That s why I follow Tech Lead ,6,0
Bitcoin is lucrative people are just confused because of its volatility,90,39
I used to see Bitcoin as a side thing but it has proven to be a major source of passive income ever since I venture into it,1,
The yield reserve on Anchor is being replenished tomorrow  450m   Time to buy the dip on Luna and enjoy the 20  APY on the Terra Blockchain ,4,1
Gotta stop the 6s lol,1,0
I m investing in myself and my creative properties  I ve got books  music albums  photography  NFTs  and podcasts that I ve recorded since 2003  I want to figure out how to market them in the Blockchain world and divide the income among my several companies ,1,0
Bitcoin adoption by nations states is finally here  we made it crypto bros  just gotta move to either Russia  North Korea or Iran  ,2,0
His strategy is to make money on youtube doing crypto vids,1,0
Always great information TechLead  Appreciate it ,2,1
Money printer goes BRRRRR  All hail money printer ,1,0
Did someone say  VeChain ,1,1
Haha we are looking at Omicron level crypto adoption here,1,1
Great content  Great value  Sprinkle of humor  No moon talk ,2,0
what do you think about ETH2   it s supposed to be much faster and gas cheaper than original Ethereum  Will it be able to compite agains new protocols networks ,3,1
Great video    ,2,1
 Bitcoin went from 4k to 70k from 2020 to 2021 thanks to institutional adoption  so people should be happy and take their profit  Too bad for those who started accumulating above 20k  as we will revisit these lows for sure  With Terry Adam I am already growing my 1 5btc  to 5 5btc from October till date      ,48,7
Thinking about picking up more MATIC,2,0
Bitcoin bull run     expected to take off again in 2022  and overlap with the run       up to next years Litecoin reward halving and this years David Burkett update    Previous run ups had a huge effect  ,1,1
DORAEMON INU is the evolution in the market financial  ,1,0
Sooo buy more ADA ,1,0
Turkey       ,1,0
Tried to buy one Million coin but Ether fees are eight times more than the cost of the coin ,1,0
Solid analysis  I m short term bearish and long term bullish  I think the current pump is fake and will crash soon  But I think it will recover and go up eventually ,2,1
Thanks so much  for watching You can join our VIP offer Message  whatApp   the numb above  for more insight and guidance  ,1,0
Great info,1,0
Hi there  have you had about the updated crypto market  I really tried to buy but I got a big loss  ,1,1
Miss Elizabeth is legit and her method works like magic I keep earning every single week with her new strategy,1,
What about eth 2 0 ,1,0
Hi there  have you had about the updated crypto market  I really tried to buy but I got a big loss  ,1,0
Best intro ever  I figured it out ,10,0
You are so bullish in bitcoin  the Fed printing machines and people countries adopting cryptos  I hope you are right  To me it all makes sense too  but who knows  ,3,0
Letsgoo ,1,1
Diversify in defi  ,1,0
Strange how countries banned BTC then flip flopped and becoming the pioneer  This will really put pressure on US ,14,1
Use subtitles,2,0
I figured it out,1,0
HBAR GALA BITCOIN ,1,0
Hello  am from Africa Ghana  I always look up to you  Am always learning crypto from you ,1,2
What about the person holding 1million btc  ,1,1
Bitcoin is in another league entirely,2,0
Buy and hold bitcoin  Sell some when the derps are running rampant   ,1,1
You have no idea what will happen    just like anyone else who says they know what will happen  No one has any idea  These are wild speculations ,1,1
I like him more and more as he gears toward BTC,4,2
Agreed BTC is in another league entirely ,3,
Imagine being an investor   doing good financial freedom No stress  all the free time to do whatever whenever   My goal  ,16,18
 If Bitcoin falls   so be it  It was a decision I was prepared to make  On the other hand  if it increases  then maybe I will retire in two years time  ,1,
Seeing alot of successstories  she must be honest and trustworthy for people to talk this good about her  ,2,
 Tyler Coleman  Yes you re right  I have made over  100 000 trading cryptos  From Btc  to Dogecoin  ADA litecoin  XRP  Ethereum etc my last was  11000 just last week with  5000 capital,1,
 Morelli Jen if you ever make it big on crypto definitely buy real estate,2,
Regardless of all  Investing in crypto markets trading still remains one of the best ways of getting out of poverty and obtaining financial freedom in this global economy pandemic,2,
The motivation is unreal  No views and likes but still uploads  I only come here to show support ,12,5
I m just here for the bot comments  Seriously  Good stuff ,4,
What happened to bitcoin going to zero videos ,2,1
this guy has lost it  ,2,1
People will be kicking themselves in few weeks if they miss the opportunity to buy and invest in Bitcoin as it s retracing     ,3,2
Crypto is the new gold,1,
Most intelligent words I ve heard,1,
Why do so many limit themselves to only the moon   I m confident this guy s strategy will lead us out the solar system,2,1
I d love to get your view on cardano,2,2
2OMB will be the DeFi gem of 2022 ,6,2
I just want to say thank you so much Mr  Techlead  your analysis  knowledge  and wisdom you give is cosmic and priceless  My life is changing thanks to your Defi Course  I recommend it for Everyone  This is the future  Power back to the people  Anyone who doesn t see the sheer value of this beautiful human being  is living in an unhealthy realm  All the best of life to your sir   give this man the full power of the universe  A powerful ancient soul indeed  Thank you   ,1,1
You re view regarding book    Cashless   by Richard turrin,1,1
Pov  You are looking for a non bot comment,51,6
finally a fellow human,1,
 AMP22X  is  sick for us dont sleep on it,39,1
Investors should avoid picking stock unless they re actually willing to research the company  If you only listen to these YouTube guys and chase big returns by investing in the latest hot stock  you re likely to overpay ,24,4
toilet,3,
Adoption like omicron   ,1,1
My crypto strategy for 2022 is to keep stocking up on Million Token now that it has flattened out  and then wait for blast off  I m hoping to have another 100 MM by next weekend ,4,2
preach,1,
After the Olympics usa and Russia will play their war games and markets will tank big time ,1,0
I love your side jokes man,2,1
You should rename your channel to CryptoLead ,2,2
stop with the crypto videos good lord,1,1
Hello Mr  Techlead  I m Ibrahim  from turkey  I have a question  I just hope you will see this  I m 27  Don t have a college degree  I want to make a living as a farmer but I need capital  Life is hard in Turkey so I figured I need a dollar based salary  I went to a technical high school  studied database programming  So I decided to get into Mobile Engineering  learn Java and whatever else is needed  self learn it and get a dollar salary  That is until I saw your video on Why I shouldn t learn how to code  And I m not trying to be Bill Gates  even 50k annually would work for me  I need about 100k annually for 5 10 years and that s it  Do you have any advice or objection to my plan  Is it worth it  Is even Java developing going to be  not needed   I wont be able to thank you enough if you help me  Have a great day ,3,2
You can do it great with Java  Also try Kotlin which is basically the same  It can provide you enough income for years ,1,
YOU ARE ON POINT     LOVE YOU MAN     BUY BITCOIN   SELL ETH       ,2,0
Thanks for watching  Send a direct msg right away  whatsapP 12512140941  Get exclusive to our Alt picks for more info on XRP  NFT  BTC and more    ,1,
Nope 99  of altcoins will go to zero,1,
BUY BITCOIN NOW   FOR FREEDOM                    CANADA WE LOVE YOU                                                                                                                             ,2,0
2022 is our changing life,1,0
One and only TL  ,1,0
Hello Techlead ,2,1
 ,1,
He s serious this time,1,0
Notigang  ,1,1
Feds seizing Bitcoin   Cryptocurrency dropping in value WITH the stock market   But y all said it was ANONYMOUS and not correlated to the market ,2,0
