Comment,Likes,Reply Count
ECHO TECH COIN TO THE MOON,1,0
              ECO T                                                                             ,1,0
Dislike,1,0
Ecot     ,1,0
hi patrick,1,0
Millionaires don t push adds  face,1,0
Bitcoin is not what you believe it to be  It is simply an effort to own everything  The rich will buy all the coins and own them  Iif we are lucky we will get to borrow fractions of a coin to by bread and then it heads back to the owners  Clever yes  but for whom  Wake up  Before it is to late  When there is no money we will simply be slaves to the owners of the coins and it won t be you      ,2,0
 When you invest  you re buying a day that you don t have to work   I pray everyone reading this becomes successful  ,144,33
What matters is getting yourself a good investment company that knows how to make profits,1,
Starting early is the best way of getting ahead to build wealth  investing remains a priority  The stock market has plenty of opportunities to earn a decent payout   with the right skills and proper understanding of how the market works ,2,
Hello  nice video i m actually looking for the best way to invest and make good profits  can someone tell me how to go about it ,4,2
He really make it happen again 3btc wow thanks for all you have done  so far,1,0
He really make it happen again 3btc wow thanks for all you have done  so far,1,0
I always be in tears   when I remember have gone through in my difficult time before meeting this real man that wipe  away all my tears I really don t know how to thank you but I can I says is thank you and God will continue to bless    you more for me wow you really so amazed me sir   ,2,0
I always be in tears   when I remember have gone through in my difficult time before meeting this real man that wipe  away all my tears I really don t know how to thank you but I can I says is thank you and God will continue to bless    you more for me wow you really so amazed me sir   ,2,0
Never let today  ruin   your tomorrow when there is life hope is   certain    I give thanks to that legend man   for rescue my life from poverty he promise to generate my wallet with 5btc wish I was thinking many peoples say that to me but he make it real to my wallet   joy all over my face thanks  alot sir,3,0
Never let today  ruin   your tomorrow when there is life hope is   certain    I give thanks to that legend man   for rescue my life from poverty he promise to generate my wallet with 5btc wish I was thinking many peoples say that to me but he make it real to my wallet   joy all over my face thanks  alot sir,3,0
another guy shilling his course blehhh,1,1
Watching BTC  Fixing above 46k   growing further  Fixing below 39k   pushing below,277,3
I agree  These are the key levels,2,
Hello  nice video i m actually looking for the best way to invest and make good profits  can someone tell me how to go about it ,5,2
What do you think about Nervos Network ,1,1
As you can see we are in the month of February and I feel  those who would allow the market dynamism to determine when to trade or not are either new in space in general or probably just na ve  the sphere have seen far worse times than this   enlightened traders continue to make good use of the dip and pump even acquiring more equities towards trading sessions  I d say that more emphasis should be put into trading since it is way profitable than hodling  Trading went smooth for me as I was able to raise over 9 2 BTC when I started at 1 5 BTC in just a few weeks implementing trades with signals and insights from David Walter  I would advise y all to trade your asset rather than hodl for a future you aren t sure about or hold it and risk losing all  ,191,10
this is so sus  you advertising bot,2,
hey techlead  What do you think of Litecoin and its new mimble wimble extension block  MWEB  upgrade,1,0
What s that wallpaper ,1,0
Yo tech lead PLEASE review crypto nodes  specifically Thor Financial  would love to see your perspective ,2,0
9 35   ,1,0
Ill wait till I can get a crypto credit card that I can swipe at the grocery store ,1,0
He is not intelligent,1,0
Programs like Titano,1,1
I realized that the secret to making a million is saving for a better investment  I always tell myself you don t need that new Maserati or that vacation just yet  That mindset helped me make more money investing  For example last year I invested 80k in stocks  with the help of my Financial Advisor of course  and made about 246k  but guess what  I put it all back and traded with her again and now I m rounding up close to a million ,7,5
Very interesting video and i appreciate for the information   If you believe in the future you understand that Crypto and Forex trading is becoming the future  despite fluctuation so i m glad i started investing and i m still getting good returns irrespective of the markets fluctuations     ,4,1
Has to be  FX Trading    Making a very good weekly passive income through it ,3,
Ohhh geezzzz   I guarantee Bitcoin will not surpass 100K infact I see it losing value as rate rise   If you want to go broke with Techlead then be my guest but make sure you screenshot this and save it on to your computer then tell me where you are by the end of the year ,1,1
This guy is insane out of his mind,2,
Please do some other type of videos again than just crypto videos  ,1,0
There are some videos going against you on YouTube  They don t understand that your channel is just comedy and shall not be taken seriously ,1,0
Most sarcastic YouTuber   I can t tell if he is trying to tell us to   F  ourselves or really give us advice    Says it with a straight face   ,1,0
Can you check Everdome and if you think it worth it  could you make a review about it ,3,0
Luxury or no luxury always be proud of your brand and try working to improve  I love luxurious lifestyles  All thanks to crypto I just got my first Lamborghini    My advice to y all invest in cryptocurrency or gold ,58,24
 Marietta Leticia His info is direct on What sapp,1,
                        ,1,
Getting rid of Covid restrictions are great till the unvaccinated dopes clog up the hospitals    Right up until that point   ,1,0
 ,1,0
I AM MAKING SO MUCH LOSSES ON TRADING PERSONALLY  I HAVE TRIED WATCHING VIDEOS AND REGISTERING ON VARIETIES OF  PROGRAMS  I DONT SEEM TO BE GETTING THIS RIGHT  I STILL DONT UNDERSTAND WHERE THE ERROR COMES FROM  I WOULD REALLY APPRECIATE AN IDEA THAT COULD HELP OUT   ,104,23
I m totally confused as well  My portfolio has drained drastically  I m now very scared of trading crypto  can t figure out what s wrong  I need to know how this thing works ,4,
Having made thousands of dollars trading in the market  I never doubt the profitability of the market ,4,8
I m tired of your vague and always wrong predictions  As a millonnaire ,1,1
What is the fastest blockchain with the lowest transaction fee ,1,0
I believe Qardin token will change the e commerce forever as we know it and metaverse too,804,0
I believe Qardin token will be a game changer   ,804,1
I Like BTC and ETH  but real money will be made with Qardin Token  Thank me later ,807,1
Amazon and Qardin Token collaborating    Amazing,801,1
Qardin token will make millionaires soon  Mark my words  ,776,6
 Vargas Kenneth Not a Pro  LoL  I work with  Nancy Lynn Lewis  in all honesty she is an Angel  Do your own research ,1,
 Rockwell Antonette Lucky you  I tried Fx without lucks  Lost money  You must be a Pro,2,
People are already making millions already this year,2,
sure  ,1,
Nice Content You have here on this Channel  I ve been following your videos  but I still don t have a knowledge on how to trade on Cryptocurrency  I m new to cryptocurrency  Where can I find a legit broker  than will manage my account and also teach me how to trade ,25,10
She trades for me too  My first investment with Shirley Quinn gave me profit over  25 000 and ever since then I trade with her and it has been a good turn up,1,
I m new to cryptocurrency and I find it difficult using these strategies well  Where can I find a legit broker  that will manage my account and also teach me how to trade,36,9
Ezillion Launchpad is a protocol aiming to provide users with the capabilities to create and launch their own initial token sale which allow blockchain based projects to raise capital while giving early stage access to their group of investors ,1,0
Strategy looks cool but I m still confused on how BTC will make 10x ROI this year 2022 when it s not a low cap gem like UDO  BMI and the likes ,3,5
 PepperCryBeatz 10x ROI is like a minimum of 3 years journey for BTC unlike those relatively low cap like SPDR  UDO  PNODE  even mid caps like ALBT and POLS will take a lesser time compared to BTC ,1,
 Crypto IDPO What is MM  MetaMask you mean ,1,
MM its the best,1,
 I m new to cryptocurrency and I don t understand how it really works  Can someone guide me on the right approach to investing and making good profit from cryptocurrency investment   ,1,11
No  pending  issues  make my life fill better with 0 3btc,1,0
No  pending  issues  make my life fill better with 0 3btc,1,0
No  pending  issues  make my life fill better with 0 3btc,1,0
I never regret trusting you      you re the best with your mining software     ,2,0
I never regret trusting you      you re the best with your mining software     ,1,0
Really good video  it s important that beginners know these basis strategies that can assist them with their trade career  It requires a lot  I guess many make losses due to lack of skills to handle their tradings ,2,12
I M NEW TO BTC AND I VE BEEN MAKING LOSSES TRYING TO MAKE PROFIT MYSELF IN TRADING   I THOUGHT TRADING DEMO ACCOUNT IS JUST LIKE TRADING THE REAL MARKET    CAN ANYONE HELP ME OUT OR AT LEAST ADVISE ME ON WHAT TO DO ,3,1
I m honored to have you around in this hard time thank you for always supporting and helping me with 12BTC   great india         ,5,1
I m honored to have you around in this hard time thank you for always supporting and helping me with 12BTC   great india        ,2,0
Hello  I m new to Biticon trade and Ive been making huge losses but recently I see a lot of people earning from it  please can someone tell me what l m doing worng ,3,1
Hello  sir  Check our new passion  called Shaman King Inu  After the ruff winter for bitcoin   we expect some nice bullish run now  because of the many new utilities  Not just a meme token   we expectMortal Kombat style p2e game with usable NFTs ahead  great community   the DEV always try to help and a lot more   Potential of 100x in a mid and a lot more  for the long term ,1,1
Serious question  I ve never heard you mention Hedera  is there a reason why  On paper they seem like the company with the greatest potential to dominate the market  They have the biggest partnerships in the industry  fast transactions  potentially unlimited tps with sharding  fixed low fees  carbon negative and they ve gone open source  What am I missing here  Why isn t every single youtuber screaming the word  Hedera  from the rooftops  They seem to be a level above literally every other L1 out there  especially Etherium ,4,2
you change your mind like a girl changes clothes,1,1
The Market has been pretty bad until today it decided to surge  Everybody was  Practically Crying then  It kept  dipping  That s what you get when you feel you can navigate the process on your own  Big thank to Raphael Castillo  I m not bothered with how bad the Market is because my assests are insured due to her advice and I still receive my profits,19,10
gram,1,
tra de wi th rap hael,1,
with his username,1,
You can reach her on Tele,1,
Just checked him out now  He s   Licenced with credible results  Thanks for the Info ,1,
I also make huge profits in stock market by trading with him weekly  his consistency is crazy ,1,
I think  he trades for everybody I know  Met him twice at a conference in Germany  after his lecture I had to personally beg him to be my Finacial Advicer  I celebrate his strong feet ,1,
Having Cr yp to  As sets and not being able to make Pr o f its out of them can be very frustrating  Big thanks to Raphael Castillo I make hu ge Pr o f its Tr a d I ng with her weekly ,1,
He s definitely the best  He  keeps surprising me with results  We are planning on surprising him too  You must have heard about that ,1,
ETHEREUM is not the fastest but it s the SAFEST and has the biggest part of the usage pie  People want safety at this point and they are compromising speed for safety    This guy obviously has investments that are competitive with ethereum for him to keep being so negative about it  IMAGINE SOMEONE SHIFTING MONEY AROUND ON SOLANA AND THEY RE GETTING READY TO PUT THEIR FINGER ON THE BUTTON AND MILLIONS OF DOLLARS COULD BE GONE WITH THAT ONE PUSH OF THE BUTTON    this is the reason etherium is still number  1,1,1
While I learn from you content  in the back of my mind I m thinking  is this guy for really or is he running a big con  ,2,1
7 30 I sincerely encourage you to take a few hours to research modern monetary theory  MMT     Imho it offers many crucial building blocks for a more reality aligned mental model for a better understanding of these kinds of long term dynamics   don t get trapped by the normative MMT approach as so many on the interwebs do  Just look at it descriptively  As an alternative explanatory model for how US monetary policy and economy functions today     For me MMT has been especially helpful at liberating me of false  outdated  definitions of common terms  such as  national debt   that most public figures in politics and media completely misrepresent to this day    This must lead to horribly wrong economic predictions ,1,0
Strategy since 2017  buy bitcoin,1,0
 Market makers like to do the complete opposite of what retail thinks is gonna happen  sure a fakeout looks possible  but what if that s exactly what they want us to think  Imagine the big boys run with the money because we are simply too  scared  to buy in because we expect a fakeout  All thanks to Alice Marcella as I have made over 14btc from nov till date  Her trading skills is exceptional ,15,6
Hey there TechLead   Great content as always  Could you do some content on the ISO20022 s   Also what s your position on Quant ,1,1
The market seems to be bouncing back but a lot of people lost huge sums already via panic selling   buying and  taking leverage position  B serious with your financial life by all means in this new year  Navigating the crypto space alone without proper guidance is very dangerous  I thank Larysa Del  a popular crypto and bitcoin expert who has upgraded my financial status  This bear market has been favourable to me as i make good p r o f i t s regardless  ,82,12
 Pauline Gagnon Just checked her out now  She s Licenced with credible results and certificates  Thanks for the Info ,1,
 Pauline Gagnon she s definitely the best  She keeps surprising me with results  We are planning on surprising her too  You must have heard about that,2,
 Pauline Gagnon I think she trades for everybody I know  Met her twice at a conference in Germany  after her lecture I had to personally beg her to be my Finacial Advicer  I celebrate her strong feet ,2,
Having Cr y p to  As sets and not being able to make Pr o f its out of them can be very frustrating  Big thanks to Larysa Del  I make hu ge Pr o f its Tr a d I ng with her weekly,4,
I used to love your videos  but now all you talk about is crypto  probably because of the money  Seriously wish you d go back to some of the content you used to make about computer science ,1,1
Good,1,0
 Great info and insight as always It s kinda irresponsible to ignore the fact that each ETF launch so far has caused a major dump at the peaks of BTC   A lot has changed and that s on everything but the truth is I don t even care much about bullish or bearish market anymore because Eric John Clark got me covered as I have made over 12btc from nov till date  His trading skills are exceptional  oops,55,5
It s funny how people brag about their gains on social media and YouTube while I m still yet to make gains  Anyone has any great idea they mind sharing ,59,22
I haven t watched your videos for a while  What happened   you ve gone fully Adobe PDF reader mode ,2,0
I have lost hugely in the market  and the market has been so disheartening for me  But thanks to Nathan Davis Who helped me out in making profits putting all my losses in the past ,46,21
 I hope everyone has their cash ready to jump in at the right time  Secure your financial future with calculated moves  The crypto market still remains your best bet in becoming a millionaire  ,75,5
 Ivy Theodore  Amazing   Usually i don t respond to this type of comments as we come across various spams daily  but i did look her up and she is registered under various regulatory bodies  ,1,
 clark  I went with Janet Young Kang she is known in the finance world  and regulated by different regulatory bodies  ,2,
 How can i come across such CFA  knowing that crypto has not been fully adopted by institutions  ,3,
 Bad risk management I believe  I suggest you mirror a CFA who diversifies once portfolio across different asset classes  crypto inclusive  ,4,
 I started trading around august  been slowly going up  This choppy market chopped me real good  Now I m back to where I first started  ,5,
moonclown,1,1
Most assets this year face strong deflationary forces from the excess of last year  but bitcoin looks poised to come out as a digital global collateral though some still point that with rate hikes coming and the Fed supposedly rolling off it balance sheet will Bitcoin not continue to suffer  It may well do that and for me that then offers a long term entry point  as I sense the correlation dynamic will change in due time  Now in trading especially for a large portfolio  s gnal algos which are automated remains the best  Few traders I know use state of the art s gnal algos for their trading activities  My best pick is that of career trader Callum Lucas  his s gnals are based on unique combinations of trend  momentum  volume scanners and onchain analytics in which I ve accumulated over 9 2BTC already  Last week his analysis about the price action of bitcoin hitting 32k target was a hit  I think we all agree that the recent market drawdowns wasn t expected as it lead to cascading liquidations  Automated s gnal algos removes you from the crowd   If interested then reach out at TeleG  m  callumlucas,54,1
 Once you get off ETH  you never go back   That s exactly what I ve done ,5,3
focus on Kyber KNC   SmartValor Valor   AAVE  Synthetix SNX   Curve CRV   Compound COMP   Maker MKR     because trading digital assets will keep growing   ,6,4
 Shah Zad link do the  same  next is 45 50  for  SNX,1,
 Great info and insight as always  It s kind of irresponsible to ignore the fact that each ETF launch so far has caused a major dump at the peaks of BTC  A lot has changed and that s on everything but the truth is I don t even care much about bullish or bearish market anymore because Trent Hart got me covered as I have made over 32btc from oct till date using his daily signals  insights and guidance   ,109,10
last year we were supposed to hit minimum  100k  we didnt even break  70k  I m thinking maybe BTC hits 100k in 2022 if we re lucky  but no way  150k,1,6
i refuse to take seriously any company called beefy,1,1
He s wearing Arc teryx guys  His name checks out ,1,1
This channel and how you do these videos is by far my favorite  More emphasis should be put into trading since it is way profitable than hodling  Trading went smooth for me as I was able to raise over 10 2 BTC when I started at 4 5 BTC  in just few weeks implementing John Pomliano daily trading signals and tips  ,2,0
Keep covering Crypto ,1,1
I love this guy,1,1
Bro please make one informative video about MarkMeta it s launched yesterday and now trending on Twitter,1,1
Record high inflation and rate increases could have bitcoin trading below 20K by years end  hopefully below 10k because that means the coins most of us can buy  fantom  ADA  algo  matic  maybe solana  avalance  will be trading at 50 100X potenial gain levels  If not then I ll be a spectator until they do  which will happen this year or in 23  But I figure we ve got 4 years of crypto fun left before the democrats gain a super majority again and regulate it out of relevance  get it while you can,3,0
Reading about people grabbing multi figures monthly as income in investments even in this crazy days in the market any pointers on how to make substantial progress in earnings would be appreciated  ,27,9
Hello friends    Miss Expert Alice Roger and her method work like magic I keep on earning every single week with her new strategy ,15,33
I m getting more bullish just in the bitcoin maximalist strategy  Ethereum seems to have some really issues and also it s just too confusing to keep up with all these other coins ,1,1
 I believe that the crypto market has already factored in inflation  These cunning rodents are always two steps ahead of the competition because they are market creators  I m praying I m mistaken and they won t dump it on individual investors like they did in the past  Those that hold on to their profits the longest will reap the greatest rewards  I trade and hold profits  Keep up the excellent work  Craig Zach has also been researching all charts  trades  and methods on BTC  which has lately helped my portfolio grow to 17 BTC,46,6
 I think we are entering a crab market Personally  We will still get our pumps and dumps but based purely on what the Fed are doing   I think we can wave goodbye to ATHs for a while  That being said  as traders we can still make good money    I trade with Tyron Kristopher  his skills set is exceptional  I am already growing my 1 2 btc to 14 4 btc from  September till date ,43,8
When Money Printer go brrrrrrrrrrrrrrrrrrrrrr   Crypto Market go              ,1,0
  I totally agree with what you are saying    The fact is  BTC is the future of crypto and the questions traders ask themselves now if this is right time to invest  before jumping into conclusion i think you should take a look at things first  for the past few days the price of BTC has been fluctuating which means the market is currently unstable and you cant tell if it is going bearish or bullish  while others still continue to trade without the fear of making lose  others are being patient  it all depends on the pattern with which you trade and also the source of your signals  i would say trading has been going smoothly for me  i started with 2 5 BTC and i have accumulated over 11 6 BTC in just three weeks  with the trading strategy given to me by expert trader Hudson Owen ,69,6
1000x brah,1,0
You can t go wrong with the Techlead             ,1,0
 Awesome post I must say   Crypto is moving with little sign of stopping throughout the past few days and weeks   with movements reaching a clear impasse   the aggregated cryptocurrency market has been following in Btcoin s lead and is struggling to garner any decisive momentum  One analyst is now noting that BTC has been holding above a key macro level throughout the past few months  i appreciate the honesty  the most you tubers this days is only up to the moon  funny part is that nobody is talking or taking in consideration of what s happening around us        stock market   delta variant   inflation and so on  let alone of how bitcoin perform before in the same situation in the past  what s best to do now is to trade with pro treder Daniel as to stack up more even in this period ,1,1
his videos are really burning in thumbnails these days,1,0
What about the network fees ,1,0
Excellent Information  Thank you  Bitcoin is consolidating right now and preparing for the next BIG upward movement  Other investors are still waiting for the right time to enter  A lot of traders will miss again the BULL RUN ,1,1
 People will be kicking themselves in few weeks if they miss the opportunity to buy and invest in bitcoin  ,17,11
AM NOT LONGER WAITING FOR THE STIMULUS CHECKS BECAUSE I EARN  22 000 EVERY 14 16 DAYS  ,2,3
I have been trading for about 6 months now and just about every trade backfires and slaps me in my face  Nearly impossible for me to catch more than a few points    I try to do top down analysis but it doesn t work for me   I say to myself  clearly I m in the 90  that lose money  so I open a demo account  do my analysis  then take the opposite of what I would normally take and get the same result  I m starting to feel hopeless  any advice for a struggling trader ,46,11
 Anne stewart  Don t listen to her  don t give up  Trading takes time months  even years  to master  even the pros learn everyday  Never the less  if you lose money no matter which side you take  maybe you need to look at how you are managing active trades rather than how you are entering them  My advice  find a mentor   And also  try incorporating the use of oscillators  Bollinger and pivot points into your strategy  And most importantly move to higher TFs 4h or 1D preferably   you ll thank me later   ,1,
 Great info and insight as always  It s kind of irresponsible to ignore the fact that each ETF launch so far has caused a major dump at the peaks of BTC  A lot has changed and that s on everything but the truth is I don t even care much about bullish or bearish market anymore because Trader Brian Donald got me covered as I have made over 32btc from oct till date using his daily signals  insights and guidance,65,10
Love they way u speak   than ur content    Nice way u start     I find they way  ,1,0
started learning about crypto 1 month ago  starting with  100  thanks for all you info,2,1
You need to learn how to invest beyond Assumptions on your crypto currencies to gain maximum stability in your poy,1,
Man I still miss the old tech lead  ,2,0
