Comment,Likes,Reply Count
tech lead wast the person that convinced me to create a personal wallet   learning a lot about crypto with this,2,
The troll levels are off the charts  OMG hahaha xD,74,5
 XRP DEV Yea man I hear you on that and thats how I like to go about things to  I got a lot of respect for your approach man  You also have a good one ,2,
 ThePhilosopher Oh haha  That s awesome and I respect that  It was more or less obvious that this will rise in value since the amount of tokens is so low  And he already has 1 14 million subscribers and plus marketing and hype  Ta daaaaa   I don t need to become rich quick or to be more precise I don t care if I ever become  rich  or not  I have everything I need and enjoy life  The money wouldn t change that  Money makes certain things easier yet I already have a decent life and enjoy my part time job as a full stack developer and spending time with friends  My crypto investments are based on rational decision making and research I did by myself  Probabilities are IMHO  duh  high that they will increase in value over the next years   Have a great day    ,2,
  ThePhilosopher I know  I also strongly disagree with what he did and really lost respect for him  It s crazy   Had the chance to buy his Token at 1 4   I knew that I could have made money  would have probably sold at 5  though  since I didn t know that he would keep promoting it that hard   But I decided that I won t do it  due to moral objections ,7,
Look at the comment section  Ppl literally lost their minds  and I can t laugh because it shows how crazy this has gotten ,6,
Next  the yield aggregator  millionaires club,43,2
Pamp eet,1,1
Chof etherscan gha tlga fih million in circulation supply ,1,
I like where  MM is heading  Keep it up  ,30,2
To zero it looks like ,2,
This comes from a CEO of a new Crypto,1,1
I made 200 bucks  Im basically chad squared ,1,1
My man TL making the boss moves ,8,1
A grand vision indeed ,21,1
Woooooooow,3,1
I have have lost like 50  of everything I ve put in the Million token    So I guess I have no idea what I m doing   People are talking about how much money they made of it while I m just constantly losing all my money   ,1,4
Attacking DOGE  not doje  fyi  won t help MM  It ll turn people against you  Stay away from that type of approach ,2,2
Million to the moon  See you at the moon jacuzzi,1,1
It sounds like you re trashing the other coins just to pump your own coin   ,2,1
MM looks to have a massive amount of potential,114,8
Rug potential ,1,
Its down 60  in 2 days  there is no project  Techlead literally woke up 2 weeks ago and had a great idea for a troll  Thousands of idiots bought at 200 and have lost more than half their investment already  In a few days they will be wishing they took the L at  99 rather than  15 ,3,
Literally dumps 40  in an hour lmao sure buddy ,3,
Glad he has a bigger vision than being just a store of value,1,
 It s a hustle ,5,
Yeah  all it needs to do is realise it   Looking unlikely right now ,3,
ALL THE WAY UP        ,37,1
Nothing can stop us   MMArmy,1,
In Techlead we trust      Milliontoken will create generational wealth  Don t let Bitcoin maxis brainwash you  Million token is the best project for all people  We are a revolutionary project with focus on creating real millionaires fast  Check our top 20 on Etherscan for proof ,1,1
If you have 1MM  consider yourself a  MMilLIONnaire    Binance Smart Chain incoming ,119,12
 Gaspard K Like a centimetre but smaller,1,
 Rithik Sanghvi Let s see  but I m sure  I love people like you ,1,
Instead invest in ADA  VeChain  DOT and other projects that have really a bright future  This Shibatoken  Doge now MM  It s just the hype like he said it s a spaceship without a pilot ,4,
 Luan Dinh Just listen  it s going even higher  The sky is the limit ,2,
Just waiting for MM to get listed on Binance   ,5,
This will be crazy   ,3,
Bro  mm is gonna hit  1000 per coin  Get as much as you can before it hit too high ,6,
Am I first        MM holder here  Let s get ready to moonshot      MillionToken,1,0
Million already made good gains,2,0
    it s over  I ll rebuy when it hits 0 03,3,0
You are 100  wrong about  SHIB  shiba inu   shiba inu has just DROPPED it s own DEX coin staking exchange  how in the world can you even try to compare it   OH wait  You are a sarcastic  millionaire comedian   in one week  SHIBA SWAB has  1 8 BILLION staked worth of coins    So yea   no comparison to ANY other token coin  without  their own swap dex exchange    binance has had a lot of news lately,1,1
when will you do a collab or interview with other channels   would be good for Millionexposure   ,34,2
And he should also do some type of AMA or livestream for his fans here  This is unprofessional IMO  people have risked a lot of money in this he should at least do more than one way dialogue  I don t know what he s thinking but as the price keeps dropping I hope he wakes up to putting in more effort than a youtube vid every few days,1,
MILLION TOKEN CHANGE MY LIFE,1,0
One million Million Tokens for one million millionaires  ,1,1
Lol  Somebody remind me   ,10,1
Actually got a feeling MM got a good chance in mooning  ,117,5
I hope we can see a 10x from here  We should surpass Shiba ,2,
It already MOONED 200X and it seems like there is a lot more to come xD crazy stuff ,2,
that feeling is correct   ,4,
It already happened  multiple times  It literally more than 200x d in less than a month  It s basically showing the course of BTC and DOGE in high speed ,7,
Million token gave me a house right now    to the moon  ,1,1
Hey guys  can someone tell me how I can purchase the Million Token  I ve read the instructions on the site but since I m a super newbie to crypto  it confuses the heck out of me ,45,22
I used coinbase wallet,1,
 Shancun M  it won t  haters be hating but they will fomo in when it goes to 1000,2,
Thanks guys ,2,
 Aadnan Elkacimi Thank you ,2,
2  You have to use fiat  whatever your country s currency is  to buy Ether  ETH     depending on your country you can do that directly from Metamask or you have to create an account with a centralized exchange like Coinbase Kucoin which has fiat onramps ,2,
1  Google  Metamask  download it  mobile app on Android iOS OR browser extension for Google Chrome Brave browser   The developers are ConsenSys their site is metamask io  they are responsible in part for Ethereum Blockchain ,4,
Its available on Gateio,2,
 Quincy I couldn t get it to work with Coinbase wallet for some reason      used MetaMask,5,
You missed the boat  only a fool would buy now  peaked at 220  will be back down to 15 dollars soon ,18,
You can buy eth on coinbase  then transfer the eth to a coinbase wallet  From that wallet  you can then swap it through uniswap with million token  It is pretty simple tbh  You can also check the site  it should clear things up,10,
Thanks to Million Token I made 30k  And still hodling ,4,2
you haven t made any  real  money until you sell,1,
Hold y all lol the funds dropping because we keep pulling back because of google gray pool staking and even there still under no one selling,1,1
SOLD DOGECOIN AND BOUGHT MILLION COIN,1,1
Guys  I made over 5k with Million Token  Not planning on selling for 5 years  See you in Mars  I live in El Salvador,4,2
2nd gen meme token  Million token  Thx a  MMilLION ,188,2
 As A Millionaire  LFG           ,49,1
To Uranus or beyond    ,2,
Thank you TL   ,15,0
Can we talk about something else please ,2,1
We believe on you and on your project keep going,25,1
Second generation meme coin xD,3,1
I love your work  but right now with your manipulated token  you getting bored  And don t say it s not manipulate because everyone can see how much money you been taking out from liquidity for pump it,1,3
 BlackCubone open your eyes  You didn t see how just go from 200 to 88 dollars on a day  That happens because he is playing with the liquidity pool  He is the one getting richest  sorry for the ones how buy 150  or more,1,
Getting tired from million coin,1,0
The sarcasm of this channel is often believed  I love it  And that thumbnail is gold hahah,220,5
Techlead is never sarcastic ,2,
He s always sarcastic and yet always means it,7,
And the title  ,5,
Sarcasm is making this guy a billionaire  Hats off ,12,
Great content   ,5,0
Loving mm,2,0
Not selling my Millions until 1 MM    1 000 000 ,4,1
Tom from Myspace   what do you think about Zuckerscrub trying to ride your coat tails as the pioneer of social media websites ,2,
Loving this Token ,146,7
fool    once there are no greater fools     i wanna see how it will end up ,1,
Long as your holding your not losing   Don t let the panic seller s scare you,1,
Its looooosing,1,
Thanks for watching enlightenment you can also contact on telegram at Binaryforex on telegram,2,
lets pump  pump  pump it up ,2,
Dude the price gonna buss all that money released tomorrow,1,0
Buy and Hodl haha ,1,0
Million token to the f king Moon    ,3,0
  ,1,0
Bitcoin is digital gold  Ethereum is digital oil  Million Token is digital diamond ,24,1
Anonymous also launched a very similar coin  Also a second gen meme coin  They even threatened Elon Musk  Keeping my eye on their coin too as well as MM,1,0
 ,2,0
Hey more for me    and everyone else,1,0
 milliontoken too        ,2,0
Million is the present and future   ,19,0
Realy realy i want to thank you for MM,14,0
Hey techlead,1,0
Our champion,1,0
  ,2,0
3rd,4,0
eh  it ll rebound randomly in the years to come,5,2
 Giovanni Rodriguez  days,1,
yay,8,0
I am the first one   ,3,0
TECH LEEADDDD     ,2,0
First ,1,0
No,1,0
My doge coin is hella down ffs  ,7,1
Lets goooo,3,0
