Comment,Likes,Reply Count
Hey Techlead   how about this idea  reward commenters with awesome comments by sending some MM to their address  And my comments are pretty awesome haha  But seriously this could evolve into a more formal program beyond just YouTube which rewards effort for marketing and encourages demand for Million token since you can make a requirement that to participate someone must hold a minimum amount of million token first,1,1
Bitcoin is digital gold  Million Coin is digital Palladium,1,2
The number of holders is the key to the strength and there is a reason Techlead keeps mentioning it and purposely tying it to marketing luxury is a good play,3,0
Most hilarious youtuber ever   On top of that he is the first one who made me a millionair ,2,2
I love Million token because now we finally have a decent store of value option for the ethereum blockchain ,3,1
Million   Dogecoin  ,1,1
 There is a lion in every million  is a seriously brilliant slogan  The logo looks amazingly prestigious too ,15,1
He got 1mil subs  and coin is limited to 1 mil in circulation  If 1 sub buys 1 coin and HODL  the price of a coin will be worth  1 000 000  Price is only  100 each now   DAMN  Im getting 10  See you in the jaccuzi bar on the moon ,7,2
10 MM tokens could be life changing some day  make it viral ,5,1
 Then the joke is better than reality  ,1,2
He went from tech lead to CPO  Chief Pump Officer ,1,2
Man  U really show your intelligence in this video  No wonder you were the tech lead  You can see the true value of million coin ,1,1
Amazing to be so early to something like this  Glad to be subscribed and along for the roller coaster ride  Keeps life interesting and so far  more fruitful  Thanks a lot ,3,1
To put it bluntly  your videos are getting VERY tedious when all you do is pump MM  I understand that you likely find it easy material to extract content from  but it makes for very boring and predictable viewing  If MM has value  there s no need to pump it so much  People will recognize its value on their own   Hopefully your channel doesn t turn into nothing but drawn out MM advertisements ,2,1
He trashes DOGE for being down 70  from its high but doesn t mention the MM is down 50  from its high in just a couple days    can t wait to see Techlead on American Greed    ,2,4
 Jin Kee if that s how you look at it then just hang on until it goes to zero    ,1,
MM is crashing sell while you can ppl,1,2
This video does give hope  We ve been trading sideways  up against some major whales and bots that have been using the liquidity and their large asset to profit off of the smaller traders at every transaction  In my opinion  MillionToken needs to make some big boy moves  no longer just raiding and spamming people s livestreams and Twitter  but some actual branding and advertising  I love MM token and I want this community to stand out from the crowd as a group of professionals ,2,1
it s good that lot of you guys making money  i missed it   any new project ,1,1
how come biggest wallet is 3  if he holds 15   ,1,1
As a social experiment  this digital token and its community based creation is such a unique learning opportunity  It s so young  and yet there s already so many breakthroughs here   It would be amazing to offer this digital token as a case study exercise for high school or college level students about entrepreneurship ,1,1
Beyond cocky  No wonder single bro  Just chill with the   m Talk  you just Launched lol  Starting to sound like Lavar Ball ,1,1
I am quite impressed at the scale of the results to date  I ll keep watching with interest ,1,1
We are creating a new cultural movement of luxury   comedy   nerd ,2,0
PUMP PUMP PUMP  ,2,1
I love how he talks about Million Token as if he s just reporting on it  not like he actually created it    ,1,1
I bought 2 of them yesterday  I wish I would of got into it sooner  It was a difficult token to figure out buying  Not a fan of the process of buying it  Sounds like it will be easier to obtain sooner then later  Good job Techlead,4,2
Haha yea  everyone is in million token now  Do you believe yourself wenn you talk        ,1,1
Yeah if i made my own token I would hype it every day as well ,1,3
Wen Binance  TL Almost there Holder  Wheres Lambo dealer ,1,1
Inspiring,2,0
Yea soon as i get in to dogecoin it crashes  I just can t win on here  Missed million token gravy train by 2 weeks  Im all brand new to crypto but learning fast  I just wish I d seen your video on million token 2 weeks ago  I bought one token at 140  I hope million token goes to the moon  Had covid not ripped away my saving Id be able to invest  Damn covid  Ruined everything for me  Only hope is million token ,1,2
Don t feel bad  I bought in higher than you did  You have to look at it like this  If it has the potential that we think it has  then it doesn t matter what you buy in at right now ,1,
Go go go    To to back side of the Moon,1,1
As a HODLER of less than a handful of million token  my only regret is that I don t have the capital to BUY MORE  ,3,3
I buy Safemoon crypto    ,1,1
 114 liking the dip jumping back in,1,1
TechLead  You posted 5  bear videos excoriating and lambasting crypto as doomed And corrupt  Destined to go to zero because they will be outlawed by governments bc They enable crime   Decrease the worth of domestic currency s  not to mention the exorbitant costs of crypto   Now you made your own crypto  and you ve completely changed your tune  What changed   How are we supposed to believe that this isn t all just a big pyramid scheme  whereby Everyone buys in just to try to sell to the next guy for more  before it all comes crashing down  as you explained in detail ,1,1
Mr Techlead  I have been promoting Million to my circle  we are all a part of it now  Million Army will grow  we have faith in our leader TL Thankyou,4,2
dig it,1,1
It s the Lion King of Crypto ,2,1
Well I own a few more than 10 looking forward to see our future unfold X ,3,1
Ah won t be a TechLead video without the Jacuzzi bar  ,4,1
A collab with andrei jikh would be a tasty promo,1,1
Great  I support this project all the way from Africa    Bought in 2 MM yesterday,7,2
Coolest thing since sliced bread       Liked    ,1,1
 Be so good  they cannot ignore you ,13,1
TECHLEAD FOR PRESIDENT ,1,1
I think i am going to sell my shib for Million  But i am keeping my doge ,1,1
Nice try for a pump down to 129 so I tell your users keep scalping before the others do ,1,1
We are witnessing history     ,8,1
lol  the techlead selling that vision  ,1,1
Holding to the future of million,1,1
lets do this  Million TO THE MOOOOOOOOOOOON  This is still the beginning of a huge story  Dont miss out on this ,2,1
There is only one million MM and they will eventually all be gone,3,1
Whoever disliked this I really hope you hodl,1,1
Fuq you dogecoin too the moon   ,3,1
Converted 3 ETH to MM I believe  1000 is possible within the next few weeks,2,1
How many mm have been sold   s it running out ,2,1
TL delivers as always,1,0
I hate i missed this flip  i said 1 00 entry was to high but missed the upside was a qwik  100 ro  15000 easy,1,1
You couldn t buy it for  1,1,
I thought this was a coding channel ,2,1
 as a hundrednair  ,1,1
Wouldn t staking make it inflationary,1,1
I can t believe how lucky I m to hold even just few  MM  Thank you man  You gave us the biggest opportunity ever seen in life    milliontoken  millionarmy,22,0
As A Billionaire you don t even put sponsors or mid roll ads anymore  Welcome Back Sir ,46,2
Techlead    First millionaire to create a million millionaires ,1,1
I want to see MILLION with one Billion market cap ,10,1
If Bitcoin hits 17k  do you guys possibly know what price doge might be at ,1,1
you really sold me on this one  well done,11,1
MM price is    as it gets listed to Binance  ,1,0
he probably bought half of them when they were a dollar,1,1
I hate you ,1,1
I M HODLING,1,1
Brilliant     As a whole Million Tokenaire ,51,1
Made my day  Thank you  ,2,1
MM Army time to enlist ,1,1
I want to take a bath in the moon jakuzzi ,3,1
I was about to buy 100 1000 coin right when it came out then I forgot for a couple days  Sad,7,4
Same here,1,
Hi  My opinion regarding the project can be as good as any one else  I am not long in this space  but I looked and listened  Observed a lot of interesting stuff regarding  Million token  is a fresh breeze of hope  Since the last couple of weeks was bad for the space  Tech lead  I would like to hear a bit more about the future initiatives for the project  long term mostly  More proof for the community  where we head   How long still  before it is regarded as an investment   In the meantime a million     You are a seriously a cool man  Too the moon ,1,1
This guy is a serious genius  believe me  this coin will accomplish what it set out to do  He is not just making a coin he s making a brand    in a couple of years this will be huge ,70,10
 MoneyBags73 No you re missing long term perspective  So he s building a brand for this coin  What does the coin itself do  What s the utility  Answer that question and you might sell me on this  If you can t answer that question  don t   me ,4,
 Oh Dae Su last time I listened to people talk like you I missed out on bitcoin when it was under a grand,5,
 EurekaBlack it ll beat btc or eth at least in terms of stored value  only 1 million in circulation and the rest of the other coins will become stable coins pegged to a certain amount of USD or something   joking    but as much as I want  coming regulations may affect all cryptos as TL pointed out too   So let s see    ,2,
 Bassanio Grant fingers crossed we all gon be multi millionaires in months or years,4,
 Oh Dae Su  just keep yourself in good health and you will live to see it    with your attitude by the time you are ready to buy you will get  0001mm for a  1000 ,7,
 Oh Dae Su It sounds like you don t understand viral social media trends the grow exponentially  There are so many great things about this project  Most transparent crypto out there ,4,
Months ,7,
I m holding around 3 000 mm bought at 3 5  and 5   Selling at 500  at least  Don t sell before 300  at least ,14,2
Going to the moon   ,2,1
Great work Dev TL and team    MM to the moon   ,6,1
I believe in  MM    ,1,1
Genius  I love this guy ,6,1
Why did you switch to only making bitcoin type videos  I much preferred your regular content   ,2,2
 Martin McAvoy ppl start new projects and channels evolve  i really wanna see where this goes,1,
Ponzyyyyyy,1,0
I love this guy  So funny and satirical  and honest ,41,2
This guy is going to make all of his followers rich  What a guy  ,26,8
You are not very wise  This coin is zero sum game  and for one to profit someone else has to lose ,3,
 smegma Honestly one thing that TL is right about is the fact this is all about marketing  There s no value other than rising price action from ppl buying literal hype  Every Doge has its day tho ,4,
No  That s if the token was back at  1  Too late now,4,
that ads agency is good idea,1,0
man the only thing that is worth a Million is your amazing skill of speaking  D you re amazing  another great video,20,1
Genius,1,1
TL  this marketing vision is simply outstanding  Next level stuff ,81,1
I ve got a price target about 35 before going back up,7,1
Got 3  MM Token and are going right to  uniswap and buy at least 7 more  D,1,0
Some great insights Techlead  Can not wait to see where this goes  Best of luck ,10,4
So stupid,2,1
I knew a guy that worked at Microsoft he was going back there but this time as an Asian  Made money I heard  You should be able to make good money there ,2,1
I m jealous  I m sooooo slow to adapt  Sad ,1,0
Million token   I smell a second UPSHOD no thanks,2,1
ex google  ex Facebook  apparently has lots of brains but he uses it to create a means to an end meme token that does nothing  But hey  people are stupid  some things you say are true   this is going to go somewhere  and then like Doge one days is going to end    my thought is  you should do better   you have so much followers and this is how you create an impact   Funny but Sad as always  You are a MASTER MANIPULATOR    Enjoy your modest share of it ,1,1
I want to be Millionaire    ,2,1
Fund on Shib and Doge moves to MM now,1,1
You know  you could say the million token crashed  50  in the last three days alone  So it has been crashing way worse than DOGE or any other crypto recently  What a joke coin  haha  xD,4,0
Amazing stuff TL  this coin is like the green version of Bitcoin  All the same properties but is energy efficient on Ethereum 2 0  Save the planet people  move your Bitcoin to Million Token ,2,1
Here it is the next generation of meme coin  the worlds most popular crypto assett    ,35,1
where to buy million token in India    ,1,0
Bruh  Such an annoying video whose content does not align with the title  We get it  MM looks promising but don t fool us with a misleading title ,1,1
Over 100 people downvoted due to missing out  smh  I mean  you still have time before  1k ,16,1
Techlead  please build a paradise on the moon and only allow million coin users to enter ,1,0
Thanks TL for MM ,3,1
Say million token one more time    great content ,2,0
Keep your Doge   Shib till BTC recovers but buy just one MM now while you can ,1,0
MM on the BSC  ,1,0
Pure Genius ,1,0
Another video  it s a good Friday ,3,0
Legend      MM HODLR    ,2,0
My nigga Tech,1,0
TO THE MOOOOON WOOHOOOOO,2,0
Love you TL        You are a genius           I have more than 1 million tokens to be honest    I m going to be billionaire    To the moon at the jacuzzi and drinks on me              ,6,3
Stop buying DOGE and buy ADA stake in a stake pool and earn 15  APY huge gains on ADA,1,1
Bwahaha  Wide open meme coin potential  Hmmm     maybe some meme videos too catch some extra sizzle ,1,0
Why the million logo use gold as color n background  Too mainstream  ,2,1
when it comes out binance i go all in,1,1
Every word this man says has meaning  behind it  you  just have to learn to listen  He is dropping gems on you  just have to learn to pick it up ,50,5
The gem i found is to love people arround you,1,
 Ugly Prophet Tbh every comment here talks about value  but if you ask them the   specifics   they cant tell you anything other than  everyone else is in on it   Doge did this  and look at Doge now  this will be the same thing ,2,
What gem did you happen to find ,2,
thank you so much for this creation of the new diamonds it really change our life  i see it as promotion who enter first will get rich who hold one will get rich  i wish if i can say that i come from the future to say that bitcoin become from the past and the new currency in the world in million  i just have one thing that going in negative way is the ETH fees that keep charging us alot in case that we trade as  buyer or seller reduce       as m,1,1
Andrei jikh has got to watch this video    Techlead  please give Andrie a chance to interview you  It would be great the MM community and the entire crypto community as well ,7,0
Just wait until January next year yall  Someone will revive it  Our emotions are played with on a yearly basis ,11,1
Sad for people who dislike this because they missed out  little do they know it s still going to  1000 a coin,23,5
10k per coin soon if not million per coin,1,
Its not it already had its high run now is when ppl start losing  watch lmao,5,
    ,1,1
I m used to carrying     made me laugh so hard ,74,2
Has to be my favorite video by far  thank you TL    millionarmy,11,1
RIP to all the idiots that fell for Musks antics     ,1,0
Hey   maybe it is better to  stay away from Binance,1,1
MM   Million Marketing  Ideas ,1,0
This guy is not joking ,1,0
                    I will spread it to Japanese  You should tell your  ex wife about it so more Japanese join the MM team,1,0
make us rich TL,2,0
MM to 1000  soon ,1,0
Dogecoin n shiba depends bitcoin pumping prices if bitcoin reach 100k  doge n shiba will hit 1  lol,1,0
We will beat doggy we are lions ,2,0
can we get back to tech  enough pretending you know anything about crypto ,1,0
It s crazy how such a niche community is about to become such a large brand  The people in the discord community have done such a fantastic job at promoting and holding the coin  The fact that we have such a transparent leader should be a wake up call to billions of people that this community and this coin are going to the moon and we welcome and encourage everyone to join us on the journey,1,0
Superb  Patrick ,2,0
BSC will make Million Token xplode  Thanks TechLead  MILLIONARMY,4,1
He spent months bashing crypto  He then releases a crypto  It goes to the moon     I m speechless  Having a good laugh following this coin  Tech must have made millions off this coin     New wife incoming ,30,7
 Phat Panda are long as there are more idiots buying this at a higher price  which will not be the case for too long ,2,
He had crypto  just sold it due to the down turn on the market  he states the truth in terms of the dodgy things going on with Tether or binance  has nothing to do with different alt coins  I see this coin and Safemoon going really really well long term ,2,
his bashing of crypto actually made me skip this one    ,7,
I know right  I don t even know what to think anymore  Building something he ridiculed a plethora of times its genius  I remember him saying that crypto is like the gold rush  the only people making money are the shovel distributors ,5,
Check out Jejudoge   In accumulation mode for new high of 160M market cap  ,2,0
Great news for Million Token  Keep it up ,1,0
Money will run people crazy,1,1
This is only the beginning     ,1,1
2 0,90,4
Listing on Binance is huge  ,4,1
Thank you TechLead  I believed in your project the moment I first viewed your video on Million token   Tim  MM whale,9,1
12499 holders  I say  300 once we have 15 000 HODLers  Doge and Shiba were training tokens for the masses  MILLION TOKEN is a next generation token,1,1
Where is the momentum  Can we be real pls most of the people in discord are in the red,2,3
Finally i m early in a crypto project  ,4,2
and yet it feels so late to the table ,1,
 I m quite used to carrying the team  LOL  I love this movement ,221,1
Going to the          ,3,
Thanks TL you re the best ,3,0
I m loving the Million token arch within the crypto season  But I m starting to miss the mechanical keyboard with RGB stuff tho  ,3,0
This dude is smart  He has diamond hands,17,1
BSC is really a game changer  We shift gears so quickly  Unbelievable,1,0
This the most Viral Digital Asset to Ever Hold   People would be dying to get a chunk of it  This is just the beginning    No other projects has done this much in starting day s which we have achieved so far    And trust me guy s it s nothing in front of what s gonna come      ,3,0
I love this guy  he is almost cracking up with all the crap he has to say to fill in those 10 minutes  The video should be one minute long  hello  we ve reached 12k holders  and MM will be listed on       Anyhow good for you MMilioneres  you ve got and amazingly sarcastic leader ,20,0
 Millionarmy,1,0
Your coin is down also  And your chat group admins doesn t even let people say anything and you get blocked ,5,0
TL carrying the team  Let s gooooooooo ,5,1
I m in ,1,1
Yeah I had to trade my SHIBA for at least 2 of your milLION coin  Awesome back story behind  It s destiny ,12,2
I think he s right crypto adoption is a marketing issue the technology has all been there for years and TL is good at marketing  ,1,3
he s the only person that was able to convince me to buy some crypto   Like you said   he s good at marketing  and that s why i m in,1,
what is the smoke at 5 35 ,1,2
A million ways for Million Token to be valued at  1 000 000 per token ,2,0
As a millionaire,2,0
Everyone comment to help the algorithm,1,0
Loving this token TL   much wow  ,16,0
Then the joke is better than reality  Totally agree with you on that  This is by far my best performing crypto asset  Thanks TL ,2,1
Really excited for binance listing,2,2
MM TO THE MOON,1,0
The sarcasm is brutal  Lol,2,1
TechLead You are a legend ,9,2
Let s do this  to the moon with the TechLead tycoon        Million Token  pump it up buttercup      ,30,1
Hi Tech lead  It s a high time you stop calling MM a meme token ,7,3
Techlead is the steve jobs of crypto currencies,2,1
MM to the moon   ,1,2
Loving this rocket ride   ,2,1
This MM coin is something else that s for sure  Love the vision behind it ,47,1
pancakeswap,2,1
blessed is he  who holds when others sell,21,4
 James Yun yes it does  it drives the price down ,1,
I think you spelled broke wrong,1,
Ain t nothing wrong with taking profits my boy   ,1,
How does he not crack up saying all that stuff        KUDOS my man   ,13,1
Doing well TechLead  I m doing my part to make this project grow ,46,1
Put your Millions in Million  MM,1,1
It makes me sick knowing I could have got in sooner and didn t  ,68,30
 Joseph i was telling people to get out at 150  120 in the last few days  its now down to 99  the hype train is over  techlead only has so many subscribers  people need to take an L right now before the L becomes 100 ,2,
 Joseph then u lost nearly half,1,
I can t believe that this coin took off  Thought it was a joke ,3,
You not the only one  Before he even launched it I was thinking of buying 1k tokens but nope  Now I m punching air  Imagine me doing that as a non millionaire,4,
 Mason Harper bro  get a VPN  Then you can  be  in the united states or any other country,2,
  Sumo Cum Loudly And your ability to predict the market is just 100  accurate ,1,
 Mason Harper My friend lives in Cananda  he has MM ,1,
That s so true  Bought at  165 and now at  140  D,1,
This is going to be painful for alot of people ,6,
Consider yourself lucky   In Canada  I can t buy million at all ,2,
You Are early  Look at the history of all other coins  This is like day 15 I think ,3,
 Joseph joseph  you got in way late  this was an extremely short term troll  its not a project  Take a small loss and get out before the big crash ,19,
It is early  Join ,4,
The only reason i didn t got sooner in is because i didn t have any wallet ,5,
Me too bro  But get in now  I got 1 token for 146  I feel like I got in really early still,9,
I m in for 3k  We re going to the moon   ,11,2
It s so lonely at the top,4,0
Million token going to  1000 minimum,1,0
I see bright future for million token,1,1
This was a the video I was waiting for,2,0
SOOOO HAPPY I DIDNT PAPERHAND THIS JEWEL,1,0
MM army ,1,0
Techlead is the king   ,6,1
Just buy one    why not  Millionaire lions    ,26,1
LET S GOOOOO,1,1
He s actually really good at advertising  Good stuff ,509,24
The best haha  A real Lion   ,2,
 Vannessa Coonrod sweet guy   Why don t you ask him out instead of circling lol,1,
No he s not  He has the personality of cardboard box ,1,
Well  he has built a YT channel will 1mio subs  D,2,
Sweet guy  Extraordinarily intelligent ,1,
 Dunravin erm  are you seriolusly b tching about  45  after 224x initial price  Really  Dude  realistically the correction should push it down to  30  but we ll see ,4,
He will just pump his coin from here on out ,9,
yeah    down 45 3  in 3 days  Should of been ex second hand car salesman  wasted on tech,11,
im here to watchi his advertising  im quite amused ,6,
Almost made me buy another one,9,
Advertising to the moon  ,16,
Yes he is very good ,11,
Ppl who sell have no idea what they are giving away    ,2,2
This is ground ground floor  Lets go to BTC and beyond ,2,1
 989 BEFORE EOW    ,1,1
My transaction to buy 5k worth of MM failed the other day  Good thing it did  It went down 30  the next day lol,3,5
TechLead  you never seize to amaze ,25,2
 The Fall of Doge vs Million Strikes Back ,1,1
no dude its going to at least 1k,1,
Its the second week only ,1,
MM Token Hodler  ,2,1
Million token is the future ,16,2
Thank you mr tech you changed my life,13,1
Giving us a glimpse of the roadmap  Cheers,58,1
Well explain all strategies            ,16,1
You are trolling for views at this point ,2,1
Starting to believe your ex wife made the best decision of her life   This Million coin venture shot any credibility you had with your audience ,1,4
Are you mad you didn t buy in earlier lol ,1,
Million market cap will soon overtake Nike,2,1
     ,4,1
Million,1,1
Thank you for this    ,8,1
Is it still a good buy at  100 ,17,11
 kave mustermann i think the highest it will ever reach is 10k,2,
If only i had invested 2 weeks ago i would be 100x by now  ,1,
 Jesus is God bro 1m  is a meme  but 1000 is possible,1,
If you believe one day it will hit  1M then yes,1,
This was epic  ,45,3
clean break past resistance and its game over in ETA 5 hours,4,4
Hilarious as always        I m holding my tokens but the discord lounge is one of the most anxiety provoking spaces  I tend to only take a glance here and there  ,23,1
Big fluctuations normal esp early on  in my limited experience ,3,
I m holding for the future  TL s got the master plan,67,10
Is there even a plan  This is a meme coin    There is no road map or project behind   just hope that there is more ppl buying and you are not the last one selling  Meme coin don t last long   ,5,
Dont be a fool  this goose is cooked  get out while you can ,10,
PATIENCE is the key to SUCCESS    ,47,4
 Stevens Garage Then he walked away with a 100  profit  which is a positive outcome any way you look at it   No one should be purchasing altcoins with money they aren t prepared to lose  Never invest more than you can afford  Don t overreach  The very definition of a moonshot is incredibly high risk high reward   I can t speak for anyone else here  but I buy to hold ,3,
Even though I am sure we are going to moon  but whatever happens  this ride will be great experience for all the current community including me ,7,6
yup  when i make a decent amount I wanna shift it into providing liquidity,1,
