Comment,Likes,Reply Count
Cardano will be ETH compatible in the future  Charles has already said this ,1,2
TechLead is underrated  MM to the moon ,14,1
Still not selling bobo,1,1
Crazy Unpopular Opinion   People have no idea what Market Cap is and coin burning is just a tool to create fomo ,1,1
I swapped to usdt back at  49k mark  and back to BTC at almost 33k  I think I m in the green even if it goes down to 29k,6,3
Wish I could like this content twice   ,1,0
HEX and PulseChain   ,3,1
I think we found the bottom guys  I think we found the bottom ,2,0
Can t wait for MillionToken to fly,4,0
500k gone   way would you send so many money at once ,2,1
you should create a playlist tutorial about web 3 programming in solidity or other language   would be awesome  ,3,1
The Chinese are going to release their digital Juan and tell the world   You want to do business in china  you will have to use our digital Juan   That is going to put a lot of downward pressure on all the other coins ,1,3
Investing in bitcoin is the best investment anyone can do this  because it has made a lot of people millionaire  I pray that anyone who reads this will be successful in life,6,5
I m also getting into forex trading because a friend of mine told me that s forex trading is the best now to invest  well i have Bitcoin worth of  19 000 on my edge wallet,1,
Time wonderland V2 will be greatest comeback  ,2,0
Now is the time to BUY,2,1
 ,1,1
Cardano will use Bridges either chain or Cosmos,1,0
This the long winter foretold by the ancients ,4,0
What are your thoughts on eth flash loans ,1,1
If Bitcoin will success  some alts will do to  if it will fail all the alts will do fail  So stick to Bitcoin,1,2
Another Great Video  SO much to learn   Is your name really Patrick ,1,0
Million token will always be legendary        ,3,2
i agree luna in danger       i honestly want to hang out with u and do diablo play sesh      and dont be scared im not homosexual      ,1,0
So the best pyramid scheme to join is Bitcoin ,1,2
Awesome vid  What a legend,3,0
I like this guy approach clearly he watches YouTube videos and knows people just want you to get to the point,26,0
bout damn time you dropped a new video,2,0
This is the only channel where I get spam with bot comments ,1,1
 Cryptocurrency and Bitcoin is the future ,53,22
Neo and oasis are the next blockchains to moon,1,3
   I am a bit of skeptic  but know a lot of aspects about BTC  So  let s make few things straight   BTC is an investment asset   like gold  it s scarce  but it s easier to acquire it and big players like pay pal and grayscale are holding it  same with a lot of banking institutions  hedge funds and masses of people  host wallet BTC owner whales have a hard time selling it without doing KYC and in some cases  this can wreck them financially  People lose access to their BTC wallets which makes that BTC frozen for all time  The Hype and FOMO is on the rise and most people only buy and hold with BTC   I mean you have to understand that normal stock market fundamentals don t apply here  It s not a 2017   2018 scenario  The regulation added to BTC can actually even make it more desirable although have a minus   Basically  anything that could stop the mooning of BTC imo would be extreme regulation restrictions and also better investment opportunities discovered by BTC owners  However   it s is best advice you find a working strategy daily signals that works well in other to accumulate and grow a very strong portfolio ahead  I have been trading with Travis Berry daily signals and strategy  him guidance makes trading less stressful and more profit despite the recent fluctuations  I was able to easily increase my portfolio in just 4weeks of trading with Travis Berry daily signals growing 1 5 BTC to 6 7 BTC  His daily signals are very accurate and yields a great positive return on investment and is available to give assistance to anyone who love crypto trading  You can reach Travis on  eI    m TravisBerry0     ,1,9
The future is very Cryptic   ,4,2
Lol,1,
R I P Bitcoin,1,3
hmm no,1,
I m the 5th,1,0
i am the Blockchain Master  ,1,2
Excited to learn more   I feel like there are so many financial tech gurus out there   but SO many contradicting opinions  Figured I d add another opinion to the list  Thanks for making such informative videos ,13,27
 Richard Jewell fake account,1,
 BandMan Chapo Bitcoin is the future  Investing in it now will be the wisest to do especially with the current dip ,2,
Hahaha love the spamming from all these bots   people get more creative every time ,1,
 Steven PaulTrust me you won t regret trading with Mr james matheson,1,
 gisann ramharack   Thanks you so much for the details,1,
 gisann ramharack I just sent him a message and he responded  Thanks a lot ,1,
 Steven Paul that his contact   ,1,
1438,1,
1620,1,
Plus 168,1,
 Steven Paul get him  ,1,
Wow I know Mr James matheson   I met him at a conference in carlifornia 2019 where he introduced us his business strategy  he helped me cover my student loans,1,
I also trade with Mr james matheson    and i must say he makes money making seem a whole lot easier right now I m a single parent and i pay the bills comfortably since i met james matheson  he s absolutely amazing and I d recommend him for any novice in crypto ,2,
I think trading is easier with proper guidance  especially from a proffessional it really helps reduce the chances of running into losses  All thanks to Mr James matheson  He changed my life  I was able to pay off my mortgage,1,
Good luck in your investments   Hold strong during these cold times ,2,
 There s no doubt in my mind that we are not only going bull  but BTC is going nuclear  A lot of people are wondering if now is a good time to buy because of where the price is at right now  I d say it s outrightly wrong to just sit back hodl and wait maybe incur some losses along the line  that s a wrong mindset for an investor because as an investor finding ways to always increase and stack up more coins thereby making prof ts should be the way of life that being said  the market is still all about BTC at the moment and I ll advise current investors and newbies to take advantage of Josh Jhang s program  a pro trader who runs a training program for investors newbies who lack understanding on how trading Bitcoin works  to help them recover loss from the crash and also accumulate more bitcoin  with his program i went from having 1 3btc to 7 8btc in just 5 weeks,5,5
First  ,2,1
First,1,2
