Comment,Likes,Reply Count
 NEW  Join me in DeFi Pro and make passive income with crypto  http   defipro dev    Million Crypto Official  https   milliontoken org  Get  25 FREE crypto here https   crypto com app y7cw5y7xvd,8,8
Unpopular people in crypto   Is it TechLead ,1,
can you make a DAO for Milion Token ,1,
Thanks for watching  Don t forget to hit subscription button whatsapP                ,2,
Great video really  Also i agree with your opinion  For the newbie if you are actually trading in the crypto space and you don t have a sound mentor  Then you are certainly going to get liquidated in 90  of your trades   Yeah that s the sad truth  For a start you need a good and experienced hand to guide you  Trust me  trading isn t difficult as we see it  With the right Signals and guide  you can earn hugely monthly ,250,13
hello I m new to Bitcoin trade and I ve been making few loses  but recently I saw a lot of people earning from it  can someone please give me a new strategy or at least tell me what I m doing wrong ,73,27
Each time I share her testimonies  there s always someone out there who knows her    ,1,
Anchor received 450 million dollars and the party continues ,1,1
INVESTING IN CRYPTO NOW IS VERY COOL EXPECIALLY WITH THE CURRENT RISE IN THE MARKET  ACT NOW ,49,74
 Market makers like to do the complete opposite of what retail thinks is gonna happen  sure a fakeout looks possible  but what if that s exactly what they want us to think  Imagine the big boys run with the money because we are simply too  scared  to buy in because we expect a fakeout  All thanks to Alice Marcella as I have made over 14btc from nov till date  His trading skills is exceptional    ,23,6
 INVESTING IN CRYPTO NOW IS VERY COOL EXPECIALLY WITH THE CURRENT RISE IN THE MARKET NOW ,63,84
 INVESTING IN CRYPTO NOW IS VERY COOL EXPECIALLY WITH THE CURRENT RISE IN THE MARKET NOW ,33,61
Nice Content You have here on this Channel  I ve been following your videos  but I still don t have a knowledge on how to trade on Cryptocurrency  where can i get a good broker who can teach me how to trade and also manage my account,24,9
I HAVE INCLUDED SO MUCH LOSSES TRADING ON MY OWN  I TRADE WELL ON DEMO BUT I THINK THE REAL MARKET IS MANIPULATED  CAN ANYONE HELP ME OUT OR AT LEAST TELL ME WHAT I M DOING WRONG ,4,1
 I feel those who would allow the market dynamism to determine when to trade or not are either new in space in general or probably just na ve  the sphere have seen far worse times than this  enlightened traders continue to make good use of the dip and pump even acquiring more equities towards trading sessions  I d say that more emphasis should be put into trading since it is way profitable than hodling  Tradlng went smooth for me as I was able to raise over 9 2 BTC when I started at 1 5 BTC  in just few weeks implementing trades with signals and insights from Jayson Elwood  I would advise y all to trade your asset rather than hodl for a future you aren t sure about  ,174,8
THIS IS THE BEST VIDEO  Bitcoin price is now okay how do I invest in bitcoin now  after you were talking about it as a conservative investment  in january I really want to invest i was waiting for day best time to invest  How can someone know a professional trader it has been my biggest dream,5,9
If someone doesn t understand what they are buying they shouldn t buy   You evaluate a smart contract platform like a pre revenue company  consider how it is being developed not what it is   Do you like a top down centralized approach where a small group holds ultimate power   Maybe you prefer one where holders of the token with an actual vested interest make the choices ,1,0
  I totally agree with what you are saying    The fact is  BTC is the future of crypto and the questions traders ask themselves now if this is right time to invest  before jumping into conclusion i think you should take a look at things first  for the past few days the price of BTC has been fluctuating which means the market is currently unstable and you cant tell if it is going bearish or bullish  while others still continue to trade without the fear of making lose  others are being patient  it all depends on the pattern with which you trade and also the source of your signals  i would say trading has been going smoothly for me  i started with 2 5 BTC and i have accumulated over 11 6 BTC in just three weeks  with the trading strategy given to me by expert trader David Mayor   ,26,2
I d say 95  of Bitcoin investors are currently in Bitcoin to eventually increase their wealth in fiat  There will need to be a massive culture change for people to buy Bitcoin for purposes of living  This needs time though  but until then it s a speculative asset ,1,0
Lol  ,2,0
So what would your strategy be RIGHT NOW with 2500  to invest and maybe monthly 100      ,2,0
I HAVE INCURRED SO MUCH LOSSES TRADING ON MY OWN   I TRADE WELL ON DEMO BUT I THINK THE REAL MARKET IS MANIPULATED    CAN ANYONE HELP ME OUT OR AT LEAST TELL ME WHAT I M DOING WRONG  ,5,2
Man  you are so A B C  with Million Token  You e killin  me  I love it ,1,1
Why didn t you add  as a millionaire  to the title ,1,0
Ethereum gas fees matter for only average people  Ethereum is premium  In future  it can be used mostly by artists  celebrities and rich  100  is tip money for rich ,1,0
TechLead  do you think LUNA  UST and ANCHOR PROTOCOL are okay  or they re in trouble  Anchor s Yield Reserves decreasing each day ,1,0
I want to wake up one morning and find out that my portfolio is  4 000 000   I know it s possible  ,65,14
Why not let MM token holder access defipro  let s say 100MM to get in ,1,1
You can definitely lose money in traditional banking by sending money to the wrong account just like in crypto ,1,0
Thanks to     she helped me invest in bitcoin now I earn daily sure profit from investing my bitcoin  thank you Regina,1,0
Thanks to     she helped me invest in bitcoin now I earn daily sure profit from investing my bitcoin  thank you Regina,1,0
hello   thank u for your video    i would like ask u what do u think about RNDR   much people say will be essential for metaverse   movie   and game   the market cap is very small  less 1 billion   and the team look very serious                    please guy let a answer if u like or no because i m interested this token THANK U,1,1
The best use case to me is play to earn gaming  I think it will be huge  Maybe crypto was just the next revolution of gaming and earning money not changing the currency  ,1,1
I love your breakdowns man always great work  One thing I would like to point out though  is the title of that reddit post where he s talking about buying owning a house  I don t think he s being unrealistic  Simply just buying a modest home  And I would agree him  Homeownership especially among millennials and onwards is at historic lows and worsening  People are Renting more  and Rooming with others more because homeownership is increasingly more difficult to do  And then covid came on top of it  Economic freedom I would say is the main selling point of cryptocurrency  Doesn t necessarily mean they want lambos and mansions  but enough income to live modestly and own a home instead of paycheck to paycheck  renting for the rest of their lives  That s where my thinking lies though  As always great stuff man keep it coming ,1,0
Don t panic  Stay invested  False opinions dont matter ,9,1
I don t want a lambo  I just want some land  a home built with my hands and some peace and quiet ,1,0
Maybe in the metaverse can   ,1,1
thats right  parachutes and life rafts are surely needed,2,1
Can these Blockchains truly be able to withstand a lot of transactions  ,1,1
Successful people don t become that way overnight  most people see at a glance wealth  a great career  purpose is the result of hard work and hustle over time  I pray that anyone who reads this will be successful in life,59,20
I m tired of hearing you talk about crypto and NFT  This channel has deviated too far from the programming topic that many people like to become a channel that only discusses useless things like crypto and other speculative thing  Don t you also notice that your videos are getting less and less views ,2,0
What are your thoughts on DRIP   so much hype behind it,2,0
When it comes to the world of investing most people don t know where to start fortunately great investors of the past and present can provide us with guidance,27,19
I can call this anything but unpopular ,1,1
Talking about stocks  Forex and cryptocurrency trading is the profitable venture I have ever invested in 1 reached my goal of  120k monthly trade earnings wondering if viewers here are familiar with Sarah O Neill s trading strategy  ,1,0
It s strange how people talk about all the profits  they ve been making through trading of bitcoin  while am here not making any profit at all  Please can Someone put me through on the right path or at least tell me what I m doing wrong ,1,0
I m new to Bitcoin and would like to invest but l ve got no idea on how to make good profit pls what s the best approach you d recommend,1,1
I m new to Bitcoin and would like to invest but l ve got no idea on how to make good profit pls what s the best approach you d recommend,1,1
It s strange how people talk about all the profits  they ve been making through trading of bitcoin  while am here not making any profit at all  Please can Someone put me through on the right path or at least tell me what I m doing wrong ,45,49
Mr Scott Graham has changed my financial status for the best  All thanks to my colleague who introduced him to me,31,11
TechLead is definitely Satoshi ,1,0
This guy looks like the scientist that created the virus from netflix s all of us are dead,2,0
His kindness shows it to everyone the king of heart feelings and passion he have for another man s fortune thanks for the 3BTC you re so amazing sir ,2,0
His kindness shows it to everyone the king of heart feelings and passion he have for another man s fortune thanks for the 3BTC you re so amazing sir ,1,0
  I believe that the inflation is already priced in crypto market since the end of last year  These manipulative rats are always 2 steps ahead of everybody because they are market makers  I hope I m wrong and they won t keep dumping it on retail investors as always buffering Those who hold the longest will profit the most  I trade and hold profits keep up the great work  and also Lori Rachel  has been doing a great job reviewing all chart  trade and techniques on BTC which has enhance the growth of my portfolio to 37 BTC lately ,26,4
 Every crypto investor right now is just smiling at the price of bitcoin as it held strong and indeed valuable enough to generate good ROI  more persons are gonna become millionaires and we have crypto to thanks for that  ,60,25
 Aaron rodriguez Interesting what expert would you possibly recommend that is capable of giving quality assistance to ensuring good returns ,1,
 Aaron rodriguez Relating crypto investment to forex trading definitely means there are risk involved and just how do you appropriate risk measures,1,
What s really the idea behind this crypto investment anyways  cause all I do is to buy when it falls and sell when it goes high ,1,
I AM RUNNING ON SO MUCH LOSS TRADING ON MY OWN  ANYONE WITH AN IDEA THAT CAN HELP  IT S REALLY FRUSTRATING EVEN AFTER WATCHING VIDEOS AND REGISTERING ON VARIETIES OF  PROGRAMS ,91,21
Just wanna say  your humor is hilarious  And racism is bs but its gonna always be there when u are successful especially  Make more vidoes  your the best,1,0
This is a great video  i learn alot watching your videos and it has been helpful to me  Trading crypto is quite difficult for newbies  Thanks to Melinda Dixon for improving my portfolio   keep up with the good videos,17,6
My crazy crypto prediction is that Ripple s XRP will move all the money including tokenized items and NFTs as well as replace the SWIFT banking system for international money exchange ,1,1
XRP is doing things  Thought it was just a cringe cult,1,
hasta la vista spam,1,0
all influencers are trash yeah i would agree with that lmfaooo u the realest on the space,1,0
 maybe in the metaverse we can    hahahha good one dude,1,0
Give some money or I will buy biliontoken,1,0
I ve been around for more than 1 2 century and I have seen my share of stock market contractions  Saw the birth of video gaming  and the birth of the internet  to name a few  Now  I get to witness the birth of blockchain and Crypto  and I can personally attest that Crypto is a completely different beast from the US stock market  100  agree that there should be a guarded approach to crypto investing  You may not win hearts and minds of everyone  but you have and are earning respect for telling the truth and trying to help others to look out for themselves  I m super picky who I listen too for crypto analysis   I have made over 21  btc from day trading with Jennifer Wilbur strategy Signal in few weeks  this is one of the best medium to backup your assets incase it goes bearish ,90,9
ADA would probably moon if Hoskinson was replaced with a leader who has top notch skills in execution,1,0
How about the stuff you really buy  Secret  I understand my friend   ,1,0
PREACH     ,1,0
I think it may be earlier for crypto  I wouldn t expect to sell Bitcoin till sometime around 2030 if you do buy it ,1,1
What is considered the best Defi stock as of now,1,1
Love all the information you provide  Your perspective   attitude and over all demeanor is very refreshing ,2,1
 quick pause ,1,1
As a software solution layer one that addresses all the issues with gas fees  clean  number of transactions  I m really curious why Hedera Hashgraph is rarely if not mentioned at all  HBAR token and it s price seems to be the reason people hate it due to it not being one that get s much movement  Seems to be marketing related to me but I m not sure  The project seems to be next level with what they re doing and their partners  Google  LG  Boeing etc  Solana comes up always with their speed but have been down three times so far due to DDOS attacks  What are your thoughts on this project and why they re so undervalued in the space ,1,1
I am a bit of skeptic  but know a lot of aspects about BTC  So  let s make few things straight   BTC is an investment asset   like gold  it s scarce  but it s easier to acquire it and big players like pay pal and grayscale are holding it  same with a lot of banking institutions  hedge funds and masses of people Self host wallet btc owner whales have a hard time selling it without doing KYC and in some cases  this can wreck them financially  People lose access to their btc wallets which makes that btc frozen for all time  The Hype and FOMO is on the rise and most people only buy and holding with btc  I mean you have to understand that normal stock market fundamentals don t apply here  It s not a 2017   2018 scenario  The regulation added to BTC can actually even make it more desirable although have a minus   Basically  anything that could stop the mooning of btc imo would be extreme regulation restrictions and also better investment opportunities discovered by btc owners However   it s is best advice you find a working strategy daily signals that works well in other to accumulate and grow a very strong portfolio ahead  I have been trading with Mr  Aron  Mason Craig daily signals and strategy  him guidance makes trading less stressful and more profit despite the recent fluctuations  I was able to easily increase my portfolio in just 4weeks of trading with Aron Craig daily signals growing 1 5 BTC to 6 7 BTC  His daily signals are very accurate and yields a great positive return on investment and is available to give assistance to anyone who love crypto trading  you can contact him on Telegram   Aroncraigsignal     for inquires and profitable trading systems ,1,2
You sir have quickly become on of my favorite You tubers  The Matrix had the Oracle and in this journey you are like the Crypto Oracle you provide  information and whatever we do with it is up to each one of us to decide ,1,0
Cardano is EVM compatible with side chains like Milkomeda   You ll see projects porting over this year ,1,1
THANK YOU SIR FOR SHARING YOUR KNOWLEDGE WITH US,2,0
My man is a Bitcoin maximalist to the bone ,1,0
 SCROOGECOIN ,1,0
This is as fake as tech lead knowing anything beyond php,1,0
He doesn t say    enjoy being poor  anymore   hahaha I wonder why    Think it has anything to do with Chamath tearing into him a bit   lol This guy is schmuck   very smart  yes but a total schmuck  He sponsors    himself   lol Hilarious ,2,1
I M NEW TO BTC AND I VE BEEN MAKING LOSSES TRYING TO MAKE PROFIT MYSELF IN TRADING   I THOUGHT TRADING DEMO ACCOUNT IS JUST LIKE TRADING THE REAL MARKET    CAN ANYONE HELP ME OUT OR AT LEAST ADVISE ME ON WHAT TO DO ,3,2
Mid week of march or last week of march will be the highest price of btc  MARKS THIS WORDS,2,0
 We all want our lambos and mansions  can we all get one       Maybe in the metaverse we can   hahaha,2,0
Hey TechLead  I was just talking about this  It s possible to prevent coin loss from blockchain   address issues  You said  someone should dev this  You could and should  You d be a hero ,2,2
 Investing in crypto now should be in every wise individuals list  in some months time you ll be ecstatic with the decision you made today  ,87,22
LOL  There is always someone using  Trash  somewhere ,1,1
Unpopular opinion  Algorand is everything Ethereum would like to be ,2,0
This blows my mind  Thanks for sharing these not so popular ideas on the market  really gives a better insight to what could be happening   Still bullish on the developments in DeFi  For me  it s what is going to push the market into the next bull run on top of a good run from BTC  I m still holding strong on my UDO bag because of the noticeable increase in demand for decentralized assets  Even the big corps are wanting to get in on it,9,1
Hello Techlead     Do you plan on making anything else besides crypto videos  Kinda miss your versatile mixup of topics ,3,0
I m waiting for the Cryptex token at binance  just a brilliant idea for the project  it will definitely be in demand  ,1,1
Loss of funds is main reason why people companies won t accept it,1,1
There s KEVM which bridges Cardano to ETH  making Cardano EVM compatible  Am I wrong ,1,1
My crazy crypto idea is that most people are going to lose interest because of    whales manipulation   Fed   friends regulation   scams   lack of understanding Enough to say some people  with some financial knowledge  believe that CBDC and crypto are the same   ,5,0
Techlead what do you think about Kadena  The whole braided chain thing,1,2
You crack me up dude  Very dry sense of humour  you d fit in well here in the UK,1,1
I feel like I just walked into r wallstreetbets,1,0
War of tanks online token,2,0
Very good episode on Crypto  Techlead  Especially the matamask part  How someone should create Ai machine learning to verify and manage the risk of transactions ,5,0
I think Secret is the future  it s what crypto initially was  but better ,2,0
At least one guy who really knows stuff  Thanks  great content ,5,1
Why aren t you all buying Million Token ,1,1
There would be nothing better than MM getting a pump while all crypto is in bear market  All eyes would go to MM and TechLead of the whole crypto space ,1,1
Lik the videos  Do not like the fake comments conversations ,1,0
Don t care about bear winter on bitcoin or ETH  because most elite traders are investing in newly launch tokens instead  rather than old ones ,2,0
Loving it,3,0
Any thoughts on LooksRare or LOOKS coins with its APR  ,1,0
Techlead is a straight comedian  Informative not educational but hilarious,1,1
Unpopular opinion 95  on so called investors are losing money in the crypto market knowingly or unknowingly,2,0
Great videos  I really enjoy listening to you  Do you think that QAN platform which is L1 and evm compatible has the power to impact position of eth ,1,0
Very good insight sir   Thank you,2,0
 all influencers are      i dont really think of this channel being such  rather singularly treasure the  experiment as its vibe,1,0
Pulsechain might be the fix ethereum needs,3,0
Always entertaining and insightful   ,5,0
There s a possibility winter is close or in as many argue that with rate hikes coming and the Fed supposedly rolling off it balance sheet will Bitcoin not continue to suffer  It may well do that and for me that then offers a long term entry point  as I sense the correlation dynamic will change in due time  Now in trading especially for a large portfolio  s gnal algos which are automated remains the best  Few traders I know use state of the art s gnal algos for their trading activities  My best pick is that of career trader Callum Lucas  his s gnals are based on unique combinations of trend  momentum  volume scanners and onchain analytics in which I ve accumulated over 9 2BTC already  Last week his analysis about the price action of bitcoin hitting 38k target was a hit  I think we all agree that the recent market drawdowns wasn t expected as it lead to cascading liquidations  Automated s gnal algos removes you from the crowd   If interested then reach out at  e     m callumlucas,49,1
 I m new to cryptocurrency and I don t understand how it really works  Can someone guide me on the right approach to investing and making good profit from cryptocurrency investment     ,1,11
Bear winter in everything comming I think ,1,1
Vitalik dance was cute tho  ,2,0
Once again great info to digest ,1,1
Reading about people grabbing multi figures monthly as income in investments even in this crazy days in the market any pointers on how to make substantial progress in earnings would be appreciated  ,25,10
The end of time baby MM,1,0
You crack me up  In a good way  Smart and funny ,1,0
Lol  after we already reach the lows of the range after over 70 days of bear market   idiots start saying we might be entering a bear marker  It s been a bear market for months   ,1,0
 May be in metaverse we can   Cracks me up    ,2,2
Thoroughly enjoyed this one   ,2,3
Let s get drunk and naked and buy crypto ,1,1
Hey let me know when you want to hang out  I ll show you what I do throughout the day   as a peasant  ,2,0
The rich stay rich by spending like the poor and investing without stopping then the poor stay poor by spending like the rich yet not investing like the rich ,60,27
Says the guy who liquidated his saving  You are a smart guy  But things dont always play out as hyped ,1,0
  I totally agree with what you are saying    The fact is  BTC is the future of crypto and the questions traders ask themselves now if this is right time to invest  before jumping into conclusion i think you should take a look at things first  for the past few days the price of BTC has been fluctuating which means the market is currently unstable and you cant tell if it is going bearish or bullish  while others still continue to trade without the fear of making lose  others are being patient  it all depends on the pattern with which you trade and also the source of your signals  i would say trading has been going smoothly for me  i started with 2 5 BTC and i have accumulated over 11 6 BTC in just three weeks  with the trading strategy given to me by expert trader Hudson Owen  ,22,10
these bots are getting creative lol,2,
 Zack Gould shhh  join the bot shill,2,
Hahahahaa nahhhhhh,1,
Dude gets it done with good info and no bs and not wasting time  You watch entire video unlike some YouTubers who always feel the need to tell me about where Bitcoin it is and where it is going bla bla and all this so I can just hear about XRP somewhere in the video ,23,1
Terra luna projects are not even working right yet like it should    I don t get this  Is this just about the hype ,1,1
Means we re still early,1,
Do Kwon posted a twitter thread saying that even if the anchor yeild reserve went to 0  anchor will still be able to provide 15 16 ,1,0
Thank you for the Luna insight  sifu techlead ,1,0
Great video  I started watching your videos last year as a beginner before giving stock market a trial  I was able to make  17 300 in one month with a capital of  4 000 trading with an experience expert who guided me through out my trading ,3,4
bot  who is the expert ,1,
When Bitcoin was dropping last summer Million Token was pumping  I wouldn t hold the Million Token market chart next to a Bitcoin  they just don t run together    Not financial advice,2,3
Don t worry  I don t think anyone is going to bring a lawsuit towards  Space Man  for giving Financial Advice in the YouTube comment section   ,1,
Unless Tesla makes a self driving lambo  level 5 Tesla all the way ,1,0
death spiral on UST is actually a popular opinion lol,1,0
Great video  informative and to the point ,2,1
I heard eth is goin to run in the Algorand algo  is this true            ,1,0
L2 collapse because they depend on ETH,1,0
Haha I love that last shill  Great content man ,1,0
Million Token  ,1,0
I wonder how much Million Token is paying you to advertise each time ,1,0
I just figured it out  you are Satoshi    U invented the bitcoin,1,0
Amazing content  your videos always have amazing value,7,0
good analysis of course you think all your analysis is great   Your looking more up beat today ,3,1
Can you please do a video chat on  Shinja  shibnobi ,2,2
Thank you for making this video  as someone who is a current crypto bear  I believe in the technology but I think the government will take it over and end all the competition with the dollar   It s not often pro crypto people share the bear case with their audience and give them a full view of the landscape and this is really good you did this  people should be as educated as possible before investing in anything ,7,1
Just heard about this channel yesterday  watched a tons of videos and love them all  Nice content pal ,6,1
