Comment,Likes,Reply Count
Would it be funny of fate if Vitalik s consciousness is one day stored as an NTF   ,13,1
This is beautiful  great work tech ,7,1
The Nerd Menace ,2,0
Wait    What   Darth Vader is Luke s father  ,1,0
We want   money   NOW          Big bag   holdin ,2,1
Great video      Tech lead being on fire      As a millionaire ,6,1
I lost it at the end lmaof,16,2
he painted the perfect picture of the Matrix lol ,1,
You sure he human ,2,0
this is quality content techlead   you got it  ,1,1
Glad I m out of Eth and went to Cardano  ,10,3
Why,3,
Lex should invite Patrick on his podcast,3,1
Good video   tyvm,1,1
Wow    Techlead brought the FIRE with this one  I freaking died ,1,0
https   youtu be 7IRZYU8ylXM,1,0
I bet neither will win but assume that they have won ,1,0
Is that Quentin Tarantino s kid ,2,1
Nerds LoL,1,1
As a millionaire I just want to tell you that was great video,1,1
  Cardano ADA is a juggernaut ready to take over,1,0
Cardano will win       ,29,7
 Wizard Because they believe in the cringe marketing videos from Charles Hoskinson  If you look from top to top and bottom to bottom bitcoin has outperformed cardano  And since it is impossible to time the market  it makes sense to hodl bitcoin ,1,
Cardano doesn t even have transaction finality or very much scalability  how do people take it seriously ,2,
 Potato Money Tips This was true of social media platforms too  but there is still value investing to be had in facebook and twitter after some consolidation  Question is  what will be left standing and what will be the myspace of crypto ,3,
There will be more competitors coming  rendering both worthless ,3,
So  this Vitalik guy wants to be Skynet ,1,0
We want money LoL,1,0
Vitalik is not middle aged lol,11,0
hadn t you sold all your crypto  as a millionaire  ,1,0
And that is why I m avoiding Ethereum or Cardono I m mostly fixed on Bitcoin and XRP for   the end of time ,1,1
So where s the moment charles is saying  this is war ,7,0
 There s a sucker born every millisecond    PT Barnum 2021,31,1
BT Barnum,1,
Going to university doesn t make you any better it s the determination of the individual that gives the outcome,7,4
Education is suddenly not important when you re a weak minded dropout,1,
Where do i put determination on my LinkedIn portfolio ,3,
Going to university does improve you  but it doesn t define your entire personhood or valor,2,
You nailed it  ,3,0
I know for a fact that if government bans crypto  it will become even more popular   100 ,1,0
I went from 80  ETH assets to 80  Cardano awhile ago  And I have 0 BTC  not interested at all ,1,1
Goodluck staying poor,1,
This gave me RMS vs Linus vibes from the get go ,5,0
Ethereum and Cardano are both kind of scammy  They both profit from over promising and under delivering  the longer it takes for them to deliver it  the more profitable it is for them  There are only very few cryptocurrencies that under promise and over deliver  but Ethereum is much more legit than Cardano  at least Ethereum has working DeFi  while Cardano still doesn t  So  Polygon is kind of like Ethereum  not great  but also not terrible ,1,0
Half of the time it s roasting himself xD true comedian,11,0
There is absolutely nothing wrong with being a pre pubescent immature nerd     I just bought a 1973 mint  Captain Fantastic  pinball machine and am planning to spend the evening with a burger and fries  a classic glass bottle of cola    and loud 60 s music  visualizing a diner on Route 66 in the mid 70 s with a sexy waitress bringing me my meal in a red plastic burger basket lined with wax paper    setting it on the play field of the machine  smiling  as I deposit my first quarter from the coin roll  Yes  a Holodeck experience    in 2021  Cheers ,1,0
Lmao    I m actually in tears from laughing so hard hahaha man you killed it on this one    ,26,0
Techlead  Charls said for Vitalik he is immature Charls  Vitalik changed a lot  not the same person  he is more mature,83,2
Actually the whole video is full of this type of manipulations  Like  in the uncut interview Buterin had a positive comment on Ada founder   about Polygon projects  etc    That guy is taking viewers for idiots  Even the title makes no sense  who declared war at who  nobody at all ,1,
Underhanded way of saying still not mature enough ,12,
when will TechLead release the  TECH token and put an end to all of this   as a millionaire ,73,3
 Ren  indeed,2,
He listened to you   ,4,
lol Charles seemed a bit drunk honestly haha,2,1
Funny man  I was beginning to get bored with your bear vibes on crypto  but this is the content I ve been hoping going for        Thanks so much   You re doing great ,1,1
Lol that pic of you with them both was actually pretty damn funny,1,1
2 different types of nerd  ,1,1
I like how TechLead puts heavenly glow on Buterin and Hoskinson  Feels like a epic war between two crypto gods ,1,1
Too much Yoda talk ,1,1
Lex Fridman should interview TechLead,6,1
lol that was hilarious  more of this please ,12,0
yoooo  the tech lead watches lex fridman        You should totally get on the podcast ,6,1
That interview was the geekiest thing ive seen ,12,0
ETH will take ADA down with it,1,
  cardano for the win  ,10,0
Gates vs  Jobs,1,0
 Warming up the planet  making YouTube videos out of it and scamming each other     ,259,2
It s funny cuz it s true,3,
You are funny     ,1,0
Dude  you re finding your stride  Good production here today   ,2,0
whos going to win  avalanche ,1,0
I m on the side of Fat linux nerd   The scrawny braniac  one is creepy  I d never invest my money with him if I didn t know of Ethereum ,2,0
I m sorry  but everytime I hear  sharding  my brain hears  sharting  xD,1,0
ADA will outlast eth,1,0
Bravo   you succeed at the monetization of your time watching vitalik  s podcast,2,0
If Craig Wright was really Satoshi those bitcoins from satoshis wallet would have been dumped on the market long time ago lmao,1,0
Ahhh    Did this fool really put himself in between Vitalik and Charles    ,1,1
New American Gods    Cryptocurrency replace god of money  Or is it god of money 2 0 ,1,0
Sitting here in pure appreciation of your word choice for the video title  I mean  you called him an  ex  etherium cofounder    ,1,0
Ironic that they Charles would compaire ethereum to a rocketship that could blow up when after the last major update the Cardano network froze for hours ,1,0
That was mental   but I resubscribed because I like Cardano ,2,0
Keep the crypto content flowing my guy,1,0
Dude  your content quality just went brrrrrrrr     We are here for the money   ,2,0
Hoskins  imo  is doing this the right way  Dotting the i s and crossing the t s when it comes to the technology  safety  and viability of his cardano platform  Where as ethereum has great technology up to a certain point with serious flaws  and it s the second most popular coin  based mostly on time and exposure in the space  I believe  ethereum and vitaliks flaws will be the reason for ethereum being flipped by Cardano  polkadot  ripple  etc    but like you said  most people in this space dont care about what the technology is  we are here to make money  People will put their money in what they think is valuable  people love bitcoin  so they will put their money in that  Me  I put my money in the project  the leadership  and the use case of a platform coin  I think 5 years from now  unless bitcoin and ethereum clean up their flaws and or are used as store of value  I just see people pouring money into better more efficient projects  use case  with faster transactions  lower fees  and eco friendly coins  Those are my thoughts ,16,1
The counter argument is  Hoskins is doing the right thing by researching on problem that that other cryptos are experiencing in the real world   There are just problem that you cannot anticipate without putting in real world for test    Just like SpaceX s starship  you can only theorize and simulate so much  putting a prototype starship out to test and the best test ,1,
eth and cardano dont scale  bsv can do everything eth and cardano can  and then some  bsv is the only real bitcoin that scales for billions of ppl ,1,0
How did Vitalik think calling it  sharting  was a good idea    ,2,1
Probably Cardano is going to win  I mean You Cannot innovate in medicine   far less even crate a personal training program without Peer Reviewed studies   In that sense  it could be a bit naive to believe You Can build the futures digital economy without mathematical Proof and 3rd party validation of the code    thats simply too risky   So either they Will have to adopt Cardanos approach or Cardano  ADA   Will be the preferred choice for B2B implementation   much more government adoption ,2,0
TechLead became a referee  as a millionaire ,1,0
Definitely a real beef between these tweebs  Your descriptions of the two made me laugh big time ,8,0
Great vid  One argument  11 47 Hoskinson said in his last video  he wants to create a Decentralized A I  similar to Vitalik s vision of placing consciousness on the blockchain  Only it will be everyone s consciousness in essence ,3,9
 James Staker  PulseChain   Hex  if you study the gut micro biome you ll eventually figure out that our biome vastly influences  or controls how we think  It does this through the enteric nervous system and the vagus nerve and the gut brain axis   You ll eventually figure out that how we think and our consciousness  without a doubt  resides there in the 100 trillion microbial organisms that populate it ,1,
Except neuroscience has never been able to identify consciousness or where it resides  Namely because they look in the brain when it resides in the intestines ,2,
Lmfao,2,0
Techlead in the middle LMAO ,2,0
This reminds of the nerds in the 1990 s arguing over the value of Pogs on the playground  Pogs are worthless as commodities    or are they ,22,0
Nerd wars ,2,0
Wow  Techlead is truelly an internet genius  Putting the finger right in the wound and rubbing salt in it  ,97,9
Ex genius Proto wizard,1,
Very few people have the talent to do it so unironically ,3,
Truly ,3,
Charles Hoskinson is so lame  Even cringier than Vitalik ,1,0
Love this video   Hilarious ,10,0
Would you like your life ruined  No  you would not ,1,0
 They re the epitomes of two different types of nerds   Why was that so brutal   ,228,2
I laughed so hard  So true ,3,
Because it s the truth and truth is brutal ,11,
Craig Wright Nakamoto is the father of Vitalik Buterin Nakamoto,1,0
I must say I love your sarcasm    thanks for giving us a laugh in these dip times ,10,0
 ,1,0
This video is very funny  Well done and thank you ,18,1
But Lex Friedman is a slow talking dunce ,1,0
A fight that will be meaningless once Flare is rolled out,1,0
This has been the funniest tech lead show ever by a long shot ,605,16
Genius putting Gollum in as crypto developer ,1,
It is very funny with some underlying good argumentation about the absurdity that is going on  Perfect content for a treatment by Techlead ,1,
TL  Shut up nerds  We don t care about the technology  we just want our money     ,1,
 Edward Tse i watched it and this was funny af   ,1,
Funny stuff  And yet  I was hoping for a sober  well reasoned analysis from millionaire  genius  TL   absent the mocking tone and hyperbole   Not the man s repertoire  I suppose  Still  his trolling skills are next level ,4,
It was hilarious,1,
Agreed ,1,
TL is getting better and better ,3,
Not for people who actually listened to the Lex Fridman interview  it was super informative to be disregarded by the techlead as a joke ,11,
 Fat linux nerd         I choked on my food haha,79,5
 tim maacqi Sorry bub  it s actually GNU ,2,
Linux has been the future since the 90s bro,5,
Charles got bullied into switching back to linux too  I keked pretty hard ,4,
Even Vitalik believes in Eth thats why he sold like 50  of his eth at 2 5 ,69,2
 S Suwandi He donated Shiba inu not doge or Eth to india  get your facts straight before you try to act smart ,2,
Lmao,1,
11 40 Mr  Tech Lead  are you a Warhammer 40k fan  We never would have thought ,2,0
Sounds like someone is holding a bag   ,1,0
 We don t care about the technology  We re not in this crypto space for the technology  We re bag holding for the money  We want money  Now   xD,976,23
As a millionaire,1,
Also says defi has no practical use  Very wise guy,1,
 Todd Maek it used to be like that  crypto are always technology project based but then a meme coin like doge coin overtakes your state of the art project like thats it outright disrespectful but that s just how the way it is lol,1,
Who are we kidding  Hell yeah we just want money,1,
 jdiamond i have and ive been trading it for years     tell me wtf is produces  nothing    defi needs constant new suckers so feed it    its just traders trading against eachother    ,6,
YEAH I LOVE DAT  ahahahahaahahah,1,
 Junior JR I think it s at least 99 9period percent  ,2,
 Junior JR Its true tho  Very few people have any knowledge  We all know it will moon  Some time   lol,3,
No one said it better  D Every single crypto pumping youtuber pretends idealism  Hilarious,6,
 Andrew Gutierrez Guess you ve never heard of defi ,6,
U know it s truth when it s so funny  At least 99 9  are in just for the money,18,
Epic,3,
ahahahahaha,1,
Couldnt have said it better   ,4,
This was my favorite video     so funny and logical to how stupid this all is    and people speculating on bullshit    crypto produces nothing but is perfect for promises and speculation to trade,33,
Yeah  he s talking about me   ,6,
You will care very soon about technology  ,19,
Quik way to get rekt,19,
most uninteresting villains in the history of make believe fantasy drama s,1,0
PONZI SCHEME vs  PUMP   DUMP,2,0
In the last 30 seconds he painted the setting of what the  real world  in the matrix movie was xD,97,3
Well VB did donate shiba inu coins    playing with people lives   Yea pretty much ,1,
Vitalik buterin wants to be trancendence like Johnny depp your mind Keeps going on forever into machines and robots,15,2
holywood production overdose,1,
Mayweather wore Ethereum outfit during weigh in today ,1,1
Elrond Egold is better than both  Worth your research ,1,0
I am officially done with your channel  The only legitimate competitors to eth are DOT  ATOMS  and SOL  Cardano is more performance art than a legitimate  project  Do your research before posting these vids ,2,3
So you are saying a college dropout does not have mathematical riguor  it is not our fault that you where insecure and payed an old man to teach you things people discovered alone thru the  past of years,2,1
Could be  or maybe he is just trolling    Anyway  Vitalik gives the impression he discards academic on favor of his heuristics  I mean academic riguor can consider those heuristics  what does Ethereum have better then Cardano  ,1,
Yeah you  as a millionaire  blinked  Lettuce hands  I like my sugar with coffee and cream yo ,2,0
 scrawny brainiac nerd vs fat linux nerd    ,701,25
Keanu Inu  ,1,
 Dain Simmons Indeed,1,
In other words  they re MLM top bosses  ,1,
I laughed so hard hearing that  OMG,1,
 Jake hahaha he s not that fat but it made it more funny,1,
Best comment in the whole video    ,1,
 Jake Yes  he is  Overweight    fat ,7,
This was hilarious  ,1,
  ,1,
Jobs vs  Wosniak,11,
lets fight irl to see who the real tech lead is,6,0
you missed the fact that we have diamond hands  but ok and great video as usual ,29,0
talk about bitcoin became as hideous and annoying as the talk about gay rights from 10 years ago,1,0
tech lead leading the drama  as a financial ok person ,2,0
The end  ,10,0
If you would actually listen to Charles   He doesn t want to be called CO Founder of ETH   He is Founder of Cardano   End of the Story  ,194,21
 FreshcoTech That 2  gen and 3  gen thing is just a marketing term  Cardano is purely meant as a pump and dump from Charles Hoskinson  He is good at marketing ,1,
 RuskiVodka Yup  Same happened in 2017  And also quite bit in 2013  But it seems to last longer each time  So one day it will just be a continuous stream of hype and cult like behaviour ,2,
 shamail siddiqui yeah even though it s totally different it will be just like all the others because they re all the same ,1,
 Ren  Souza I agree ,1,
What the co founder of Eth doesn t realize is no one cares ,1,
Problem is  for the people who can name 3 cryptos  they don t know what cardano is ,2,
 J D i am sure you didnt form this opinion yourself clearly biased,3,
Yeah he doesn t deserve any credit for ethereum  he basically just tried to create a foundation to cash in then a coin to try and split the community later on  and now another coin to cash in again ,3,
Techlead will never miss an opportunity to put ex something in the title xD,11,
jesus the whole crypto community really has become one massive cult this year   ,20,
Well  too bad for him ,12,
Lol  cult like comment,28,
TechLead has a good sense ,71,4
amen   funny and concisely smart  ,1,
 RuskiVodka my bro     i am 100  with your observation  a complex sense of   dry  humor   is a glaring sign of high I Q     those who do not get  it          can stay on their hamster wheel      weeeee ,2,
I love his humor it s fucking hilarious  I think many people dont realize he s being sarcastic half the time,8,
They both said each other mattured  but you phrased it as they both said each other were immature  you are stiring the pot intentionally  As someone who watched the full interview and finished it an hour ago the way you portray Vitalik Buterin in this video is super disingenuous Im in favour of Cardano  but people like you really use misinformation and mischaracterisation to get people to side with you because you are financially invested  Its very black and white,2,1
crapdano,4,1
Competition breeds innovation   There s plenty of liquidity to go around ,3,0
I LOVE this dude  Another great video ,2,0
I came for that sarcasm lmao,4,0
This is actually misleading  they have patched up their differences ,12,0
You are now a crypto channel ,5,0
Never trust a Russian lol  ,6,0
ADA will flip ETH,14,6
 mi ke casper was supposed to be releases in 2017,1,
Will never happen,1,
The Dude in terms of overall market cap  cost off one ETH will always be a lot more then what ONE ADA coin is because of the supply  Ada has 40 billion coins ETH 120 million,1,
ADA has 6 years of empty promises and delays ,1,
ETH all the way    ,5,0
NANO ,2,0
What s the secret of success    Right decisions How do you make right decisions    Experience  How do you gain experience    Wrong decisions,57,3
You never truly know succes until you have succes  Failure is just the excuse of the non millionares,1,
You ll never truly know success until you know failure,1,
your second,1,
Second ,1,
