Comment,Likes,Reply Count
 As expected  Bitcoin reached its all time high  It s expected that the long volatile route to the top starts now  where I expect Bitcoin s peak around Christmas  We often see that when Bitcoin makes a move  the altcoins follow in the two weeks after  which could explain the latest surge in Ethereum and Solana  As big as Bitcoin is now  it s a mere fraction of what it will be so it never too late  one important note is to follow the guidance of a professional   In three weeks of trading I have been able to make 9 2 btc using signals from sheyla strategy  they can easily be reached on Telegram   as  sheylastrategy ,72,10
Baby Squid Game Token Inu,2,1
Wow  A good crypto content video  Congrats ,3,1
Very good explanation  I learned a lot in this video and you also saved me from fomoing into random coins,18,1
Great video ,3,1
Good to see TechLead much more well versed in DeFi in comparison to a few months back  This is the best way to learn   ,4,1
love it,4,1
My first and only crypto  MM  million token  created by Tech Lead  ,4,1
Million is the answer to all of your problems  ,5,1
I don t understand why people would not bother to do basic levels of research before pouring out their hard earned cash   Guess that s why they stay poor no matter what ,4,2
As a hundredaire ,2,1
Thanks for your analysis on this  TL busting into solidity is fun,17,1
Squid Game  pretty funny show   ,11,1
I really like your setup  Your room looks very nice  however  I recommend you to find a way to get more sunlight in the room by opening a window or smth   it s extremely important for regulating your sleep schedule and other things,6,0
The main reason I went all in Million Token is because I was tired of all the scams in crypto  MM is the only coin founded by a YouTuber with more than 1 Mill subs   ,31,2
Why wouldn t anyone not invest in Million token  ,2,
in long term you all will see who is the true mooning cryptocurrency,6,2
It ll be Million Token   ,2,
RED LIGHT             BOOM REKT     ,3,1
Very useful content ,4,1
Very informative,2,1
Hows Millionaire Coin  ,1,3
Million Token is doing alright  We have staking with 20  APY  governance system and NFTs along with a community with more drama than Netflix   it ll be a slow grind to  50 000 but we ll get there  I recommend checking out the community discord ,1,
Technically the Squid Game crypto lived up to its name   one guy won and took all the money ,648,14
It lived upto it s name     Reason being     To larger audience it looks like a normal coin     And when someone focuses onto it    It goes bam explode ,1,
top comment,3,
bruh lmao XD,2,
Bruhhh,9,
 ,13,
Great outlook   MillionToken  Inevitable  1B MC     ,10,2
Bruh when we hit  1 000 drinks on me boiss at the jacuzzi bar  ,2,
No idea what you are talking about    Coding is sophisticated    ,3,2
There s nothing like million token  Glad I loaded my bag early ,14,8
 Max White What do you mean  Million at  1  is  1 mil market cap  Million at  50K  is   50 bil market cap  That s the highest market cap that SHIB reached last week  Do the math yourself ,1,
 Max White absolutely  you re right Always smart to take profit  I ll do it many times on our way to 50k   ,1,
Million Token is going to pump to  50 000 and all the doubters will FOMO in  ,3,
Lmfao    as a millionaire    You should have sold the hype pump ,1,
I wish more people like you would provide more information like this  Love the video thanks again ,61,1
GOOD FOR THEM  ,3,1
Thanks for the info,3,1
 funny show  ,1,1
You can tell who lost money on their Squid Game token by the number of dislikes on this video ,6,1
I didn t even know there was one   ,1,1
Thank you telling me about Dogelon Mars wash trading I almost fomo ed into it     ,10,1
Wait u watched squid game  as a millionaire   i thought u had no time for that  ,3,1
Good info   Thanks ,3,1
Million token is worth one millionth of one satoshi ,1,1
Enter plug for million token,1,1
  ,5,0
Just wait for Squid Game Token Season 2   You can win your money back   ,46,2
I cant wait till it comes out so I can see dumb people get scammed again Its hilarious how people just buy anything  from the hype,4,
  Amazing post mate  BITO hit 1B in trading volume on day 1  was the second largest ETF launch ever and was nearly the most traded ETF overall yesterday  If the SEC was concerned about demand from institutions for a Bitcoin based ETF  they can set those aside and go ahead and approve a real ETF  We were already on shaky footing with historically low volume and almost pure whale pumps  narrowly avoiding a long term bear market  This is the worst possible time in history  to invest as so many don t back up their  crypto assets More emphasis should be put into day tradiing as it is less affected by the unpredictable nature of the market I have made over 13 btc 4rm day tradn with Declan Lim insights and signals in less than 4 weeks this is one of the best medium to backup your assets incase it goes bearish      ,1,0
 milliontoken the only real and safe investment  To the moon   ,23,2
MM token the next Squid Token ,4,2
Ha ha ha,1,
For sure,1,
Wish million could go back up    ,4,6
 balllsdeep hope so brother lol,2,
 Jason Jenkins lmao,1,
Hang in there bro  We ll be at the Jacuzzi bar soon  ,2,
Lol  saw THAT one coming ,8,1
